,fileName,judgements
0,./data_dsicap/DorothyDay/raw/166.html.txt,"['Maybe I am saying this to justify myself for my protesting this last month the refusal of bail to the eleven Communists , a protest which was published in the Daily Worker , the American Guardian and other papers , much to the horror of many of our Catholic fellow workers .', 'My radical associates were the ones who were in the forefront of the struggle for a better social order where there would not be so many poor .', 'We believe in the constructive activity of the people , the masses and the mutual relations which existed during the mediaeval times and were worked out from below .', 'Certainly we disagree with the Communist Party , as we disagree with other political parties who are trying to maintain the American way of life .', 'We and the Communists have a common idea that something else is necessary , some other vision of society must be held up to be worked for .', 'If we spend the rest of our lives in slums , as I hope we will who work for and read the CATHOLIC WORKER , if we are truly living with the poor , working side by side with the poor , helping the poor , we will inevitably be forced to be on their side , physically speaking .', 'But when it comes to activity , we will be pacifists , I hope and pray , non-violent resisters of aggression , from whomever it comes , resisters to repression , coercion , from whatever side it comes , and our activity will be the works of mercy .', 'The Rending of War And as for our great masses of Catholic people , they will be dragged in , poor though they be , or workers though they be , to use the same means of force and violence , to hate their enemy , to defend the status quo , because there will be no time for fine distinctions then and the Catholic will not be able to apologize for his siding with the duPonts , the Morgans , the Girdlers , war profiteers , the cynical politicians , the literary people , the intellectuals who will use fine and exalted phrases to inspire and integrate the body and soul of the worker in one passion -the desire for sweat , blood and tears , for suffering , and they will use these mysterious cravings of the human heart and once again betray the workers into war .', 'Final Aims But the Communists , the eleven , the Communist leaders in the expelled CIO unions , they are not honest , everyone says .', 'If business has managed so well , if everyone is being so well-paid , well-housed , well-fed , what is all the shouting for ?', 'Every pastor in the U.S. , in churches which had Italian parishioners , seemed to be urging the people to write to friends in Italy that they would get no help from the U.S. unless they voted our way .', 'Pastors from Italian churches went to Italy and all kinds of opinion-making tactics were used by the public relations men of the Capitalist order .', 'In view of the fact that Russia and official Communism controls so much of Europe and Asia and is spreading , hysteria has been built up here which is a terrible indication of our lack of confidence in our own way of life , our own integrity , our moral supremacy which Mr.Truman was just talking about this morning .', 'I believe that we must reach our brother , never toning down our fundamental oppositions , but meeting him when he asks to be met , with a reason for the faith that is in us , as well as with a loving sympathy for them as brothers .', 'We understand because we believe , as St.Anselm says and how can they understand with a darkened reason , lacking this faith which is our privilege to possess which would enlighten their minds ?', 'Maritain says he is more certain of his faith than he is of his own existence , since Primordial Truth has told him through the intermediary of the Church which is itself an object of faith .', 'Just yesterday a reporter from an information sheet run by ex-FBI men for business men , called up , and every day or so there are other calls .', 'Only a few short years ago our present enemies were our allies , the allies of this government , and it was our C.O.s who were being arrested and confined for their beliefs , for not fighting side by side with Russia .']"
1,./data_dsicap/DorothyDay/raw/173.html.txt,"['Intelligent parents of today , rather than leave their children a certain sum of money , prefer to spend their substance in giving them an education which will make them capable workers , whether the work be intellectual or manual .', 'The time will come for nuns alsoand in a certain sense it has already comewhen the most secure dowry for a young girl wishing to enter a convent will be her capacity for work .', 'Poverty has been practiced particularly by means of economy , it has been sought to make things last ; darns and patches have therefore been multiplied , time being taken up in excess of what a more rational economic organization would allow .', ""To return to an economic organization of convents based on labor is only to return toSt.Teresas primitive plan which was always her favorite . ''"", 'While asking of nuns this effort for the organization of productive work , Holy Church has acted in a most motherly way , being anxious not only to secure their material subsistence , but also to help their spiritual life in the best way possible .', 'Therefore , before giving expression to her requirements , as set forth in Article eight , ( of the apostolic constitution , Sponsa Christi ) Holy Church , in the explanatory part of the constitution , has represented to nuns in the happiest way how it is possible to combine this more intense application to work with that search for union with God which is characteristic of their contemplative life .', 'These teachings are so rich , and may be foreseen as so fruitful , that they could serve as a basis for a mysticism of labor .', 'This commentary shows not only how the Holy Father in his new directions to religious orders is meeting the needs of the time , and the criticisms of the time , but also how they are being received .', 'We have spoken in THE CATHOLIC WORKER on how orders in the Church have been so plentifully supplied with property and the means of improving that property , of the alms of the faithful , and how little has been done to help families , each one of which is a little church , a little community , and how when that help is given , the world [ sic ] alms and pauper carry a stigma .', 'But perhaps even here , and Peter Maurin talked of this so many times , there is needed a great change in attitude .', 'But in school literacy takes first place and reading is no longer taught , beginning with the Little Office , Our Ladys Primer .', 'At home , Becky occasionally says , when she is made to run too many errands , I am the chief slave around here .', 'Tamar and I had forgotten about it , and David , when he returned home from his work at Wolfe Pond Park at four-thirty , reminded us that Bob was expected any minute .', 'Folk songs , folk art , folk dancing , are expression of the exuberance and joy and thankfulness for life .', 'Duffys main job is to restore its fertility .', 'To live in this way , with the sacraments of the Church and with a sacramental attitude towards the material things of life , this is indeed the good life , even though life and death are never far apart .']"
2,./data_dsicap/DorothyDay/raw/13.html.txt,"['However , agrees with Pius XI in his encyclical Forty Years After , that the state may intervene when a particular group is threatened and no other means are available to them .', 'And then when they have heard all this from the lips of priest , professor and laymen , Peter Maurin rises up with the voice of one crying in the wilderness and says , The great danger of the present day is Fascism and the tendency of all organization is to lead to fascism .', 'The result was the encyclical Forty Years After , recalling Pope Leo XIIIs encyclical on the Condition of Labor which was also disregarded for forty years .', 'Little by little , it can be found that the ideal works and is practical and then people are surprised .', 'Christ said , Be ye therefore perfect even as your Father in Heaven is perfect .', '( As for those who dont God knows that we are but dust and he is a kind and tender father . )', 'We admit the danger of these palliatives to the existing disorder but we see their danger from a different standpoint than do many others who oppose them as being the offshoots of Moscow thought .', 'We believe with the Pope that whenever the general interest of any particular class suffers and is threatened with evils which can in no other way be met , the public authority , the state , must step in to meet them.If within the walls of a household there occur grave disturbances of mutual rights , the public power must interfere .', 'But not the italics - which can in no other way be met .', 'Organizations of Catholic Workingmen is another thing entirely .']"
3,./data_dsicap/DorothyDay/raw/60.html.txt,"['The car was so full in the back that Marie Pierce , the colored girl who is on the executive committee of the Southern Tenant Farmers Union and I were crammed together warmly on the back seat .', 'But our feet were icy ( it was not a heated car ) and when we stopped at a gas station where there was also a dry goods store , we went in to buy an extra pair of socks .', 'In the room where I am writing there is a table and two chairs and shelves piled with literature and papers , for they are publishing a monthly called the Sharecroppers Voice.Around the wall there are crudely painted signs : Woe unto them that join house to house , that lay field to field till there be no room , and ye be made to dwell alone in the midst of the land .', 'And landless indeed these people are , for although most folk now realize that there are eleven million unemployed in the cities , they do not know that there are eight million dispossessed through the South , according to figures published by the University of North Carolina Press .', 'Marie had come into town for some meetings , and on the way out to bring relief to dispossessed families , we were going to drop her off at her home .', 'The road was frightful and it was only because we were wedged in that we were saved from being bruised by the jolting we received .', 'That laughter sounded strange to me , conditions being**as they were .', 'I was to see more laughing as we went through the day a hard desperate laughter , but it was laughter .', 'We passed the Holiness Church on the outskirts where the meeting of five hundred sharecroppers and tenants had been broken up some weeks before .', 'The whole town had been aroused and had wanted to hold another meeting immediately , an armed meeting , that would be prepared for an attack .', 'Six miles out of Earle we visited another little church which was not much more than a shed .', 'By the door , one young woman was washing clothes .', 'The little tent where we stood on the frozen earth was filled with fourteen children and there were thirteen more in the camp .', 'The boss driver allows about fifteen acres to the family so you see how many families are affected .', 'This is the situation in one State but all the other Southern States are affected in the same way .', 'There are 125,000,000 acres devoted to a single crop , nearly as much land as is given to all other crops in the whole region .']"
4,./data_dsicap/DorothyDay/raw/145.html.txt,"['Men stood on our coffee line this morning like dripping pedestals , but at least they were not shuddering with the cold as they have been so many mornings lately .', 'Now the line has doubled and still we go on , God alone knows how , because these last two weeks there has been nothing in the bank .', 'We spoke last year too , of the necessity of starting this work in other centers throughout the country , and now we note with joy that Pittsburgh , Detroit , Milwaukee , Boston , Houma , and other places are feeding the Ambassadors of the gods who come to them .', 'But we must recognize the hard fact , that no matter how good a social order , there will always be the lame , the halt and the blind who must be helped , those poor of Christ , the least of His children , whom He loved , and through whom there is a swift and easy road to find Him .', 'When we succeed in persuading our readers to take the homeless into their homes , having a Christ room in the house as St.Jerome said , then we will be known as Christians because of the way we love one another .', 'But we need more Christian homes where the poor are sheltered and cared for .', 'When they gave a banquet they did not invite their rich neighbor , but the men who were in need .', 'And the one thing we are sure in feeding the unemployed is that our Lord wants us to do this work so we must do it .', 'Men must be fed , morning after morning , and we pray for the faith of those poor mothers who live from day to day as we do , confronted by hungry mouths and not knowing where the next meal is coming from to feed them .']"
5,./data_dsicap/DorothyDay/raw/147.html.txt,"['They are coal miners and by next week , I suppose , their deaths will be forgotten by the newspaper public .', 'There are a great many coal miners killed every year and no matter how many times the numbers are printed in order to form public opinion , in order to enforce Congressional action on an inspection law , the number is forgotten , the law tabled , and violations go on .', 'And Other Strikes And more violence in Milwaukee where an armored car at the Allis Chalmers plant fired tear gas in a pitched battle with auto strikers who have been out since February .', 'Old Patrick Kenny , a worker for Bethlehem for twenty years , was tossed on the ash heapliterally , he was put away in the almshouse , and had it not been for the work of Mary Frecon , who is the head of Catholic Worker activities in Harrisburg , he would be still moldering there in confinement .', 'A sad commentary on the ignorance of Catholics as to the social teachings of the Church was evidenced in the charge against us , the three Catholic Workers helping in the soup kitchen and distributing papers , that we were Communist .', 'Nor Are We Howard Curtis , sub regional director of the SWOC ( Steel Workers Organizing Committee ) , reported to me that one of the young Catholics who had signed up with the union had accused us of being Communist and had destroyed some of our papers which were left in the union hall .', 'Hysteria Grows But hysteria is mounting in this country , and fear , anger , contention and lack of brotherly love are a result of the publication of best sellers such as Jan Valtins Out of the Night .', 'Sabotage , destruction , communist propaganda , are the charges made on every side .', 'We are not denying that Communism exists , that Communists are members of the unions , that a few of the unions are controlled by Communists .', 'General Strike As to Communists working towards a general strikethat has been the dream of radicals , and the bugbear of the public for generations .', 'Jack London once wrote a pamphlet on the general strike , predicting the entire changing of the social order , through a peaceable general strike , peaceable because the workers were so well organized , so well disciplined and so well prepared .', 'They asked him if he was different from other men and he replied that inasmuch as he and his wife and four children depended upon God rather than on the Steel Corporation pay envelope for their sustenance , he guessed he was .', 'These men , inarticulate men for the most part , because they are used to using their hands rather than their tongues , have all too few leaders and all too many critics .']"
6,./data_dsicap/DorothyDay/raw/3.html.txt,"['Chapter Eight After describing their search for a farm and the move to Mott Street , most of the chapter is a clarification of why they support organizing and striking workers .', 'After a talk to a womens club in Florida she observes that the rich who deny Christ in His poor are atheists indeed .', 'Notes how hard their work is and that change comes slowly .', 'Asserts that Love and ever more love is the only solution to every problem that comes up .', 'Calls for a greater use of prayer and the desire to be saints .', 'Speaks about what individual workers are doing in New York and is encouraged by houses around the country .']"
7,./data_dsicap/DorothyDay/raw/177.html.txt,"['I am always thanking God that my lines have fallen in goodly places , and then falling from this happiness of gratitude into the suffering that is inseparable from love .', 'There are so many ways to spend money on people instead of on a little connecting link of subway , extending for five or six blocks and which is costing millions of dollars .', 'Deane Mowrer said that the other night the gangs of children on her block which is between Avenue C and Avenue D , went rioting down the street knocking over every ash can and garbage can and destroying property as they could .', 'To all appearances they were dead , and now they are blooming .', 'We started out twenty-five years ago thinking we were just going to get out a newspaper , small though it might be , which would allow us to exercise our journalistic talents .', 'Everything was personalist , we were our brothers keepers , and we were not to pass by our neighbor who has fallen by the wayside and let the State , the all encroaching State , take over , but were to do all we could ourselves .', 'He firmly believed in the withering away of the state which the Communists spoke of , but he did not believe it would happen under a dictatorship even of the Proletariat , and he always said that the only true communism was the voluntary communism of the Church .', 'He wanted farming communes , communities of families , though many people went to the land when they married , and there have been attempts at farming communes , we can not point to any successful one .', 'Peter was a personalist and a communitarian and he said that there could be a Christian capitalism and a Christian communism .', 'We keep quoting from Peter , and keep repeating his writings because he was , to use his own words , the theoretician of the green revolution we were to promote .', 'In fact , to this very day , common sense in religion is rare and we are too often trying to be heroic instead of just ordinarily good and kind .', 'And the fact that we were so soon involved , and are now so completely involved in the daily practice of the works of mercy and cant get out of them , nor ever can for all the rest of our lives , is some proof that we are continuing Peter Maurins mission .', 'If your brother is hungry feed him , if he is naked , cover him , if he is without shelter , visit him , if he is sick comfort him , if he is in prison visit him , if he is dead bury him .', 'If the little boys who are running riot could be put to work and the mothers stay home , how much happier it would be .', 'But we do not have a philosophy of work , as Peter Maurin said , and certainly the jobs open to most people in this mechanized age , are anything but attractive .', 'Im afraid I believe in private property too , though St.Gertrude says that property , the more common it is , the more holy it is .', 'But when I speak of private property it is mostly personal property I am thinking of .', 'The man explained that all property was held in common around the Catholic Worker , so it was his as well as any one elses .', 'We expressed ourselves in the CW as pleased with this expropriation , and went on to say that the Benedictine oblates amongst us would like to go to some of the Benedictine monasteries and become squatters on their vast tracts , and so induce them to start again the guest houses which are part of the rule of the order .', 'I thought the visit very short , there had been no time for any conversation , nor any dear-to-his-heart round table discussions for Peter , but it was only on the way home that it occurred to me that our dear friends the monks had read the paper and had been afraid that in the parlance of the gangster , we were casing the joint .', 'It is Ammons recognition of course , that we are living in fearsome times and that only the most drastic , heroic remedies , much suffering , and self-inflicted sufferings , are going to serve as penance for our sins as a country .', 'And that if his aims were lower , we would still only be reaching half way , human nature being inclined to sloth .', 'Ammon is one of those people who have kept his ideal , and it is just as strong in him now as it was in his early youth .', 'He has been putting on Christ as St.Paul calls it , though for some people it is as hard to see Christ in Ammon Hennacy as it is to see Him in the derelict .', 'On my last trip when I passed out some Catholic Worker papers in the bus which came from Mexico City to El Paso ( fare eleven dollars ) the insurance saleswoman who was reading the paper began to read Peters essays out loud to her companion , a Canadian , and to laugh with startled amazement at his ideas .', 'When people know Ammon they laugh at him and with him , and because of him , and some of this laughter is that joyful laughter that the Christian ideal is so flaming , so alive , so burning still .', 'And His fire is quite a different fire from that of the nuclear weapon , which is of hell .']"
