,fileName,sentence
0,./data_dsicap/DorothyDay/raw/156.html.txt,"['Summary : Defines Christian personalism as the realization of the dignity of the other fellow , of our obligation to him , the willingness to work with him , on those elements of truth he has seized hold of , accepting his cooperation as far as he will give it , and the refusal to admit disappointment when he doesnt go as far as we think he might .', 'The opposition of THE CATHOLIC WORKER to the Marshall Plan is based upon Its violation of the Christian concept of charity .', 'Consistently THE CATHOLIC WORKER in its editorial policy , in its signed articles , in its manner of operating Houses of Hospitality has emphasized Christian Personalism ( the realization of the dignity of the other fellow , of our obligations to him , the willingness to work with him on those elements of the Truth he has seized hold of , accepting his cooperation as far as he will give it , and the refusal to admit disappointment when he doesnt go as far as we think he might ) .', 'Consistently we have written in terms of personal responsibility and the need for all Catholics to exhaust the message of Christ as given to us in the Sermon on the Mount .', 'I have a new commandment to give you , that you are to love one another ; that your love for one another is to be like the love I have borne you .', 'Like the love I have borne you.That is the essence of the Lords teaching .', 'His love for us was not self-righteous but full of deep compassion .', 'His love was based upon fraternal charity for us , the love of a Brother for brothers .', 'Try and imagine Our Lord telling the non-believers among the multitude at the time of the miracle of the loaves and fishes Go hungry , for I know that you do not agree with me now , and I know ( and He did know ) that on a certain Friday you will demand my life because my teachings affront your social sensibilities .', 'We are seizing upon the starvation status of our brothers in Europe and telling them , Go hungry , you do not agree with our ideological concepts , if I feed you now you may oppose me later .', '* * * * * We have consistently in THE CATHOLIC WORKER discussed the problem of modern industrial capitalism .', 'We have not been deluded , nor have we deluded any of our readers into thinking that with the application of the revolutionary principles of Christ in our lives , and in the lives of any great numbers of people , that the present social and industrial structure can continue to exist .', 'We do know that this is just what is involved in the Marshall Plan .', 'Our Secretary of State has not tried to conceal it , he has in fact been quite explicit on this score .', 'We do know that already over one-half of the monies sent to Greece are being spent on the army .']"
1,./data_dsicap/DorothyDay/raw/171.html.txt,"['I notice that June first last year , Arthur Sheehan was talking to us on St.Bernard , and on June third , John Cogley was talking St.Thomas , What is God .', 'His last of ten talks came in the middle of June .', 'As they said of St.Francis , When he heard the love of God mentioned , he felt in his soul an interior jubilation .', 'He took it for granted that they wanted the good , the best , that there would be a response to hearing tremendous things about God and man .', 'We talked of silence that night .', 'Pilgrimage I notice too in my notes for last year , that while I was speaking at Pendle Hill , Betty Lou and Rita and Roger and Annabelle went on a pilgrimage to Our Lady of Mt .', 'I had made it the year before , and I had wanted to make it again .', 'We set out from the Catholic Worker at about ten in the evening and walk up the one hundred and twenty blocks to the Shrine where the first Mass is said at Midnight , and Masses continue right through until noon on the day of the feast .', 'Anyone who wishes to join us this year , get in touch with us at the office .', 'What he means by the damned wantlessness of the poor , and I dont know where that quotation comes from , is this : the poor want what they are persuaded to want by advertisements , radio , television .', 'They want radio and television , cars , clothes , cosmetics , cigarettes , good food and drink .', 'They dont want to take over the factories , land , in any decentralist or distributist movement .', 'They dont think it possible .', 'So what they get is capitalism or communism , and we dont want either .', 'We would like to see a country made up of farming communes , agronomic universities , hospices , unions , cooperatives , small units of all those necessary institutions to be preserved , and a doing away with luxury in order to have the essential which is ownership of house and field and job , and the responsibility which goes with that ownership .', 'And it is good to think of the four hour day of manual labor that Peter Maurin stresses so that we will have time to study and to pray .', 'If we prayed enough , great things would come to pass .', 'If we prayed enough , we would grow in strength of soul and body and there would be love in our hearts , not fear .', 'Two Examples We have to make the kind of society where it is easy for people to be good , Peter Maurin used to say .', 'And so we go around in a circle .', 'To love God is to love your brother .', 'In this we have come to know His love , St.John says , that he laid down his life for us , and we likewise ought to lay down our life for the brethren He who has the goods of this world and sees his brother in need and closes his heart to him , how does the love of God abide in him ?', 'When I read of Adlai Stevenson going around Indo China in an armoured car , I thought of Lydwinne van Karsbergen going around Africa in an old car with a companion , another woman , and penetrating the most inaccessible places .', 'St.Ignatius of Antioch went to the wild beasts with joy and I am sure that the spirit of the lay missionary movement is that if either wild beasts , or Mau Mau devour them , in the chance they take in trying to reach the least of their brothers , then they will rejoice to be ground like wheat .', 'In the last two weeks alone , he has distributed 356,000 acres , and these he looted from the rich , with love .', 'I confess that the incendiary and murderous activities of the communists did not unnerve me , because I know that the birth of a new culture has always been accompanied in the past by blood baths .', 'The people are going to solve their own problems , not I. I am simply creating an atmosphere .', 'Speaking To get back to this year , during the month of May , I spoke first at our own Friday night meeting on May first .', 'There were a few of our number distributing copies of the Catholic Worker in Union Square , as usual .', 'To build up fear of other men is to build up hatred too .', 'This last month , Fritz Eichenberg , Quaker , who does magnificent illustrations for The Catholic Worker , refused to take the loyalty oath at Pratt Institute in Brooklyn where he teaches .', 'The occupied countries became the occupied countries because people were terrorized into saying yes , when they should have said no .', 'From the printer I went down to Peter Maurin Farm , and at seven the next morning a group of us drove to Maryfarm to make a day of recollection , Hans and Ed , Pat Rusk and Lucille Smith and baby Paul , my godchild , and Bernadette who is twelve and came along to hold the baby so her mother could make the conferences given by Msgr .', 'We drove back at five and instead of going down the turnpike to Staten Island and avoiding New York city , we drove to the house of hospitality , so the others could see the results of the fire , and get copies of the new issue of the paper .', 'The driver of the hearse leaned out of his car and shouted at me , Got to make time , you know !', 'It is St.Augustine who says that the flesh of Jesus is the flesh of Mary , and that we must be formed , as Jesus was , in her womb .', 'I know what it means now to sign oneself In Mary .', 'If we wish to be formed in the image of Christ , there is the mold .', 'He keeps his hands off the spiritual things of my church an [ sic ] I keep my hands out of his business , said Msgr .']"
2,./data_dsicap/DorothyDay/raw/173.html.txt,"['Intelligent parents of today , rather than leave their children a certain sum of money , prefer to spend their substance in giving them an education which will make them capable workers , whether the work be intellectual or manual .', 'Poverty has been practiced particularly by means of economy , it has been sought to make things last ; darns and patches have therefore been multiplied , time being taken up in excess of what a more rational economic organization would allow .', 'St.Teresa of Avila understood this when she said that she wanted her nuns to earn their living by their hands , in addition to living on the alms sent them .', ""To return to an economic organization of convents based on labor is only to return toSt.Teresas primitive plan which was always her favorite . ''"", 'These teachings are so rich , and may be foreseen as so fruitful , that they could serve as a basis for a mysticism of labor .', 'There is meekness and humility both on the part of the vicar of Christ , and of those who comment on his pronouncements .', 'We have spoken in THE CATHOLIC WORKER on how orders in the Church have been so plentifully supplied with property and the means of improving that property , of the alms of the faithful , and how little has been done to help families , each one of which is a little church , a little community , and how when that help is given , the world [ sic ] alms and pauper carry a stigma .', 'The new movements in the Church towards poverty and manual labor , a sharing with the poor and the destitute their hard lot in life , and side by side with this the persecution of the Church and its clergy and religious , and the despoiling of the Church of its property bringing about an involuntary precarity , go hand in hand with the pronouncements of Pope Pius XII who consoles his children and at the same time urges them to a new life .', 'Peter Maurin used to call it a philosophy of work .', 'Are children being taught a reverence for the soil , out of which all things come , since we are but dust ?', 'Her task was to furnish a home , to cut out all the things one would need in that home , and she pored over magazines , and cut out linoleum , furniture , kitchen sets , parlor sets , gadgets , and had a lovely time doing it .', 'And all the while standards were being set up in her mind desires were being stimulated to buy what the advertisers present and to get the job , to get the money , to buy what the advertisers present .', 'I remember an Italian on Mott street just about to get married .', 'Are our children being taught not only to work for what they need , not what they want , and also to work for others , so that they will always have a surplus to give away ?', 'Are they taught to tithe themselves to give even one-tenth of what they are going to earn , to the poor ?', 'I think these things as I see my grandchildren going back to school .', 'At home , Becky occasionally says , when she is made to run too many errands , I am the chief slave around here .', 'Her mother says , No , I am the chief slave , and you are first assistant .', 'Mary will pick things up off the floor and bring them to you ( she has not far to bend ) .', 'Nicky loves to set the table , and bring out baskets of food when we are having a picnic under the mulberry trees .', 'How they all love to go to the garden to pick squash , tomatoes , onions , cucumbers , green peppers and carrots .', 'And they love to bring out the remainders to the 28 rabbits , 23 chickens and geese .', 'It is the cleaning up , the washing of dishes , the putting away of things that are hard .', 'We havent a thing in the house , the usual womanly reaction .', 'We have had two and three Masses a day at Peter Maurin farm for the past month .', 'There is culture , which is the drawing which little Mac Smith does , and all the children love to do , and the reading and the listening to music , and the making of it .', 'At Peter Maurin farm , we all joined in singing , Michael with Russian songs , Fr .', 'The Hopi Indians raise their food from more obstinate land and they induce it with love to yield their necessities .']"
3,./data_dsicap/DorothyDay/raw/148.html.txt,"['Summary : Discusses the two major subjects of her speaking engagements , Peter Maurin , whom she describes as founder and mind of the C.W.', ', and personalism , which she describes as communitarian , and the philosophy of both P. Maurin and the C.W..', 'We are printing Gerrys letter in this issue of the paper , but I want to take up one paragraph especially .', 'He said : Quite by chance I gave a very , very informal talk on the Catholic Worker several nights ago .', 'I am positive they were bored to death or couldnt understand my middle western accent .', 'I did my best but it makes one seem so much like a fool when people just dont grasp what you are driving at .', 'Joe and Gerry How well we all know that feeling , those of us who are called upon to speak at meetings , communion breakfasts , conventions , etc .', 'Gerry Griffin and Joe Zarrella were five and a half years with the CATHOLIC WORKER and neither of them made more than half a dozen speeches , and then only when they were caught in a trap and forced into it .', 'Joe made a trip with Peter Maurin once and found himself on the platform and on the spot , but after he got home he never made another speech and all my pleadings , cajoling and even outright commands served to no purpose .', 'So far , only Peter and Arthur Sheehan and I have done the talking around the country .', 'Peter Maurin First of all , it was Peter who came into our lives and called us to work in the vineyard .', 'He convinced us by his own talking that there was work to be done , that we each had vocations , callings .', 'When people ask me how the Catholic Worker movement started and what it is , I tell them about Peter , and the way he lives , and the ideas he expresses .', 'I talk about his personalist and communitarian philosophy .', 'And since we started talking about these things ten years ago , there is scarcely a mail comes in that we dont have to go on talking and writing about them to answer the questions .', 'Thats because our readers are trying to live these ideas , not just talk about them .', 'And the living of them leads to endless discussions , which as Peter says , leads to the clarification of thought , but it also leads to endless misunderstandings .', 'I am at present engaged in trying to write a book , and it will be a long book , about Peter and his ideas and the work that came of them .', 'So it is hard to try even to suggest what it is all about in a few short columns .', ', and To be what you want the other fellow to be .', 'We are here to know God , to love Him and to serve Him .', 'Peter is always giving us lists of books which enlighten us , develop our faculties so that we know more about God and man .', 'We are here to know God , to love Him and to serve Him , and how can we love and serve Him unless we love our brother and serve him .', 'So it follows , that each of us , instead of being self-centered , must try more and more to be God centered .', 'To obey the first commandment by loving God above all things , with all our hearts , souls , minds and strength , and our neighbor as ourselves .', 'Mine for instance , is journalism writing , and it is only because of the paper , the CATHOLIC WORKER , that houses of hospitality and farming communes , or even the suggestion of them came into being .', 'People read about our way of thinking and our way of life and want to join us .', 'We write about these things and they sound wonderful in writing .', 'The kingdom of Heaven sounds wonderful , too , but it must be taken by violence .', 'And love in practice is a harsh and dreadful thing compared to love in dreams A Movement People come to join us in our wonderful work .', 'Unless we can live simply , unquestioningly and solitarily , one might say , in the midst of a mob , then we cease to be a personalist .', 'But since we are not having regular meetings , he must take his chances to indoctrinate as he gets them , which may be in the midst of mailing out the paper , answering letters , etc .', 'Remember St.Paul and how he talked all through the night and how one of his listeners sitting on a window sill in the close room , hot with the lamp light , fell out of the window and had to be restored to life by the speaker , who then went back to his indoctrinating regardless !', 'He has done every kind of manual labor so he is indeed a worker as well as a scholar .', 'But he is an indoctrinator , not a manager of a house of hospitality , nor yet of a farming commune .', 'Joe and Gerry did the former job of running a house of hospitality as well as they could considering we were also a newspaper office , but we have not yet found good farm managers , with knowledge , ability and perseverance .', 'Whether our farms will ever be more than groups of people living together , more than villages on the land , it is hard to tell .', 'But we have lost our knowledge of crafts , we have not yet achieved the unjudging self-discipline , the asceticism , the voluntary poverty necessary for even the beginnings of a farming commune .', 'You can get a paper-covered dollar edition from Sheed and Ward , 63 Fifth Avenue .', 'I had read that and am now reading two complete volumes , edited by Ernest A. Wallis Budge , keeper of the Assyrian and Egyptian antiquities of the British Museum and published 1907 .', 'It is familiar ground that I am covering what with the campaign in Africa , and letters from Gerry from Syria .', 'We hope our readers can get hold of both and enjoy them as I have .']"
4,./data_dsicap/DorothyDay/raw/13.html.txt,"['However , agrees with Pius XI in his encyclical Forty Years After , that the state may intervene when a particular group is threatened and no other means are available to them .', 'And it is to explain this our end in view that I am writing this editorial .', 'People come to the workers school and talk and hear much talk about the encyclical , Forty Years After about the NRA and how far it goes to approach the Popes idea , about international peace and international associations of working men and industrialists .', 'And then when they have heard all this from the lips of priest , professor and laymen , Peter Maurin rises up with the voice of one crying in the wilderness and says , The great danger of the present day is Fascism and the tendency of all organization is to lead to fascism .', 'And Peter continues his warning , Fascism !', '( Often it is hard to get them home . )', 'But for the benefit of those who linger over their suppers , I am rehashing Peters preachings thus : In view of the general disorder and chaotic condition of affairs , Pope Pius issued his great encyclical on Saint Francis of Assisi .', 'It was the message of Christs vicar on earth the message that Christ himself gave in the Sermon On the Mount .', 'It is as though a sad and weary father said to his children who warred continually on one another : Very well you will not follow the ideal for the sake of Christ .', 'But - the organization held up as best by Pope Pius XI , is not the organization of the labor union as we know I here in America .', 'The perfect state it is a thing to fight for .', 'Christ said , Be ye therefore perfect even as your Father in Heaven is perfect .', 'Go ye therefore and sell what you have and give to the poor .', 'If you have two coats take one and give it to your brother , and if your brother ask you for your coat , give him your cloak too .', 'People do not scoff at these words because they are the words of Christ .', 'But nevertheless these words ( hard words ) go down through the ages , and through them many have followed the precept as well as the counsel .', '( As for those who dont God knows that we are but dust and he is a kind and tender father . )', 'The Catholic Worker regards the existing system of labor unions as a poor and faulty one , far below that of organization described by Pope Pius XI in his Encyclical , Forty Years After .', 'The Catholic Worker fears the NRA inasmuch as it may lead to more state regulation and bring nearer the danger of Fascism .', 'Peter Maurin believes that the Pope is opposed to political action , that he welcomed the dissolution of the Catholic party in Italy and the Centrist party in Germany .', 'So though we say that Michael Gunn more nearly approaches in his idea the teachings of the Pope than does the NRA we continue to cling to the ideal as held up in the gospel and in the encyclical on St.Francis of Assisi .', 'We shall not reach it we know .']"
