,fileName,sentence
3,./data_dsicap/DorothyDay/raw/173.html.txt,"[u'Intelligent parents of today , rather than leave their children a certain sum of money , prefer to spend their substance in giving them an education which will make them capable workers , whether the work be intellectual or manual .', u'Poverty has been practiced particularly by means of economy , it has been sought to make things last ; darns and patches have therefore been multiplied , time being taken up in excess of what a more rational economic organization would allow .', u'St.Teresa of Avila understood this when she said that she wanted her nuns to earn their living by their hands , in addition to living on the alms sent them .', u""To return to an economic organization of convents based on labor is only to return toSt.Teresas primitive plan which was always her favorite . ''"", u'These teachings are so rich , and may be foreseen as so fruitful , that they could serve as a basis for a mysticism of labor .', u'*** We have often spoken of the collective wealth of orders and the individual poverty of religious , who often have not enough to buy stationery .', u'We have spoken in THE CATHOLIC WORKER on how orders in the Church have been so plentifully supplied with property and the means of improving that property , of the alms of the faithful , and how little has been done to help families , each one of which is a little church , a little community , and how when that help is given , the world [ sic ] alms and pauper carry a stigma .', u'The new movements in the Church towards poverty and manual labor , a sharing with the poor and the destitute their hard lot in life , and side by side with this the persecution of the Church and its clergy and religious , and the despoiling of the Church of its property bringing about an involuntary precarity , go hand in hand with the pronouncements of Pope Pius XII who consoles his children and at the same time urges them to a new life .', u'Peter Maurin used to call it a philosophy of work .', u'Is our work that we are preparing to do in life helping to feed , clothe , shelter people ?', u'Are children being taught a reverence for the soil , out of which all things come , since we are but dust ?', u'Her task was to furnish a home , to cut out all the things one would need in that home , and she pored over magazines , and cut out linoleum , furniture , kitchen sets , parlor sets , gadgets , and had a lovely time doing it .', u'And all the while standards were being set up in her mind desires were being stimulated to buy what the advertisers present and to get the job , to get the money , to buy what the advertisers present .', u'I remember an Italian on Mott street just about to get married .', u'Are our children being taught not only to work for what they need , not what they want , and also to work for others , so that they will always have a surplus to give away ?', u'Are they taught to tithe themselves to give even one-tenth of what they are going to earn , to the poor ?', u'I think these things as I see my grandchildren going back to school .', u'At home , Becky occasionally says , when she is made to run too many errands , I am the chief slave around here .', u'Her mother says , No , I am the chief slave , and you are first assistant .', u'Mary will pick things up off the floor and bring them to you ( she has not far to bend ) .', u'Nicky loves to set the table , and bring out baskets of food when we are having a picnic under the mulberry trees .', u'How they all love to go to the garden to pick squash , tomatoes , onions , cucumbers , green peppers and carrots .', u'And they love to bring out the remainders to the 28 rabbits , 23 chickens and geese .', u'It is the cleaning up , the washing of dishes , the putting away of things that are hard .', u'We havent a thing in the house , the usual womanly reaction .', u'We are never as orderly as we should be what with the accumulations of clothes in the bedrooms .', u'We have had two and three Masses a day at Peter Maurin farm for the past month .', u'There is culture , which is the drawing which little Mac Smith does , and all the children love to do , and the reading and the listening to music , and the making of it .', u'At Peter Maurin farm , we all joined in singing , Michael with Russian songs , Fr .', u'The Hopi Indians raise their food from more obstinate land and they induce it with love to yield their necessities .']"
4,./data_dsicap/DorothyDay/raw/162.html.txt,"[u'He works nights and tries to farm days .', u'He had counted on his grown son farming while he brought in a cash income , but the boy joined the army and is now in Japan .', u'There are two young sons in school , and since they are closing all the smaller schools around here , they have to go by school bus twelve miles to the Berkeley Springs school .', u'My meeting was in Hagerstown where I was introduced by Paul Wagner , a CIO organizer ( the auto workers include the airplane plants ) .', u'They would probably have to go before the arbitration board .', u'We had dinner together , a good meal cooked by his bride of a few months ; and Dan Cassey , also CIO auto worker accountant from Detroit and a friend of the late Paul St.Marie , was there .', u'I had commented in my book On Pilgrimage on the grave difficulties attendant on organizing in such a district as this , and I did not know that Id be meeting the organizers.- Nationalization We talked of President Trumans suggestion to build Federal Steel plants , a first step to nationalize the industry , everyone foretells .', u'The CIO men thought such a step in the right direction but according to the Popes and Eric Gill respectively , such steps are only taken when ( 1 ) the industry is too great for private management or ( 2 ) should be only a step towards turning over the means of production to much smaller groups representing the workers themselves .', u'First of all they must be taught to want it and as far as I can see , the drift of the clerical advisers of the workers is all in the other direction .', u'Even my friend who ate sweet meats with me , as the Palmist said , those of the Catholic Rural Life Conference , in a public statement at their last conference in December have come out against us of the Catholic Worker movement in the recent Commonweal controversy in endorsing our present industrial system and advocating a moderate decentralization .', u'All they want , what they will settle for , is a share of the profits , instead of a share in the ownership , and the decentralization of the physical business of factories and production , and not a decentralization of control by widespread ownership .', u'Their best dig around us here is a dig at our poverty , part of which is holy in that we voluntarily accept what we can not help .', u'We use it as a means of sharing what we have with others , and is something we will accept as inevitable if we want to get on the land , or out into the village atmosphere , away from the occasions of sin which both the Holy Father and Fr .', u'They not only disregard the lessons of historywhy else did the Russian revolution come about except in desire of the people for land and work and responsibility , a sense of their dignity as workers ?', u'To have any vision of ownership by the workers of the means of production , a distributist economy , personal responsibility , a regional economy , is to them visionary .', u'Yes , the workers must be brought to want communal ownership so far have they strayed from the responsible man .', u'Now they want the security of government ownership .', u'They want the government rather than the corporations to take over , so that they can all become civil or federal employees .', u'Many a time in talking to young people at schools , I have noticed that their idea of security is to work towards a city job .', u'Of course when I speak along these lines there are always members of the audience who feel that I have gone too far .', u'One Protestant minister who reported my talk for the Hagerstown paper said that he agreed with all I had to say about the works of mercy ( our care for the victims of our social order ) but that he violently disagreed with everything else .', u'This afternoon Tamar , Becky and Susie and I took a walk down through Peter Yosts property ( 146 acres for $ 2,100 ) .', u'Only in such a diocese as that of St.Louis have I heard of priests going to the land with their people .', u'We certainly try to be realistic and the terrible dilemma of the choice between city streets and the countryside without church or school is a tragedy of our day .', u'It was fun going over the old house with its two tiny stairways , its pump on the back porch , the log barn and granary and other outbuildings .', u'A better house than mine , Mr.Weber , our neighbor to the east , was saying just a few weeks ago at a pig killing at Mrs.Fearnows .', u'They were pouring cement the day we were over there , and a local portable mill had moved in and was sawing logs for them , and they are going to have to build with green lumber just for the sake of shelter .', u'The new place will be 25 by 25 , and Mrs.Weber was lamenting on how small her kitchen was going to be .', u'Mrs.Fearnow said Mrs.Weber used to be a sickly woman , but now at fifty-four is beginning to get her health back !', u'I must say that she looks younger at fifty-four than I do at fifty-one !', u'We hung out a line full of clothes today and the extra rinsing will do them good .', u'Here a Celanese factory is the largest industry , though there are many other factories and it is a railroad town , too .', u'What are we going to do about the increase of unemployed , who have been kept employed these last ten years only because of war and reparation for war , or preparation for more war !']"
5,./data_dsicap/DorothyDay/raw/5.html.txt,"[u'The book is adapted from the diary she kept in 1948 , when she spent the first four months with Tamar ( daughter ) and the rest of the year at Mott street and the retreat farm in Newburgh .', u'CONTENTS Foreword Introduces the book as a womans book , and for women , dealing with things of concern to us all , the family , the home , how to live , and what to live and what we live by .', u'January Deep in Winter at her daughters farm in West Virginia they await the birth of Tamars third child .', u'Urges readers to come to their farm for a retreat to renew strength for the apostolate .', u'John J. Hugo who himself quotes saints , mystics , scripture , and Church prayers to illustrate how the nuptial union is an analogy of Gods love for us .', u'Recalls the Catholic Worker began in May sixteen years ago and summarizes their program and the many allied movements of the lay apostolate .', u'Says their pacifism and distributism distinguishes them from other movements .', u'Focuses on voluntary poverty as exemplified in Peter Maurins life , especially since he became ill .', u'Keyword : economics July-August Relishes life on the land , saying it is a place to retreat to , find God , and to go forth from as apostles .', u'Gives examples of her failure to love and the struggle to renew love of God and neighbor .', u'Recalls the wonderful time children had at their labor day retreat and laments their expenses on the farm and for the breadline in the city .', u'November An essay and meditation about love in its many forms , human and divine .', u""Concludes that the Catholic Worker is `` still trying to work out a theory of love , a study of the problem of love so that the revolution of love instead of that of hate may come about and we will have a new heaven and a new earth wherein justice dwelleth . ''""]"
6,./data_dsicap/DorothyDay/raw/170.html.txt,"[u'Summary : Summarizes Peter Maurins worldview and discusses his new social order and how his life embodied his ideas .', u'In 1932 , Peter Maurin , founder of the Catholic Worker movement , was working at hard manual labor at Mount Tremper , New York , at a boys camp where he mended roads , cut ice , and did other chores winter and summer and received his living , not a very munificent one , in return .', u'He slept in the barn which was as close to the Stable as he could get .', u'Before this he had travelled through the States and Canada as an unskilled laborer .', u'Before that he had worked in France , where he was born , at the one thing he was skilled at , teaching with the Christian Brothers .', u'But he believed too , that the scholar had to become a worker not only that he might understand the conditions and problems of the worker , but that the worker too might become a scholar , because Peter believed in THE PEOPLE changing their own conditions .', u'Peter Maurin studied the prophets of Israel and the Fathers of the Church ; he studied Proudhon , Karl Marx , Kropotkin and familiarized himself with utopian socialist thought as well as Marxist thinking .', u'He knew to whom to turn among Catholic thinkers , and he introduced us to Romano Guardini , Karl Adam , Luigi Sturzo , Vincent McNabb , among the priests , and to E. I. Watkin , Christopher Dawson , G. K. Chesterton and Hillaire Belloc as well as E. J. Penty and Peter Kropotkin , who was in a way his favorite among the laywriters .', u'He always aimed at the best , and to him voluntary poverty , manual labor was the beginning of all true reform , which was to begin with ones self .', u'People are always saying , they dont do this , and they dont do that , he would cry out in ringing accents , WE is a community , THEY is a crowd .', u'And a lonely crowd , David Reisman would say , himself crying out against the damned wantlessness of the poor .', u'Peter would have liked Reismans book as he would have liked Martin Bubers book , PATHS IN UTOPIA .', u'He wanted people to be taught to want the best , and the best for him was the immediate program of the works of mercy , practiced in the cities and farming communes set up in the countryside where workers and scholars could get together to try to rebuild society within the shell of the old by founding better institutions to take the place of soulless corporations .', u'He saw the need for the works of mercy as a practice of love for our brother which was the great commandment and the only way we can show our love for Christ , and he saw too that such a practice would mean conflict with the State .', u'Peters teaching meant the immediate establishment of houses of hospitality because it was a time of depression and not only the worker , but young Catholic college graduates were unemployed .', u'Young people gave their services and unemployed workers gave their skills , and readers of THE CATHOLIC WORKER sent in material goods and money , so that for the last twenty years we have kept going on this basis of voluntary poverty and abolition of the wage system , for those preferred to give their services rather than go out and earn a wage for them .', u'Peter did not believe in the use of force to bring about this new society , so from the first we have opposed class war , race war , civil war , imperialist war , and have been surrounded by them all .', u'He spoke of the treason of the intellectuals and also of the fault of the worker who permitted his work to be treated as a commodity to be bought and sold .', u'The impact Peter made on us all , from one end of the country to the other , so that houses of hospitality and farms were undertaken from coast to coast , was because he personally lived a life of poverty and work .', u'The evil is so deep seated , he said , that of course much of the time will be given up to an immediate practice of the works of mercy .', u'But he believed too , in constantly trying to create order out of chaos .', u'Because Peter loved most of all what he called the green revolution , we are beginning our twenty-first year with emphasis on the land .']"
7,./data_dsicap/DorothyDay/raw/153.html.txt,"[u'In this issue of the CATHOLIC WORKER we are especially stressing the writing of women and are carrying articles by Irene Naughton , Ade Bethune , Julia Porcelli , Josephine Drabek and Mary Frecon .', u'They deal with work as it is in the world today , and with the works of mercy .', u'It seems to me that they illustrate some of the things which our Holy Father , our dear sweet Christ on earth , as St.Catherine of Sienna called him , has to say in his message to women which we are printing in its entirety in this issue .', u'Their fate is to go through life single , without a mate and without a home .', u'We are reminded of the words of Isaias : And in that day seven women shall take hold of one man , saying : we will eat our own bread , and wear our own apparel ; only let us be called by thy name , take away our reproach .', u'The great need of the human heart is for love , and especially do womens lives seem empty if they are deprived of their own to love .', u'Indeed , we know that the first commandment is to love , and we show our love , as St.Teresa said , for our God by our love for our fellows .', u'One of our friends on Welfare Island says that there is great need over there for help .', u'Thousands of patients in mental hospitals sit out their sad and dreary lives with no help .', u'Duffy points out in his article this month the need for more and more parish houses of hospitality .', u'Youth demands the heroic , Paul Claudel says , and here is a chance to give ones self to starting and operating these centers to practice the works of mercy .', u'It is necessary to do the thing ones self .', u'If they are cold , how can we go clothed and sheltered ?', u'It is easy to see why the saints espoused voluntary poverty .', u'If they have a few serviceable and well-made clothes , they will not be always shopping for the multitude of dresses and coats and sweaters which seem necessary to them now to keep up with the well-dressed girl in the office .', u'We may say that there is nothing that we can do , but that is not true .', u'We can send clothes , personally ; food , personally .', u'There are nuns all around us of every nationality , and if you go to them and ask for the addresses of orphanages and hospitals and convents in Italy , France , Belgium , Holland and many other countries , you can send bundles up to eleven pounds .', u'We should rejoice that there is work for us today , that we can put forth our hands to strong things .', u'In these days of sore distress our happiness and our love will be in doing these things , and in doing these things we will find God and find happiness .', u'As St.Augustine says : It is with no doubtful knowledge , Lord , but with utter certainty that I love you .', u'You have stricken my heart with Your word , and I have loved You .', u'And indeed heaven and earth and all that is in them tell me wherever I look that I should love You .', u'None of these things do I love in loving my God .', u'Yet in a sense I do love light and melody and fragrance and food and embrace when I love Godthe light and the voice and the fragrance and the food , and embrace in the soul , when that shines upon my soul which no place can contain , that voice sounds which no tongue can take from me , I breathe that fragrance which no wind scatters .', u'That is that I love , when I love my God .']"
