,fileName,sentence
5,./data_dsicap/DorothyDay/raw/174.html.txt,"['They have been doing what Jesus Christ Himself told them to do in their great love of God and of their brothers .', 'This work which has caught the attention of the world began with the Resistance movement in France when both Communist and Catholic lived side by side in prison and concentration camp where they began to know one another and love one another .', 'With a Strong Cry And now , after ten years trial , these worker priests have been under the scrutiny and criticism of the world so that every day there is some mention of their work and present struggles in the secular press as well as the Catholic .', 'Since the controversy over the worker priests mission in Paris and throughout France has started , the Little Brothers of Jesus have received word from Rome that they can continue to work eight hours a day and live as they are doing .', 'There are even two of their number living and working on a collective farm in Palestine !', 'The unfortunate aspect of the controversy over the priest workers is that it is being used by the enemies of the Church to belabor the Church .', 'Cardinal Saliege has said there was a yielding on the part of the priest to the temptation to believe that his essential function is to take the place of the lay leader in the workers fight .', 'The article goes on to state : Perhaps the most disturbing factor of all was the attempt to construct an ideological and theological background to justify even more extreme positions being taken by the priest workers and their followers .', 'Their argument can be reduced to three heads : ( 1 ) the only philosophy which is immanent in the workers movement is Marxism ; ( 2 ) a distinction must be made between Marxist morality and its atheismthe former can be accepted , even the latter can contribute to human progress ; ( 3 ) a clear distinction must be drawn between the Catholic faith and temporal action .', 'While it would be erroneous to suggest any close association between the priest workers and the doctrinal errors of Jeunesse de LEglise it is nevertheless true that many of their defenders their worst enemies their friends did use such arguments as these .', 'It will be seen that the issue is not too clear as to whether or not any of the priest workers actually did embrace Marxism as a solution , though they went along with them in the union and political action and their work for peace .', 'Agreement While we do not agree with their emphasis on political action and peace action ( they are no more pacifists than the Communists are ) we still do not see why there should be such a furor in the Church while the great mass of priests of the Church go along wholeheartedly with Capitalism , which Count de La Torre in Osservatore Romano called a cancer on the social body of the Church , and worse than Communism .', 'We hear of plenty of electioneering and political action amongst priests when it comes to legislation about Bingo or getting our share of State benefits for our schools , and tax exemption .', 'But where are the priests crying out for the workers in time of strike , crying out for the poor , living among them in their tenements ?', 'Waste Last month one of our workers washed dishes in a monastery for some days and witnessed the thick steaks , chops , roasts which were served twice a day to the fifteen or so members of the community .', 'What was left ( on the platters as well as on the plates ) was thrown into the garbage , and the men at the door , the ambassadors of Christ , were turned away harshly , first by the housekeeper , and then by the priest at the front door , who then came out to the kitchen reproaching her for not having gotten rid of the bums for good and all in the first place .', 'Christ came for the sinners , He told us , so that must go for Bowery sinners too .', 'Clarification As far as we of The Catholic Worker are concerned , this controversy is all to the good in that it will perhaps through much discussion and suffering bring about clarification of thought on the subject of manual labor and voluntary poverty as essential means in bringing forth good fruit .', 'The great scandal of the age is that those without the sacraments are so often superior in charity , courage , even laying down their lives for their brothers , to the practicing Catholic who partakes of the Sacraments of Penance and Holy Eucharist and then stands by while his brother is exploited , starved , beaten , and goes on living his bourgeois life , his whole work being to maintain his standard of living , and neglecting the one thing needful , love of God and brother .', 'In the union field , even in this country , it has been the union organizer , often the Communist , who has risked jail and beatings to organize textile workers and migrant workers while the Catholic too often stands by and accepts the benefits of the union and does not earn them .', 'Both Mauriac and Maritain have said that he who loves his brother and works for justice is working for Christ even though he deny Him ; that is , deny Him as he sees Him in the nominal Christian .', 'With the infinite variety of work in the Church , to some one of which each one of us has his vocation though we may turn away and refuse it , there is of course a great contrast between the work of the Little Brothers of Jesus and that of the priest workers .', 'We who have worked for the same length of time as the Little Brothers , since 1933 , can see that no Point Four program , no technological advances , no purely material means are going to remedy the disease of today .', 'On the other hand , seeing too as we do the slums of Harlem , the East Side , the perversion of the masses by poverty and propaganda , we also realize that we have to make the kind of social order where it is easier for men to be good .', 'The depth of the suffering of the world is measureless , a bottomless abyss and our only approach to it is through the dark night of the soul , a taste of which the priest workmen of France are now having .']"
6,./data_dsicap/DorothyDay/raw/178.html.txt,"['And how terrible it is to see that I myself am in the same category , a convicted criminal , under suspended sentence for being a slum landlord .', 'What strange lessons we learn through this hard way , of loving our enemy , in the class war which is basic in the world today , very much a part of all the cold war which is going on between the rich and the poor .', 'What is the solution to such a questionfor everyone to own his own home , through cooperative housing in the city , such as that of the Amalgamated Clothing Workers or the International Ladies Garment Workersor for the city to own all the apartments ?', 'Subsidiarity It is an injustice , a grave evil and a disturbance of right order , writes Pius XI In his encyclical Quadragesimo Anno , for a larger and higher association to arrogate to itself functions which can be performed efficiently by smaller and lower societies .', 'We will go back to the status of tenants , and pay our monthly rent , and in addition to a day center ( the former little theater and dancing school which we have rented on Spring street ) we will rent apartments in the near neighborhood .', 'Little Margaret who is over 70 says that it is good for her arthritis to walk up and down stairs all day .', 'It keeps her from getting stiffened up .', 'As I write , moving starts , the files are going over to the loft , the addressograph machine and the stencils .', 'We will go to press on Dec. 29 , mail out the paper the two days before New Years , and the day after New Years we will take up our beds and go .', 'Little by little we will furnish new apartments as we get them .', 'We know that none will be neglected and that things will work out for the best .', 'All things work for good for those who love God and we are trying to learn to love , it is the business of our life .', 'God is Love and we hope some day to see Him face to face .', 'It is a new era for us , it is getting back to poverty again , it is getting closer to the poor .', 'We will take the money paid us by the city , and begin to build a cinder block retreat house on the Peter Maurin farm , While our life is simplified in one way , it is still complicated since we still will have to deal with law and architects and lawyers and city officials .', 'There is no getting out of at least trying hard to follow our best judgment , our inspiration , to work harder at the farming commune idea of Peter Maurin .', 'If we are stopped on that level too , on that higher level we are reaching for , then that too will be considered the will of God , only accepted because we have done all we reasonably could .', 'When we could go no further , then we had to go by faith .', 'And it seems only reasonable to try to use our resources to build on the land .', 'If we are stopped , we will just go on distributing the goods entrusted to us to the poor again following the light of reason as far as it will take us .', 'Several times those poignant lines of St.Vincent de Paul are quoted , It is only by feeling your love that the poor will forgive you for the gifts of bread .', 'And he says that St.Vincent de Paul probably healed more people than Jesus did , and that shocked me into the realization that we probably have fed more people and housed more people than Jesus did , but what Jesus has done is to take possession of all human trials and sufferings so that presented by Him to God , they might serve for the redemption of mankind .', 'His passion was to suffer all things , to be like in every way to us except in sin , and to be Love itself .', 'One of the things of which I have become more and more convinced , as I have gone around the world , is that a certain phenomenon has been taking place throughout Christendom under different outward appearances .', 'What I am referring to here can perhaps best be illustrated by pointing to a certain lack of effectiveness with missionary charitable works as regards the propagation of the Christian faith , coinciding with an aggravation of the divisions between men .', 'He goes on to say that what our Lord wanted was unity , that they all might be one .', 'I know socially minded employers who , having done the best they could to meet the workmens movement , say : Look at the dreadful results .', 'What , they ask , was the use of going to all the trouble of setting up dispensaries on our farms to care for the sick and of looking after the children of our workmen ?', 'All we are getting is revolt .', 'And then Pere Voillaume goes on to tell of the kind of charity Jesus Christ wants of us Christians , to what limits He can ask us to go in observing His commandment .', 'It is plain from the Gospel , as I have already reminded you , that there is a closer bond between love and poverty than we may always appreciate .', ""either the Christians are going to comprehend what has happened and change , or the Church is going to be arrested in her development ; the working classes will move farther and farther away from her , especially in those countries where they are already largely outside , and the Christian communities which have been founded among the different colored races will totter because the missionary is white and because he has come with the white official and the white business man , and whether he will or not , is therefore looked upon as one of them . ''"", 'Every morning they receive our Lord in communion , and every night they kneel with empty hands before the tabernacle and bring before the Lord the misery of the world , and yes , too the beauty and joy of the world .', 'They live in love and humility , they take the littlest place , they are poor with the poor , suffer with the poor , endure fatigue , ugliness , noise , all that is most difficult in the life of the destitute .', 'I write thus at length because I feel that this way has so much to teach us , in our own work , whether we live in the world or out of it , whether we are housewife , teacher , artist , student ; whether we live , because of our vocation , in Westchester or on Mulberry St. Jesus Caritas It is a gift of Friendship which I am making you , our readers , when I tell you to send for a copy of this quarterly , Jesus Caritas , to Association Charles de Jesus 11 , Cite Trevise Paris 9e France A contribution of 75c is asked but it is easier to send a dollar and so to help spread the work .', 'It is made up of Little Brothers , Little Sisters of Jesus , Little Sisters of the Sacred Heart , Union of the Brothers of Jesus , a secular Institute for diocesan priests in process of official constitution , a secular institute for laymen , one for women , and the Charles of Jesus Fraternity , an association for men and women .', 'The French edition has been coming out for some time , but this issue I am writing of is the first English edition .', 'We have much to learn about poverty and love , and may we grow in both , this coming year !', 'It is very cold now and David has to get up three times during the night to replenish .', 'I have got to get married when I grow up , says Mary who is seven , Because I am afraid to sleep alone .', 'And I am going to get married too , says Martha who is three , and I am going to carry a hand bag .', 'All this talk about marriage was because there was a fourteen year old girl who has just left school to get married , and the little girls are fascinated at the idea of being so suddenly grown up before you know it , and having a home of your own .', 'One family had four children and the commentator talked about the man on the plantation only planting as many trees as he could care for , and the picture of that family was a happy one , well ordered and cheerful , everyone smiling .', 'One child withdrawn , obviously disturbed , another child feeding another , a boy talking back to his father , and so on .', 'couple agreed in the privacy of their own home that if people ever talked to each other openly about the sufferings brought on by raising a family today , the birth rate would drop to zero .', 'How good it is to get letters during the month from families who have made as much of a break with industrialism as they can , and to realize that there are many setting themselves against the system .', 'We talked also about the two books , Mans Search for the Good Life , by Scott Nearing and Living the Good Life , by Helen and Scott Nearing , being a plain and practical account of a 20 year project , in a self subsistent Homestead in Vermont , together with remarks on how to live sanely and simply in a troubled world .', 'I am always astounded however by the divergence of theory and practice .', 'Which reminds me that my remarks on the collective farms and community farms in Soviet Russia were misunderstood in some quarters the last month .', 'When I pointed out the contrast between the great collective farms where men and women have their homes and private gardens and stock , and our own gigantic wheat and fruit and cattle ranches where much of the work is done by migrants and tenant farmers who own nothing and who are turned away in sickness and in times of unemployment , I was not speaking in favor of giving up our freedom .']"
7,./data_dsicap/DorothyDay/raw/151.html.txt,"['Summary : A chapter from her unpublished book Peter Maurin .', 'We would like to be able to tell you when the book is going to come out , but we are trying to make up our minds whether or not to publish it ourselves .', 'If we had a printing fund ( and anyone who is interested in our publishing the Peter book can let us hear from them ) we might go ahead .', 'THIS noon I met Peter down at St.Andrews Church and we walked along the Bowery to the Eclipse Restaurant , where he usually has his breakfast .', 'I dont mean that they are thick , but wherever you look between the piles of bread on the counter , under the edges of the tables , on the floor at your feet , on the wall where you hang your coat and see always a scurrying insect .', 'One of our friends , a priest at a Benedictine priory , in order to comfort us when we were having coffee in our kitchen at Saint Josephs House , told us about the cockroaches in their kitchen where they have a good deal of help .', 'The priest who sat next to me killed one but after we saw three or four others we didnt bother .', 'I certainly dont think the poor ever get used to cockroaches , bed bugs , body lice , fleas , rats and such like vermin that go with poverty .', 'Someone asked Peter once why God had created bedbugs , and he said : For our patience , probably .', 'Peter and I sat down with two Negroes .', 'Peter ordered lamb stew which came at once , a huge bowl of it with three slices of bread and a very large mug of coffee for 20c .', 'It seemed to me that at every table around everyone was eating the same lamb stew , and when I ordered fried mush and an egg the waiter shook his head uncomprehendingly and said : lamb stew , so I ordered it too .', 'We began talking of labor leaders , and Peter said : Murray seems to be a religious man .', 'They are often mystics but mysticism may go in the wrong direction .', 'They say he prays .', 'I dont know about Lewis .', 'His mysticism may take that form but I dont know .', 'Since Peter was hungry he talked more or less in fragments so we had no time on this occasion to talk in detail about the labor situation .', 'Her father , Peter said , was a Russian diplomat and formulated the foreign policies in the time of the Tsar .', 'He was too Machiavellian a statesman .', 'Peter went on eating his lamb stew with great appetite .', 'He had been traveling all night , coming from Philadelphia , where the Catechetical Congress had been going on the last few days .', 'I had asked him to go down there because many Bishops are very interested in Peters ideas .', 'I dont know how many he saw , I dont imagine , in a huge congress of this kind , there was much chance to talk .', 'Peter did not look in the least tired , but , of course , he looked rather dirty , traveling as he had done , jumping from New York to Boston , then back to Philadelphia and then home again .', 'AS Peter finished up the last crumbs of his bread and the last drops of stew , he looked around him and called attention to the type of workers .', 'I worked with one of these gangs going out of Chicago to Peoria once .', 'I thought of Christ and His disciples , as he said this .', 'These workers dont get much and many of them drink .', 'I told them I am the son of a peasant who could neither read nor write and so I am pre-capitalistic .', 'Yes , I am pre-capitalistic and I dont like capitalism and I dont like Socialism , which is the child of capitalism .', 'I dont like the father and I dont like the son .', 'We dont like advertising .', 'I told them about the fallacy of saving and the wisdom of givingHe Left So Much , The First Christians , Self Organization , On the Farming Commune , Firing the Boss .', 'Then The Land of Refuge , Free Guest Houses , Rural Centers in Ireland , The Irish Scholars , and I told them they dont have to keep up with the Irish politicians .', 'They can keep up with the Irish scholars , and go in for Irish Communism .', 'And so the Jesuits formed there that communal life and gave them guns and told them to shoot whites when whites tried to force them into slavery .', 'They dont know those things .', 'He said that we were Christian communistsbut he was trying to figure out the encyclicals on the social order .', 'These encyclicals , I told him .', 'We consider this society a product of capitalism and we are trying to go back to a functional society : they had one once , before it had decayed into acquisitiveness .', 'They dont .', 'They just talk about it .', 'We go back , it is simpler .', 'We go back to the simple life .', 'Even Thoreau was talking about it , and Gandhi is an admirer of Thoreau .', 'We go back .', 'The Bishop of Sacramento says it almost does itself .', 'It is not like people asking for money and saying , rely on my judgment .', 'Some will tell me that is not in the encyclicals .', 'They dont know the encyclicals .', 'The idea is now people dont work if they dont get wages .', 'We know some workers who cant take it .', 'If we were more preoccupied about the next world , maybe it would solve the problems of this world , too .', 'We have to present these ideas in such a way they wouldthat is where intelligence winsthat the religious orders would again profess those things .', 'But they have become like the professors that dont profess .', 'They say that they are not practical .', 'When the Abbott of Saint Meinrads was here , he asked meWhere do you get all those ideas ?', 'I told him I didnt get themthey got me .', 'The secretaries wouldnt listen to me but I have succeeded in getting over their secretaries .', 'Through carrying out the farming commune program we prove we may be able to bring the Franciscans back to Franciscanism .', 'And if you bring the Franciscans back to Franciscanism you will have the stuff for the Jesuits , too , as well as the Benedictines .', 'When the Jesuits and Benedictines and Franciscans get our line of practicality then the Knights of Columbus will get it too .', 'And when the Knights of Columbus get it , then the Free Masons will get it and the Free Masons will be both free and masons .', ""Because the ideas get me I got to ex-people expect that from me . ''""]"
8,./data_dsicap/DorothyDay/raw/170.html.txt,"['Summary : Summarizes Peter Maurins worldview and discusses his new social order and how his life embodied his ideas .', 'In 1932 , Peter Maurin , founder of the Catholic Worker movement , was working at hard manual labor at Mount Tremper , New York , at a boys camp where he mended roads , cut ice , and did other chores winter and summer and received his living , not a very munificent one , in return .', 'He slept in the barn which was as close to the Stable as he could get .', 'Before this he had travelled through the States and Canada as an unskilled laborer .', 'Before that he had worked in France , where he was born , at the one thing he was skilled at , teaching with the Christian Brothers .', 'But he believed too , that the scholar had to become a worker not only that he might understand the conditions and problems of the worker , but that the worker too might become a scholar , because Peter believed in THE PEOPLE changing their own conditions .', 'Peter Maurin studied the prophets of Israel and the Fathers of the Church ; he studied Proudhon , Karl Marx , Kropotkin and familiarized himself with utopian socialist thought as well as Marxist thinking .', 'He knew to whom to turn among Catholic thinkers , and he introduced us to Romano Guardini , Karl Adam , Luigi Sturzo , Vincent McNabb , among the priests , and to E. I. Watkin , Christopher Dawson , G. K. Chesterton and Hillaire Belloc as well as E. J. Penty and Peter Kropotkin , who was in a way his favorite among the laywriters .', 'When he waved the encyclicals at us , it was not only the social encyclicals of the Popes , but also that on St.Francis of Assisi .', 'He always aimed at the best , and to him voluntary poverty , manual labor was the beginning of all true reform , which was to begin with ones self .', 'People are always saying , they dont do this , and they dont do that , he would cry out in ringing accents , WE is a community , THEY is a crowd .', 'And a lonely crowd , David Reisman would say , himself crying out against the damned wantlessness of the poor .', 'Peter would have liked Reismans book as he would have liked Martin Bubers book , PATHS IN UTOPIA .', 'He wanted people to be taught to want the best , and the best for him was the immediate program of the works of mercy , practiced in the cities and farming communes set up in the countryside where workers and scholars could get together to try to rebuild society within the shell of the old by founding better institutions to take the place of soulless corporations .', 'He saw the need for the works of mercy as a practice of love for our brother which was the great commandment and the only way we can show our love for Christ , and he saw too that such a practice would mean conflict with the State .', 'Peters teaching meant the immediate establishment of houses of hospitality because it was a time of depression and not only the worker , but young Catholic college graduates were unemployed .', 'Young people gave their services and unemployed workers gave their skills , and readers of THE CATHOLIC WORKER sent in material goods and money , so that for the last twenty years we have kept going on this basis of voluntary poverty and abolition of the wage system , for those preferred to give their services rather than go out and earn a wage for them .', 'Peter did not believe in the use of force to bring about this new society , so from the first we have opposed class war , race war , civil war , imperialist war , and have been surrounded by them all .', 'He spoke of the treason of the intellectuals and also of the fault of the worker who permitted his work to be treated as a commodity to be bought and sold .', 'The impact Peter made on us all , from one end of the country to the other , so that houses of hospitality and farms were undertaken from coast to coast , was because he personally lived a life of poverty and work .', 'But he believed too , in constantly trying to create order out of chaos .', 'Because Peter loved most of all what he called the green revolution , we are beginning our twenty-first year with emphasis on the land .']"
