,fileName,sentence
0,./data_dsicap/DorothyDay/raw/167.html.txt,"[u'Dave Mason suggests that we form Poverty Incorporated and sell shares in order to get the down payment for the new home we have in mind and Stanley recalls that it was the dream of Dan Orr before his death that we take over the Empire State building .', u'It is too big .', u'People dont live in big cities because they like bigness but because they want to be little , to lose themselves in the mass , partly so that they will not be judged for their failure , and partly because they can thus escape their responsibility themselves to be big of heart and soul , as the son of God , creatures of body and soul , temples of the Holy Ghost , are supposed to be .', u'Since writing our SOS last month , stating that our building at 115 Mott street was sold and we would have to move at once we have found the place we want .', u'It is two adjoining buildings , with backyard , in a poor neighborhood , and there is adequate space for kitchen and laundry and dining room and meeting room and dormitory and office .', u'There is backyard in which to hang out our clothes .', u'We can go on with this work we started seventeen years ago , and which we can not give up now .', u'When I saw Archbishop McIntyre on my January trip to the coast , he told me then never to give up the work we had started , that it was a difficult and delicate and dangerous work which God evidently wanted us to do .', u'We are not incorporated however , so there is no chance of our selling shares in Poverty , Inc. , nor chances for a car or a television set , so we will beg and try to raise the money .', u'We dont want to look anywhere else .', u'And all of us feel the same way , the folks on the farm , here at Mott Street , our friends and readers .', u'We must go on with the work .', u'And what is the work but to love God and our neighbor , to show our love for God by our love for our neighbor .', u'When He pictured the last judgment he listed the corporal works of mercy .', u'We really should be praying to St.Stephen too , on this job of finding a place since the apostles and disciples had to call him and others in to serve tables .', u'Always the Poor We believe not in big , impersonal buildings , lodging houses , homes , Institutions with a capital letter , there is so much of that , and people get lost , but work done by a group of individuals banded together with a sense of personal responsibility .', u'Just the same , we did not know what we were getting into when the Catholic Worker started in May , 1933 .', u'When we started giving a hot cup of coffee ( and all the bread they wanted ) to all who came , coffee was 19c .', u'It would be an insult to St.Joseph not to go on serving coffee .', u'Certainly , the coffee line is impersonal enough , but they probably know us better than we know them .', u'They come in for clothes , for carfare , for help to fill out forms , and when they can get a bed nowhere else , when all the flop houses on the Bowery are full , or they are just out of the hospital , then they stay with us for a while and we get to feel them part of the Catholic Worker family .', u'Peter Carey , who works with the St.Vincent de Paul at Bellevue and with the telephone company also , and who used to head the Catholic Union of Unemployed , says that he meets many a man in his contacts who has been straightened out by the CW .', u'They are women who have been in hospitals , jails , mental institutions .', u'And they too , many of them , get helped and many of the stay for long periods .', u'Sometimes we feel that we are not doing them any good and that they would far better be in one of the institutions on Long Island , where they could receive the medicines , the sedatives , the baths and other therapy but when we call the hospitals , they either refuse to take them or return them to us the next day .', u'Literally , there is no place else for them to go .', u'If you are picked up on a park bench , in the station , or in a door way , you get a jail sentence , one woman said to me .', u'You dont know what youll do when you are exhausted with hunger and sleeplessness .', u'There is a most terrible crying need for a shelter for women , a Catholic place where they can get straightened out and look for work and remain while working until they can find a room .', u'And as for free shelter , the one Catholic place which offers that puts the woman to work in its laundry so that she can neither look for work nor save for a room .', u'A Double Dwelling Needed A hospice for men and women , where there is a place for a family life together , where all without exception , even those who come to get help , can have their share in performing works of mercy , where we can have meetings and discussions as to the nature of man and his destiny and the kind of an order where it is easier for him to be goodthis is our aim in running a House of Hospitality .', u'It is a place where we can show our love for each other .', u'Only those who know how hard it is have a right to say it .', u'A Matter of Mood Some days when it rains , and the cellar flooded and drowned rats , and soaking newspapers and old mattresses contribute a peculiar odor of decay , and the walls drip and the bannisters are slimy and the lights have to burn all day even on the top floor to dispel the gloom and one of the women has had one of her spells ( for several days and nights ) , cursing and wailingthen it is indeed hard to love one another .', u'On other days , like this afternoon , when the sun is shining and the women have been cleaning house and washing clothes , everything looks bright and cozy and you forget the verminous walls and the fact that you have just bought some DDT to be used like talcum powder .', u'All you can see then are the nice things , the fact that the little fig tree in the window is covered with tiny figs , the milk bottle vase of forsythia is abloom , that someone has washed the windows , that Joe Cuellar keeps the office neat and clean , and that the sleeping quarters have clean bedding and that there is an empty bed for a guest and that the women are sitting companionably around the teapot in the front building and sharing buns .', u'Then we can say with the poet Maxwell Bodenheim , I know not ugliness .', u'A Gim me Novena We are not at all abashed at saying that we are indulging in what is generally termed a gim me novena .', u'It takes , you see , fifty-four days and I do know that before the time is up you are overwhelmed with favors of one kind or another .', u'I would be so bold as to say you really get your request !', u'My acquaintance with the rosary novena began back in 1937 when one of the girls who came to help us with the children we were taking care of for the summer began to make it to get herself a husband .', u'She had met someone she loved and so she started to pray .', u'So I started saying it in order that we might purchase the farm which adjoined the hill-top farm we had bought the year before .', u'Weeks passed , months passed , and somehow the money that came in for the farm was all eaten up ; it had been frittered away in grocery bills , because the work of feeding people , after all , is never done , but goes on and on three times daily , day after day , and will go on as long as we shall live .', u'And before the novena was well under way the cross was lightened and one wore it as a knapsack filled with all good things one could not do without on this , our pilgrimage .', u'Yes I am pretty sure when I say that somehow or other we are going to be able to raise the money needed to make our down payment on this ideal double house , with sufficient room for a real true House of Hospitality .', u'We will lose some of our destitution , and still retain our poverty in these more spacious rooms which once housed thirty nuns .', u'There is room for our office and files to be on one floor , and Charlie , who has heart trouble ( he is in Bellevue right now ) will not have to walk up any flight of stairs .', u'There is a back yard with hedges and a few trees where we can hang our clothes .', u'Oh , Ive been talking about trees , if you only knew how I missed trees .', u'But our family will go along , and there are the poor and the homeless also in this new neighborhood .', u'How the money is to come we know not .', u'But we believe , we hope , we love .', u'And if any of you , our readers , want to exchange your mansions on earth for mansions in heaven , if any of you want to get rid of your goods and wish to choose the poor to be your burden bearers for you so that you will have them a hundred-fold in heaven , I beg you to sow in this field , and abundantly , so that you will reap such a crop that you will never hunger for any good thing .']"
1,./data_dsicap/DorothyDay/raw/171.html.txt,"[u'I notice that June first last year , Arthur Sheehan was talking to us on St.Bernard , and on June third , John Cogley was talking St.Thomas , What is God .', u'His last of ten talks came in the middle of June .', u'As they said of St.Francis , When he heard the love of God mentioned , he felt in his soul an interior jubilation .', u'He took it for granted that they wanted the good , the best , that there would be a response to hearing tremendous things about God and man .', u'We talked of silence that night .', u'Pilgrimage I notice too in my notes for last year , that while I was speaking at Pendle Hill , Betty Lou and Rita and Roger and Annabelle went on a pilgrimage to Our Lady of Mt .', u'I had made it the year before , and I had wanted to make it again .', u'We set out from the Catholic Worker at about ten in the evening and walk up the one hundred and twenty blocks to the Shrine where the first Mass is said at Midnight , and Masses continue right through until noon on the day of the feast .', u'Anyone who wishes to join us this year , get in touch with us at the office .', u'What he means by the damned wantlessness of the poor , and I dont know where that quotation comes from , is this : the poor want what they are persuaded to want by advertisements , radio , television .', u'They want radio and television , cars , clothes , cosmetics , cigarettes , good food and drink .', u'They dont want to take over the factories , land , in any decentralist or distributist movement .', u'So what they get is capitalism or communism , and we dont want either .', u'We would like to see a country made up of farming communes , agronomic universities , hospices , unions , cooperatives , small units of all those necessary institutions to be preserved , and a doing away with luxury in order to have the essential which is ownership of house and field and job , and the responsibility which goes with that ownership .', u'And it is good to think of the four hour day of manual labor that Peter Maurin stresses so that we will have time to study and to pray .', u'If we prayed enough , great things would come to pass .', u'If we prayed enough , we would grow in strength of soul and body and there would be love in our hearts , not fear .', u'Two Examples We have to make the kind of society where it is easy for people to be good , Peter Maurin used to say .', u'And so we go around in a circle .', u'To love God is to love your brother .', u'In this we have come to know His love , St.John says , that he laid down his life for us , and we likewise ought to lay down our life for the brethren He who has the goods of this world and sees his brother in need and closes his heart to him , how does the love of God abide in him ?', u'When I read of Adlai Stevenson going around Indo China in an armoured car , I thought of Lydwinne van Karsbergen going around Africa in an old car with a companion , another woman , and penetrating the most inaccessible places .', u'St.Ignatius of Antioch went to the wild beasts with joy and I am sure that the spirit of the lay missionary movement is that if either wild beasts , or Mau Mau devour them , in the chance they take in trying to reach the least of their brothers , then they will rejoice to be ground like wheat .', u'In the last two weeks alone , he has distributed 356,000 acres , and these he looted from the rich , with love .', u'I confess that the incendiary and murderous activities of the communists did not unnerve me , because I know that the birth of a new culture has always been accompanied in the past by blood baths .', u'The people are going to solve their own problems , not I. I am simply creating an atmosphere .', u'Speaking To get back to this year , during the month of May , I spoke first at our own Friday night meeting on May first .', u'There were a few of our number distributing copies of the Catholic Worker in Union Square , as usual .', u'To build up fear of other men is to build up hatred too .', u'This last month , Fritz Eichenberg , Quaker , who does magnificent illustrations for The Catholic Worker , refused to take the loyalty oath at Pratt Institute in Brooklyn where he teaches .', u'One must accept voluntary poverty these days to keep his integrity .', u'The occupied countries became the occupied countries because people were terrorized into saying yes , when they should have said no .', u'From the printer I went down to Peter Maurin Farm , and at seven the next morning a group of us drove to Maryfarm to make a day of recollection , Hans and Ed , Pat Rusk and Lucille Smith and baby Paul , my godchild , and Bernadette who is twelve and came along to hold the baby so her mother could make the conferences given by Msgr .', u'We drove back at five and instead of going down the turnpike to Staten Island and avoiding New York city , we drove to the house of hospitality , so the others could see the results of the fire , and get copies of the new issue of the paper .', u'The driver of the hearse leaned out of his car and shouted at me , Got to make time , you know !', u'After a brief ceremony at the cemetery we drove on out to the Edgewood Division of Pilgrim State Hospital at Brentwood , way out on Long Island , where Frank Wagner and John Pohl are held for tuberculosis .', u'It is St.Augustine who says that the flesh of Jesus is the flesh of Mary , and that we must be formed , as Jesus was , in her womb .', u'I know what it means now to sign oneself In Mary .', u'He keeps his hands off the spiritual things of my church an [ sic ] I keep my hands out of his business , said Msgr .']"
2,./data_dsicap/DorothyDay/raw/152.html.txt,"[u'Summary : Another chapter from her unpublished biography of Peter Maurin .', u'Defends Peter from the criticism of being a materialist and portrays him as an apostle to the world , not of the world .', u'In his poverty , rich ; in renouncing all , possessing all ; generous , giving out of his heart , sowing generously and reaping generously , humble and asking when in need , possessing freedom and all joy .', u'There are those who might say it comes because of his anarchistic nature , his refusal to enter into political controversy , his refusal to use worldly means to change the social order .', u'He has so thoroughly discouraged in his followers the use of political means that he has been termed an anarchist by many , especially by our dear Jesuit friend , Father Dowling , who often has often come to us and talked to us of proportional representation .', u'He uses those things he needs , in the way of clothing and food , as though he used them not .', u'He used to tell the late Father Virgil Michel that if Benedictines had kept to their early ideal of manual labor , there would not be so many breakdowns from mental over-work .', u'We must use the whole man , says Peter , so that we may be holy men .', u'He may be quoting it sounds like Eric Gill , but it also sounds like Peter .', u'There is nothing he likes better than building fires , and to get down and poke a grate fire until it is all but out , and poke kindling wood in under the coals , and shake it down , and finally dump it , and rebuild it altogether that is fun !', u'Then to laboriously go over the coal ( we have no sifters ) getting out the pieces so none will be wasted , and to empty the ashes and usually the wind blows them all over Peter , his grey hair , his iron grey suit and shoes .', u'There is not much in the way of manual labor he can do around Mott Street except to help keep the fires going and to mend chairs .', u'That is the way the voluntarily poor are treated , I tell Peter .', u'Because of our generosity in letting them borrow our chairs , because we believe that when someone takes our coat we should offer him our cloak too , then the argument is , they do not appreciate good things , they dont value what they have , so we might as well take them .', u'The poor dont know the difference , they say .', u'Peter does not answer , but takes the broken-down chairs , or those too heavy to be moved , which they have left us , and mends them uncomplainingly .', u'He begins , too , to understand what Christ meant when he said He came to minister , not to be ministered unto .', u'Saint Francis said , You can not know what you have not practiced .', u'It is voluntary poverty , stripping oneself even of what the world calls dignity , honor , human respect .', u'For truly it must be admitted that one does not always have the respect of the poor , of the workers .', u'There was Smitty who gave out clothes in the basement store room every day , and for three hours he took the abuse of the women and men who came for underwear and socks and sweaters and coats .', u'These clothes are sent in here for us .', u'He was in rags himself , down at the heel , wearing his clothes until we begged him to find something else in order to wash the things he had on .', u'He must drink he must steal it is beyond reason that anyone voluntarily should stay down in that dingy rat-ridden hole , under the five-story tenement and give out clothes and bits of literature , and keep on taking abuse as meekly as he did .', u'And already he had been up since five oclock in the morning , getting the coffee ready for the breadline , slicing the bread , which the men soak in their coffee .', u'They are served in one of the two stores which front our St.Josephs House of Hospitality .', u'The men must come in on a line , be served their coffee and bread at a counter , drink it and eat their soaked-up bread , and then go out and let another batch of thirty or so come in .', u'They can go back on the line again and take their turn on second helpings , and they can take all the bread they wish in their ragged pockets .', u'Many a time Peter makes what he calls points , but I do not understand for months .', u'Certainly through the fifty thousand readers of THE CATHOLIC WORKER ( that is its present circulation ) , he has found for himself many readers , many listeners .', u'Through the Houses of Hospitality which have been established , he has built up groups for round table discussions .', u'Through the farming communes , he has directed attention to fundamental economic ideas .', u'I do know thisthat when people come into contact with Peter Maurin , they change , they awaken , they begin to see , things become as new , they look at life in the light of the Gospels .', u'They admit the truth he possesses and lives by , and though they themselves fail to go the whole way their faces are turned at least toward the light .', u'Looking at things as he does in the light of history , taking the long view , he is content to play his part , to live by his principles and to wait .', u'I have always thought of Peter as an apostle to the world .', u'In the essays printed in THE CATHOLIC WORKER , many of them contain an outline of history , a criticism of history , an outline of simple solutions .', u'They all have to do with the world , this life which we know and love , with the needs of our bodies for food , clothing and shelter .', u'Richarz , he says , has summarized the evidence which proves that 30,000 years is the absolute minimum , and then he goes on to talk about early human remains of the Pleistocene period , which began from 300,000 to a million years ago , with the weight of opinion inclining more and more to the larger figure .', u'Thomas Mann , in the prelude to Joseph and His Brothers , says that experts estimate the age of the human species as 500,000 years , and calls it a scant reckoning .', u'With this fresh point of view , Peter does not find it at all extraordinary to expect people to try to begin now to put into practice some of the social ideas , not only of the New Testament , but of the old .', u'Unless we try to put these ideas into practice , we are guilty of secularism , so tersely condemned by Pope Pius XI .', u'Unless we are trying to put the social ideas of the Gospel into practice , we are not showing our love for our neighbor .', u'And how can we love God Whom we have not seen , unless we love our brother whom we do see , as Saint John wrote .', u'Unless we are putting these social ideas into practice , recognizing the correlation of the soul and body , we are using religion as an insurance policy , as a prop , as a comfort in affliction , and not only is religion then truly an opiate of the people , but we are like men who beholding our face in a glass , go away , not mindful of what manner of men we are .', u'He brings to us quotations and books and ideas that , by stimulating the mind to know , will encourage the heart to love .', u'Three quotations from the first letter of Saint John epitomize Peters religious attitude for me .', u'If we love one another , God abideth in us ; and His charity is perfected in us If any man say : I love God , and hateth his brother , he is a liar .', u'For he that loveth not his brother whom he seeth , how can he love God whom he seeth not ?', u'And there is that sentence of Saint James , If a brother or sister be naked and want daily food , and one of you say to them , Go in peace , be ye warmed and filled ; yet give them not those things that are necessary for the body , what shall it profit ?', u'It is the above quotations that point the reason for Peters preoccupation with the material details of this world , with the social order , with the need of rebuilding as he says , within the shell of the old , with a philosophy which is so old that it looks like new .', u'And this preoccupation of his with business , with economics , with agriculture , with labor , with capital , with credit unions , maternity guilds , with cooperatives , his unceasing emphasis on the fact that these are the vital concerns of religion , have led people to think of him as a materialist !', u'they say , piously , and return to their prayers .', u'After all , we must use our spiritual weapons , we must devote ourselves to religious service , and all these things will be added unto us .']"
