,fileName,judgements
0,./data_dsicap/DorothyDay/raw/5.html.txt,"[u'John J. Hugo who himself quotes saints , mystics , scripture , and Church prayers to illustrate how the nuptial union is an analogy of Gods love for us .', u'Keyword : economics July-August Relishes life on the land , saying it is a place to retreat to , find God , and to go forth from as apostles .', u'Deeply personal account of being with her dying mother.Includes prayers and meditations on death and dying .']"
1,./data_dsicap/DorothyDay/raw/171.html.txt,"[u'Summary : Societal structures need to be built so that it will be easy to be good .', u'I find that on June first last year , I have complained that every weekend has been stormy !', u'I notice that June first last year , Arthur Sheehan was talking to us on St.Bernard , and on June third , John Cogley was talking St.Thomas , What is God .', u'And Simone Weil said , From earliest childhood to the grave there is something in the depths of every human heart which in spite of all the experience of crimes that have been committed , endured , observed , invincibly expects people to do good and not evil .', u'More than any other thing , this is the sacred element in every human being .', u'Silencethe wellspring of all great thingsand a man next door goes on sawing ; filing ; there is truck traffic , and the sound of conversation from a kitchen which overlooks the yard .', u'Pilgrimage I notice too in my notes for last year , that while I was speaking at Pendle Hill , Betty Lou and Rita and Roger and Annabelle went on a pilgrimage to Our Lady of Mt .', u'We set out from the Catholic Worker at about ten in the evening and walk up the one hundred and twenty blocks to the Shrine where the first Mass is said at Midnight , and Masses continue right through until noon on the day of the feast .', u'What he means by the damned wantlessness of the poor , and I dont know where that quotation comes from , is this : the poor want what they are persuaded to want by advertisements , radio , television .', u'We would like to see a country made up of farming communes , agronomic universities , hospices , unions , cooperatives , small units of all those necessary institutions to be preserved , and a doing away with luxury in order to have the essential which is ownership of house and field and job , and the responsibility which goes with that ownership .', u'Two Examples We have to make the kind of society where it is easy for people to be good , Peter Maurin used to say .', u'St.Ignatius of Antioch went to the wild beasts with joy and I am sure that the spirit of the lay missionary movement is that if either wild beasts , or Mau Mau devour them , in the chance they take in trying to reach the least of their brothers , then they will rejoice to be ground like wheat .', u'Bhave came from a well-to-do family , he was a student when he joined Gandhi , he knew Sanskrit and many Indian dialects and was a learned man as well as a man of prayer .', u'I confess that the incendiary and murderous activities of the communists did not unnerve me , because I know that the birth of a new culture has always been accompanied in the past by blood baths .', u'The people are going to solve their own problems , not I. I am simply creating an atmosphere .', u'Mans freedom stems from his free will , and he must respect the freedom of other men because they are made to the image and likeness of God and are temples of the Holy Spirit .', u'To build up fear of other men is to build up hatred too .', u'The teacher is afraid to speak of interracial justice , of peace , of social justice these days , for fear he may be considered subversive .', u'The occupied countries became the occupied countries because people were terrorized into saying yes , when they should have said no .', u'However , since we live in a time of disenchantment , such thinking , where it is rational in aim and method and not simply escapism , is not easy .', u'In dynamic political context , it is the modest , commonsense goals of constructive critics that are unattainable .', u'It often seems that the retention of a given status quo is a modest hope ; many lawyers , political scientists and economists occupy themselves by suggesting the minimal changes which are necessary to stand still ; yet today this hope is almost invariably disappointed ; the status quo proves the most illusory of goals .', u'From the printer I went down to Peter Maurin Farm , and at seven the next morning a group of us drove to Maryfarm to make a day of recollection , Hans and Ed , Pat Rusk and Lucille Smith and baby Paul , my godchild , and Bernadette who is twelve and came along to hold the baby so her mother could make the conferences given by Msgr .', u'It is sad that there must be such haste at funerals and the sense of quiet and peace is destroyed by speed .']"
2,./data_dsicap/DorothyDay/raw/152.html.txt,"[u'He does not indeed refuse to use mystical means , physical means , secular means , the means that are at hand .', u'He has so thoroughly discouraged in his followers the use of political means that he has been termed an anarchist by many , especially by our dear Jesuit friend , Father Dowling , who often has often come to us and talked to us of proportional representation .', u'He used to tell the late Father Virgil Michel that if Benedictines had kept to their early ideal of manual labor , there would not be so many breakdowns from mental over-work .', u'There is nothing he likes better than building fires , and to get down and poke a grate fire until it is all but out , and poke kindling wood in under the coals , and shake it down , and finally dump it , and rebuild it altogether that is fun !', u'Since people live out of doors , a good part of the winter as well as the summer , the women in the tenement on either side of us , back and front , come down on the sidewalk when their work in the house is done , and just sit .', u'That is the way the voluntarily poor are treated , I tell Peter .', u'Peter does not answer , but takes the broken-down chairs , or those too heavy to be moved , which they have left us , and mends them uncomplainingly .', u'The store is long and narrow and there is not enough room for tables and chairs .', u'There is a little Swiss fellow , very critical of the men he is serving .', u'To him there is a synthesis about all his ideas they fit together ; as blueprints for a new world they are unsurpassed , idyllic .', u'But , when it comes to working them out , given the human material , the lack of equipment , the vagaries of human nature there is the rub !', u'They admit the truth he possesses and lives by , and though they themselves fail to go the whole way their faces are turned at least toward the light .', u'Looking at things as he does in the light of history , taking the long view , he is content to play his part , to live by his principles and to wait .', u'Father Furfey of the Catholic University , in his book , The History of Social Thought , brings out in his first chapter how long the history of the human race is .', u'Unless we are putting these social ideas into practice , recognizing the correlation of the soul and body , we are using religion as an insurance policy , as a prop , as a comfort in affliction , and not only is religion then truly an opiate of the people , but we are like men who beholding our face in a glass , go away , not mindful of what manner of men we are .', u'And there is that sentence of Saint James , If a brother or sister be naked and want daily food , and one of you say to them , Go in peace , be ye warmed and filled ; yet give them not those things that are necessary for the body , what shall it profit ?', u'It is the above quotations that point the reason for Peters preoccupation with the material details of this world , with the social order , with the need of rebuilding as he says , within the shell of the old , with a philosophy which is so old that it looks like new .', u'And this preoccupation of his with business , with economics , with agriculture , with labor , with capital , with credit unions , maternity guilds , with cooperatives , his unceasing emphasis on the fact that these are the vital concerns of religion , have led people to think of him as a materialist !', u'After all , we must use our spiritual weapons , we must devote ourselves to religious service , and all these things will be added unto us .']"
3,./data_dsicap/DorothyDay/raw/164.html.txt,"[u'and contends that the greatest threat to the Church is the working mans ignorance of the Churchs social teaching not communism , which is simply a consequence to the ignorance .', u'I dont know what their wages are now , but the point O. Henry made , as well as St.Thomas Aquinas , was that it was necessary to have a certain amount of goods in order to lead a good life , and the girls were having a hard time leading a good life .', u'It was the placards with quotations from the Popes that did it , the good Irish policemen would have felt they were arresting Pius XI himself , but we definitely felt let down .', u'This use of a spiritual weapon undoubtedly did much to sanctify the strike and the union in the eyes of the girls , and since their pastor warned them against unions and strikes , they felt that undoubtedly in this case Communism , if there was Communism in the union , was more sympathetic to the workers than the Church , as represented by their pastor .', u'But when we helped run the soup kitchen , we were immediately joined by a young woman representative of the furriers union in Easton , who was a Comrade and working , through the works of mercy , in the interests of the Party .', u'In the case of the Bremen picketing , since both Catholics and Communists were picketing and giving out literature , and some of the Communist literature was addressed to the Catholics , we felt it necessary to make clear our position , that there was a fundamental opposition between us , that we regarded their dictatorship of the proletariat as a bad means , that we were opposed to all dictatorships in trying to uphold the dignity of man , the son of God , and his liberty in Christ .', u'The men were arrested and taken to the 47th Street station and the crowd was afterwards dispersed by policemens clubs and fists .', u'Joe Curran , Catholic When Joe Curran was still working with Communist advisers he was running for political office on the west side and some of the leaflets handed out hailed him as a Catholic .', u'We too , with other innocents are invited to have our names in the mast heads of organizations for peace and democracy , civil rights , Spanish rights , Negro rights , and we have refused mainly because we could do no more than we were doing , and did not want the empty honor on the one hand , or to lend prestige on the other ( it is a vicious circle ) to groups in whose work we had no part and often no knowledge .', u'Pope Pius XII said , The greatest danger to the Church is that the working people know nothing , absolutely nothing , of the social doctrine of the Church .', u'When Catholics fail to fulfill what the Church plainly declares to be their grave duty , it is not their religion that is to be blamed , but the gross neglect of their religion .', u'In Western Europe due to slowness of social reform , bitterness has increased and Catholics while trying to hold on to their faith have felt that only the Communists were with them .', u'This has been taken into consideration by the Pope in his recent notice of the excommunication of Communists and there is no excommunication involved for them .', u'We Are Accused In the past we have been accused of Communism on the strangest grounds : because there was a Negro on the mast head of the paper ; because we defended the right of property for the worker ( workers should be owners ) ; because we were pacifists ( at times that is the party line ) .', u'The brotherhood of man is indeed a dangerous doctrine and the implications of our Christianity are seldom realized .', u'On the one hand there is the Holy Family , and on the other there is that saying of our Lords , the worst enemy will be those of ones own household .', u'On the one hand Churches are being rebuilt , and on the other the poor are still living in rubble in America as well as in Europe .', u'Now it is a dismal rural slum where countless families live in wooden barracks for lack of better homes , where the rooms are small and the congestion is as bad as in the city apartments .', u'By the time a woman is having her sixth child , the call of the flesh is far less acute .', u'The drain and drag of children on the mother is such that she is apt to neglect her husband and lose that love of body and soul , so that she has to explore and search in her depths and seek it and pray for it , wooing it and caressing it again into life , seeking it in the body of her husband , bone of her bone , flesh of her flesh , breathing life into what seems dead , as Elias did to the widows son .', u'But our faith , more precious than gold , must be tried as though by fire .']"
4,./data_dsicap/DorothyDay/raw/162.html.txt,"[u'Summary : Discusses Trumans attempt to nationalize steel and argues that it should be permitted as a transition to smaller group ownership , or if private ownership is efficient .', u'We had dinner together , a good meal cooked by his bride of a few months ; and Dan Cassey , also CIO auto worker accountant from Detroit and a friend of the late Paul St.Marie , was there .', u'I had commented in my book On Pilgrimage on the grave difficulties attendant on organizing in such a district as this , and I did not know that Id be meeting the organizers.- Nationalization We talked of President Trumans suggestion to build Federal Steel plants , a first step to nationalize the industry , everyone foretells .', u'The CIO men thought such a step in the right direction but according to the Popes and Eric Gill respectively , such steps are only taken when ( 1 ) the industry is too great for private management or ( 2 ) should be only a step towards turning over the means of production to much smaller groups representing the workers themselves .', u'First of all they must be taught to want it and as far as I can see , the drift of the clerical advisers of the workers is all in the other direction .', u'Ownership of tools or factories is not all a necessary development of the life of man ; the proletarian state is perfectly compatible with sanctity , the belt , the assembly line , must be accepted , it is here to stay , you cant turn the clock back .', u'There are no trust funds on which they can draw , no credit unions to advance money to young couples to buy on the land , little help from brother Catholics ( although the letter from Farmer Hinks of the Eastern Shore of Maryland is an exception ) .', u'Certainly what hurts most of all , there is no teaching in that direction , so that those who are caught in the economic machine are positively discouraged from hoping to lead their children to another way of life .', u'In their anxiety not to appear crackpot , or fuzzy idealist or romantic agrarian they bend over backward to boost what is at best a short range program and lose sight completely of the long range view of another social order .', u'To have any vision of ownership by the workers of the means of production , a distributist economy , personal responsibility , a regional economy , is to them visionary .', u'For instance if they endorse socialized medicine now ( as the editor of America has done ) they may find themselves in the situation of Cardinal Mindzcenty tomorrow , because they will be forced sooner or later to protest the encroachment of the State , the little by little encroaching State which the Bishops of the United States warned against in their most recent statement .', u'Many a time in talking to young people at schools , I have noticed that their idea of security is to work towards a city job .', u'And then Christmas eve his old house burned down , and everything was lost , including $ 2,500 in cash which the older people were saving in the house , remembering the crash of 1929 when so many small banks failed throughout the country .', u'Everybody has already sent furnishings for the new house , which all are helping to build .', u'They were pouring cement the day we were over there , and a local portable mill had moved in and was sawing logs for them , and they are going to have to build with green lumber just for the sake of shelter .', u'The new place will be 25 by 25 , and Mrs.Weber was lamenting on how small her kitchen was going to be .', u'Mrs.Fearnow said Mrs.Weber used to be a sickly woman , but now at fifty-four is beginning to get her health back !', u'Later in January One could write much more about delightful walks , and life on the land , but space is limited .', u'Here a Celanese factory is the largest industry , though there are many other factories and it is a railroad town , too .', u'What are we going to do about the increase of unemployed , who have been kept employed these last ten years only because of war and reparation for war , or preparation for more war !', u'Is it not about time we begin some radical thinking of what a peace time economy would be like , and how to give men work at satisfactory and honorable pursuits ?']"
5,./data_dsicap/DorothyDay/raw/173.html.txt,"[u'Intelligent parents of today , rather than leave their children a certain sum of money , prefer to spend their substance in giving them an education which will make them capable workers , whether the work be intellectual or manual .', u'The time will come for nuns alsoand in a certain sense it has already comewhen the most secure dowry for a young girl wishing to enter a convent will be her capacity for work .', u'Poverty has been practiced particularly by means of economy , it has been sought to make things last ; darns and patches have therefore been multiplied , time being taken up in excess of what a more rational economic organization would allow .', u""To return to an economic organization of convents based on labor is only to return toSt.Teresas primitive plan which was always her favorite . ''"", u'While asking of nuns this effort for the organization of productive work , Holy Church has acted in a most motherly way , being anxious not only to secure their material subsistence , but also to help their spiritual life in the best way possible .', u'Therefore , before giving expression to her requirements , as set forth in Article eight , ( of the apostolic constitution , Sponsa Christi ) Holy Church , in the explanatory part of the constitution , has represented to nuns in the happiest way how it is possible to combine this more intense application to work with that search for union with God which is characteristic of their contemplative life .', u'These teachings are so rich , and may be foreseen as so fruitful , that they could serve as a basis for a mysticism of labor .', u'This commentary shows not only how the Holy Father in his new directions to religious orders is meeting the needs of the time , and the criticisms of the time , but also how they are being received .', u'We have spoken in THE CATHOLIC WORKER on how orders in the Church have been so plentifully supplied with property and the means of improving that property , of the alms of the faithful , and how little has been done to help families , each one of which is a little church , a little community , and how when that help is given , the world [ sic ] alms and pauper carry a stigma .', u'But perhaps even here , and Peter Maurin talked of this so many times , there is needed a great change in attitude .', u'But in school literacy takes first place and reading is no longer taught , beginning with the Little Office , Our Ladys Primer .', u'At home , Becky occasionally says , when she is made to run too many errands , I am the chief slave around here .', u'Tamar and I had forgotten about it , and David , when he returned home from his work at Wolfe Pond Park at four-thirty , reminded us that Bob was expected any minute .', u'Folk songs , folk art , folk dancing , are expression of the exuberance and joy and thankfulness for life .', u'Duffys main job is to restore its fertility .', u'To live in this way , with the sacraments of the Church and with a sacramental attitude towards the material things of life , this is indeed the good life , even though life and death are never far apart .']"
6,./data_dsicap/DorothyDay/raw/170.html.txt,"[u'He always aimed at the best , and to him voluntary poverty , manual labor was the beginning of all true reform , which was to begin with ones self .', u'He wanted people to be taught to want the best , and the best for him was the immediate program of the works of mercy , practiced in the cities and farming communes set up in the countryside where workers and scholars could get together to try to rebuild society within the shell of the old by founding better institutions to take the place of soulless corporations .', u'Peters teaching meant the immediate establishment of houses of hospitality because it was a time of depression and not only the worker , but young Catholic college graduates were unemployed .', u'Peter did not believe in the use of force to bring about this new society , so from the first we have opposed class war , race war , civil war , imperialist war , and have been surrounded by them all .', u'The impact Peter made on us all , from one end of the country to the other , so that houses of hospitality and farms were undertaken from coast to coast , was because he personally lived a life of poverty and work .', u'The evil is so deep seated , he said , that of course much of the time will be given up to an immediate practice of the works of mercy .', u'Because Peter loved most of all what he called the green revolution , we are beginning our twenty-first year with emphasis on the land .']"
