,fileName,judgements
0,./data_dsicap/WBC/raw/WestboroBaptist_Sermon_20080127.pdf.txt,"['Some Jew named Ruthie called in to a radio program I was on last Thursday and said that I hated Jews and that I therefore was anti-Semitic .', ""Then said Jesus TO THOSE JEWS which believed on him , If ye continue in my word , then are ye my disciples indeed ; And ye shall know the truth , and the truth shall make you free . ''"", ""She wanted to read to me from Gen. 1:27 ; and when she had done so , she made the argument that it was proof from the Bible that sodomy was OK , that it 's OK to be gay ."", ""Ruthie the Jew said that that verse proves it 's OK to be gay , in full demonstration of the fact that God Almighty has stricken the Christ- rejecting Jews with His judicial blindness , as it is written in Romans 11 : 7-10 ; to wit : Sunday , January 27 , 2008 page 2 Sermon Outline `` What then ?"", ""11:7-10 ) These are strong , so-called imprecatory prayers ( `` imprecatory '' means to pray for God to bring evil things upon a person ; a curse ) these verses in Romans are prayers of David imprecatory prayers but very acceptable to God , ( who answered those prayers by striking unbelieving Jews with judicial blindness to this day ) and that kind of praying was also acceptable to Paul the Jew , who chooses to quote from ( and adopt as his own ) David 's imprecatory prayers ."", ""Speaking directly to the Jews of His day , our Lord Jesus Christ was very uncompromising ( Jesus was a straight , plain , hard , no-nonsense preacher not a kissy-pooh preacher ) ; and very straight-forward ; to wit : `` Then said Jesus again unto them , I go my way , and ye shall seek me , and shall die in your sins : whither I go , ye can not come . ''"", '`` And he said unto them , Ye are from beneath ( doomed earthdwellers ) ; I am from above : ye are of this world ( this doomed , soon-to- be-destroyed-with-fire world , make no mistake ) ; I am not of this world .', ""And so , following the example of my Savior , Captain , and Divine Pattern , I say unto Ruthie the Jew , that if you believe not that Jesus is the Christ , the Messiah , the Son of the Living God you will die in your sins ; and you will thereupon join Heath Ledger in Hell , where , throughout eternity , you two can swap fairy tales like saying that Gen. 1:27 proves it 's OK to be gay , and like making the movie `` Brokeback Mountain '' was just fine with God ."", ""Sunday , January 27 , 2008 page 3 Sermon Outline Moreover , we learn from the words of Christ Himself that the experience WBC is having with exposing the evils of the movie `` Brokeback Mountain '' , as well as exposing the eternal destiny of Heath Ledger as being torment in the Lake of Fire and Brimstone , the fires of Hell excites murderous rage throughout the world ."", 'And so it is , that when the Elect hear the Word of God preached , a responsive chord is struck , such that the heart of the sheep resonates with that of the Shepherd .', 'And a part of that Gospel is to tell them that most of them are deaf , dumb , and blind , and otherwise are too hard-hearted to accept our message ; and that what little of Gospel preaching ( seed ) might Sunday , January 27 , 2008 page 4 Sermon Outline otherwise take hold and grow within them , is IMMEDIATELY snatched away by Satan , their father .', 'For the non-Elect , Jesus had the following plain , clear words ; to wit : `` Ye are of your father the devil , and the lusts of your father ye will do .', ""When he speaketh a lie , he speaketh of his own : for he is a liar , and the father of it . ''"", ""It is my belief that God is similar to my parents while he may see the sin itself as an abomination , HOW COULD HE HATE ANYONE HE HAS CALLED HIS CHILD ... who are we to put the word `hate ' in God 's mouth ? ''"", ""For by thy words thou shalt be justified , and by thy words thou shalt be condemned . ''"", 'To the editor referred to above ; Listen up , smart-mouth : God is not your father ; and you are not His child .', 'Your editorial maligning WBC is sufficient evidence in and of itself to prove that God is not your father ; and you are not His child .', '8:45,47 ) The response of the Jews upon hearing such devastating pronouncements of their lost condition , was to attack Jesus with baseless , slanderous and irrelevant , ad hominem lies ( like they do us today ) to wit : `` Then answered the Jews , and said unto him , Say we not well that thou art a Samaritan , and hast a devil ?', 'Art thou greater than our father Abraham , which is dead ?']"
1,./data_dsicap/WBC/raw/WestboroBaptist_Sermon_20080608.pdf.txt,"[""Gill says the following to that fearsome and horrific passage ; to wit : `` Which is not to be understood of a single act of sin , but rather of a course of sinning ; nor of sins of infirmity through temptation , or even of grosser acts of sin , but of voluntary ones ; and not of all voluntary ones , or in which the will is engaged and concerned , but of such which are done on set purpose , resolutely and obstinately ; and not of immoral practices , but of corrupt principles , and acting according to them ; it intends a total apostasy from the truth , against light and evidence , joined with obstinacy . ''"", 'Add to those words in Luke , these additional bits of evidence from 1st John 4:6 ; to wit : `` We are of God : he that knoweth God heareth us ; he that is not of God heareth not us .', ""We are preaching to this doomed generation of ours as a John the Baptist Voice crying in the wilderness , or a Noah who , `` being warned of God of things not seen as yet , moved with fear , prepared an ark to the saving of his house , by which also he condemned the whole world , Sunday , June 8 , 2008 page 2 Sermon Outline and became heir of the righteousness which is by faith . ''"", 'All their sinfulness deserves a great punishment a punishment so great that it can not be fully comprehended by our thoughts , nor ever be sufficiently expressed , in time or in eternity .', 'In which chapter he writes : `` For what hell and destruction are , is a mystery , as well as what heaven is ; and the true and proper notion or conception of either , are a riddle to the most of men .', ""The institutions of Hell ( as well as Heaven ) remain largely mysterious to us in our present limited state and scope of understanding `all things being naked and open ' only unto `the eyes of him with whom we have to do , ' viz."", 'And , `Lo , these are parts of his ways ; but how little a portion is heard of him ?', 'The Grand Executioner or Immediate Inflictor of the threatened punishment , is the Lord Jesus Christ ( and His elect people and elect angels ) .', ""29:29 ; to wit : '' `` The secret things belong unto the Lord our God ; but those things which are revealed belong unto us and to our children for ever , that we may do all the words of this law . ''"", 'Generally , the context consists of the Lord warning repeatedly and in various ways and very , very plainly that a horrific , everlasting curse would be enforced and fulfilled to the letter against any person who left the Lord to serve idols .', ""And so , `` those things which are revealed and which belong unto us and to our children for ever , that we may do all the words of this law , '' those things include the curse of Sunday , June 8 , 2008 page 3 Sermon Outline God upon reprobates , and the painful punishments that await those who depart from the living God ; to wit : `` Lest there should be among you man , or woman , or family , or tribe , whose heart turneth away this day from the Lord our God , to go and serve the gods of these nations ; lest there should be among you a root that beareth gall and wormwood '' ( a poison herb , this passage being cited at Heb ."", ""12:15 , `Looking diligently lest any man fail of the grace of God ; lest any root of bitterness springing up trouble you , and thereby many be defiled . '"", '`` The Lord will not spare him , but then the anger of the Lord and his jealousy shall SMOKE AGAINST THAT MAN , and ALL THE CURSES that are WRITTEN IN THIS BOOK shall LIE UPON HIM , and the Lord shall blot out his name from under heaven .', ', he is headed , irreversibly to the punishments of Hell ) `` out of all the tribes of Israel , according to ALL THE CURSES of the covenant that are written in this book of the law ... like the overthrow of Sodom & Gomorrah which the Lord overthrew in his anger , and in his wrath ... For they went and served other gods , and worshiped them , gods whom they knew not ... And the anger of the Lord was kindled against this land , to bring upon it all the curses that are written in this book .', ""And the Lord rooted them out of their land in anger , and in wrath , and in great indignation , AND , The secret things belong unto the Lord our God ; but those things which are revealed belong unto us and to our children for ever , THAT WE MAY DO ALL THE WORDS OF THIS LAW . ''"", ""That is , the God who lives to administer punitive measures to the wicked ; to wit : `` Vengeance is MINE ( ALONE ) , I WILL repay , saith the Lord . ''"", "", which shall consume in Hell 's eternal flames all those who while on earth were adversarial to God 's elect ) . ''"", 'Goodwin says that the painful punishments inflicted by Christ , the Immediate Inflictor , are set forth plainly in some Scriptures , and inferential in others ; and that it takes a consideration of all , in order for the saints on earth to form adequate and accurate notions or concepts of Hell and the painful punishments of the damned .', ""3:19 , `By which he also went and preached unto the spirits in prison , ' large enough , to be sure , to hold men and devils : `The wicked shall be turned into hell , and all the nations that forget God , ' Psa ."", ""5:26 ; where is nothing but `darkness , utter darkness , ' `blackness of darkness , ' Jude 4 , that is , an emptiness of all good , not a beam of light to all eternity ; also a `place of torment , ' Lk ."", ""50:22 , `Now consider this , ye that forget God , lest I tear you in pieces , and there be none to deliver ; ' `cutting them up to the backbone , ' Heb ."", ""18:6 , `But whoso offends one of these little ones which believe in me , it were better for him that a millstone were hanged about his neck , and that he were drowned in the depth of the sea , ' to make sure they never rise again ; also unto a being cast , `bound hand and foot , ' Mat ."", ""13:42,49,50 , `The Son of man shall send forth his angels , and they shall gather out of his kingdom all things that offend , and them which do iniquity ; and shall cast them into a furnace of fire ; there shall be wailing and gnashing of teeth , ' `So shall it be at the end of the world ; the angels shall come forth , and sever the wicked from among the just , and shall cast them into the furnace of fire ; there shall be wailing and gnashing of teeth ; ' `a lake of fire , ' and so drowned over head and ears for ever ; a lake `fed with a stream of brimstone , ' which ( of all matter that feedeth fire ) is the most fierce , ( `For Tophet is ordained of old ; yea , for the king it is prepared ; he hath made it deep and large ; the pile thereof is fire and much wood ; the breath of the Lord , like a stream of brimstone , doth kindle it , ' ) Isa ."", ""29 `Of how much SORER PUNISHMENT , suppose ye , shall he be thought worthy , who hath trodden under foot the son of God , and hath counted the blood of the covenant , wherewith he was sanctified , an unholy thing , and hath done despite unto the Spirit of grace . '"", 'I say , when he would set out the severeness of this infliction of punishment , as infinitely exceeding all those kinds of horrid corporal tortures and torments , he infers the soreness ( extreme painfulness ) of this from the fact that now God Himself is the Avenger and the Immediate Inflictor .', ""`We know him that hath said thus , Vengeance is mine , ' that is , what a great and powerful God he is ."", ""( Luke 12:5 ) `` And fear not them which kill the body , but are not able to kill the soul ; but rather fear him which is able to destroy both soul and body in hell . ''"", ""Goodwin : `` They , and they alone , know him in his love , and have tasted and found that his immediate `loving-kindness is better than life ; ' and from the LAW OF CONTRARIES , they know that his wrath must be more bitter than death .""]"
2,./data_dsicap/WBC/raw/WestboroBaptist_Sermon_20071118.pdf.txt,"[""Gill says of these words in Isaiah : `` The love of God to his people is an everlasting love ; it always continues ; it never did , nor ever will depart , notwithstanding their fall in Adam , their depraved state by nature , their actual sins and transgressions , their many revoltings and backslidings ; whatever departs from them , His kindness shall not ; though riches may flee away from them , friends stand aloof from them , health may be taken away , and life itself , yet the love of God is always the same ; and so , whatever providences may attend His church and interest in any period of time , He has the same paternal care for it , and kindness for His people , as ever . ''"", 'This is the great Covenant of Grace made with Christ and His people from everlasting , even in the Council Halls of Eternity the Father , Son and Holy Ghost being the holy Signatories thereto ; to wit : `` The eternal God is thy refuge , and underneath are the everlasting arms : and he shall thrust out the enemy from before thee ; and shall say , Destroy them .', ""This covenant is ordered in all things and sure , according to David ; to wit : `` Although my house be not so with God ; yet he hath made with me an everlasting covenant , ordered in all things , and sure : for this is all my salvation , and all my desire , although he make it not to grow . ''"", 'These precious stones describe the priceless spiritual house of infinite intrinsic value which is the church , composed of precious stones .', ""And all thy children shall be taught of the Lord ; and great shall be the peace of thy children . ''"", ""Sunday , November 18 , 2007 pg.2 Sermon Outline BEAUTIFUL , FUNCTIONAL , AND MYSTERIOUS A description of the church ; beautiful , functional , and mysterious ; supplemented and fleshed out in the New Testament metaphor ; to wit : `` Ye also , as lively stones , are built up a spiritual house , an holy priesthood , to offer up spiritual sacrifices , acceptable to God by Jesus Christ . ''"", 'Beloved , knowledge and understanding of these glorious things is supernatural .', ""Such are the weapons of our spiritual warfare which are mighty to the pulling down of Satan 's strongholds ."", 'Though the disciples had been with Jesus some three and a half years , it was not until He opened the eyes of their understanding POST-resurrection that they had any real understanding ; to-wit : `` And he said unto them , These are the words which I spake unto you , while I was yet with you , that all things must be fulfilled , which were written in the law of Moses , and in the prophets , and in the psalms , concerning me .', ""I repeat , to emphasize the importance : these supernatural understandings are the spiritual weapons of our warfare that are mighty through God to the pulling down of Satan 's strongholds ."", 'And we know that the Son of God is come , and hath given US an understanding , that we may know him that is true , and we are in him that is true , even in his Son Jesus Christ .', ""So far from it , that thou shalt not be in the least afraid of it , neither from within nor from without ; not from false teachers that oppress the mind with false doctrine ; nor from persecutors that oppress and injure in person and property : the church will be now free from the oppression and tyranny of mystical Babylon , which is now set to fall , on whom God 's wrath will be poured , and so the church will be no more in fear of them ."", ""This is all included in the mystery of godliness , `Even the mystery which hath been hid from ages and from generations , but now is made manifest to his saints . '"", ""`` FOR THY SAKE , '' as Gill says , `` `for thy sake , they shall fall ; because of the love that I bear to thee , they shall not succeed , or do thee any hurt , but shall perish , ' these are also the unclean spirits like frogs ( Rev ."", 'The Lord God Almighty has given the heathen and the uttermost parts of the earth for the inheritance of and to be put in active , actual , present possession of our Lord Jesus Christ .', 'Notice here , Beloved , that the absolute and the total power or sovereignty of our Lord Jesus Christ is tied only and completely to the preaching of the Gospel .', 'Sunday , November 18 , 2007 pg.4 Sermon Outline HIS COMMANDMENTS ARE NOT GRIEVOUS See how important all these words are .', ""Our Lord Jesus Christ personalized this concept forever in a compound , redundant , and unforgettable way ; to wit : `` He that hath my commandments , and keepeth them , he it is that loveth me : and he that loveth me shall be loved of my Father , and I will love him , and will manifest myself to him . ''"", 'Kiss the Son , lest he be angry , and ye perish from the way , when his wrath is kindled but a little .', "", from the President to the Chief Justice of the United States you have the duty to discharge your function as a servant of the Lord , in the solemn fear of the Lord , and that means in the fear of the Lord to the point of trembling , and to the point of getting on your knees and kissing the feet of the Lord Jesus Christ , in conscious and deliberate and lowly PUBLIC acknowledgment of the fact that if His wrath is kindled the tiniest little bit , He can with one wave of His hand banish immediately to Hell every last one of this generation alive on the earth and of all generations of human beings that ever lived ) . ''"", ""Sunday , November 18 , 2007 pg.5 Sermon Outline AN OFFENDER FOR A WORD `` We , having the same spirit of faith , according as it is written , I believed , and therefore have I spoken ; we also believe , and therefore speak . ''"", '( 2 Corinthians 4:13 ) `` And when the tempter ( Satan ) came to him ( Christ ) , he said , If thou be the Son of God , command that these stones be made bread .', ""4:3,4 ) `` Thy words were found , and I did eat them ; and thy word was unto me the joy and rejoicing of mine heart ; for I am called by thy name , O Lord God of hosts . ''"", ""But his word was in mine heart as a burning fire shut up in my bones , and I was weary with forbearing , and I could not stay . ''"", ""For by thy WORDS thou shalt be justified , and by thy WORDS thou shalt be condemned . ''"", '`` And Enoch also , the seventh from Adam , prophesied of these , saying , Behold , the Lord cometh with ten thousands of his saints , To execute judgment upon all , and to convince all that are ungodly among them of all their ungodly deeds ... and of all their hard speeches ( WORDS ) which ungodly sinners have spoken against him .']"
3,./data_dsicap/WBC/raw/WestboroBaptist_Sermon_20070708.pdf.txt,"[""Sunday , July 8 , 2007 pg.1 Sermon Outline America 's Dumb , Greedy Dogs In the Last Days of All the Last of the Last Days one of the biggest and clearest Signs of those Times is declared in the Bible to be the great , and universal proliferation of false prophets ."", ""`` And ye shall be hated of all men for my name 's sake ; but he that shall endure unto the end , the same shall be saved ."", 'And where does it expressly refer to worldwide Institutionalized Blaspheny as more proof that we are in the Last Days of All ?', ""13:4,5 : `` And there was given unto him this Abomination that maketh Desolate standing in the holy place and standing where he ought not , `Who opposeth and exalteth himself above all that is called God , or that is worshipped ; so that he as God sitteth in the temple of God , showing himself that he is God ' ( 2 Thes ."", 'Revelation 13:5,6 Sunday , July 8 , 2007 pg.2 Sermon Outline Institutionalized Worldwide Apostacy and Blasphemy This universal Institutionalized Apostacy and Blasphemy is the direct result of a judicial stroke from God Almighty .', 'God has cursed filthy , abominable , disobedient mankind with a delusion a strong delusion that they should believe a lie , and be damned in Hell forever ; to wit : `` And with all deceivableness of unrighteousness in them that perish ; because they received not the love of the truth ( the Truth WBC has preached to them on the mean streets of the nation and the world for 16+ years now ) I say , `` they received not the love of the truth , that they might be saved .', ""And for this cause God shall send them strong delusion , that they should believe a lie ; That they all might be damned who believed not the truth ( that WBC preached to them ) , but had pleasure in unrighteousness . ''"", 'And , in further proof that false prophets shall abound in the Last Days of All , are these solemn pronouncements from the virtual death bed of the Apostle Paul , and from his last words on earth , in 2nd Timothy ; to wit : `` This know also , that in the last days perilous times shall come ... For the time will come when they will not endure sound doctrine ; but after their own lusts shall they HEAP TO THEMSELVES TEACHERS , ( i.e.', ""Gill : `` Having itching ears , always desirous of new things , as the Greeks of old ; loving to have their ears scratched and tickled with smooth things ; that are pleasing and agreeable to natural men , and carnal minds ; as for example , 1 ) the purity of human nature , and that man is essentially good at heart not totally depraved at all ; 2 ) the power of man 's free will , that irresistible grace is a false doctrine , because it 's all up to man 's free will choices as to salvation and all other issues of life ; 3 ) the excellency of man 's own self-righteousness ; and , 4 ) and the merit of man 's works ; and the like ; see Isa ."", ""Here 's an example of the garbage taught at the Fountainhead : They promote such bastardized versions of the Bible as the NIV ( New International Version ) and the TNIV ( Today 's New International Version ) ; 41 % of all Bibles sold ; more than 170 million sold since introduction , 1978 ; removes all reference to sodomites , and calls itself `` gender-sensitive '' ( no longer sons of God , now children of God ) ; prepares for onset of feminizing God ala lesbian professor ( Bob Jones grad ) , Dr. Virginia Mollenkott , calling Jesus Christ a woman at National Council of Churches conference ; and who wrote in her book ( The Biblical Imagery of God as Female ) that she is `` lifting up the biblical image of God as the One Mother of us all . ''"", ""And , take the Fountainhead 's WCC ( World Council of Churches ) corrupt commentary on Mark 7:25-30 , where a distraught Greek mother begged Jesus to cast a devil out of her daughter , and Jesus said , `` Let the children first be filled ; for it is not meet to take the children 's bread , and to cast it unto the dogs ."", 'For we are unto God a sweet savor of Christ , in them that are saved , and in them that perish ; To the one we are the savor of death unto death ; and to the other the savor of life unto life .', ""They were tolerating gross sin within its membership and abusing the Lord 's Supper ; to wit : `` It is reported commonly that there is fornication among you , and such fornication as is not so much as named among the Gentiles , that one should have his father 's wife ... Purge out therefore the old leaven , that ye may be a new lump , as ye are unleavened . ''"", 'And , church members at Corinth were actually suing each other in Pagan courts ; to wit : `` Now therefore there is utterly a fault among you , because ye go to law one with another .', ""How could Paul call such people , who were of all people on earth `` a sweet savor of Christ unto God , in them that are saved , and in them that perish '' ?"", ""Therefore , behold , I , even I , will utterly forget you , and will forsake you ... and cast you out of my presence ; And I will bring an everlasting reproach upon you , and a perpetual shame , which shall not be forgotten . ''""]"
