,fileName,judgements
5,./data_dsicap/WBC/raw/WestboroBaptist_Sermon_20070930.pdf.txt,"[""9:12 ; to wit : `` And he hath confirmed his words , which he spake against us , and against our judges that judged us , by bringing upon us a great evil : for under the whole heaven hath not been done as hath been done upon Jerusalem . ''"", ""Behold , and see if there be any sorrow like unto my sorrow , which is done unto me , wherewith the Lord hath afflicted me in the day of his fierce anger . ''"", '`` The hands of the pitiful women have sodden their own children : they were their meat in the destruction of the daughter of my people .', ""4:10,11 ) Additional evidence in support of my proposition that the destruction of Jerusalem was the worst tragedy in history , is the following from Ezekiel 5:9 ; to wit : `` And I will do in thee that which I have not done , and whereunto I will not do any more the like , because of all thine abominations . ''"", ""For though these instances only show that mothers ate their children , yet no doubt the fathers took part with them ; for if mothers , who are naturally more tender , could do this , it is much more reasonable to suppose that fathers did the same ... though monstrously shocking . ''"", 'Now let us continue the narrative : `` And on the ninth day of the fourth month the famine prevailed in the city , and there was no bread for the people of the land .', 'IT IS A DREADFUL & FEARFUL THING TO DEPART FROM THE LIVING GOD In any event , Beloved , you see from these nuances how that a thousand things coalesced to bring it to pass that the destruction of Jerusalem was a thing of unequaled horror and monstrous barbarism .', 'And thou shalt eat the fruit of thine own body , the flesh of thy sons and of thy daughters , which the Lord thy God hath given thee , in the siege , and in the straitness , wherewith thine enemies shall distress thee ; So that the man that is tender among you , and very delicate , his eye shall be evil toward his brother , and toward the wife of his bosom , and toward the remnant of his children which he shall leave ; So that he will not give to any of them of the flesh of his children whom he shall eat ; because he hath nothing left him in the siege , and in the straitness , wherewith thine enemies shall distress thee in all thy gates .', 'The tender and delicate woman among you , which would not adventure to set the sole of her foot upon the ground for delicateness and tenderness , her eye shall be evil toward the husband of her bosom , and toward her son , and toward her daughter .', ""THE WARNING PROPHECY OF JEREMIAH Moreover , the great prophet Jeremiah who was on the scene in the days of good king Josiah as well as evil kings Jehoiakim and Zedekiah , even unto the carrying away of Jerusalem captive warned that they would eat their children in Jerusalem ; to wit : `` Hear ye the word of the Lord , O kings of Judah , and inhabitants of Jerusalem ; Thus saith the Lord of hosts , the God of Israel ; Behold , I will bring evil upon this place , the which whosoever heareth , his ears shall tingle ... And I will cause them to eat the flesh of their sons and the flesh of their daughters , and they shall eat every one the flesh of his friend in the siege and straitness , wherewith their enemies , and they that seek their lives , shall straiten them . ''"", '19:3,9 ) And that same wonderful prophet , after the fact , lamented with tears as follows : `` The hands of the pitiful women have sodden their own children : they were their meat in the destruction of the daughter of my people .']"
6,./data_dsicap/WBC/raw/WestboroBaptist_Sermon_20070527.pdf.txt,"[""Sunday , May 27 , 2007 page 1 Sermon Outline `` Away with such a fellow from the earth ; for it is not fit that he should live . ''"", ""Beloved , we 're in good company ; this is more evidence our ministry is of God and our calling and election is sure ."", ""The mob said of Paul : `` Away with such a fellow from the earth ; for it is not fit that he should live . ''"", ""Last Tuesday , May 22 , as we picketed Jerry Falwell 's funeral at the Thomas Road Baptist Church in Lynchburg , Virginia , we noticed heightened police activity , and found out later there was a bomb plot against WBC by Army and ROTC terrorists led by a wonderful flag-waving patriot police identified as Mark David Uhl , 19a student at Falwell 's Liberty Universitystudying to become an Army chaplain ."", ', you are a filthy practicing fag , or , which is worse , you are a fag-enabler ) .', ""For every one that doeth evil ( fags and fag-enablers ) hateth the light ( which is why you plot to kill WBC saints ) , neither cometh to the light , lest his deeds should be reproved ( WBC 's words of God 's only and absolute truth reprove your Hell-bound soul , and that 's what tears you up , and that 's the truthful explanation for your bombs and violence designed to kill and destroy WBC 's humble servants ) ."", ""But he that doeth truth cometh to the light , that his deeds may be made manifest , that they are wrought in God . ''"", 'For many months now , front page news is only about the wrath of God .', 'Furthermore , God is Himself laughing and mocking even as He pours out His wrath on this evil sodomite nation that has rejected His Word and persecuted His only faithful servants who are delivering His Word .', 'Anyone who does not believe THAT is Bible- dumb , willingly ignorant , hates God and His Word , and is headed irreversibly for Hell .', 'The church age , New Testament picture of Christ as an avenging God is no different He is the same , yesterday , today and forever .', 'His head and his hairs were white like wool , as white as snow ; and his eyes were as a flame of fire ; And his feet like unto fine brass , as if they burned in a furnace ; and his voice as the sound of many waters .', 'And he had in his right hand seven stars ; and out of his mouth went a sharp twoedged sword ; and his countenance was as the sun shineth in his strength .', 'The preachers who try to sanitize , popularize , and make the God of the Bible more palatable , are going to Hell and taking all their followers with them .', ""So that a man shall say , Verily there is a reward for the righteous ; verily he is a God that judgeth in the earth . ''"", ""So that a man shall say , Verily there is a reward for the righteous ; verily he is a God that judgeth in the earth . ''"", 'Other co-conspirators are a group of ROTC and Army super-patriots and flag-waving idolaters determined to kill WBC servants of God for warning America that God Almighty is killing our troops in Iraq for turning this nation over to fags and dykes and for persecuting WBC for preaching the truth about sodomites .', ""16:2 , where the Lord Jesus foretold these times : `` They shall put you out of their synagogues ; ( churches ) think , Falwell crusading against WBC , like huge articles in his paper going to thousands of synagogues and churches , with headlines like : `Fred Phelps is not one of us . '"", 'America has created a murderous Satanic Zeitgeist , wherein it is commonly believed that any crime of violence against WBC people and property is not only permissible , but encouraged and condoned .', 'The likelihood of interference certainly not punishment by the authorities is very remote .', ""The police at first refused to do anything , denying the event even happened ; then hinting that maybe WBC people set the bomb off them- Sunday , May 27 , 2007 page 6 Sermon Outline selves ; then telling the media that WBC was n't the target of the bomb ; a big headline in the Kansas City Star blared out : `` Phelps family was n't bomb target , police say . ''"", ""And you think God 's white-hot wrath is not sending U.S. troops home in body bags ?"", 'Remember , America , the whole world and God Almighty -- is watching what you do in this case .']"
7,./data_dsicap/WBC/raw/WestboroBaptist_Sermon_20080413.pdf.txt,"[""The Scriptures are full of God 's appointments , and none is more comforting to God 's dear ones in affliction than the one in 1 Thessalonians 5:9 ."", 'Yet he possessed in his bosom a divine message straight from God Almighty , for the whole world and that message was pure wrath .', 'Every valley shall be exalted , and every mountain and hill shall be made low ; and the crooked shall be made straight , and the rough places plain ; And the glory of the Lord shall be revealed , and all flesh shall see it together ; for the mouth of the Lord hath spoken it .', ""Called out of the kingdom of Satan by the loud and lusty voice of God 's ministers on earth , as it were ."", 'Listen to the words : `` And thou shalt number seven sabbaths of years unto thee , seven times seven years ; and the space of the seven sabbaths of years shall be unto thee forty and nine years .', ""58:1 ) , `` loudly and lustily , '' `` in the ears of a waste and wild people ; meaning the world , void of God 's grace , barren in all virtue , having no pleasing abode , nor sure direction of any good way in it , being full of horror and accursed . ''"", ""Picture the man John as the Holy Spirit most accurately presents him ; to wit : `` And the same John had his raiment of camel 's hair , and a leathern girdle about his loins ; and his meat ( food ) was locusts and wild honey . ''"", ""For John had said unto Herod , It is not lawful for thee to have thy brother 's wife ."", ""yea , I say unto you , and more than a prophet ... Verily I say unto you , Among them that are born of women there has not risen a greater than John the Baptist . ''"", '11:7,9-11 ) So , Beloved , when we are taught by such a man speaking of eternal things , Heaven and Hell , with wonderful authority we are , above all people on earth , greatly blessed .', ""Of the preeminence of Christ , John said : `` I indeed baptize you with water unto repentance ; but he that cometh after me is mightier than I , whose shoes I am not worthy to bear ; he shall baptize you with the Holy Ghost , and with fire . ''"", ""Now , as to the urgency of the need for quick and decisive action if you would avoid `` unquenchable fire , '' John the Baptist said : `` Whose fan is in his hand , and he will throughly Sunday , April 13 , 2008 page 4 Sermon Outline purge his floor , and gather HIS wheat ( i.e."", ""1:4,5,11 ) `` And when the Gentiles heard this , they were glad , and glorified the word of the Lord ; and as many as were ordained to eternal life believed . ''"", 'If you find no comfort in the age-old doctrine of the Absolute Predestination of all things , it is because you are lost and on your way to Hell .', ""`` I am Jesus whom thou persecutest ; it is hard for thee to kick against the pricks . ''"", ""Here is the exact language which the Holy Spirit has used in describing and identifying you Arminian scum ; to wit : `` And a stone of stumbling , and a rock of offense , even to them which stumble at the word , being disobedient ; whereunto they were APPOINTED . ''"", '( Acts 17:31 ) And , God has made an APPOINTMENT with every individual of mankind except for those of His Elect Remnant who are alive and remain at the coming of the Lord , who will be raptured without tasting death ( 1 Cor .', ""2:12a `` Kiss the Son , lest he be angry , and ye perish from the way , when his wrath is kindled but a little . ''""]"
8,./data_dsicap/WBC/raw/WestboroBaptist_Sermon_20080323.pdf.txt,"[""3:12,13 ) `` By faith Abel offered unto God a more excellent sacrifice than Cain ... and by it he being dead yet speaketh . ''"", ""We briefly touched on this subject of Cain and Abel last Sunday , as a part of my sermon on the blood of God 's Elect , and how precious that blood is in the sight of God ."", 'The Way of Cain is nothing other than the pathway that all the non-Elect are traveling .', 'Cain was revealed by his conduct to be the seed of the Serpent , as distinct from the seed of the Woman , which Abel was revealed by his conduct to be all as taught to and by our first parents in Genesis , chapter 3 .', 'In fact , and by the way , every major doctrine in the Word of God had its beginning in the book of beginnings , which is , by definition , the book of Genesis .', ""But back to Gen. 3 ; to wit : `` And the Lord God said unto the serpent , Because thou hast done this , thou art cursed above all cattle , and above every beast of the field ; upon thy belly shalt thou go , and dust shalt thou eat all the days of thy life : And I will put enmity between thee and the woman , and between thy seed and her seed ; it shall bruise thy head , and thou shalt bruise his heel ... Unto Adam also and to his wife did the Lord God make coats of skins , and clothed Sunday , March 23 , 2008 page 2 Sermon Outline them , '' ( formerly thereto , Adam and Eve `knew that they were naked ; and they sewed fig leaves together , and made themselves aprons ' ) . ''"", ""Showing symbolically at the very dawning of human history , that blood must be shed if mankind 's spiritual nakedness is to be covered and pointing ahead to the coming of Christ into the world , and the shedding of His precious blood upon the cross for the redemption of His Elect ."", ""So far , I have found only John Owen somewhat agreeing with my interpretation ; to wit : `` And in the process of time '' Cain and Abel made their respective offerings unto God ; `` that is , `after the expiration of some time ' or days , namely , after Cain and Abel were settled in their distinct callings , Gen. 4:3 ."", ""Until then they had been under the instruction of their parents ; but being now fixed in their own peculiar stations and callings , they made their distinct , solemn profession of the worship of God ; which is the sense of the place , THOUGH NOT OBSERVED BY ANY EXPOSITORS . ''"", 'And we can be sure that with their brilliant minds at the dawn of creation , they understood all about the Five Points making up the Doctrines of Grace , and the absolute necessity of blood to be shed ( Mactation ) the blood of an innocent victim for remission of sins .', ""9:13 , predestination vs. human responsibility , and the necessity of blood being shed in offerings to God as typifying the blood of Christ , election , predestination , reprobation , God 's vengeance upon the non-elect for persecuting the Elect , etc . )"", ""The blood of God 's Elect has a voice in it , which cries to God when shed as symbolized by the blood of Abel ; to wit : `` And the Lord said unto Cain , Where is Abel thy brother ?"", ""The Lord Jesus expanded or at least articulated the concept of murder probably as it appertained to the murder or shedding the blood of God 's Elect ; to wit : `` Ye have heard that it was said by them of old time , Thou shalt not kill ; and whosoever shall kill shall be in danger of the judgment : But I say unto you , That whosoever is angry with his brother ( i.e."", "", dull or stupid clown , absurd , foolish buffoon ; which constitutes mocking and scoffing God 's Elect for their preaching ) , shall be in danger of Hell fire ( the ultimate punishment ) . ''"", ""`` And in her ( the Great Whore of false religious systems as they control governments and together persecute God 's Elect ) And in her was found the blood of prophets , and of saints , and of all ( God 's Elect ) that were slain upon the earth . ''"", ""Here 's the passage of proof ; to wit : `` For true and righteous are his judgments ; for he hath judged the great whore , which did corrupt the earth with her fornication , and hath AVENGED THE BLOOD OF HIS SERVANTS at her hand . ''"", ""`` Knowing this first , that there shall come in the last days scoffers , walking after their own lusts , And saying , Where is the promise of his coming ? ''"", 'The old Puritan Thomas Brooks wrote a lengthy Sermon about the matter , which he delivered to the House of Commons he being the appointed chaplain of that body .', 'The several themes of the Sermon were essentially the themes of Westboro Baptist Church ; to wit : that God burned London down , because of their sins and departing from the Lord , primarily because of the way London had persecuted the Puritans and other faithful preachers , and that the smart-ass , stiff-necked Londoners were too stupid to recognize that God had sent the fire because of their sins , which would only bring worse and more tragedies .', ""Brooks wrote , preached , and believed about this matter , all that the Puritans and other faithful ministers through the centuries have written , preached , and believed ; to wit : `` God is the author of all the plagues and judgments that befall a nation . ''"", "", chapters 24 and 25 as further dispositive and irrefragable proof of his proposition that , `` God is the author of all the plagues and judgments that befall a nation . ''"", ""And , in a general way , God sends all such tragedies in punishment for the persecution of His people on earth ; because , `` Precious shall their blood be in His sight . ''"", 'Our Father will redeem our soul from the deceit and violence of all our enemies ; and precious shall our blood be in his sight .']"
9,./data_dsicap/WBC/raw/WestboroBaptist_Sermon_20080106.pdf.txt,"[""Sunday , January 6 , 2007 page 1 Sermon Outline `` Babylon the great is fallen , is fallen . ''"", ""To wit : `` And a mighty angel took up a stone like a great millstone , and cast it into the sea , saying , Thus with violence shall that great city Babylon be thrown down , and shall be found no more at all . ''"", ""I say , Seraiah was ordered by the Almighty to take that speech after reading it to the crowd and tie a big rock around it so it would sink in the deepest part of the river To wit : `` And it shall be , when thou hast made an end of reading this book , that thou shalt bind a stone to it , and cast it into the midst of Euphrates . ''"", ""50:40 ) I say , 110 verses like that Sunday , January 6 , 2007 page 2 Sermon Outline one just quoted I say the strongest language ever penned to this effect : `` Fallen , fallen is Babylon the great , and shall rise no more again forever . ''"", 'The short answer is that Jeremiah told him to , and he feared the Lord and loved the Lord , and was willing to hazard his life for the Lord ( Acts 15:26 ) , and he was willing to jeopardize his life in the high places of the field .', ""This is all we know of this quiet little Prince , but it 's enough to place him right up there with Phinehas for courage when the chips are down , as they say in Las Vegas ."", 'Think what courage it took to say to such a great and prosperous empire that her doom was coming soon .', ""Here 's another example , taken from the speech of Seraiah ; to wit : `` Thus saith the Lord of hosts ; The broad walls of Babylon shall be utterly broken , and her high gates shall be burned with fire ; and the people shall labor in vain , and the FOLK IN THE FIRE , and they shall be weary . ''"", 'Those outer walls and inner walls were 311 feet high and 87 feet thick , and they completely surrounded the city of Babylon , with a circumference of some 60 miles ( some 15 miles on each side of the square city ) , and pierced with 100 huge , thick gateways with gates of bronze .', ""Babylon 's magnificence , beauty , splendor , prosperity and power just before her final and total destruction was simply indescribable such that King Nebuchadnezzar could well boast , in the language of Scripture ; to wit : `` The king spake , and said , Is not this great Babylon , that I have built for the house of the kingdom by the might of my power , and for the honor of my majesty ? ''"", ""Standing in the very shadow of those massive walls thought to endure for the ages and proclaiming in the Name of God ; to wit : Sunday , January 6 , 2007 page 3 Sermon Outline `` Thus saith the Lord of hosts ; The broad walls of Babylon shall be utterly broken , and her high ( bronze ) gates all 100 of them shall be burned with fire . ''"", '51:58 ) And , Beloved , here we are this little church despised and rejected standing in the big middle of this great nation , in our own dispensation of time declaring the same message to this evil nation which is modern Babylon ; to wit : America is Doomed !', ""There were nine different men throughout the Bible who were named `` Seraiah '' but our hero of this remarkable story is mentioned only in this one place , the last six verses of Jeremiah , chapter 51 ; to wit : Jer ."", ""Seraiah was obviously a `` prince '' in the administration of king Zedekiah , with a marvelous talent for placating offended dignitaries , and hence was ordered to accompany king Zedekiah as a part of his delegation to placate the great Babylonian king who was greatly offended by the rebellious Zedekiah ."", ""Declare ye among the nations , and publish , and set up a standard ; publish , and conceal not : say , Babylon is taken , Bel is confounded , Merodach is broken in pieces ; her idols are confounded , her images are broken in pieces . ''"", ""Babylon 's great god Bel the god of war and destruction was Babylon 's most important god just as Bel , the god of war and destruction is America 's most important god ."", ""`` Because of the wrath of the Lord it shall not be inhabited , but it shall be wholly desolate : every one that goeth by Babylon shall be astonished , and hiss at all her plagues . ''"", ', America : think , 700 military bases in 134 countries throughout the world , the hammer of the whole earth ) `` How is the hammer of the whole earth cut asunder and broken !', ""`` When ye shall have done all those things which are commanded you , say , We are unprofitable servants : we have done that which was our duty to do . ''""]"
