,fileName,judgements
4,./data_dsicap/WBC/raw/WestboroBaptist_Sermon_20071021.pdf.txt,"['Sunday , October 21 , 2007 pg.1 Sermon Outline Hid from the Wise & Prudent , and Revealed unto Babes There was one occasion in the life and ministry of the Lord Jesus Christ when He was upon earth where it appears that He literally jumped for joy when contemplating a thing .', 'On any view of this matter , something has caused our Lord Jesus Christ to be exhilaratingly happy , to be thrilled in the extreme , and to exult to the point of leaping for joy .', 'Well , preliminarily I suggest that the thing that has so thrilled the Savior is the absolute sovereignty of God ; and that the immediate application of such an incident in the life of Christ is that we should find our own happiness likewise enhanced by an accurate consideration of that blessed doctrine ; to wit : The Absolute Sovereignty of God .', ""NOTWITHSTANDING in this rejoice not , that the spirits are subject unto you ; but rather rejoice , because your names are written in heaven . ''"", 'In order to abate their surprise , and reduce their transport of mind , he said this , meaning , that this was no news to him , nor any surprising event , that devils should be cast out of men , and be in a state of subjection ; for as he existed as the eternal son of God before his incarnation , he was present and saw Satan and his angels fall from heaven , from their first estate , their habitation of bliss and glory , down to hell , upon their sin and rebellion , as violently , swiftly and suddenly , as the lightning falls from heaven to earth ; and when he sent out these his disciples , as soon as they began their work , and all along in it , he , by his divine omniscience , saw the powers of darkness falling before their ministry and miracles ; and he also foresaw how Satan hereafter , in a more conspicuous manner , would fall before the preaching of his Gospel by his apostles , not only in Judea , but especially among the Gentiles , where he , the prince of this world , would be cast down from his throne , and out of his kingdom ; so that what they related , as it was what he knew before , it was but little in comparison of what he himself had seen long ago , and of what he foresaw would be ; and even he would give them power to do other miraculous works besides these .', ""`Behold , I give you power to tread on serpents and Sunday , October 21 , 2007 pg.2 Sermon Outline scorpions , ' which may be understood figuratively of the devil , and his principalities and powers , and all his emissaries , who , for their craft and cunning , and for their poisonous and hurtful nature and influence , may be compared to serpents and scorpions ; `and over all the power of the enemy ; ' of mankind in general , and of the seed of the woman , Christ and his people in particular , Christ has a power over all Satan 's power , his whole posse of devils , even the power of the air , of which he is prince ; and Christ communicated this power to his disciples , even to the seventy ; adding , `and nothing shall , by any means , hurt you ; ' not the most hurtful and poisonous animals , nor the most malicious persecutors on earth , nor all the devils in hell ; as the former venomous creatures , when took up in their hands , should not hurt their bodies ; so the other , whatever they might be permitted to do with respect to their lives , and outward estate , should never hurt their souls , and the eternal welfare of them ; nor even hinder the work of God prospering in their hands . ''"", ""The Lord our God has given us power to defeat Satan and his demon spirits ; to wit : `` Be sober , be vigilant ; because your adversary the devil , as a roaring lion , walketh about , seeking whom he may devour : Whom RESIST stedfast in the faith , knowing that the same afflictions are accomplished in your brethren that are in the world . ''"", ""And THAT 'S when our Lord Jesus Christ said , in effect , That 's wonderful , but it 's NOTHING compared to the joy you should experience in contemplating the fact that your names are written in heaven ."", "", a remnant ) of Adam 's race are unconditionally ELECTED to be saved , and each has his name eternally written in Heaven ; and a definite and vast majority of the whole of Adam 's race do NOT have their names written in Heaven , and are predestinated to spend eternity in Hell ."", ""Furthermore , the fact that this doctrine ( Unconditional Election of some to be saved , and most to be lost ) is mysterious , hidden , abstruse , recondite , obscure , and not easily understood added immeasurably to the Savior 's joy ."", 'Virtually the whole of mankind spend their lives under the Sunday , October 21 , 2007 pg.3 Sermon Outline silly , mistaken notion that God is desperately trying to get every individual of mankind saved and come to a knowledge of the truth when the exact opposite is true .', 'One time , when `` great multitudes were gathered together unto him ... And he spake many things unto them in parables ... And the disciples came , and said unto him , Why speakest thou unto them in parables ?', ""And in them is fulfilled the prophecy of Esaias , which saith , By hearing ye shall hear , and shall not understand ; and seeing ye shall see , and shall not perceive : For this people 's heart is waxed gross , and their ears are dull of hearing , and their eyes they have closed ; lest at any time they shall see with their eyes , and hear with their ears , and should understand with their heart , and should be converted , and I should heal them ."", 'Our Lord Jesus Christ is rejoicing with joy unspeakable and full of glory just THINKING about the doctrine of Unconditional Election ( predestination of some to salvation and some to damnation ) , AND , just THINKING about the fact that this doctrine is completely hidden from all but a few babes .', ""`` Do n't rejoice , '' says Christ , `` because God 's power makes the demons subject to you , as wonderful as that is ."", ""Rather rejoice because God has chosen you to be one of those few members of Adam 's race to be saved , AND , because God has hidden these truths from the masses of mankind . ''"", 'In his masterful work , Precious Remedies with The Covenant of Grace , ( 1676 ) Thomas Brooks said : `` The names of the elect are said to be written in the book of life by a usual metaphor ; for we commonly write down the names of such as are dear unto us , that we may continually remember them .', ""So God having in his eternal counsel elected some to salvation , hath written their names in the book of life ; as our Savior tells us , `Rejoice , because your names are written in heaven , ' Luke 10:20 ."", '`` Some understand the metaphor of the sonship of the elect ; so that to be written in the book of life shows that they are heirs of glory ; for we know that such are to inherit whose names are written in the last will and testament of men .', 'Now from this book of life , that shall be opened in the great day , when the other books shall be opened , ( Rev .', ""`And I saw the dead , small and great , stand before God ; and the books were opened ... and the dead were judged out of those things which were written in the books , according to their works . '"", 'Now my name being written in that Sunday , October 21 , 2007 pg.4 Sermon Outline book , I am exempt from all condemnation , and interested in the great salvation ; my name being in the book of life , I am secured from coming into the judgment of reprobation or condemnation , Jn .', ""( `And there shall in no wise enter into it any thing that defileth , neither whatsoever worketh abomination , or maketh a lie ; but they which are written in the Lamb 's book of life . '"", 'I further plead , O blessed Lord , that there is an immutable connexion betwixt being written in this book of life and the obtaining of eternal life ; and if the connexion betwixt being written in this book of life and the obtaining of eternal life were not peremptory , what reason could there be of opening this book in the day of judgment ?', ""When we have traced all things whatsoever as to cause and effect chain-link fashion to their final and ultimate source we will find that final and ultimate causal source to be `` the will of God . ''"", ""4:35 ) `` We know that all things work together for good to them that love God , to them who are the called according to his purpose . ''"", ""2:10 ) `` Thou art worthy , O Lord , to receive glory & honor & power : for thou hast created all things , & for thy pleasure they are , & were created . ''""]"
5,./data_dsicap/WBC/raw/WestboroBaptist_Sermon_20070722.pdf.txt,"[""These Mighty Men went to join David in the wilderness because they were in deep , ruinous debt , they were distressed ( in anguish under Saul 's oppression ) , and they were discontented ( bitter of soul ) ."", 'having been deceived into borrowing money at usurious rates of interest , and being dunned by bill collectors ; see , S # 5378 + S # 5377 ) , and every one that was discontented ( i.e.', ""This is an elegant metaphor of the Elect of God , who confess that they are strangers and pilgrims on the earth , that they are miserable living in the City of Destruction and fearing the wrath of God to come , and that they therefore declare plainly that they seek a country , better than this , that is , an heavenly country ; `` wherefore God is not ashamed to be called their God : for he hath prepared for them a city ; '' ( Heb ."", ""( 1 Samuel 22:1-2 ) Sunday , July 22 , 2007 pg.2 Sermon Outline David 's Mighty Men : TACHMONITES As with David 's Mighty Men leaving all to follow David into a danger-fraught wilderness knowing exactly what they were doing and what they were getting into , and yet rejoiced for the opportunity to suffer with David for a short while , and then to rule and reign with him , SO DO WE !"", '12:40 ) ; to wit : `` All these men of war , that could keep rank , came with a perfect heart to Hebron , to make David king over all Israel ; and all the rest also of Israel were of one heart to make David king .', '1:4 ) All to the effect that our afflictions are submicroscopic and infinitesimal ( so tiny in quantity and volume as to be incapable of measurement ) in size , and diminutive in duration , compared to the certainty of our glorious rewards , all of which are infinite in size and duration ; to wit , e.g .', "": `` For our light ( tiny ) affliction , which is but for a ( tiny ) moment , worketh for us a far more exceeding and eternal weight of glory ; While we look not at the things which are seen , but at the things which are not seen ; for the things which are seen are temporal ; but the things which are not seen are eternal . ''"", ""Indeed , our Lord Jesus Christ is our precise and precisely-worded pattern in and for this doctrine , urging us on to infinite reward and infinite glory ; to wit : `` Let us run with patience the race that is set before us , Looking unto Jesus the author and finisher of our faith ; who for the joy that was set before him endured the cross , despising the shame , and is set down at the right hand of the throne of God . ''"", 'And from that glorious throne on high , our Captain is beckoning us to join Him , with these happy words ; to wit : `` To him that overcometh will I grant to sit with me in my throne , even as I also overcame , and am set down with my Father in his throne .', ""Sunday , July 22 , 2007 pg.3 Sermon Outline 8 Characteristics of David 's Mighty Men Now let us examine the attributes and descriptive characteristics of David 's Mighty Men which are the same attributes and characteristics , in principle , as those possessed by God 's Elect in New Testament Churches ."", ""In each case , they are supernatural gifts from God ; `` For at that time day by day there came to David to help him , until it was a great host , like the host of God . ''"", ""( This attribute an understanding of the times , which is substantially the same as the signs of the times of Matthew 16:3 when connected to their thorough knowledge of the Word of the Lord of 1 Chronicles 12:23 is solid evidence that David 's Mighty Men were likely to have been God 's Elect , making them mighty in spirit even the Holy Spirit as well as in body . )""]"
6,./data_dsicap/WBC/raw/WestboroBaptist_Sermon_20070902.pdf.txt,"['We have picketed fags in Idaho many times and each time have been despised and rejected by the people of Idaho , who have always sided with the fags .', "", if ye will not treat WBC with the honor and respect due her members as messengers of God Almighty , sent to warn America of her sodomite sins ) if ye will not do so , ye have sinned against the Lord : and be sure your sin will find you out . ''"", 'We have no doubt that many others in the Senate and in the House are as guilty as Sen. Craig .', 'Furthermore , the Fag-Enablers in the Senate and the House as well as the Fag-Enablers in Idaho who voted Craig into Congress again and again for some 30 years , despite knowing full well about his sodomite ways are just as guilty or guiltier !', ', the Tribe ; and the geographical territory ; and the political State with its governing structure ; and the population ; also sometimes called Benjamites , and the Children of Benjamin ) I say , Benjamin was a Fag-Enabler in spades !', 'The story of Gibeah goes like this : A very unremarkable , nondescript man was headed home with his whorish concubine and her servant and two donkeys , when darkness overtook them , and they were herded by divine Providence into the mean-spirited and demonic little fag town of Gibeah of Benjamin ; to wit : `` And they passed on and went their way ; and the sun went down upon them when they were by Gibeah , which belongeth to Benjamin .', 'It seems that Cities take on distinctive characters from their inhabitants in the aggregate , for which they are known in time and eternity ; e.g .', ""Sunday , September 2 , 2007 pg.3 Sermon Outline Back to our story of the Levite and his concubine in Gibeah : Eventually , an old man took them into his house for the night , where the following atrocity was committed by the fag beasts of Gibeah ; to wit : `` Now as they were making their hearts merry , behold , the men of the city , certain sons of Belial , beset the house round about , and beat at the door , and spake to the master of the house , the old man , saying , Bring forth the man that came into thine house , that we may know him . ''"", 'The Levite took his dead concubine home , `` And when he was come into his house , he took a knife and laid hold on his concubine , and divided her , together with her bones , into twelve pieces , and sent her into all the coasts of Israel .', 'They actually went to war against all the other tribes of Israel , rather than surrender a few murdering sons of Belial who were guilty as dogs !', 'And here is the plain application of that Bible Doctrine to current events on the ground ; to wit : Sen. Craig is the Fag ; and Idaho is the Fag-Enabler and/or , the U.S. Senate is the Fag-Enabler .']"
7,./data_dsicap/WBC/raw/WestboroBaptist_Sermon_20080217.pdf.txt,"['Again , Jeremiah says , `` For I have set my face against this city for evil , and not for good , saith the Lord : it shall be given into the hand of the king of Babylon , and he shall burn it with fire .', ""Such passages give us insight into how it will be when we take our places beside the Great King on His throne of massive adjudication in the world to come ; to wit : `` To him that overcometh will I grant to sit with me in my throne , even as I also overcame , and am set down with my Father in his throne . ''"", ""7:18 ) `` And the kingdom and dominion , and the greatness of the kingdom under the whole heaven , shall be given to the people of the saints of the most High , whose kingdom is an everlasting kingdom , and all dominions shall serve and obey him . ''"", "", all the Elect ) have a unique and special honor , and they are all without exception honorable , and they occupy seats or thrones in glory from which they execute God 's vengeance upon the heathen , and from which they administer punishments upon the reprobates or the non-elect throughout all eternity ."", ""`` And Enoch , '' we read , for example , `` the seventh from Adam , prophesied of these , saying , Behold , the Lord cometh with ten thousands of his saints , To execute judgment upon all , and to convince all that are ungodly among them of all their ungodly deeds which they have ungodly committed , and of all their hard speeches which ungodly sinners have spoken against him . ''"", ""How would this area of the King 's laws apply for instance to the reprobate Methodist pastor who together with his wife and two kids got killed in a car wreck last week in Tennessee , even as they were helping others clean up the carnage of the tornadoes and storms that killed many people and did much damage last week in Tennessee ?"", 'We stood with our signs of religious protest and warning , outside the city auditorium in Sacramento , Calif. , where 200 such Methodist pastors were performing a wedding ceremony for TWO FEMALES before a big Sunday , February 17 , 2008 page 3 Sermon Outline crowd of several thousand , inside the auditorium .', ""When Mel White another preacher who left his wife and kids to `` marry '' a man I say , when Mel White came to Topeka at the expense of another group of fag-enabling preachers , to try and get me to soften my Gospel sermons with respect to fags , a gaggle of Methodist preachers from First Methodist Church were his sponsors ."", 'The Methodist bishop of Eastern Kansas had three sons , two of whom were openly gay , and those two were already dead of AIDS even as they were studying in their Methodist seminary to become Methodist preachers like their father .', '1:17 ; to wit : `` Now unto the King eternal , immortal , invisible , THE ONLY WISE GOD , be honour and glory for ever and ever .', 'Cut the apple open , carve out the core where the seeds are , pluck them out and count them maybe 5 , or 6 .', 'Soon , you will have millions ; then billions ; then trillions ; and so forth , until the number of apples from JUST ONE seed will be INCALCULABLE but they MUST BE CALCULATED .', ""He is saying to all those with whom he has powerful influence , It 's OK to be gay ."", ""Mankind , when he hears that such are God 's concepts , angrily cries out , `` Unfair !"", ""And Cain was very wroth , and his countenance fell ... And Cain talked with Abel his brother : and it came to pass , when they were in the field , that Cain rose up against Abel his brother , and slew him . ''"", ""And we are further told that the elect angels all belong to the church state with us , and that by being members of the same family , the church , we `` are come to ... an innumerable company of angels . ''"", 'and if the world shall be judged by you ( including the weak and sometimes backslidden church members at Corinth ) are ye unworthy to judge the smallest matters ?', 'Likewise I have a more modest request , that I humbly and most respectfully make ; and that is that the Methodist Bishop for eastern Kansas be assigned to my case load .', 'Also , a few judges and a few more big shot preachers are on my short list of defendants .', 'These things are very real to us , as they were with Salome .']"
8,./data_dsicap/WBC/raw/WestboroBaptist_Sermon_20080120.pdf.txt,"['Gill says this `` was not a common and ordinary motion felt by women in such circumstances , but an extraordinary one ; the two children in her strove with each other , as if it was for mastery , or who should get out first before the proper time ; which not only gave her great uneasiness of mind , but pain of body ; this was an emblem of the future difference between those two children , Esau and Jacob , and of the contentions that would be between their respective offspring , and of the enmity and war between them .', ', Rebekah ) had doubtlessly enquired of other women , whether it had ever been so with them , and they replied , no ; then , says she , how comes it to pass that it should be different with me than others ?', 'Or , if those children by struggling should kill one another , or be abortive and kill me , why should I have been so desirous of conception ?', ""Trapp says , `` They ran at tilt , as it were , and jostled one against another ( as two mighty knights on horses ride at full gallop , each with a long sharp lance seeking to unseat and kill the other when they collide ) so these two babes ran at tilt , as it were , and jostled one against another , even to bruising and hurting . ''"", ""To which Gill adds , `` Indeed , if she inquired of any particular person of note for religion , and as a prophet , there is none so likely as he , who was the friend of God , and had great intimacy with God , and to whom God revealed his secrets . ''"", ""In any case , the Lord God gave Rebekah a prompt answer , either through Abraham or some other holy man , or by an impulse upon her own mind ; to wit : `` And the Lord said unto her , ( and there follows one of the grandest declarations of the Calvinistic doctrines of election , reprobation , and absolute predestination ever uttered ; to wit : ) `` And the Lord said unto her , Two nations are in thy womb , and TWO MANNER OF PEOPLE , shall be separated from thy bowels : and THE ONE PEOPLE shall be stronger than THE OTHER PEOPLE ; and the elder shall serve the younger . ''"", '( Gen. 25:23 ) These two weighty and all-important things were said unto Rebekah before the boys were born as irrefutable proof of the doctrine of election , the doctrine of reprobation , and the doctrine of predestination ; to wit : `` ( For the children being not yet born , neither having done any good or evil , that the purpose of God according to election might stand , not of works , but of him that calleth ; ) It was said unto her , The elder shall serve the younger .', ""Now we are prepared to interpret the mysterious historical event and identify the two peoples in Rebekah 's womb ; to wit : `` Two manner of people shall be separated from thy bowels ; and the one people shall be STRONGER than the other people ; and the elder shall SERVE the younger . ''"", 'Whereas , the Reprobate Esaus ( the non-Elect ) are spiritual dwarfs and malnourished weaklings , who are total ignoramuses when it comes to any knowledge whatsoever of the Bible .', ""Esau certainly appeared at birth to be more beast than infant with even an abundance of facial and other body hair , which was a sign , as the ancient rabbis observed , `` that he would be a shedder of blood , fierce and cruel . ''"", ""( Gen 25:26 ) Jacob 's little hand took hold on Esau 's heel make no mistake TO PLUCK HIM BACK AND GET OUT FIRST and this action was not casual or accidental and this action had a meaning and a mystery in it and this action signified that this little rascal Jacob had a deep respect for and understanding of the birthright , and was determined come hell or high water in one way or another to have that birthright and all it stood for ."", ""A startling thing which I discovered in researching this sermon , was that the best authorities among the ancient Jews believed that Esau was not only the fierce and cruel slayer of animals , but also the slayer of men ; and that not only was Jacob a sincere and upright man of godly plainness , but that he was also a minister , who studied religion in the school of Shem and the tent of Eber , agreeably to the Targum of Jonathan ; to wit : `` a minister in the school of Shem , seeking doctrine from the Lord ; a student there , where he resided awhile , in order to be instructed in the doctrines of truth and righteousness . ''"", 'And Esau said to Jacob , Feed me , I pray thee , with that same red pottage ; for I am faint ; therefore was his name called Edom ( margin , That is , Red ) .', '( Gen. 25:29-34 ) The ancient Jewish writers say that this Kitchen Conference took place on the day that Abraham died , and that the cheap bean-like red lintels was the food of mourning for the dead ; and so , they gather that Jacob and Esau were now 15 years of age when this eternal bargain was struck , in the buying and the profane selling of this birthright .', 'For , Abraham was 100 years old when Isaac was born ( Gen. 21:5 ) ; and Isaac was 60 years old when Jacob and Esau were born ( Gen. 25:26 ) ; and Abraham lived to be 175 ( Gen. 25:7 ) .', 'Many privileges were annexed to that birthright , both temporal and eternal ; such as honor and authority in the family next to parents , a double portion of the inheritance , the parental blessing , and especially in this case the promises of Messiah ; and which was typical of the heavenly inheritance ALL OF THIS REBEKAH KNEW by the divine oracle were designed for Jacob , and which NO DOUBT she had acquainted him with ; and ADVISED HIM TO DEAL WITH HIS BROTHER about parting with his birthright AS HE HAD OPPORTUNITY ; and it is VERY LIKELY they had talked together about it many times , and Esau had shown some indifference to his right , and made no great account of it ; and now , an opportunity offering itself , to get him in the mind to part with it , JACOB POUNCED , like a cat on its prey .', ""Meaning , `` Let it be made in plain and full terms , that there be no dispute about it hereafter , or any attempt at revocation of it . ''"", ""I will tread them in mine anger , and trample them in my fury ... For the day of vengeance is in mine heart , and the year of my redeemed is come . ''""]"
