,fileName,sentence
2,./data_dsicap/WBC/raw/WestboroBaptist_Sermon_20080504.pdf.txt,"[""Sunday , May 4 , 2008 page 1 Sermon Outline `` And of some have compassion , making a difference : And others save with fear , pulling them out of the fire ; hating even the garment spotted by the flesh . ''"", ""This passage , consisting of two verses , ( 22 & 23 ) , would seem by its position to suggest some means whereby we might obey or encouragement to obey verse 21 ; to wit : `` Keep yourselves in the love of God , looking for the mercy of our Lord Jesus Christ unto eternal life . ''"", 'Does the passage suggest a certain activity which while we are busily engaged therein will , rather automatically , and rather simultaneously , cause us to keep ourselves in the love of God , and also cause us to be looking for the mercy of our Lord Jesus Christ unto eternal life ?', ""Briefly put , if we find somebody who is genuinely sincere , humble , sorrowful and in mourning for his sins and above all , genuinely penitent we must SHOW THAT SINNER COMPASSION GALORE and spare no pains `` to comfort them which are in any trouble , by the comfort wherewith we ourselves are comforted of God . ''"", 'But these devils that we find ourselves dealing with every day , in every place from one end of this country to the other are not the least bit interested in repenting of their sins .', 'They mock and scoff at the very idea of repenting of their filthy sins and getting right with God .', ""These oily , kissy-pooh preachers who are today filling their churches with vile , abominable , impenitent perverts ; I say , they are disobediently ignoring that divine order that Holy Command : to wit : `` Making a difference ! ''"", ""These are a people like those `` that jeoparded their lives unto the death in the high places of the field , '' where God 's faithful soldiers are to be found ; to wit : Sunday , May 4 , 2008 page 2 Sermon Outline `` They handle the pen of the writer ... they ( have ) great thoughts of heart , and great searchings of heart ... and they were a people that jeoparded ( i.e."", "", put in jeopardy ) their lives unto the death in the high places of the field . ''"", ""( Judges 5:14-18 ) These reflect the attributes of God 's Elect that equip them to obey the Holy Commandment that they at all times shall be `` MAKING A DIFFERENCE '' between how they deal with God 's compassion toward a person , and how they deal with God 's wrath toward a person ."", ""In fact , we have a positive duty NOT to deal with him in God 's COMPASSION , and we have a concurrently positive duty to deal with him ONLY in God 's WRATH !"", ""It is sin and rebellion against God to show God 's compassion when dealing with an impenitent sinner ."", ""And it is likewise a grievous sin and rebellion against God NOT to deal ONLY in God 's wrath when dealing with an impenitent sodomite sinner or any other kind of impenitent sinner ."", ""Holding out to them either God 's COMPASSION , or God 's WRATH ."", ""That 's what it means to rightly divide the word of truth ; to wit : `` Study ( i.e."", ', give all due diligence ) to show thyself approved unto God , a workman that needeth not to be ashamed , rightly dividing ( i.e.', ""The so-called `` gay '' community held two of their typical nationwide events this month , and , of course , pushed their filthy agenda down everybody 's throat as a concomitant part of each event also attended with their usual fag ultimatum ; to wit : cooperate with us in each of our events , or else we will blackball you and mark you secretly for silent destruction ."", ""The `` Golden Rule Pledge '' is a national event where students on their campuses are urged to sign pledge cards that they will not engage in the name-calling , bullying , and harassment of others simply because of their sexuality ; because , 1 ) Christ said , `` And as ye would that men should do to you , do ye also to them likewise ; '' Lk ."", 'Sunday , May 4 , 2008 page 3 Sermon Outline They call themselves the LGBT Community ; and the acronym LGBT stands for , Lesbian , Gay , Bisexual , Transgender students .', ""They are demanding `` LOVE AND RESPECT '' solely because they say , ( erroneously ) , that `` all people are created in the image of God and therefore deserve LOVE AND RESPECT '' elsewhere in their literature they say that `` all people have been created in the image of God and therefore have INFINITE WORTH AND DIGNITY '' ) ."", ""Note that nowhere do they ever say , `` Love and respect us because God loves us , BECAUSE WE HAVE REPENTED OF OUR SINS AND ARE NOW LIVING HOLY LIVES IN THE FEAR OF GOD ! ''"", 'They want us to have compassion on them IN THEIR SINS .', 'They want us to disobey God , who has commanded us to Make a Difference , and preach Hell fire and damnation to them , `` hating even the garment spotted ( LEPROSY !', 'Leprosy could be very , very serious , as when the leprosy was in the head ; to the least serious , as when leprosy was only in the garment ; to wit : `` He is a leprous man !', 'he is unclean ; the priest shall pronounce him utterly unclean ; his plague is in his head ... he shall cry , Unclean , unclean .', ""All the days wherein the plague shall be in him he shall be defiled ; he is unclean ; he shall dwell alone ; without the camp shall his habitation be . ''"", ""13:44-46 ) `` Hating even the garment spotted by the flesh , '' seems to be a most elegant way of saying that just as the lowest kind of leprosy is still leprosy and is therefore deadly , and a thing not only not to be desired , but a thing to be feared and avoided at all costs even so , sodomy is the most deadly of all sins , in that , its practitioners are too judicially blind to recognize it as sin , but are deluded into believing it to be a thing of pride gay-pride week , gay-pride parade , etc ."", 'SODOMY IS THE DEADLIEST OF ALL SINS By its nature by definition the sin of buggery ( as the British say ) can never be absolved , because it can never be repented of a precondition to absolution .', ""and demand love , respect , and acceptance , because they say they `` are created in the image of God and therefore have infinite worth and dignity . ''"", 'You were created in the image of sinful , fallen , depraved , unregenerate Adam .', 'See , Gen. 5:3 ; to wit : Sunday , May 4 , 2008 page 4 Sermon Outline `` And Adam lived an hundred and thirty years , and begat a son IN HIS OWN LIKENESS , AFTER HIS IMAGE ; and called his name Seth .', ""( Gen. 5:3-5 ) The fag 's so-called Day of Silence , when they wear a strip of duct tape over their mouths to call everybody 's attention to their complaint that the LGBT Community `` has been daily silenced by the name-calling , bullying and harassment simply because of their sexuality . ''"", ""Examine this claim closely , and you will find that what these smelly fornicators refer to as `` name-calling , bullying and harassment '' is nothing more than WBC 's Gospel preaching ."", ""We carry signs saying , `` God Hates Fags ! ''"", ""In the literature announcing their `` Day of Silence , '' they bewail their plight like this : Quote : `` But when Christians hold signs on campus that read , `` God Hates Fags , '' and `` Fags Burn in Hell , '' the LGBT Community associates that with Christianity . ''"", ""They are upset because we at WBC choose to obey the Lord our God when he issues His Commandment ; to wit : `` Making A Difference . ''"", 'Preach only Hell-fire and damnation to them .', ""It would be major sinfulness for us to preach love and compassion to impenitent sodomites '' and we are not going to do it ."", 'We are now preaching to the thousands of kissy-pooh preachers , priests and rabbis in America and around the world .', 'WBC has a message from God to you and each of you .', 'We no longer say , Shame on you , for not preaching Hell-fire and brimstone to the millions of fags and fag-enablers .', 'We are now saying to you , Mr .', ""You , sir , are on your way to Hell just as surely as the fags and fagenablers that you preached love and compassion to , thereby rebelling against God who gave you a direct Command ; to wit : `` Make a Difference ! ''"", ""Guess who joined the fags in their `` Golden Rule Pledge '' and their `` Day of Silence '' events ."", 'You will not be surprised if some of our leading so-called fundamentalists and evangelicals joined the fags in preaching love and compassion to them , and in assuring them that they were created in the image of God , and therefore have infinite worth and dignity .', 'Dr. Warren Throckmorton of Grove City College , a leading so-called fundamentalist college in the category of Bob Jones University , is taking a leading role in helping the fags and opposing us .', 'Likewise are the nationwide ministries of Campus Crusade for Christ and Intervarsity Christian Fellowship which I have known since the early days of my ministry , and which I have known to be leading evangelical power houses .', ""They have forsaken the Lord and rebelled against His plain Command ; to wit : `` Make a Difference . ''"", 'Sunday , May 4 , 2008 page 5 Sermon Outline Call the names of these rebels and picket them ; to wit : Dr. Warren Throckmorton , Grove City College ( 60 miles north of Pittsburgh , Pennsylvania ) , Appalachian State Univ.', 'They are making a plea for compassion toward impenitent fags ( i.e.', ', that all fags , though impenitent and cursed of God deserve love and respect , because they have infinite worth and dignity , because they are created in the image of God ) .', ""Simultaneously , they are joining out-and-out fags in pleading ( via their gimmicks called `` Golden Rule Pledge '' and `` Day of Silence '' ) this Derivative Plea ; to wit : Whatever you do , do n't preach the FEAR of God ( Hell-fire & brimstone ) to impenitent fags ."", 'I answer : 1 ) Those that are hardened , and grown perverse and stubborn ; softer strains would but harden these more ; and , 2 ) Those that are secure libertines , wallowing in sin and pleasure .', ""God 's wrath and vindicative justice is the proper object of fear , and so it must be looked upon ."", 'It is a duty that Christ enjoineth upon us .', '`Fear him , saith Christ , who is able to cast body and soul into Hell-fire .', ""'' Jonathan Edwards said : `` The God that holds you over the pit of Hell , much as one holds a spider , or some loathsome insect , over the fire , ABHORS you , and is dreadfully provoked ; his wrath towards you burns like fire ; he looks upon you as worthy of nothing else , but to be cast into the fire ; he is of purer eyes than to bear to have you in his sight ; you are ten thousand times more abominable in his eyes , than the most hateful venomous serpent is in ours ."", 'consider the fearful danger you are in ; it is a great furnace of wrath , a wide and bottomless pit , full of the fire of wrath , that you are held over in the hand of that God , whose wrath is provoked and incensed as much against you , as against many of the damned already in Hell .', ""That , Beloved , is the kind of preaching to the sodomite damned that God Commands us to preach to the `` others '' of Jude 23 i.e."", 'And , we are simultaneously commanded NOT to preach about COMPASSION to impenitent fags ; to wit : `` And of some have COMPASSION , making a DIFFERENCE : And others save with FEAR , pulling them out of the fire ( i.e.']"
3,./data_dsicap/WBC/raw/WestboroBaptist_Sermon_20070729.pdf.txt,"['GodHatesIreland.com is the new Website launched by WBC this week to expose Ireland as the Emerald ( now Pink ) Isle of the Sodomite Damned , saturated with fags and dykes at every level of society and government where they have laws that criminalize Gospel preaching .', 'Beloved , in these last of the last days , God has honored us by raising us up and giving us hearts like the heart of John the Baptist .', ""Here 's an e-mail one of thousands mostly hostile we get every week : He says : `` When I saw this Web page , when I heard the sermon , despite the public outcry , despite the horror and ridicule that precedes Pastor Phelps , that have reached me before hearing his voice personally ..."", 'I have never bothered to deal with sin and sodomy of the western nations too much , but when I heard the Pastor speak , I was shaken to the bottom of my soul .', ""This surely is a man , this surely is a tool brought with the thunder of God Almighty pronounced unto us . ''"", ""For this is he that was spoken of by the prophet Isaiah , saying , The voice of one CRYING in the wilderness , Prepare ye the way of the Lord , make his paths straight . ''"", ""The e-mail guy said he heard my sermon and , `` I SAW the man screaming in the wilderness . ''"", 'Sunday , July 29 , 2007 pg.2 Sermon Outline GodHatesIreland.com And now , back to our new Website , God Hates Ireland.com .', ""Back on March 10 , 2003 , we warned America about Ireland 's sad , sick , sodomite culture and fag Irish Senator David Norris 's case before the European Court of Human ( i.e."", 'Because we in America had a similar case Lawrence v. Texas pending before the Supreme Court of the U.S. At oral arguments March 26 , 2003 we picketed the U.S. Supreme Court in Washington , D.C. , in religious protest and warning warning those 9 black-robed heretics NOT to follow the Satanic , fag-dominated courts of Europe all now dominated by ONE Super-Supreme Fag Court sitting like the Great Whore of Rev .', 'We did not know at the time , that our own Supreme Court of the United States as they sat in their warm building furnished lavishly by us Americans I say they were sitting there with a brief amicus curiae supporting the fag position by Irish Pres .', 'Mary Robinson and Irish Fag Senator David Norris which our own Supreme Court cited by name as authority in their own blasphemous , pro-fag landmark opinion in Lawrence v. Texas .', 'We warned specifically that Ireland is now saturated with fags and dykes at every level , such that Ireland is no longer Emerald but Pink the world-wide fag color .', ""We warned that WBC has had lots of experience with Ireland 's militant sodomite citizenry , steeped for many decades in ignorant , blind , idolatrous Catholicism , belching out their vile fagspeak , slander , and blasphemy against God and His Word cursing WBC members as guests on Dublin talk-radio shows ."", 'We warned that the very leprechauns of Ireland are likely to be fags !', 'It is economically advantageous to join the European Union , but in order to do so , countries must submit to and yield their sovereignty to the godless fag agenda .', ""Sunday , July 29 , 2007 pg.3 Sermon Outline WBC 's Solemn Warnings That Satanic , lawless fag agenda includes same-sex marriage , decriminalization of all sodomy and age-of-consent laws , and laws making it a serious crime to preach God 's Word about sodomites ."", ""Ct. oral arguments in Lawrence v. Texas ) , I say , in spite of WBC 's solemn warnings , America 's highest court went full steam ahead , adopting the Strasbourg Fag Court case of Norris v. Ireland and Mary Robinson briefs , even citing the Norris v. Ireland case and Mary Robinson 's briefs by name as authority , in the U.S. Supreme Court opinion handed down June 26 , 2003 ."", 'On June 26 , 2003 , the Supreme Court of the U.S. the official conscience of this nation coughed up a glob of filthy , fag spit , commingled with a small dollop of diseased Irish fag feces and spat it in the Face of God Almighty .', '`` Shall I not visit for these things ?', ""saith the Lord ; shall not my soul be avenged on such a nation as this ? ''"", ""`` But thou shalt say unto them , This is a nation that obeyeth not the voice of the Lord their God , nor receiveth correction ; truth is perished , and is cut of from their mouth . ''"", ""In short , the Western World ( and more and more the East ) is raging mad at WBC for preaching God 's Truth about fags and they vainly imagine that they can pass enough stupid laws to trump the Word of God ."", ""The kings of the earth set themselves , and the rulers take counsel together , against the LORD , and against his anointed , saying , Let us break their bands asunder , and cast away their cords from us . ''"", ""( Psalm 2:1-3 ) Continuing to quote Psalm 2 at verse 2 : `` The kings of the earth set themselves , and the rulers take counsel together , against the Lord , and against his anointed . ''"", ""The heads of state have all conspired together and set their feet in concrete ; saying , 1 ) It 's OK to be gay ; and , 2 ) anybody who says otherwise and make no mistake , they all mean WBC !"", 'And now continuing to give the meaning of Psalm 2 at the last half of verse 2 : These heads of state and inferior rulers at every level of government in America , Europe and elsewhere are continuously holding meetings to take counsel together against the Lord and against his anointed ( note : the only way they can get at the Lord is by plotting to and acting to destroy His anointed servants on earth ; i.e.', ""And the subject of all their conferences , plots , and schemes against WBC is found , succinctly , at verse 3 ; to wit : `` Let us break their bands asunder , and cast away their cords from us . ''"", ""The bands and cords whereby WBC afflicts and `` torments '' ( see , `` These two prophets tormented them that dwelt on the earth . ''"", 'I say , whereby WBC afflicts and torments all mankind , are nothing other than plain , sharp , ringing Anglo-Saxon Bible doctrines , faithfully preached .', ""18:22 ; to wit : `` Thou shalt not lie with mankind as with womankind ; it is abomination . ''"", 'And their consciences bear witness to the truth of what the Bible says .', 'So , when the Truth is preached about them , these beasts smell brimstone & feel heat from rapidly-approaching fires of eternal Hell .', 'That kind of preaching torments them .', ""Hence their mad drive to have laws saying : 1 ) It 's OK to be gay , and 2 ) Anybody saying otherwise must be silenced by force of the criminal law ."", ""And my , how they cringe and howl when their vile sex practices are held up to Bible light ; as Christ said , `` And this is the condemnation , that light is come into the world , and men loved darkness rather than light , because their deeds were evil . ''"", ""My , how they cringe and scamper when God 's light is shined on these hiding cockroaches ."", ""When it is widely told and exposed on a regular basis : Fags eat each other 's feces , do n't forget , and call it `` Scat ; '' lick each other 's anus , and call it `` Rimming ; '' drink each other 's semen , and call it `` Priapus Cocktail ; '' urinate on each other and call it `` Golden Showers . ''""]"
4,./data_dsicap/WBC/raw/WestboroBaptist_Sermon_20070902.pdf.txt,"['We have picketed fags in Idaho many times and each time have been despised and rejected by the people of Idaho , who have always sided with the fags .', 'Sen. Craig has lifted up his voice against WBC in the U.S. Senate , and he has cast his vote to deny the Constitutional rights of free religious exercise and freedom of speech to WBC .', ""And now , in answer to our prayers and in fulfillment of God 's many promises to avenge His own elect who cry to Him night and day against those who persecute them God Almighty has with one well-placed , dramatic stroke utterly destroyed United States Sen. Larry Craig ."", 'But God Almighty the Avenger of His people had other plans .', 'God has answered our prayers .', 'His sin has found him out .', "", if ye will not treat WBC with the honor and respect due her members as messengers of God Almighty , sent to warn America of her sodomite sins ) if ye will not do so , ye have sinned against the Lord : and be sure your sin will find you out . ''"", 'A sovereign God chooses which man He will openly expose and disgrace for his fag sins and his fag-enabling sins in this life and which man He will await the Great Judgment Day to openly expose and disgrace .', "", their sins follow them like bloodhounds , to be fully dealt with before The Great White Throne ) . ''"", 'We have said that U.S. Sen. Larry Craig is a Fag , in a State ( Idaho ) of Fag-Enablers .', ""My computer spellcheck says there is no such word as , `` Enablers . ''"", ', the Tribe ; and the geographical territory ; and the political State with its governing structure ; and the population ; also sometimes called Benjamites , and the Children of Benjamin ) I say , Benjamin was a Fag-Enabler in spades !', 'A Fag-Enabler is one who against all logic , and against his own best interests for time and eternity fanatically supports , condones and promotes the filthy fag agenda and lifestyle .', 'The story of Gibeah and Benjamin will strip joy from all hearts , as in the words of the prophet Hosea when he was announcing the final doom of the Ten Northern Tribes ; to wit : `` Rejoice not , O Israel , for joy , as other people : for thou hast gone a whoring from thy God , thou hast loved a reward ( i.e.', "", irreversibly ) corrupted themselves , as in the days of Gibeah : therefore he ( God ) will remember their iniquity , he will visit their sins . ''"", 'The story of Gibeah goes like this : A very unremarkable , nondescript man was headed home with his whorish concubine and her servant and two donkeys , when darkness overtook them , and they were herded by divine Providence into the mean-spirited and demonic little fag town of Gibeah of Benjamin ; to wit : `` And they passed on and went their way ; and the sun went down upon them when they were by Gibeah , which belongeth to Benjamin .', ""This shows the mean spirit that characterized Gibeah ; and remember that Gibeah was the home town of the wicked King Saul , where he hatched the early plots to destroy David , and where he gave orders to the evil Doeg to slaughter the holy Ahimelech and 85 of God 's priests , for helping David ."", ""And Capernaum ... it shall be more tolerable for the land of Sodom in the day of judgment , than for thee . ''"", ""Sunday , September 2 , 2007 pg.3 Sermon Outline Back to our story of the Levite and his concubine in Gibeah : Eventually , an old man took them into his house for the night , where the following atrocity was committed by the fag beasts of Gibeah ; to wit : `` Now as they were making their hearts merry , behold , the men of the city , certain sons of Belial , beset the house round about , and beat at the door , and spake to the master of the house , the old man , saying , Bring forth the man that came into thine house , that we may know him . ''"", ""We learn from God 's Word the true nature of sodomites ."", 'It ought to scare the wits out of the fags and fag-enablers of today .', 'The Levite , to save his own hide , gave his concubine to the howling fag beasts surrounding the house ; to wit : `` So the man took his concubine , and brought her forth unto them ; and they knew her , and abused her all the night until the morning ; and when the day began to spring , they let her go .', ""Then came the woman in the dawning of the day , and fell down at the door of the man 's house where her lord was . ''"", ""At their eternal peril does mankind reject God 's Word on the subject , and undertake to re-define and tidy-up the image of fags and sodomy as merely a clean , innocent , alternate lifestyle commanding our respect ."", ""And it was so , that all that saw it said , There was no such deed done nor seen from the day that the children of Israel came up out of the land of Egypt unto this day ; consider of it , take advice , and speak your minds . ''"", 'Thereby branding themselves forever as Fag-Enablers ; to wit : `` And the tribes of Israel sent men through all the tribe of Benjamin , saying , What wickedness is this that is done among you ?', ""But the children of Benjamin gathered themselves together out of the cities unto Gibeah , to go out to battle against the children of Israel . ''"", 'Remember , near the beginning of this sermon , I said , `` Benjamin was a Fag-Enabler in spades !', ""A Fag-Enabler is one who against all logic , and against his own best interests for time and eternity fanatically supports , condones and promotes the filthy fag agenda and lifestyle . ''"", 'In other words , the tribe of Benjamin was all but annihilated and swept from the face of the earth because of their fanatical determination to defend and support guilty , murderous Fags in Gibeah .', 'U.S. Sen. Larry Craig is a Fag , in a State ( Idaho ) of Fag-Enablers In this remarkable story of Gibeah occupying 3 full chapters of Holy Writ ( the last 3 chapters of the Book of Judges ) we have the definitive description of Fags and Fag-Enablers .', 'A FagEnabler is one who against all logic , and against his own best interests for time and eternity fanatically supports , condones and defends the vile fag agenda and lifestyle .']"
