,fileName,judgements
4,./data_dsicap/WBC/raw/WestboroBaptist_Sermon_20071209.pdf.txt,"[""Even the PUBLICANS as Gill says , `` Even those wicked men , who were before profligate and abandoned sinners , when they came under John 's ministry , were so wrought upon by the power and grace of God through it , that they approved of and applauded the wisdom , goodness , and grace of God , in sending such a prophet as John ; in qualifying him in the manner he did , and giving in him a commission to preach such doctrines , and administer such an ordinance as he did : and this their approbation of the divine conduct , and their thankfulness for the same , they testified by their being baptized with the baptism of John ; they expressed their sentiments by their obedience ; they declared it was right in God to institute such an ordinance , and for John to administer it ; and that it became them to submit to it , as a part of righteousness to be fulfilled ; they hereby signified , that they thought that it was agreeable to the nature of God , who is holy , just , and good , suitable to the Gospel dispensation , and very fit and proper for them . ''"", ""But , as in every dispensation in addition to good people who gladly stepped into the water as the first public step in their journey desiring to flee from God 's wrath to come there were others who `` REJECTED THE COUNSEL OF GOD AGAINST THEMSELVES , '' and who gave public evidence of their stubborn and rebellious hatred of God by one simple declination ; to wit : `` But the Pharisees and lawyers rejected the counsel of God against themselves , BEING NOT BAPTIZED OF HIM . ''"", ""7:30 ) Some ancient versions read , But the Pharisees , lawyers and scribes , because the lawyers and scribes are the same sort of persons ; tending to comprise `` them that are contentious , and do not obey the truth , but obey unrighteousness , thereby incurring unto themselves the indignation and wrath , the tribulation and anguish of God Almighty . ''"", ""The Ethiopic version renders it , `` They despised the command of God ; '' that is , the ordinance of baptism , which was of God , and the produce of his counsel and wisdom , as the whole scheme , and all the ordinances of the Gospel are , and that they ARE NOT THE INVENTIONS OF MEN ."", ""Beloved , we must with all humility be required and enabled to lay hold on the concept , that WBC this humble church of the Lord Jesus Christ is in the line of , and directly descended from , Jeremiah and the prophets of the Old Testament , and John the Baptist , crying in the 21st Century Wilderness , `` Prepare ye the way of the Lord , make his paths straight . ''"", 'And John also was BAPTIZING in Aenon near to Salim , because there was much water there : and they came , and were baptized .', ""Christ said of this young man : `` Verily I say unto you , Among them that are born of women there hath not risen a greater than John the Baptist . ''"", 'During that short dispensation of time , wherein God dealt with mankind in , by , and through John the Baptist a Voice Crying in the Wilderness the only way to justify God and go to Heaven , was to submit to the baptism of John ; and the sure way to reject the counsel of God and go to Hell , was to NOT submit to the baptism of John .', '`` Bring forth therefore fruits worthy of repentance ... Every tree therefore which bringeth not forth good fruit is hewn down , and cast into the fire .', ""3:8-11 ) John 's only injunction to the common people with particularity ; and which is satisfied by such fruit hanging on the Gospel tree as that described in such passages as 1 Tim ."", ""6:17-19 ; to wit : Sunday , December 9 , 2007 pg.4 Sermon Outline `` Charge them that are rich in this world , that they be not highminded , nor trust in uncertain riches , but in the living God , who giveth us richly all things to enjoy ; That they do good , that they be rich in good works , ready to distribute , willing to communicate ; Laying up in store for themselves a good foundation against the time to come , that they may lay hold on eternal life . ''"", ""`` Then came also publicans ( tax-collectors ) to be baptized ... And he said unto them , Exact no more than that which is appointed you . ''"", 'And what about such cop-violence as deliberately leaving peaceful picketers unprotected to be beaten by mobs ?', 'False reports and false testimony in court is their stock in trade .', ""All they have to do is change one word on a report , one date , one name , any one small matter and a man 's life , liberty , property , family , reputation all that is dear for time and eternity may be lost forever ."", 'Cops are like the `` three things , yea , four things , that are never satisfied ; that never say , It is enough : The grave ; and the barren womb ; the earth that is not filled ( i.e.', "", covetousness ) lies in the 5th Bullet of Hebrews 13 right after `` Marriage is honorable in all ; '' to wit : `` Let your conversation be without covetousness ; and be content with such things as ye have : for he hath said , I will never leave thee nor forsake thee .""]"
5,./data_dsicap/WBC/raw/WestboroBaptist_Sermon_20070826.pdf.txt,"['Sunday , August 26 , 2007 pg.1 Sermon Outline God Spared Not the Old World , Bringing in the Flood John Bunyan ( 1628-1688 ) died when he was yet 59 years old , still 3 months short of his 60th birthday .', ""He was a dirt-poor , uneducated young Tinker ( a mender of pots and pans ) who said that he and his wife `` came together as poor as poor might be , not having so much household-stuff as a dish or spoon betwixt us both '' according to the Encyclopaedia Britannica , which took 4 full pages telling of the poor Tinker 's life and accomplishments ."", ""His most famous work was The Pilgrim 's Progress , such that Britannica said , as late as 1,900 A.D. , `` Bunyan , like the Bible , was to be found in every English home and was known to every ordinary reader ; '' adding : `` But it was The Pilgrim 's Progress which speedily found its way into every home and carried Bunyan 's reputation to every part of the British Isles , to Europe and to America . ''"", 'I believe that we have everything Bunyan ever wrote for publication in our humble library and I tell you it is massive .', ""For example since my sermon today involves The Flood of Noah , I will use Bunyan 's exposition of Gen. 7:20 to make this point ; to wit : Bunyan wrote : `` ( At the time of The Flood ) : `Fifteen cubits upward did the waters prevail ( some 24 feet ) and the mountains were covered . '"", 'And here is how Bunyan treats Gen. 7:21-23 ; to wit : `` And all flesh died that moved upon the earth , both of fowl , and of cattle , and of beast , and of every creeping thing that creepeth upon the earth , and every man : All in whose nostrils was the breath of life , of all that was in the dry land , died .', ""And every living substance was destroyed , which was upon the face of the ground , both man , and cattle , and the creeping things , and the fowls of the heaven ; and they were destroyed from the earth , and Noah only remained alive , and they that were with him in the ark . ''"", "", translated him ) before Noah was born , Noah 's father Lamech doubtless heard Enoch , his grandfather , preach many times , and we may be sure that Lamech , Noah 's father , and Methuselah , Noah 's grandfather saw to it that Noah knew all about the holy Enoch and his thunderous message Sunday , August 26 , 2007 pg.3 Sermon Outline of approaching doom for mankind ."", ""We may reasonably surmise that the moral and spiritual condition of mankind in the days of Enoch ( called the 7th from Adam ) was about as bad as it could get and getting worse , making things so dangerous for Enoch that God miraculously `` took '' him and further , that three generations later in the days of Noah ( the 10th from Adam ) the moral and spiritual condition of mankind was infinitely worse , thus bringing on The Flood ."", ""To wit : `` And God said unto Noah , The end of all flesh is come before me ; for the earth is filled with violence through them ; and , behold , I will destroy them with the earth . ''"", 'To the God-blessed prophet Enoch , the end of all things was at hand , and it is likely that he clearly foresaw The Flood ; and it is likely that he clearly foresaw the final Great Day of Judgment ; and it is likely that he understood that the message God gave him to preach covered both The Flood and the final Great Day of Judgment : `` Behold , the Lord cometh , with myriads of his saints , to execute judgment ( i.e.', ""`All flesh , ' `All in whose nostrils was the breath of life ' ; `All that was on the dry land , ' `every living substance , ' `every man ' ; and they were destroyed from off the earth : By which manner of language doubtless there is insinuated a threatening to them who should afterward live ungodly ."", "", `` suffering the vengeance of eternal fire , '' FOR THAT VERY PURPOSE ; to wit : to be an example for us to see consider well and tremble ."", ""( Thus ) Secretly intimating , that those Sunday , August 26 , 2007 pg.4 Sermon Outline that then lived , being the first of God 's workmanship , and far surpassing in magnificence those that lived after the Flood , if God would have spared , He would have spared them ; but seeing he so dreadfully swept them away , let no man be so bold to presume that wickedness shall now deliver him that is given to it . ''"", 'If God spared not a world of people who were far superior to us in every conceivable way , it would be no big deal , as they say , for Almighty God to obliterate this sad , sick , diseased , world of vile and abominable mankind as easily as one might smash a loathsome insect under foot , and with as much concern .', 'They were possessed of sharp minds , powerful intellects , and strong , agile bodies in robust good health ; blessed with a remarkably healthful climate and a salubrious ( conducive to good health and well-being ) atmosphere ; and fertile , productive soil covering the entire globe , yielding plentiful crops of herbs , fruits and vegetables which , while growing , were well-watered by a worldwide natural sprinkling system emitting a regular mist in exactly the ideal quantity .', 'Such that , before The Flood , people lived hundreds of years not uncommonly approaching a thousand years in vibrant good health ; contrasted with the sickly lives of threescore years and ten which is now the sad lot of mankind since The Flood .', 'Listen to this sentence of Rehwinkel : `` Even after sin and death had come into this world , it was still a world vastly superior to the world which now is .', ""Bunyan describe Noah and the members of Westboro Baptist Church ; to wit : `` `And Noah only remained alive , and they that were with him in the ark . '"", ""`` Antipas was my faithful martyr , who was slain among you , where Satan 's seat is . ''""]"
6,./data_dsicap/WBC/raw/WestboroBaptist_Sermon_20070923.pdf.txt,"[""He came on the scene near the end of Judah 's life as a nation , when God had already determined to destroy Judah for her sins and a good chunk of those sins were the blatant sins of Manasseh ."", 'It was a kind of STAY OF EXECUTION , FOR THE SINS OF MANASSEH : `` And like unto him ( Josiah ) was there no king before him , that turned to the Lord with all his heart , and with all his soul , and with all his might , according to all the law of Moses ; neither after him arose there any like him .', ""NOTWITHSTANDING the Lord turned not from the fierceness of his great wrath , wherewith his anger was kindled against Judah , because of all the provocations that MANASSEH had provoked him withal . ''"", ""The record of Manasseh 's life and 55-year reign is given twice almost identical accounts at 2 Kgs ."", ""Did Manasseh truly repent after all his bloody deeds and blasphemous mistreatment of God 's Elect people or was his foxhole conversion feigned ?"", 'Gill says he was bound with painful fetters both hands and feet , with chains of brass which were never removed or loosened all the way to Babylon .', ""HIS PRAYER also , and how God was intreated of him , and all his sins , and his trespass , and the places wherein he built HIGH PLACES , and set up groves and graven images , before he was humbled : behold , they are written among the sayings of the seers . ''"", ""Thou hast built thy HIGH PLACE at every head of the way , and hast made thy beauty to be abhorred , and hast opened thy feet ( spread thy legs ) to every one that passed by , and multiplied thy whoredoms . ''"", 'Manasseh knew all about the HIGH PLACES where they were , how many there were , and the sinful nature and filthy practices peculiarly associated with each place .', ""Even the pinheads in England , who wrote and/or edited The Illustrated Bible Dictionary , see through the pretended conversion of Manasseh ; saying : `` His ( Manasseh 's ) reformation appears to have been superficial . ''"", 'An eternal principle as old as God , and as binding as Thou shalt not kill or commit adultery is involved here .', 'By dealing fast and loose with the HIGH PLACES , Manasseh demonstrated beyond any doubt that his reformation ( or better said , his repentance ) was superficial .', 'DESTROY ALL HIGH PLACES The only way to get right with God was to destroy ALL HIGH PLACES .', 'But when ye go over Jordan , and dwell in the land which the Lord your God giveth you to inherit , and when he giveth you rest from all your enemies round about , so that ye dwell in safety ; Then there shall be A PLACE which the Lord your God shall choose to cause his name to dwell there ; thither shall ye bring all that I command you ; your burnt offerings , and your sacrifices , your tithes , and the heave offering of your hand , and all your choice vows which ye vow unto the Lord : And ye shall rejoice before the Lord your God , ye , and your sons , and your daughters , and your menservants , and your maidservants , and the Levite that is within your gates ; forasmuch as he hath no part nor inheritance with you .', 'ONE PLACE FOR LEGITIMATE PUBLIC WORSHIP The only legitimate place for public worship in the days of Manasseh was the Temple of God in Jerusalem .', ""The Lord chose that PLACE , and dwelt there , and spoke to His people there ; where every vessel and every piece of furniture spoke clearly and definitively of some grand Truth ; and where accurate notions of the nature and attribute of God were communicated to God 's Elect people .""]"
7,./data_dsicap/WBC/raw/WestboroBaptist_Sermon_20080120.pdf.txt,"['Gill says this `` was not a common and ordinary motion felt by women in such circumstances , but an extraordinary one ; the two children in her strove with each other , as if it was for mastery , or who should get out first before the proper time ; which not only gave her great uneasiness of mind , but pain of body ; this was an emblem of the future difference between those two children , Esau and Jacob , and of the contentions that would be between their respective offspring , and of the enmity and war between them .', ', Rebekah ) had doubtlessly enquired of other women , whether it had ever been so with them , and they replied , no ; then , says she , how comes it to pass that it should be different with me than others ?', 'Or , if those children by struggling should kill one another , or be abortive and kill me , why should I have been so desirous of conception ?', ""Trapp says , `` They ran at tilt , as it were , and jostled one against another ( as two mighty knights on horses ride at full gallop , each with a long sharp lance seeking to unseat and kill the other when they collide ) so these two babes ran at tilt , as it were , and jostled one against another , even to bruising and hurting . ''"", ""To which Gill adds , `` Indeed , if she inquired of any particular person of note for religion , and as a prophet , there is none so likely as he , who was the friend of God , and had great intimacy with God , and to whom God revealed his secrets . ''"", ""In any case , the Lord God gave Rebekah a prompt answer , either through Abraham or some other holy man , or by an impulse upon her own mind ; to wit : `` And the Lord said unto her , ( and there follows one of the grandest declarations of the Calvinistic doctrines of election , reprobation , and absolute predestination ever uttered ; to wit : ) `` And the Lord said unto her , Two nations are in thy womb , and TWO MANNER OF PEOPLE , shall be separated from thy bowels : and THE ONE PEOPLE shall be stronger than THE OTHER PEOPLE ; and the elder shall serve the younger . ''"", '( Gen. 25:23 ) These two weighty and all-important things were said unto Rebekah before the boys were born as irrefutable proof of the doctrine of election , the doctrine of reprobation , and the doctrine of predestination ; to wit : `` ( For the children being not yet born , neither having done any good or evil , that the purpose of God according to election might stand , not of works , but of him that calleth ; ) It was said unto her , The elder shall serve the younger .', ""Now we are prepared to interpret the mysterious historical event and identify the two peoples in Rebekah 's womb ; to wit : `` Two manner of people shall be separated from thy bowels ; and the one people shall be STRONGER than the other people ; and the elder shall SERVE the younger . ''"", 'Whereas , the Reprobate Esaus ( the non-Elect ) are spiritual dwarfs and malnourished weaklings , who are total ignoramuses when it comes to any knowledge whatsoever of the Bible .', ""Esau certainly appeared at birth to be more beast than infant with even an abundance of facial and other body hair , which was a sign , as the ancient rabbis observed , `` that he would be a shedder of blood , fierce and cruel . ''"", ""( Gen 25:26 ) Jacob 's little hand took hold on Esau 's heel make no mistake TO PLUCK HIM BACK AND GET OUT FIRST and this action was not casual or accidental and this action had a meaning and a mystery in it and this action signified that this little rascal Jacob had a deep respect for and understanding of the birthright , and was determined come hell or high water in one way or another to have that birthright and all it stood for ."", ""A startling thing which I discovered in researching this sermon , was that the best authorities among the ancient Jews believed that Esau was not only the fierce and cruel slayer of animals , but also the slayer of men ; and that not only was Jacob a sincere and upright man of godly plainness , but that he was also a minister , who studied religion in the school of Shem and the tent of Eber , agreeably to the Targum of Jonathan ; to wit : `` a minister in the school of Shem , seeking doctrine from the Lord ; a student there , where he resided awhile , in order to be instructed in the doctrines of truth and righteousness . ''"", 'And Esau said to Jacob , Feed me , I pray thee , with that same red pottage ; for I am faint ; therefore was his name called Edom ( margin , That is , Red ) .', '( Gen. 25:29-34 ) The ancient Jewish writers say that this Kitchen Conference took place on the day that Abraham died , and that the cheap bean-like red lintels was the food of mourning for the dead ; and so , they gather that Jacob and Esau were now 15 years of age when this eternal bargain was struck , in the buying and the profane selling of this birthright .', 'For , Abraham was 100 years old when Isaac was born ( Gen. 21:5 ) ; and Isaac was 60 years old when Jacob and Esau were born ( Gen. 25:26 ) ; and Abraham lived to be 175 ( Gen. 25:7 ) .', 'Many privileges were annexed to that birthright , both temporal and eternal ; such as honor and authority in the family next to parents , a double portion of the inheritance , the parental blessing , and especially in this case the promises of Messiah ; and which was typical of the heavenly inheritance ALL OF THIS REBEKAH KNEW by the divine oracle were designed for Jacob , and which NO DOUBT she had acquainted him with ; and ADVISED HIM TO DEAL WITH HIS BROTHER about parting with his birthright AS HE HAD OPPORTUNITY ; and it is VERY LIKELY they had talked together about it many times , and Esau had shown some indifference to his right , and made no great account of it ; and now , an opportunity offering itself , to get him in the mind to part with it , JACOB POUNCED , like a cat on its prey .', ""Meaning , `` Let it be made in plain and full terms , that there be no dispute about it hereafter , or any attempt at revocation of it . ''"", ""I will tread them in mine anger , and trample them in my fury ... For the day of vengeance is in mine heart , and the year of my redeemed is come . ''""]"
