,fileName,judgements
0,./data_dsicap/WBC/raw/WestboroBaptist_Sermon_20080302.pdf.txt,"["", this lonely `` country '' of Israel , the 10 northern tribes , sequestered and isolated from all other countries ) Israel shall say in that day , Behold , such is our expectation , whither we flee for help to be delivered from the king of Assyria : and how shall we escape ? ''"", '20:2-6 ) Gill ; to wit : `` Signifying that it was vain and foolish , and they had acted a very weak , as well as a wicked part , in having recourse to the Egyptians and Ethiopians to help them against the Assyrians , as it plainly appeared by both nations now being conquered by the Assyrians ; and how shall WE escape ?', ""Isaiah was obedient to the divine command , Gill says , `` not regarding the disgrace which might attend it , nor the danger of catching cold , to which he was exposed , and hence he has the character of a servant of the Lord , and a faithful obedient one he was . ''"", ""Earlier in his long career as an obedient servant of the Lord , Isaiah 's complete dedication to the publication of his message from God led to the naming of his first son ; to wit : `` Shearjashub '' ( Isaiah 7:3 ) which Strong says was the `` Symbolic name of a son of Isaiah '' meaning , `` A remnant shall return . ''"", ""`` Except the Lord of hosts had left unto us a very small remnant , we should have been as Sodom , and we should have been like unto Gomorrah . ''"", ""What a glorious sign and wonder that a little boy should be running around the house all day every day bearing such a name ; to wit : `` The Remnant shall return . ''"", 'Sunday , March 2 , 2008 page 2 Sermon Outline `` Thus saith the Lord of hosts ; If it be marvellous in the eyes of the remnant of this people in these days , should it also be marvellous in mine eyes ?', ""The meaning of the new baby 's name is one of the great themes of Isaiah 's message ; to wit : `` Flee ye , flee ye , to the spoil . ''"", ""Now hear Isaiah 's own words the heart of the same glorious message as dictated by the Holy Spirit working in Isaiah ; to wit : `` Howl ye ; for the day of the Lord is at hand ( Maher-shalal-hash-baz , flee ye , flee ye , to the spoil ) it shall come as a destruction from the Almighty ."", ""Therefore shall all hands be faint , and every man 's heart shall melt : And they shall be afraid : pangs and sorrows shall take hold of them ; they shall be in pain as a woman that travaileth : they shall be amazed one at another ; their faces shall be as flames ."", '`` God is jealous , and the Lord revengeth ; the Lord revengeth , and is furious ; the Lord will take vengeance on his adversaries , and he reserveth wrath for his enemies .', 'The Lord is slow to anger , and great in power , and will not at all acquit the wicked : the Lord hath his way in the whirlwind and in the storm , and the clouds are the dust of his feet .', ""Neither their silver nor their gold shall be able to deliver them in the day of the Lord 's wrath ; but the whole land shall be devoured by the fire of his jealousy : for he shall make even a speedy riddance of all them that dwell in the land . ''"", ""This rage and fury of God involves that attribute of God called his jealousy ; to wit : The preamble to the Ten Commandments , `` for I the Lord thy God am a jealous God , visiting the iniquity of the fathers upon the children unto the third and fourth generation of them that hate me . ''"", ""34:13 ) `` For thou shalt worship no other god : for the Lord , WHOSE NAME IS JEALOUS , is a jealous God . ''"", '`` Men do not despise a thief , if he steal to satisfy his soul when he is hungry ; but if he be found , he shall restore sevenfold ; he shall give all the substance of his house .', 'The wonderful husband is the Lord ; and the unfaithful , slut of a wife is Israel , and , by logical extension , the whole of mankind , except the Elect .', ""Under this law , if the husband ( `` the spirit of jealousy come upon him , and he be jealous '' - Num ."", 'Thereupon the priest performed an elaborate but awful little ceremony , with dreadful and fearsome consequences if the woman was guilty .', ""5:29,30 ) Beloved , this chapter in Scripture called the Law of Jealousies is yet another way the Lord has provided to show unto us and to all mankind what a heinous thing adultery is , and why , in full flower , both physical and spiritual adultery is continually FRETTING the Lord our God , leading to the outpouring of God 's wrath ( Ezek ."", '5 , we have one little woman who MAY have been guilty of adultery ONE TIME being on frightful trial to determine guilt .', ""16 ( `` But thou didst trust in thine own beauty , and playest the harlot because of thy renown , and pourest out thy fornications on every one that passed by ; his it was . ''"", 'The words of Ezekiel dictated by the Holy Ghost and preserved for us so that we might declare them to our generation , and to the world at large , and in particular to doomed America , are these ; to wit : `` And in all thine abominations ( sodomy ) and thy whoredoms thou hast not remembered the days of thy youth , when thou wast naked and bare , and wast polluted in thy blood .']"
1,./data_dsicap/WBC/raw/WestboroBaptist_Sermon_20080608.pdf.txt,"[""Gill says the following to that fearsome and horrific passage ; to wit : `` Which is not to be understood of a single act of sin , but rather of a course of sinning ; nor of sins of infirmity through temptation , or even of grosser acts of sin , but of voluntary ones ; and not of all voluntary ones , or in which the will is engaged and concerned , but of such which are done on set purpose , resolutely and obstinately ; and not of immoral practices , but of corrupt principles , and acting according to them ; it intends a total apostasy from the truth , against light and evidence , joined with obstinacy . ''"", 'Add to those words in Luke , these additional bits of evidence from 1st John 4:6 ; to wit : `` We are of God : he that knoweth God heareth us ; he that is not of God heareth not us .', ""We are preaching to this doomed generation of ours as a John the Baptist Voice crying in the wilderness , or a Noah who , `` being warned of God of things not seen as yet , moved with fear , prepared an ark to the saving of his house , by which also he condemned the whole world , Sunday , June 8 , 2008 page 2 Sermon Outline and became heir of the righteousness which is by faith . ''"", 'All their sinfulness deserves a great punishment a punishment so great that it can not be fully comprehended by our thoughts , nor ever be sufficiently expressed , in time or in eternity .', 'In which chapter he writes : `` For what hell and destruction are , is a mystery , as well as what heaven is ; and the true and proper notion or conception of either , are a riddle to the most of men .', ""The institutions of Hell ( as well as Heaven ) remain largely mysterious to us in our present limited state and scope of understanding `all things being naked and open ' only unto `the eyes of him with whom we have to do , ' viz."", 'And , `Lo , these are parts of his ways ; but how little a portion is heard of him ?', 'The Grand Executioner or Immediate Inflictor of the threatened punishment , is the Lord Jesus Christ ( and His elect people and elect angels ) .', ""29:29 ; to wit : '' `` The secret things belong unto the Lord our God ; but those things which are revealed belong unto us and to our children for ever , that we may do all the words of this law . ''"", 'Generally , the context consists of the Lord warning repeatedly and in various ways and very , very plainly that a horrific , everlasting curse would be enforced and fulfilled to the letter against any person who left the Lord to serve idols .', ""And so , `` those things which are revealed and which belong unto us and to our children for ever , that we may do all the words of this law , '' those things include the curse of Sunday , June 8 , 2008 page 3 Sermon Outline God upon reprobates , and the painful punishments that await those who depart from the living God ; to wit : `` Lest there should be among you man , or woman , or family , or tribe , whose heart turneth away this day from the Lord our God , to go and serve the gods of these nations ; lest there should be among you a root that beareth gall and wormwood '' ( a poison herb , this passage being cited at Heb ."", ""12:15 , `Looking diligently lest any man fail of the grace of God ; lest any root of bitterness springing up trouble you , and thereby many be defiled . '"", '`` The Lord will not spare him , but then the anger of the Lord and his jealousy shall SMOKE AGAINST THAT MAN , and ALL THE CURSES that are WRITTEN IN THIS BOOK shall LIE UPON HIM , and the Lord shall blot out his name from under heaven .', ', he is headed , irreversibly to the punishments of Hell ) `` out of all the tribes of Israel , according to ALL THE CURSES of the covenant that are written in this book of the law ... like the overthrow of Sodom & Gomorrah which the Lord overthrew in his anger , and in his wrath ... For they went and served other gods , and worshiped them , gods whom they knew not ... And the anger of the Lord was kindled against this land , to bring upon it all the curses that are written in this book .', ""And the Lord rooted them out of their land in anger , and in wrath , and in great indignation , AND , The secret things belong unto the Lord our God ; but those things which are revealed belong unto us and to our children for ever , THAT WE MAY DO ALL THE WORDS OF THIS LAW . ''"", ""That is , the God who lives to administer punitive measures to the wicked ; to wit : `` Vengeance is MINE ( ALONE ) , I WILL repay , saith the Lord . ''"", "", which shall consume in Hell 's eternal flames all those who while on earth were adversarial to God 's elect ) . ''"", 'Goodwin says that the painful punishments inflicted by Christ , the Immediate Inflictor , are set forth plainly in some Scriptures , and inferential in others ; and that it takes a consideration of all , in order for the saints on earth to form adequate and accurate notions or concepts of Hell and the painful punishments of the damned .', ""3:19 , `By which he also went and preached unto the spirits in prison , ' large enough , to be sure , to hold men and devils : `The wicked shall be turned into hell , and all the nations that forget God , ' Psa ."", ""5:26 ; where is nothing but `darkness , utter darkness , ' `blackness of darkness , ' Jude 4 , that is , an emptiness of all good , not a beam of light to all eternity ; also a `place of torment , ' Lk ."", ""50:22 , `Now consider this , ye that forget God , lest I tear you in pieces , and there be none to deliver ; ' `cutting them up to the backbone , ' Heb ."", ""18:6 , `But whoso offends one of these little ones which believe in me , it were better for him that a millstone were hanged about his neck , and that he were drowned in the depth of the sea , ' to make sure they never rise again ; also unto a being cast , `bound hand and foot , ' Mat ."", ""13:42,49,50 , `The Son of man shall send forth his angels , and they shall gather out of his kingdom all things that offend , and them which do iniquity ; and shall cast them into a furnace of fire ; there shall be wailing and gnashing of teeth , ' `So shall it be at the end of the world ; the angels shall come forth , and sever the wicked from among the just , and shall cast them into the furnace of fire ; there shall be wailing and gnashing of teeth ; ' `a lake of fire , ' and so drowned over head and ears for ever ; a lake `fed with a stream of brimstone , ' which ( of all matter that feedeth fire ) is the most fierce , ( `For Tophet is ordained of old ; yea , for the king it is prepared ; he hath made it deep and large ; the pile thereof is fire and much wood ; the breath of the Lord , like a stream of brimstone , doth kindle it , ' ) Isa ."", ""29 `Of how much SORER PUNISHMENT , suppose ye , shall he be thought worthy , who hath trodden under foot the son of God , and hath counted the blood of the covenant , wherewith he was sanctified , an unholy thing , and hath done despite unto the Spirit of grace . '"", 'I say , when he would set out the severeness of this infliction of punishment , as infinitely exceeding all those kinds of horrid corporal tortures and torments , he infers the soreness ( extreme painfulness ) of this from the fact that now God Himself is the Avenger and the Immediate Inflictor .', ""`We know him that hath said thus , Vengeance is mine , ' that is , what a great and powerful God he is ."", ""( Luke 12:5 ) `` And fear not them which kill the body , but are not able to kill the soul ; but rather fear him which is able to destroy both soul and body in hell . ''"", ""Goodwin : `` They , and they alone , know him in his love , and have tasted and found that his immediate `loving-kindness is better than life ; ' and from the LAW OF CONTRARIES , they know that his wrath must be more bitter than death .""]"
2,./data_dsicap/WBC/raw/WestboroBaptist_Sermon_20071118.pdf.txt,"[""Gill says of these words in Isaiah : `` The love of God to his people is an everlasting love ; it always continues ; it never did , nor ever will depart , notwithstanding their fall in Adam , their depraved state by nature , their actual sins and transgressions , their many revoltings and backslidings ; whatever departs from them , His kindness shall not ; though riches may flee away from them , friends stand aloof from them , health may be taken away , and life itself , yet the love of God is always the same ; and so , whatever providences may attend His church and interest in any period of time , He has the same paternal care for it , and kindness for His people , as ever . ''"", 'This is the great Covenant of Grace made with Christ and His people from everlasting , even in the Council Halls of Eternity the Father , Son and Holy Ghost being the holy Signatories thereto ; to wit : `` The eternal God is thy refuge , and underneath are the everlasting arms : and he shall thrust out the enemy from before thee ; and shall say , Destroy them .', ""This covenant is ordered in all things and sure , according to David ; to wit : `` Although my house be not so with God ; yet he hath made with me an everlasting covenant , ordered in all things , and sure : for this is all my salvation , and all my desire , although he make it not to grow . ''"", 'These precious stones describe the priceless spiritual house of infinite intrinsic value which is the church , composed of precious stones .', ""And all thy children shall be taught of the Lord ; and great shall be the peace of thy children . ''"", ""Sunday , November 18 , 2007 pg.2 Sermon Outline BEAUTIFUL , FUNCTIONAL , AND MYSTERIOUS A description of the church ; beautiful , functional , and mysterious ; supplemented and fleshed out in the New Testament metaphor ; to wit : `` Ye also , as lively stones , are built up a spiritual house , an holy priesthood , to offer up spiritual sacrifices , acceptable to God by Jesus Christ . ''"", 'Beloved , knowledge and understanding of these glorious things is supernatural .', ""Such are the weapons of our spiritual warfare which are mighty to the pulling down of Satan 's strongholds ."", 'Though the disciples had been with Jesus some three and a half years , it was not until He opened the eyes of their understanding POST-resurrection that they had any real understanding ; to-wit : `` And he said unto them , These are the words which I spake unto you , while I was yet with you , that all things must be fulfilled , which were written in the law of Moses , and in the prophets , and in the psalms , concerning me .', ""I repeat , to emphasize the importance : these supernatural understandings are the spiritual weapons of our warfare that are mighty through God to the pulling down of Satan 's strongholds ."", 'And we know that the Son of God is come , and hath given US an understanding , that we may know him that is true , and we are in him that is true , even in his Son Jesus Christ .', ""So far from it , that thou shalt not be in the least afraid of it , neither from within nor from without ; not from false teachers that oppress the mind with false doctrine ; nor from persecutors that oppress and injure in person and property : the church will be now free from the oppression and tyranny of mystical Babylon , which is now set to fall , on whom God 's wrath will be poured , and so the church will be no more in fear of them ."", ""This is all included in the mystery of godliness , `Even the mystery which hath been hid from ages and from generations , but now is made manifest to his saints . '"", ""`` FOR THY SAKE , '' as Gill says , `` `for thy sake , they shall fall ; because of the love that I bear to thee , they shall not succeed , or do thee any hurt , but shall perish , ' these are also the unclean spirits like frogs ( Rev ."", 'The Lord God Almighty has given the heathen and the uttermost parts of the earth for the inheritance of and to be put in active , actual , present possession of our Lord Jesus Christ .', 'Notice here , Beloved , that the absolute and the total power or sovereignty of our Lord Jesus Christ is tied only and completely to the preaching of the Gospel .', 'Sunday , November 18 , 2007 pg.4 Sermon Outline HIS COMMANDMENTS ARE NOT GRIEVOUS See how important all these words are .', ""Our Lord Jesus Christ personalized this concept forever in a compound , redundant , and unforgettable way ; to wit : `` He that hath my commandments , and keepeth them , he it is that loveth me : and he that loveth me shall be loved of my Father , and I will love him , and will manifest myself to him . ''"", 'Kiss the Son , lest he be angry , and ye perish from the way , when his wrath is kindled but a little .', "", from the President to the Chief Justice of the United States you have the duty to discharge your function as a servant of the Lord , in the solemn fear of the Lord , and that means in the fear of the Lord to the point of trembling , and to the point of getting on your knees and kissing the feet of the Lord Jesus Christ , in conscious and deliberate and lowly PUBLIC acknowledgment of the fact that if His wrath is kindled the tiniest little bit , He can with one wave of His hand banish immediately to Hell every last one of this generation alive on the earth and of all generations of human beings that ever lived ) . ''"", ""Sunday , November 18 , 2007 pg.5 Sermon Outline AN OFFENDER FOR A WORD `` We , having the same spirit of faith , according as it is written , I believed , and therefore have I spoken ; we also believe , and therefore speak . ''"", '( 2 Corinthians 4:13 ) `` And when the tempter ( Satan ) came to him ( Christ ) , he said , If thou be the Son of God , command that these stones be made bread .', ""4:3,4 ) `` Thy words were found , and I did eat them ; and thy word was unto me the joy and rejoicing of mine heart ; for I am called by thy name , O Lord God of hosts . ''"", ""But his word was in mine heart as a burning fire shut up in my bones , and I was weary with forbearing , and I could not stay . ''"", ""For by thy WORDS thou shalt be justified , and by thy WORDS thou shalt be condemned . ''"", '`` And Enoch also , the seventh from Adam , prophesied of these , saying , Behold , the Lord cometh with ten thousands of his saints , To execute judgment upon all , and to convince all that are ungodly among them of all their ungodly deeds ... and of all their hard speeches ( WORDS ) which ungodly sinners have spoken against him .']"
3,./data_dsicap/WBC/raw/WestboroBaptist_Sermon_20070916.pdf.txt,"[""It is irrational and sinful to love too much , and is called `` inordinate affection ; '' to wit : `` Mortify therefore your members which are upon the earth ; fornication , uncleanness , IN-ORDINATE AFFECTION , evil concupiscence , and covetousness , which is idolatry : For which things ' sake the wrath of God cometh on the children of disobedience . ''"", ""23:11 ) Now listen to these outrageous words of David AFTER Absalom 's four-year plot and his bloody war and attempt to kill his father David and overthrow his kingdom had all failed , and the spoiled brat Absalom was dead ."", ""Just please listen to David 's sick , sinful words ; to wit : `` And the king was much moved ( upon learning of his own army 's victory over Absalom 's forces and of Absalom 's death ) `` And the king was much moved , and went up to the chamber over the gate , and wept : and as he went , thus he said , O my son Absalom , my son , Absalom !"", 'And he cast stones at David , and at all the servants of king David : and all the people and all the mighty men were on his right hand and on his left .', ""Gill suggests that the words Shimei used in his curses against David were well-chosen , and are full of hateful insinuations designed to smite David 's conscience and further add to his almost unbearable burdens of distress and melancholy fleeing for his very life from his own son seeking to kill him and usurp the holy throne that bears his name for all eternity : To wit : THE THRONE OF DAVID ."", 'I suggest that we learn from these scriptures that when we are in great distress ( as was David here ) Satan is likely to bring our past sins vividly to mind , to add immeasurably to our burden of distress and guilt .', ""After all , these accusations of Shimei ( who has apparently studied David 's life very carefully and knows all about David 's outrageous sins of David 's adultery with Bathsheba and David 's murder of Uriah her husband to cover his adultery ) I say , these accusations of Shimei are true , thereby making David 's distress all the worse , as he fled for his life and his kingdom ."", ""David knew that the Lord God had sent Shimei to curse David ; and David further knew that many of Shimei 's charges against him were absolutely true ."", ""And David sent messengers , and took her ; and she came in unto him , and he lay with her ; for she was purified from her uncleanness ( Now is n't that nice !"", ""This made it doggone inconvenient for the newly-minted whore Bathsheba to claim it was her husband Uriah 's baby , because Uriah was off fighting King David 's wars for him ."", ""So , when all attempts to fix this sorry mess any other way failed , the ONLY OPTION left to cover David 's and Bathsheba 's sin was simply to murder Uriah her husband ."", ""And , Sin # 3 ) David murdered Uriah in cold blood and several other good men in the bloody , treacherous process ; to wit : `` And it came to pass in the morning , that David wrote a letter to Joab ( Uriah 's military boss ) , and sent it by the hand of Uriah ( just think of it , Uriah is delivering his own death warrant , signed by King David , his commander in chief ) ."", 'And he wrote in the letter , saying , Set ye Uriah in the forefront of the hottest battle , and retire ye from him , that he may be smitten , and die .', 'And it came to pass , when Joab observed the city , that he assigned Uriah unto a place where he knew that valiant men were .', ""Sunday , September 16 , 2007 pg.4 Sermon Outline It is true that Shimei 's charges about David usurping Saul 's throne and stirring up Philistines to kill Saul , were false and slanderous ."", ""Lesson # 2 ) At such times of great distress , some Satan-inspired son of Belial like Shimei will blatantly remind us of our ancient sins , long ago repented of and forgiven , ala David 's ; to wit : `` Even as David also describeth the blessedness of the man , unto whom God imputeth righteousness without works , Saying , Blessed are they whose iniquities are forgiven , and whose sins are covered ."", ""At such times , we should derive great comfort from the enormity of David 's sins , for if David can be gloriously completely , irreversibly and eternally forgiven of adultery and cold-blooded , premeditated , and multiple bloody-murders so may we ."", 'Whereupon Shimei the slimy little weasel was the first to congratulate David , apologize , and beg for mercy ; to wit : `` And Shimei fell down before the king , as he was come over Jordan ; And he said unto the king , Let not my lord impute iniquity unto me , neither do thou remember that which thy servant did perversely the day that my lord the king went out of Jerusalem , that the king should take it to his heart .']"
