,fileName,judgements
4,./data_dsicap/WBC/raw/WestboroBaptist_Sermon_20070909.pdf.txt,"['( Jude 11 ) While Bush stubbornly sends people to die every day in Iraq , and incurs billions if not trillions in debt prosecuting a bloody war , he is busily planning his own post-presidency future and how to become a multimillionaire , bragging on his failed policies , and bragging on how he brought down the wrath of God on America .', ""And those `` words '' mark him as a `` condemned '' child of Hell , according to the Lord Jesus ; to wit : `` For by thy WORDS thou shalt be justified , and by thy WORDS thou shalt be CONDEMNED . ''"", '`` Holy Father ... those that thou gavest me I have kept , and none of them is lost , but the son of perdition [ i.e.', ""The Draper , `` Dead Certain , '' book says : `` Discussing his past battles with alcohol , Bush says he would never be able to make decisions on war if he was still drinking . ''"", 'Remember , Beloved , that this is the same Bush who choked and fainted while trying to eat a pretzel , that cries all the time , uncontrollably , who sees ghosts coming at him out of the walls and out of unoccupied rooms in the White House , and who admits he has been a sloppy drunk for years , unable to make decisions , with a cloudy brain , absolutely , he says .', 'Balaam , for lucre , spoke in the name of the true and living God and he knew and well understood and pretended to believe the 5-point doctrines of Calvinism , as in predestination and election and reprobation ; to wit : Sunday , September 9 , 2007 pg.3 Sermon Outline `` God is not a man , that he should lie ; neither the son of man , that he should repent ; hath he said , and shall he not do it ?', ""In fact it is the worst form , and is symbolized by the iron-and-clay feet and toes of King Nebuchadnezzar 's image ."", '; to wit : `` I blessed the most High , and I praised and honored him that liveth for ever , whose dominion is an everlasting dominion , and his kingdom is from generation to generation .', ""On the night of Belshazzar 's great feast which marked the end of Israel 's 70 years of Babylonian Captivity and shortly after Daniel had pronounced the King 's and the Kingdom 's doom , right to the King 's face we read these words : `` In that night was Belshazzar the king of the Chaldeans slain ."", 'Another ancient monarch who ruled the world the direct antithesis of democracy yet see what kind of man he was from his words ; to wit : `` Then king Darius wrote unto all people , nations and languages , that dwell in all the earth ; Peace be multiplied unto you .', 'I make a decree , That in every dominion of my kingdom men tremble and fear before the God of Daniel ; for he is the living God , and stedfast for ever , and his kingdom that which shall not be destroyed , and his dominion shall be even unto the end .', 'If they should lift a hand or a voice to protect us in any way , and do their Constitutional and moral duty toward WBC their political careers would be over .', ""By and by , the time would come , when good America would no longer be good ( which he said was the reason for America 's greatness , after he went into faithful churches in those days , and concluded that America was great because America was good . )"", ""And that is why America persecutes us , because ELECTED officials are afraid they wo n't be RE-ELECTED if they protect our Constitutional rights .""]"
5,./data_dsicap/WBC/raw/WestboroBaptist_Sermon_20070805.pdf.txt,"['The story of Amalek is one of the most remarkable accounts in all the Bible , and is in many ways unique to our own experience .', ""Indeed , God Almighty 's decree for the utter annihilation of the whole Amalekite nation has historically been more than many commentators could swallow ."", ""Dr. Robert Jamieson : `` The doom of extermination denounced against the Amalekites has been a great difficulty in the way of establishing the historical truth of this book ; Rationalistic and infidel writers declaring it to be irreconcilable with the benevolence of the Divine character and government . ''"", 'If Dr. Jamieson had suffered nearly as much as we have at the hands of our modern Amalekites , he would not think for a minute that Genocide utter annihilation was too harsh a penalty upon Amalek .', ""But Jamieson goes on to somewhat redeem himself in our eyes ; by the following remarkable exposition ; to wit : `` But it must be borne in mind , '' he says , `` that , although the attack upon Israel by Amalek was cruel , treacherous , and altogether unprovoked , it was not the baseness and implacable hostility of Amalek , but their daring impiety , which drew down upon them the vengeance of heaven ( Deut ."", ""`The attack , in respect both to the time and the circumstances , must have been intended by the Amalekites , as well as considered by the Israelites , as a direct insult to the majesty of Jehovah , in his character of peculiar guardian and immediate Lord of this , His chosen people . '"", ""`` Remember what Amalek did unto thee by the way , when ye were come forth out of Egypt ; How he met thee by the way , and smote the hindmost of thee , even all that were feeble behind thee , when thou wast faint and weary ; and he feared not God . ''"", 'Nobody knows for sure just exactly who these Amalekites were .', 'Hear Dr. Jamieson again : `` The attack , therefore , made upon Israel by this fierce Bedouin tribe was altogether unprovoked and gratuitous ; and whatever was their impelling motive , they seem to have PREMEDITATED A SYSTEMATIC , OBSTINATE , AND EXTERMINATING CONTEST .', ""At all events , it is evident that the assailing force was not some stray parties who had unexpectedly fallen in with the advancing hosts of Israel ; but that it comprised the full strength of the Amalekite nation . ''"", "", Black , from Ham ) , and the same with those who were ( already a large nation ) in Abraham 's time ( about 2,000 B.C . )"", 'Dr. Jamieson may come closest to unlocking the mystery ; to wit : `` Considering that the Amalekites were the first ( see , Num .', ""24:20 , Balaam 's prophesy : `` Amalek was the first of the nations [ to attack Israel in the Wars of the Lord ] ; but his latter end shall be that he perish for ever . ''"", ') to oppose the march of the Israelites after the miraculous passage of the Red Sea , their assault was a mean , dastardly , insidious surprise on the rear ( Num .', 'Then add these revealing words from Dr. Jamieson : `` But it must be borne in mind , that , although the attack upon Israel was cruel , treacherous , and altogether unprovoked , it was not the baseness and implacable hostility of Amalek , BUT THEIR DARING IMPIETY ( mark those words : But Their Daring Impiety ! )', ""And , these words from Graves , `On the Pentateuch : ' `` The attack , in respect both to the time and the circumstances , must have been intended by the Amalekites , as well as considered by the Israelites , as A DIRECT INSULT TO THE MAJESTY OF JEHOVAH , ( BANG ! )"", ""But Moses ' hands were heavy ; and they took a stone , and put it under him , and he sat thereon ; and Aaron and Hur stayed up his hands , the one on the one side , and the other on the other side ; and his hands were steady until the going down of the sun ."", '25:17-19 : `` Remember what Amalek did unto thee by the way , when ye were come forth out of Egypt ; How he met thee by the way , and smote the hindmost of thee , even all that were feeble behind thee , when thou wast faint and weary ; and he feared not God .', ""We are high profile worldwide as the Elect of God , supernaturally called out of a corrupt mass to deliver God 's message of doom , even as we are amazingly kept and delivered from every evil work just as Israel out of Egypt , through the Red Sea , and bound for Canaan all of which is God Almighty 's main business , and by which He displays His sovereign grace and power as He does in no other way ; and hence , Satan plots and schemes to attack us when and where we are weak and vulnerable , so as thereby to attempt to thwart , frustrate , and destroy that signal display of God 's sovereignty .""]"
6,./data_dsicap/WBC/raw/WestboroBaptist_Sermon_20080106.pdf.txt,"[""Sunday , January 6 , 2007 page 1 Sermon Outline `` Babylon the great is fallen , is fallen . ''"", ""To wit : `` And a mighty angel took up a stone like a great millstone , and cast it into the sea , saying , Thus with violence shall that great city Babylon be thrown down , and shall be found no more at all . ''"", ""I say , Seraiah was ordered by the Almighty to take that speech after reading it to the crowd and tie a big rock around it so it would sink in the deepest part of the river To wit : `` And it shall be , when thou hast made an end of reading this book , that thou shalt bind a stone to it , and cast it into the midst of Euphrates . ''"", ""50:40 ) I say , 110 verses like that Sunday , January 6 , 2007 page 2 Sermon Outline one just quoted I say the strongest language ever penned to this effect : `` Fallen , fallen is Babylon the great , and shall rise no more again forever . ''"", 'The short answer is that Jeremiah told him to , and he feared the Lord and loved the Lord , and was willing to hazard his life for the Lord ( Acts 15:26 ) , and he was willing to jeopardize his life in the high places of the field .', ""This is all we know of this quiet little Prince , but it 's enough to place him right up there with Phinehas for courage when the chips are down , as they say in Las Vegas ."", 'Think what courage it took to say to such a great and prosperous empire that her doom was coming soon .', ""Here 's another example , taken from the speech of Seraiah ; to wit : `` Thus saith the Lord of hosts ; The broad walls of Babylon shall be utterly broken , and her high gates shall be burned with fire ; and the people shall labor in vain , and the FOLK IN THE FIRE , and they shall be weary . ''"", 'Those outer walls and inner walls were 311 feet high and 87 feet thick , and they completely surrounded the city of Babylon , with a circumference of some 60 miles ( some 15 miles on each side of the square city ) , and pierced with 100 huge , thick gateways with gates of bronze .', ""Babylon 's magnificence , beauty , splendor , prosperity and power just before her final and total destruction was simply indescribable such that King Nebuchadnezzar could well boast , in the language of Scripture ; to wit : `` The king spake , and said , Is not this great Babylon , that I have built for the house of the kingdom by the might of my power , and for the honor of my majesty ? ''"", ""Standing in the very shadow of those massive walls thought to endure for the ages and proclaiming in the Name of God ; to wit : Sunday , January 6 , 2007 page 3 Sermon Outline `` Thus saith the Lord of hosts ; The broad walls of Babylon shall be utterly broken , and her high ( bronze ) gates all 100 of them shall be burned with fire . ''"", '51:58 ) And , Beloved , here we are this little church despised and rejected standing in the big middle of this great nation , in our own dispensation of time declaring the same message to this evil nation which is modern Babylon ; to wit : America is Doomed !', ""There were nine different men throughout the Bible who were named `` Seraiah '' but our hero of this remarkable story is mentioned only in this one place , the last six verses of Jeremiah , chapter 51 ; to wit : Jer ."", ""Seraiah was obviously a `` prince '' in the administration of king Zedekiah , with a marvelous talent for placating offended dignitaries , and hence was ordered to accompany king Zedekiah as a part of his delegation to placate the great Babylonian king who was greatly offended by the rebellious Zedekiah ."", ""Declare ye among the nations , and publish , and set up a standard ; publish , and conceal not : say , Babylon is taken , Bel is confounded , Merodach is broken in pieces ; her idols are confounded , her images are broken in pieces . ''"", ""Babylon 's great god Bel the god of war and destruction was Babylon 's most important god just as Bel , the god of war and destruction is America 's most important god ."", ""`` Because of the wrath of the Lord it shall not be inhabited , but it shall be wholly desolate : every one that goeth by Babylon shall be astonished , and hiss at all her plagues . ''"", ', America : think , 700 military bases in 134 countries throughout the world , the hammer of the whole earth ) `` How is the hammer of the whole earth cut asunder and broken !', ""`` When ye shall have done all those things which are commanded you , say , We are unprofitable servants : we have done that which was our duty to do . ''""]"
7,./data_dsicap/WBC/raw/WestboroBaptist_Sermon_20080629.pdf.txt,"[""Sunday , June 29 , 2008 Sermon Outline ... page 1 `` And fear not them which kill the body , but are not able to kill the soul : but rather fear him which is able to destroy both soul and body in hell . ''"", ""This verse falls logically into two parts ; to wit : 1 ) `` And fear not them which kill the body , but are not able to kill the soul : '' and 2 ) `` but rather fear him which is able to DESTROY both soul and body in hell . ''"", ""I was saying to Mom just the other day , at our morning Bible study and prayer time , that , as we have now reached the eventide of our Pilgrim 's Progress , I am just so thankful that the Bible is as dear , and wonderful , and precious to us now , ( indeed , even more so ) , as when we set out upon our journey together almost 56 years ago ."", ""Such unfeigned love for the Scriptures is also powerful internal and external evidence that one 's calling and election is sure ; to wit : `` Wherefore the rather , brethren , give diligence to make your calling and election sure . ''"", ""`` That is , '' says John Brown , `` get a hold of some undoubted evidence , that you are God 's elect . ''"", ""14:21 ) Note here , Beloved , that the great , teeming masses of mankind live and die in total , blind ignorance , of just exactly what the `` commandments '' of Jesus Christ are ; let alone do they have either the ability or the inclination to `` keep '' them ; nor do they give a rat 's tutu about finding out just exactly what those said `` commandments '' are , and less than a rat 's tutu about `` keeping '' them ."", ""Yet , `` having '' those commandments and `` keeping '' them constitutes that certain objective evidence that MANIFESTING of Himself to us those `` good works '' that constitute proof that `` our calling and election is sure . ''"", '14:22 ) Beloved , this is that JUDE ( who wrote the splendid little book of Jude , next to the last book in the Bible , Revelation ) who is putting this perceptive question to the Lord Jesus .', ""Sunday , June 29 , 2008 Sermon Outline ... page 2 I say , it appears that Jude sensed that holy mysteries must be involved here , but that he wanted the Lord Jesus to verify what he was already suspecting ; to-wit : `` How is it , '' asked Jude , `` that thou wilt manifest thyself unto us , and not unto the world ? ''"", "", the word which none but my elect can hear , by supernatural enabling , the effectual call ) I say , saith Christ , `` the word which ye hear is not mine , but the Father 's which sent me . ''"", 'By the grace of God this little flock will be publishing the holy message that God has given us and we will be as wise as serpents and harmless as doves and all the while we will accumulate an immense thorough , and well-documented TESTIMONY .', 'Everything Guinness has ever done and included in his world-famous Book is tidbits and chicken feed compared to what WBC has done for the cause of God and Truth in the earth .', '2:1-3 ) Those idiots in Congress the House of Representatives AND the United States Senate and President George Bush , who had to sign the unconstitutional laws they passed against us to make them effective and the various State Legislatures , and the Governors who signed the State laws to make them effective I say , all those thousands of idiots who think they can change the Word of God and who think they can stop the preaching of WBC are the objects of ridicule and scorn and mockery and derision each one by name and otherwise identified in the courts of Heaven ; to wit : `` He ( the Lord God ) that sitteth in the heavens shall LAUGH : the Lord shall have them in DERISION .', ""Senators and Representatives , all the governors , and all the state legislators who took official action to stop WBC 's preaching in flagrant violation of the Constitution and in oppressive denial of WBC 's First Amendment rights of freedoms of religion and speech I say , we know your names and identities we have documented your many crimes against our church we are competent witnesses to give first-hand testimony against each of you and we fully expect to give evidence against you , lasting for many days , at the Judgment of the Great Day of God 's Wrath ."", ""We are not afraid of you , because you are not able to kill the soul ; and this absence of fear on our part is solid irrefutable evidence and proof positive that we are saved and on our way to Heaven , and is furthermore proof positive that you are NOT saved , and are on your way to Hell ; to wit : `` And in nothing terrified by your adversaries : which is to them an evident token of perdition , but to you of salvation , and that of God . ''"", ""Gill says , `` By the CHAFF , are meant wicked and ungodly persons , such as are destitute of the grace of God , whether professors or profane ; being empty , barren , and unfruitful ; and so good for nothing but the fire , which therefore he will burn with the unquenchable fire , of divine wrath and vengeance . ''"", ""Beloved , these people who reject Christ and His Word that is to say , the preaching and the holy message of God through Westboro Baptist Church I say , those people are absolute , good-for-nothing trash , fit only to be dealt with by the fiery wrath of God Almighty 's indignation ."", ""Therefore as the FIRE devoureth the stubble , and the FLAME consumeth the CHAFF , so their root shall be as rottenness , '' ( i.e."", ""Therefore is the anger of the Lord kindled against his people , '' ( Chaff-People ) `` and he hath stretched forth his hand against them , and hath smitten them : and the hills did tremble , and their carcases were torn in the midst of the streets ."", ""Even as we speak , amazing ( the Associated Press says , `` unprecedented '' ) I say , AMAZING demonstrations of God 's fiery wrath are taking place in the godless state of California ."", ""The experts are calling it `` an unprecedented LIGHTNING STORM ... 5,000 to 6,000 LIGHTNING STRIKES ... `We are finding fires all the time . '"", ""'' 840-PLUS , and counting ; to wit ; ( from an AP story last Tuesday , June 24 ) `` More than 840 wildfires sparked by an `unprecedented ' LIGHTNING STORM are burning across Northern California , alarming the governor and requiring the help of firefighters from Nevada and Oregon . ''"", ""And here is the Bible commentary on these current events ; to wit : Sunday , June 29 , 2008 Sermon Outline ... page 5 `` For the wrath of God is revealed from heaven against all ungodliness and unrighteousness of men , who hold '' ( i.e."", '1:18 ) In other words , God by His amazing demonstrations , and even supernatural displays , of His fiery wrath is revealing to the Chaff-People the true nature of their coming Judgment and their long home in Hell .', ""Consider that solemn question in light of what the AP this week called the `` unprecedented LIGHTNING STORMS in Northern California , producing 5,000 to 6,000 LIGHTNING STRIKES , which in turn produced 840-PLUS WILDFIRES , '' most of which are still burning as we speak ."", 'WILDFIRES in such numbers that the governor of California is in a state of shock , the AP says , and is pleading for help from nearby states of Nevada and Oregon !', 'But WE know what to make of these things , and sooner or later the stupid governors and other officials will be forced in desperation to listen to us .', 'This was fire from heaven , and therefore said to be a fire from the Lord that devoured them ; it was such a FIRE , AS BLASTS OF LIGHTNING are , which strike , and blast , and shrivel the spirits of a living body in an instant , which is evident by the manner of their deaths .', 'Sunday , June 29 , 2008 Sermon Outline ... page 6 These two boys , Nadab and Abihu , were the eldest sons of Aaron the High Priest ; and they were the beloved nephews of Moses .', 'Their sins that so enraged the Lord as to strike them dead by a lightning bolt , is not clear .', ""Their cousins carried their bodies quickly out of God 's tabernacle to an ignominious burial , and their souls went straight to Hell , there to continue to be tormented by this lightning bolt fire of the Lord ."", 'FLASHES OF LIGHTNING from the cloud in which He was ; and consumed the 250 men that offered incense ; not that it reduced them to ashes , but took away their lives , struck them dead at once , in like manner as Nadab and Abihu were , who though said to be devoured by the fire , YET THEIR BODIES REMAINED .', 'To which Goodwin adds , `` What created fire can be conceived more subtle or powerful , than the angels themselves are conceived to be ?', ""In one night , just one angel struck 185,000 times , leaving only dead , unmarked bodies of Sennacharib 's Assyrian host all 185,000 of them and their SOULS all being tormented in Hell by the same fiery , flying angels ."", '26:53 ) A Roman legion was 6,000+ ; thus making 12 legions = 72,000+ angels a mere pittance compared to the total number , all of whom are engaged in lightning strikes around the world 24/7 , and in tormenting the multiplied billions of the damned already in Hell 24/7 .']"
