,fileName,judgements
0,./data_dsicap/WBC/raw/WestboroBaptist_Sermon_20080127.pdf.txt,"['Some Jew named Ruthie called in to a radio program I was on last Thursday and said that I hated Jews and that I therefore was anti-Semitic .', ""Then said Jesus TO THOSE JEWS which believed on him , If ye continue in my word , then are ye my disciples indeed ; And ye shall know the truth , and the truth shall make you free . ''"", ""She wanted to read to me from Gen. 1:27 ; and when she had done so , she made the argument that it was proof from the Bible that sodomy was OK , that it 's OK to be gay ."", ""Ruthie the Jew said that that verse proves it 's OK to be gay , in full demonstration of the fact that God Almighty has stricken the Christ- rejecting Jews with His judicial blindness , as it is written in Romans 11 : 7-10 ; to wit : Sunday , January 27 , 2008 page 2 Sermon Outline `` What then ?"", ""11:7-10 ) These are strong , so-called imprecatory prayers ( `` imprecatory '' means to pray for God to bring evil things upon a person ; a curse ) these verses in Romans are prayers of David imprecatory prayers but very acceptable to God , ( who answered those prayers by striking unbelieving Jews with judicial blindness to this day ) and that kind of praying was also acceptable to Paul the Jew , who chooses to quote from ( and adopt as his own ) David 's imprecatory prayers ."", ""Speaking directly to the Jews of His day , our Lord Jesus Christ was very uncompromising ( Jesus was a straight , plain , hard , no-nonsense preacher not a kissy-pooh preacher ) ; and very straight-forward ; to wit : `` Then said Jesus again unto them , I go my way , and ye shall seek me , and shall die in your sins : whither I go , ye can not come . ''"", '`` And he said unto them , Ye are from beneath ( doomed earthdwellers ) ; I am from above : ye are of this world ( this doomed , soon-to- be-destroyed-with-fire world , make no mistake ) ; I am not of this world .', ""And so , following the example of my Savior , Captain , and Divine Pattern , I say unto Ruthie the Jew , that if you believe not that Jesus is the Christ , the Messiah , the Son of the Living God you will die in your sins ; and you will thereupon join Heath Ledger in Hell , where , throughout eternity , you two can swap fairy tales like saying that Gen. 1:27 proves it 's OK to be gay , and like making the movie `` Brokeback Mountain '' was just fine with God ."", ""Sunday , January 27 , 2008 page 3 Sermon Outline Moreover , we learn from the words of Christ Himself that the experience WBC is having with exposing the evils of the movie `` Brokeback Mountain '' , as well as exposing the eternal destiny of Heath Ledger as being torment in the Lake of Fire and Brimstone , the fires of Hell excites murderous rage throughout the world ."", 'And so it is , that when the Elect hear the Word of God preached , a responsive chord is struck , such that the heart of the sheep resonates with that of the Shepherd .', 'And a part of that Gospel is to tell them that most of them are deaf , dumb , and blind , and otherwise are too hard-hearted to accept our message ; and that what little of Gospel preaching ( seed ) might Sunday , January 27 , 2008 page 4 Sermon Outline otherwise take hold and grow within them , is IMMEDIATELY snatched away by Satan , their father .', 'For the non-Elect , Jesus had the following plain , clear words ; to wit : `` Ye are of your father the devil , and the lusts of your father ye will do .', ""When he speaketh a lie , he speaketh of his own : for he is a liar , and the father of it . ''"", ""It is my belief that God is similar to my parents while he may see the sin itself as an abomination , HOW COULD HE HATE ANYONE HE HAS CALLED HIS CHILD ... who are we to put the word `hate ' in God 's mouth ? ''"", ""For by thy words thou shalt be justified , and by thy words thou shalt be condemned . ''"", 'To the editor referred to above ; Listen up , smart-mouth : God is not your father ; and you are not His child .', 'Your editorial maligning WBC is sufficient evidence in and of itself to prove that God is not your father ; and you are not His child .', '8:45,47 ) The response of the Jews upon hearing such devastating pronouncements of their lost condition , was to attack Jesus with baseless , slanderous and irrelevant , ad hominem lies ( like they do us today ) to wit : `` Then answered the Jews , and said unto him , Say we not well that thou art a Samaritan , and hast a devil ?', 'Art thou greater than our father Abraham , which is dead ?']"
1,./data_dsicap/WBC/raw/WestboroBaptist_Sermon_20080608.pdf.txt,"[""Gill says the following to that fearsome and horrific passage ; to wit : `` Which is not to be understood of a single act of sin , but rather of a course of sinning ; nor of sins of infirmity through temptation , or even of grosser acts of sin , but of voluntary ones ; and not of all voluntary ones , or in which the will is engaged and concerned , but of such which are done on set purpose , resolutely and obstinately ; and not of immoral practices , but of corrupt principles , and acting according to them ; it intends a total apostasy from the truth , against light and evidence , joined with obstinacy . ''"", 'Add to those words in Luke , these additional bits of evidence from 1st John 4:6 ; to wit : `` We are of God : he that knoweth God heareth us ; he that is not of God heareth not us .', ""We are preaching to this doomed generation of ours as a John the Baptist Voice crying in the wilderness , or a Noah who , `` being warned of God of things not seen as yet , moved with fear , prepared an ark to the saving of his house , by which also he condemned the whole world , Sunday , June 8 , 2008 page 2 Sermon Outline and became heir of the righteousness which is by faith . ''"", 'All their sinfulness deserves a great punishment a punishment so great that it can not be fully comprehended by our thoughts , nor ever be sufficiently expressed , in time or in eternity .', 'In which chapter he writes : `` For what hell and destruction are , is a mystery , as well as what heaven is ; and the true and proper notion or conception of either , are a riddle to the most of men .', ""The institutions of Hell ( as well as Heaven ) remain largely mysterious to us in our present limited state and scope of understanding `all things being naked and open ' only unto `the eyes of him with whom we have to do , ' viz."", 'And , `Lo , these are parts of his ways ; but how little a portion is heard of him ?', 'The Grand Executioner or Immediate Inflictor of the threatened punishment , is the Lord Jesus Christ ( and His elect people and elect angels ) .', ""29:29 ; to wit : '' `` The secret things belong unto the Lord our God ; but those things which are revealed belong unto us and to our children for ever , that we may do all the words of this law . ''"", 'Generally , the context consists of the Lord warning repeatedly and in various ways and very , very plainly that a horrific , everlasting curse would be enforced and fulfilled to the letter against any person who left the Lord to serve idols .', ""And so , `` those things which are revealed and which belong unto us and to our children for ever , that we may do all the words of this law , '' those things include the curse of Sunday , June 8 , 2008 page 3 Sermon Outline God upon reprobates , and the painful punishments that await those who depart from the living God ; to wit : `` Lest there should be among you man , or woman , or family , or tribe , whose heart turneth away this day from the Lord our God , to go and serve the gods of these nations ; lest there should be among you a root that beareth gall and wormwood '' ( a poison herb , this passage being cited at Heb ."", ""12:15 , `Looking diligently lest any man fail of the grace of God ; lest any root of bitterness springing up trouble you , and thereby many be defiled . '"", '`` The Lord will not spare him , but then the anger of the Lord and his jealousy shall SMOKE AGAINST THAT MAN , and ALL THE CURSES that are WRITTEN IN THIS BOOK shall LIE UPON HIM , and the Lord shall blot out his name from under heaven .', ', he is headed , irreversibly to the punishments of Hell ) `` out of all the tribes of Israel , according to ALL THE CURSES of the covenant that are written in this book of the law ... like the overthrow of Sodom & Gomorrah which the Lord overthrew in his anger , and in his wrath ... For they went and served other gods , and worshiped them , gods whom they knew not ... And the anger of the Lord was kindled against this land , to bring upon it all the curses that are written in this book .', ""And the Lord rooted them out of their land in anger , and in wrath , and in great indignation , AND , The secret things belong unto the Lord our God ; but those things which are revealed belong unto us and to our children for ever , THAT WE MAY DO ALL THE WORDS OF THIS LAW . ''"", ""That is , the God who lives to administer punitive measures to the wicked ; to wit : `` Vengeance is MINE ( ALONE ) , I WILL repay , saith the Lord . ''"", "", which shall consume in Hell 's eternal flames all those who while on earth were adversarial to God 's elect ) . ''"", 'Goodwin says that the painful punishments inflicted by Christ , the Immediate Inflictor , are set forth plainly in some Scriptures , and inferential in others ; and that it takes a consideration of all , in order for the saints on earth to form adequate and accurate notions or concepts of Hell and the painful punishments of the damned .', ""3:19 , `By which he also went and preached unto the spirits in prison , ' large enough , to be sure , to hold men and devils : `The wicked shall be turned into hell , and all the nations that forget God , ' Psa ."", ""5:26 ; where is nothing but `darkness , utter darkness , ' `blackness of darkness , ' Jude 4 , that is , an emptiness of all good , not a beam of light to all eternity ; also a `place of torment , ' Lk ."", ""50:22 , `Now consider this , ye that forget God , lest I tear you in pieces , and there be none to deliver ; ' `cutting them up to the backbone , ' Heb ."", ""18:6 , `But whoso offends one of these little ones which believe in me , it were better for him that a millstone were hanged about his neck , and that he were drowned in the depth of the sea , ' to make sure they never rise again ; also unto a being cast , `bound hand and foot , ' Mat ."", ""13:42,49,50 , `The Son of man shall send forth his angels , and they shall gather out of his kingdom all things that offend , and them which do iniquity ; and shall cast them into a furnace of fire ; there shall be wailing and gnashing of teeth , ' `So shall it be at the end of the world ; the angels shall come forth , and sever the wicked from among the just , and shall cast them into the furnace of fire ; there shall be wailing and gnashing of teeth ; ' `a lake of fire , ' and so drowned over head and ears for ever ; a lake `fed with a stream of brimstone , ' which ( of all matter that feedeth fire ) is the most fierce , ( `For Tophet is ordained of old ; yea , for the king it is prepared ; he hath made it deep and large ; the pile thereof is fire and much wood ; the breath of the Lord , like a stream of brimstone , doth kindle it , ' ) Isa ."", ""29 `Of how much SORER PUNISHMENT , suppose ye , shall he be thought worthy , who hath trodden under foot the son of God , and hath counted the blood of the covenant , wherewith he was sanctified , an unholy thing , and hath done despite unto the Spirit of grace . '"", 'I say , when he would set out the severeness of this infliction of punishment , as infinitely exceeding all those kinds of horrid corporal tortures and torments , he infers the soreness ( extreme painfulness ) of this from the fact that now God Himself is the Avenger and the Immediate Inflictor .', ""`We know him that hath said thus , Vengeance is mine , ' that is , what a great and powerful God he is ."", ""( Luke 12:5 ) `` And fear not them which kill the body , but are not able to kill the soul ; but rather fear him which is able to destroy both soul and body in hell . ''"", ""Goodwin : `` They , and they alone , know him in his love , and have tasted and found that his immediate `loving-kindness is better than life ; ' and from the LAW OF CONTRARIES , they know that his wrath must be more bitter than death .""]"
2,./data_dsicap/WBC/raw/WestboroBaptist_Sermon_20080427.pdf.txt,"[""It 's the Day of Pentecost , following the death and resurrection of the Lord Jesus , and Peter is preaching one of his greatest sermons to the huge crowd of people assembled in Jerusalem from all over the world ; to wit : `` And there were dwelling at Jerusalem Jews , devout men , out of every nation under heaven ... Parthians , and Medes , and Elamites , and the dwellers in Mesopotamia , and in Judea , and Cappadocia , in Pontus , and Asia , Phrygia , and Pamphylia , in Egypt , and in the parts of Libya about Cyrene , and strangers of Rome , Jews and proselytes , Cretes and Arabians ..."", '( Acts 2:5,9-11,14,22,23 ) Thus you see that Peter plainly and boldly declared the doctrine of REPROBATION in his historic sermon on the Day of Pentecost that launched the infant church , as it were .', ""... And the third angel followed them , saying with a loud voice , If any man worship the beast and his image , and receive his mark in his forehead , or in his hand , The same shall drink of the wine of the wrath of God , which is poured out without mixture into the cup of his indignation ; and he shall be tormented with fire and brimstone in the presence of the holy angels , and in the presence of the Lamb ; And the smoke of their torment ascendeth up for ever and ever ; and they have no rest day nor night , who worship the beast and his image , and whosoever receiveth the mark of his name . ''"", ""13:4,8 ; 14:9-11 ) Sunday , April 27 , 2008 page 2 Sermon Outline And then a somewhat strange , startling pronouncement is made , apparently by the third angel , or maybe an unidentified voice from heaven ; To wit : `` HERE is the patience of the saints ; HERE are they that keep the commandments of God , and the faith of Jesus . ''"", ""And then , an unidentified voice is heard from heaven , maybe the same voice speaking comforting words to those patient and suffering saints ( God 's Elect ) who have evidently been hurt by the Beast and his agents , who are now suffering the torments of the damned just described ."", ""Here are the words of comfort from heaven ; to wit : `` And I heard the voice from heaven saying unto me , Write , Blessed are the dead which die in the Lord from henceforth ; Yea , saith the ( Holy ) Spirit , that they may rest from their labors ; and their works do follow them . ''"", ""14:13 ) In the preceding chapter 13 the Beast is seen ruling the world and waging a successful war against God 's Elect ; to wit : `` And it was given him to make war with the saints , and to overcome them ; and power was given him over all kindreds , and tongues , and nations ."", ""For a time , the Beast had power to kill the saints `` cause that as many as would not worship the image of the beast should be killed . ''"", 'Truly , Beloved , it is our joy and privilege that we have from this little church by our preaching , our testimony , and our manner of life sent forth a message to the whole world , confessing that we are strangers and pilgrims on the earth .', ""`` For they that say such things declare plainly that they seek a country ... a better , that is an heavenly country ... wherefore God is not ashamed to be Sunday , April 27 , 2008 page 3 Sermon Outline called their God ; for he hath prepared for them a city . ''"", ""And , remember Beloved , what a dreadful choice the REPROBATES made , when they took the Mark of the Beast branded , as it were 666 indelibly branded upon their bodies by some hellish device as the price they paid for the right to buy and sell and thereby earn a living in Satan 's worldwide empire ; to wit : `` And that no man might buy or sell , save he that had the mark . ''"", 'Many say as a school of Lutheran scholars and theologians , in particular that predestination is proper only for the elect , and that as to the reprobate , there is only a prescience or naked foreknowledge ; no preordination ; and sometimes called PRETERITION ( a mere passing by ) that is , as to the reprobate , God merely passes him by and leaves him in his sins .', ""But Scripture is strong in the position that just as God actively predestinates some few members of Adam 's race to be saved ; even so , God actively predestinates all the huge balance of Adam 's vile seed to be damned and even pickles him so that he is preserved in his sins to be damned ; to wit : `` The Lord knoweth how to deliver the godly '' ( i.e."", 'When you track any and all events whatsoever , track them back upstream to their original source their fountainhead you will find the original source of all things whatsoever to be the WILL OF GOD .', ""The Lord Jesus was announcing the doom of entire cities telling them that they were going to Hell , because God wanted them to go to Hell ; to wit : `` Then began he to upbraid the cities wherein most of his mighty works were done , because they repented not ... And thou , Capernaum , which art exalted unto heaven , shalt be brought down to hell . ''"", ""And then the Lord Jesus made this startling statement ; to wit : `` For if the mighty works , which have been done in thee , had been done in SODOM , '' ( yes , SODOM ) , `` it would have remained until this day ."", ""Immediately following the prophesy of Jesus that 1 ) all the inhabitants of the magnificent city of Capernaum would be cast into Hell ; and , 2 ) that God would punish them more severely in the day of judgment than Sodom 's hapless inhabitants and , 3 ) that God would not have famously destroyed Sodom 2,000 years earlier with a spectacular fire and brimstone annihilation of all her inhabitants , if the mighty works which had been done in Capernaum by Christ had also been done in Sodom ."", ', God did those three stunning things regarding the total destruction of millions of people in the cities of Capernaum and Sodom in what to natural man Sunday , April 27 , 2008 page 5 Sermon Outline was unfair and prejudicial for no other reason than this ; to wit : BECAUSE GOD WANTED TO .', ""THE FATHER 'S WILL ABSOLUTELY PREVAILS Another incident with almost identical wording occurred in Luke Chapter 10 ; and there , these additional words are added ; to wit : `` In that hour Jesus rejoiced in spirit , and said , I thank thee , O Father ... '' Lk ."", ""Manton says , `` The scriptures show that the greatest evil that ever was , did not only fall under the foreknowledge , but the `determinate counsel of God , ' Acts 2:23 ; it was not only foreknown , but unchangeably ordained and determined . ''""]"
3,./data_dsicap/WBC/raw/WestboroBaptist_Sermon_20080406.pdf.txt,"['To-wit : `` But in all Israel there was none to be so much praised as Absalom for his beauty ; from the sole of his foot even to the crown of his head there was no blemish in him .', ""Listen , `` Favor is deceitful , and beauty is vain ; but a woman that feareth the Lord , she shall be praised . ''"", 'Incidentally , all that hair he cut off at his annual haircut , weighed from 3 to 6 pounds , depending on which expositor you are reading .', ""David 's inordinate affection or , David 's vile affection for Absalom , was manifested early on , when he let Absalom get away with murdering his half-brother , Amnon , after Amnon had raped Absalom 's sister , Tamar ( who was Amnon 's own half-sister ) ."", 'Here is how the whole , sordid tale begins in 2 Samuel , Chapter 13 ; to wit : `` And it came to pass after this , that Absalom the son of David had a fair sister , whose name was Tamar ; and Amnon the eldest son of David loved her .', ""And Amnon was so vexed , that he fell sick for his sister Tamar ; for she was a virgin ; and Amnon thought it hard for him to do anything to her . ''"", ""13:1,2 ) Sunday , April 6 , 2008 page 2 Sermon Outline And so , it appears that the punishment of David promised by God for David 's great sins regarding Uriah the Hittite and his wife , Bathsheba I say , David 's punishment had begun ; because , as it is written , `` The thing that David had done displeased the Lord . ''"", ""Gill says : `` Amnon thought it hard or difficult to have access to her ( Tamar ) , almost impossible , what he despaired of and what , if attained to would be wonderful and amazing ; he was at his wits ' end how to contrive any scheme to get at her , and obtain his desire ."", ""`But Amnon had a friend , ' though his friendship proved to be his ruin ; `whose name was Jonadab , ' and they were cousins , `and Jonadab was a very subtle man ; ' a very penetrating man into the dispositions of men , and could judge by their countenances what they were , and the affections of their minds , and had a talent in forming schemes ; he was wise to do evil , and was wickedly cunning ."", ""`And he said unto him , why art thou , being the king 's son , lean ( i.e."", 'and cheerful , and yet he pined away ; his flesh wasted , his countenance waxed wan and pale , and especially in the mornings ; in the day-time he met with diversions which , in some measure , took off his thoughts from the object his mind was impressed with ; but in the night season , they were continually employed about it ; so that he could have no rest and sleep , which made him look ruefully ( i.e.', 'Because some child turns out to be a sorry son-of-Belial does not always mean that the parents are to blame because of the sin of inordinate affections or vile affections .', 'But when the Holy Spirit dictates it so as in the case of Eli , and Amnon , and David with Pretty- Boy Absalom then we had better believe it and heed it for the deadly sin that it is .', 'I tell you , anybody that would have the Jerry Falwell reaction is guilty of the heinous sin of inordinate affection , and is going to Hell .', 'It is clear from the language that follows , that something very wrong with Eli is going on here .', ""Through hellish inordinate affections for his sons ; and thereby Eli brought down the wrath of God in a most fearsome way ; to wit : Sunday , April 6 , 2008 page 4 Sermon Outline `` And this shall be a sign unto thee , that shall come upon thy sons , on Hophni and Phinehas ; in one day they shall die both of them . ''"", 'Now Eli was ninety and eight years old ; and his eyes were dim , that he could not see .', 'And the man said unto Eli ... Israel is fled before the Philistines , and there hath been also a great slaughter among the people , and thy two sons also , Hophni and Phinehas , are dead , and the ark of God is taken .', 'The seriousness of the sin of inordinate affections is further high-lighted by a most interesting passage of Scripture in the 13th Chapter of Deuteronomy ; to wit : `` If thy brother , the son of thy mother , or thy son , or thy daughter , or the wife of thy bosom , or thy friend , which is as thine own soul , entice thee secretly , saying , Let us go and serve other gods , which thou hast not known , thou , nor thy fathers ; Namely , of the gods of the people which are Sunday , April 6 , 2008 page 5 Sermon Outline round about you , nigh unto thee , or far off from thee , from the one end of the earth even unto the other end of the earth ; Thou shalt not consent unto him , nor hearken unto him ; neither shall thine eye pity him , neither shalt thou spare , neither shalt thou conceal him ; But thou shalt surely kill him ; thine hand shall be first upon him to put him to death , and afterwards the hand of all the people .', ""And all Israel shall hear , and fear , and shall do no more any such wickedness as this is among you . ''"", 'That fact only demonstrates how addicted we are to the deadly sin of inordinate affections .', 'When word came to David that his army had won a notable victory and saved his kingdom but that Absalom was necessarily killed in the process rather than rejoice in victory , David descended into deep depression and despair ; to wit : `` And the king was much moved , and went up to the chamber over the gate , and wept : and as he went , thus he said , O my son Absalom , my son , my son Absalom !', ""( 2 Samuel 18:33 ) ( Such that ) `` ... the victory that day was turned into mourning unto all the people ... '' 2 Samuel 19:2 ."", ""( And such that David was warned that if he did n't knock off his foolish weeping ) `` ... there will not tarry one with thee this night ; and that will be worse unto thee than all the evil that befell thee from thy youth until now . ''""]"
