,fileName,judgements
0,./data_dsicap/WBC/raw/WestboroBaptist_Sermon_20080210.pdf.txt,"[""... Then these men were bound in their coats , their hosen , and their hats , and their other garments , and were cast into the midst of the burning fiery furnace . ''"", 'He issued a decree that anybody who did not fall down and publicly worship that monstrous idol would be summarily executed .', ""Here is a man Nebuchadnezzar by name who just a short time before had made a wonderful Confession of faith to the one , living , and true God , to the exclusion of all other `` gods '' with a small `` g '' ; to wit : `` The king answered unto Daniel , and said , Of a truth it is , that your God is a God of gods , and a Lord of kings , and a revealer of secrets , seeing thou couldest reveal this secret . ''"", ""The `` secrets '' there referred to was a horrifying dream of another `` great image , '' only this `` great image '' was not all of gold only the head was of gold ; which quickly degenerated into inferior metals ( breast and arms of silver ; belly and thighs of brass , legs of iron , and feet part of iron and part of clay ) which was interpreted by Daniel as meaning that Nebuchadnezzar 's vast kingdom of absolute tyranny and monarchical power would soon give way to `` another kingdom inferior to thee , '' and so to another , and yet another , until the end of time when the God of heaven would set up a kingdom that should last forever ."", ""This great image , whose brightness was excellent , stood before thee ; and the form thereof was terrible . ''"", ""The overwhelming majority of Babylon 's officials ( civic , military , priests , all others ) were seething with rage at king Nebuchadnezzar 's RELIGIOUS CONVERSION Sunday , February 10 , 2008 page 2 Sermon Outline under Daniel to the worship of the one , true and living God ."", 'They were all idolaters and image- worshipers , born and bred , and they were determined to keep it that way .', ""Gills says , that Nebuchadnezzar was determined `` to contradict the interpretation of his dream , and avert the fate of his empire signified by it ; or to purge himself from the jealousies his subjects entertained of him , of relinquishing the religion of his country , and embracing the Jewish religion , by his praise of the God of Israel , and the promotion of Jews to places of trust and honor ; and , ( get this ) they say it may be to LAY A SNARE for Daniel and his companions ; of which we have an instance of the like kind in chapter 6 . ''"", 'To wit : `` Then the presidents and princes sought to find occasion against Daniel concerning the kingdom ; but they could find none occasion nor fault ; forasmuch as he was faithful , neither was there any error or fault found in him .', ""6:4,5 ) And so they cooked up an elaborate scheme , to wit : They conned Darius the king into signing a goofy law that made it a criminal offense punishable by death in the lion 's den ; to wit : `` that whosoever shall ask a petition of any God or man for thirty days , save of thee , O king , he shall be cast into the den of lions . ''"", ""Even so , in like manner , the old Jews say the entire project to build and erect a 90-foot-tall , solid gold image an idol worth $ billions was nothing but an elaborate scheme `` to ensnare Daniel and his companions . ''"", ""All the time that thing was being built and erected ; all the time the music was being prepared and the orchestra was rehearsing ; all the time the invitations and orders were going throughout the empire that all officials were to attend the grand dedication of the golden image I say , all those months or years of preparation , the holy Jews were getting ready to defy the king 's command to bow down and the murderous Chaldeans were likewise getting ready to investigate and prosecute the case against the three Hebrew children , for NOT bowing down ."", ""For months and months preparations were being made for the grand dedication of the image ; to wit : `` Then the princes , the governors , and captains , the judges , the treasurers , the counsellors , the sheriffs , and all the rulers of the provinces , ( thousands of them ) were gathered together unto the dedication of the image that Nebuchadnezzar the king had set up ; and they stood before the image that Nebuchadnezzar had set up . ''"", ""And the instrument of death a burning , fiery furnace was immediately at hand ; to wit : `` That at what time ye hear the sound of the cornet , flute , harp , sackbut , psaltery , dulcimer , and all kinds of musick , ye fall down and worship the golden image that Nebuchadnezzar the king hath set up : And whoso falleth not down and worshippeth shall the same hour be cast into the midst of a burning fiery furnace . ''"", ""3:5,6 ) Rabbi Jarchi says , `` the music was to draw , the furnace was to drive , men to this idolatrous worship ; the one was to please and sooth the minds of men ; and so allure them to such stupid service ; the other to frighten them into obedience . ''"", ""Gill says regarding that huge religious/ patriotic festivity , that it was regularly celebrated `` not only by those in Babylon and by those that lived near the plain of Dura where the image stood , but in all places where the ( beautiful patriotic and religious ) music was played , what through love of music , the fear of the furnace , regard to superstition and idolatry , and to the king 's command , men of all nations and languages gave it homage and worship . ''"", ""When they heard the music sound , they were immediately to repair to the plain , where the image stood , and pay their adoration to it ; or to fall down prostrate in their own houses in honor of it ; and perhaps persons were appointed in all cities and towns throughout the empire to play this music ; at hearing which , all people , nations and tongues , were to bow down , in token of their religious regard unto it . ''"", 'And , Remember , Beloved , that all this time , while this elaborate scheme was being planned , developed and implemented , Daniel and his three best friends were running the empire .', ""11:34 I say , is it likely that these four righteous men did not know that they were headed for a historic , world-famous , life-and/or- death showdown with the king ( whether the king realized it or not ala Darius and Daniel and the lions ' den ) once the image was built and set up , and the command to bow down actually was issued ?"", ""It certainly looked bad for Shadrach , Meshach , & Abednego as the most mighty men in Nebuchadnezzar 's army roughly bound them in their clothes and forthwith cast them into the burning fiery furnace on urgent orders of a great king who was filled with rage and fury , `` and the form of his visage was changed against Shadrach , Meshach , and Abednego . ''"", ""Listen to these blessed words ; the story never grows old with the telling ; throughout all eternity it will be repeated to the glory of God , His wisdom , power and faithfulness to His own ; to wit : `` And these three men , Shadrach , Meshach , and Abednego , fell down bound into the midst of the burning fiery furnace . ''"", ""He answered and said , Lo , I see four men loose , walking in the midst of the fire , and they have no hurt ; and the form of the fourth is like the Son of God . ''"", '3:24,25 ) All commentators agree that this famous fiery furnace is emblematic of the fiery trials and afflictive dispensations the children of God pass through in this world .', ""But rejoice , inasmuch as ye are partakers of Christ 's sufferings ; that , when his glory shall be revealed , ye may be glad also with exceeding joy . ''"", ""They were bound before ; but the furnace has a marvelous liberating effect , and an educational effect , where the truths of God are taught and learned : `` Ye shall know the truth ; and the truth shall make you free . ''"", ""`` When thou walkest through the fire , I will be with thee ; thou shalt not be burned ; neither shall the flame kindle upon thee . ''"", ""48:10 ) `` Wherein ye greatly rejoice , though now for a season , if need be , ye are in heaviness through manifold temptations ; That the trial of your faith , being much more precious than of gold that perisheth , though it be tried with fire , might be found unto praise and honor and glory at the appearing of Jesus Christ . ''"", 'We may reasonably conclude that the Lord Jesus is more likely to be closer and more self-revealing to His people in the fiery furnace of affliction than at any other time or place .']"
1,./data_dsicap/WBC/raw/WestboroBaptist_Sermon_20070722.pdf.txt,"[""These Mighty Men went to join David in the wilderness because they were in deep , ruinous debt , they were distressed ( in anguish under Saul 's oppression ) , and they were discontented ( bitter of soul ) ."", 'having been deceived into borrowing money at usurious rates of interest , and being dunned by bill collectors ; see , S # 5378 + S # 5377 ) , and every one that was discontented ( i.e.', ""This is an elegant metaphor of the Elect of God , who confess that they are strangers and pilgrims on the earth , that they are miserable living in the City of Destruction and fearing the wrath of God to come , and that they therefore declare plainly that they seek a country , better than this , that is , an heavenly country ; `` wherefore God is not ashamed to be called their God : for he hath prepared for them a city ; '' ( Heb ."", ""( 1 Samuel 22:1-2 ) Sunday , July 22 , 2007 pg.2 Sermon Outline David 's Mighty Men : TACHMONITES As with David 's Mighty Men leaving all to follow David into a danger-fraught wilderness knowing exactly what they were doing and what they were getting into , and yet rejoiced for the opportunity to suffer with David for a short while , and then to rule and reign with him , SO DO WE !"", '12:40 ) ; to wit : `` All these men of war , that could keep rank , came with a perfect heart to Hebron , to make David king over all Israel ; and all the rest also of Israel were of one heart to make David king .', '1:4 ) All to the effect that our afflictions are submicroscopic and infinitesimal ( so tiny in quantity and volume as to be incapable of measurement ) in size , and diminutive in duration , compared to the certainty of our glorious rewards , all of which are infinite in size and duration ; to wit , e.g .', "": `` For our light ( tiny ) affliction , which is but for a ( tiny ) moment , worketh for us a far more exceeding and eternal weight of glory ; While we look not at the things which are seen , but at the things which are not seen ; for the things which are seen are temporal ; but the things which are not seen are eternal . ''"", ""Indeed , our Lord Jesus Christ is our precise and precisely-worded pattern in and for this doctrine , urging us on to infinite reward and infinite glory ; to wit : `` Let us run with patience the race that is set before us , Looking unto Jesus the author and finisher of our faith ; who for the joy that was set before him endured the cross , despising the shame , and is set down at the right hand of the throne of God . ''"", 'And from that glorious throne on high , our Captain is beckoning us to join Him , with these happy words ; to wit : `` To him that overcometh will I grant to sit with me in my throne , even as I also overcame , and am set down with my Father in his throne .', ""Sunday , July 22 , 2007 pg.3 Sermon Outline 8 Characteristics of David 's Mighty Men Now let us examine the attributes and descriptive characteristics of David 's Mighty Men which are the same attributes and characteristics , in principle , as those possessed by God 's Elect in New Testament Churches ."", ""In each case , they are supernatural gifts from God ; `` For at that time day by day there came to David to help him , until it was a great host , like the host of God . ''"", ""( This attribute an understanding of the times , which is substantially the same as the signs of the times of Matthew 16:3 when connected to their thorough knowledge of the Word of the Lord of 1 Chronicles 12:23 is solid evidence that David 's Mighty Men were likely to have been God 's Elect , making them mighty in spirit even the Holy Spirit as well as in body . )""]"
2,./data_dsicap/WBC/raw/WestboroBaptist_Sermon_20071014.pdf.txt,"['Sunday , October 14 , 2007 pg.1 Sermon Outline The Abomination of Desolation standing in the holy place Beloved , the Lord has given us an amazing perspective from which to view time and eternity the life which now is , and that which is to come .', 'The signs are great and they are everywhere .', ""Just as though we had not sent them and every other media outlet a weekly news release every week for 17 years entitled , `` Week so-and-so of the Great Gage Park Decency Drive , '' the latest such news release being sent forth to all media last Friday , Oct. 12 with an opening line for all the world to see ; to wit : `` WBC observes WEEK 851 ( nearly 17 years ) of protests against public sodomy at Gage Park , Oct ."", 'Our experience at Gage Park just a few blocks from our church , where we have been located by the amazing providence of God , and where we have preached every week for 52 years I say that our experience at Gage Park in Topeka , Kansas , at the very heart and geographical center of the United States and of the world proves that THE END OF THE WORLD IS NEAR THE COMING OF THE LORD ( AND OUR REDEMPTION ) DRAWETH NIGH .', ""Here is the verse ; to wit : `` But when ye shall see the abomination of desolation , spoken of by Daniel the prophet , standing where it ought not , '' the end is near ."", ""And the companion verse ; to wit : `` When ye therefore shall see the abomination of desolation , spoken of by Daniel the prophet , stand in the holy place , '' the end is near ."", ""23:17,18 ) Further proof that the abomination of desolation refers to sodomites or fags or dogs or the power of the dog , or the socio-political/socio-religious power of fags , I say further proof is seen in the words of Daniel referred to by our Lord Jesus Christ where He says , `` the abomination of desolation , SPOKEN OF BY DANIEL THE PROPHET . ''"", 'Fag fornicating is always barren fornicating , desolate , totally unproductive , forever sterile there are many kinds of ceremonial and moral abominations ; but only one that is always , totally , and forever the abomination of desolation ; to wit : fags .', ""In the now-19 year old saga of `` THE GREAT GAGE PARK DECENCY DRIVE '' we are dealing with `` the power of the dog . ''"", ""We did not know it at the time , but that letter launched the epochal struggle that later became known as THE GREAT GAGE PARK DECENCY DRIVE and , in a way , signaled the end of the world to those with eyes to see , which is the meaning of the parenthetical words of the Lord Jesus , `` let him that readeth understand . ''"", 'Dear Friends : A malodorous sore with the scab off is open and running at the extreme southwest corner of Gage Park .', ""`At any hour of the day or night , ' a park official told me , `male couples may be seen entering and exiting the area . '"", ""In preparation for the presidential visit and lest the national media focus on the shameful running sore of Topeka 's Gage Park the area was purged of its unnatural visitors for about a month prior to and including the day of Reagan 's visit ."", ""Sunday , October 14 , 2007 pg.4 Sermon Outline Last week , on Fri. , Oct. 5 , a story in the paper , headlined , `` Two Arrested in Sex Sting , '' said : `` two Topeka men were arrested in connection with solicitation of sodomy in Gage Park during a prostitution sting operation by the Topeka Police Dept ."", ""So it was at Sodom ; to wit : `` Even as Sodom and Gomorrah , and the cities about them in like manner , giving themselves over to fornication , and going after strange flesh , are set forth for an example , suffering the vengeance of eternal fire . ''"", '( Jude 7 ) And our Lord Jesus said that when those conditions prevail as they did in Sodom and Gomorrah such would signal the approaching end of the world as when you see the abomination of desolation standing in the holy place and standing where it ought not ; to wit : `` Likewise also as it was in the days of Lot ; they did eat , they drank , they bought , they sold , they planted , they builded ( a vibrant , thriving society , like the USA ) ; But the same day that Lot went out of Sodom it rained fire and brimstone from heaven , and destroyed them all .', ', every level of society ) : And they called unto Lot , and said unto him , Where are the men which came in to thee this night ?']"
3,./data_dsicap/WBC/raw/WestboroBaptist_Sermon_20070902.pdf.txt,"['We have picketed fags in Idaho many times and each time have been despised and rejected by the people of Idaho , who have always sided with the fags .', "", if ye will not treat WBC with the honor and respect due her members as messengers of God Almighty , sent to warn America of her sodomite sins ) if ye will not do so , ye have sinned against the Lord : and be sure your sin will find you out . ''"", 'We have no doubt that many others in the Senate and in the House are as guilty as Sen. Craig .', 'Furthermore , the Fag-Enablers in the Senate and the House as well as the Fag-Enablers in Idaho who voted Craig into Congress again and again for some 30 years , despite knowing full well about his sodomite ways are just as guilty or guiltier !', ', the Tribe ; and the geographical territory ; and the political State with its governing structure ; and the population ; also sometimes called Benjamites , and the Children of Benjamin ) I say , Benjamin was a Fag-Enabler in spades !', 'The story of Gibeah goes like this : A very unremarkable , nondescript man was headed home with his whorish concubine and her servant and two donkeys , when darkness overtook them , and they were herded by divine Providence into the mean-spirited and demonic little fag town of Gibeah of Benjamin ; to wit : `` And they passed on and went their way ; and the sun went down upon them when they were by Gibeah , which belongeth to Benjamin .', 'It seems that Cities take on distinctive characters from their inhabitants in the aggregate , for which they are known in time and eternity ; e.g .', ""Sunday , September 2 , 2007 pg.3 Sermon Outline Back to our story of the Levite and his concubine in Gibeah : Eventually , an old man took them into his house for the night , where the following atrocity was committed by the fag beasts of Gibeah ; to wit : `` Now as they were making their hearts merry , behold , the men of the city , certain sons of Belial , beset the house round about , and beat at the door , and spake to the master of the house , the old man , saying , Bring forth the man that came into thine house , that we may know him . ''"", 'The Levite took his dead concubine home , `` And when he was come into his house , he took a knife and laid hold on his concubine , and divided her , together with her bones , into twelve pieces , and sent her into all the coasts of Israel .', 'They actually went to war against all the other tribes of Israel , rather than surrender a few murdering sons of Belial who were guilty as dogs !', 'And here is the plain application of that Bible Doctrine to current events on the ground ; to wit : Sen. Craig is the Fag ; and Idaho is the Fag-Enabler and/or , the U.S. Senate is the Fag-Enabler .']"
4,./data_dsicap/WBC/raw/WestboroBaptist_Sermon_20080420.pdf.txt,"[""And right in the big middle of it all is the happiest of all thoughts ; to wit : That God will `` take '' us even as He `` took '' Enoch , to not only be with Him forever in Heaven , but that , we shall reign with Him over the wicked and sit with Him as fellow judges with Him , in judging the hateful persecutors of earth ."", ""Now this wonderful text points us immediately and directly to the majestic language of the Holy Spirit in the glorious resurrection chapter in 1 Corinthians 15 ; to wit : `` Behold , I show you a mystery ; We shall not all sleep , but we shall all be changed , '' ( Job said , `` If a man die , shall he live again ?"", ""Beloved , our Jubilee has come at last , when we are finally set free from all our sins and afflictions and the wrath of man which we have suffered for so long in our service for the King , `` choosing rather to suffer affliction with the people of God , than to enjoy the pleasures of sin for a season ; Esteeming the reproach of Christ greater riches than the treasures in Egypt '' ."", ""Sinai was so traumatizing , that even the mighty Moses is reported by the apostle to the New Testament church as saying , `` I exceedingly fear and quake . ''"", ""And , what is more sobering to us in the church age , is the fact that our Lord Jesus Christ is represented as speaking to the churches in this dispensation with a great voice , as of a TRUMPET ; to wit : `` I was in the spirit on the Lord 's day , and heard behind me a great voice AS OF A TRUMPET , Saying , I am Alpha and Omega , the first and the last ; and , What thou seest , write in a book , and send it unto the seven churches which are in Asia . ''"", ""And , `` After this I looked , and , behold , a door was opened in heaven ; and the first voice which I heard was as it were of a TRUMPET talking with me ; which said , Come up hither , and I will show thee things which must be hereafter . ''"", ""And , the final and unspeakable woes upon doomed mankind are announced by angels utilizing trumpets ; to wit : Sunday , April 20 , 2008 page 3 Sermon Outline `` And I beheld , and heard an angel flying through the midst of heaven , saying with a loud voice , Woe , woe , woe , to the inhabiters of the earth by reason of the other VOICES OF THE TRUMPET of the three angels , which are yet to sound ! ''"", '8:13 ) And , the apostle intimates that the doctrine of the LAST TRUMPET , and the glorious happenings in heaven and earth in connection therewith , are calculated to comfort the suffering saints as nothing else can ; to wit : `` For the Lord himself shall descend from heaven with a shout , with the voice of the archangel , and with the TRUMP OF GOD ; and the dead in Christ shall rise first ; Then we which are alive and remain shall be caught up together with them in the clouds , to meet the Lord in the air ; and so shall we ever be with the Lord ( irrespective of all the abstruse or obscure nuances of eschatology the recondite doctrines of last things SO SHALL WE EVER BE WITH THE LORD ! )', 'So when this corruptible shall have put on incorruption , and this mortal shall have put on immortality , then shall be brought to pass the saying that is written , Death is swallowed up in victory .', ""49:14 , `The upright shall have dominion over them in the morning , ' that is , of the resurrection ; they counted their lives madness and folly , but now they are exalted ; partly to make amends for the perverse censures of worldly men ; now they are judged every day , counted the off-scouring and reproach of men ; but then the Lord will clear up their innocency , and they shall sit as Justices with the Judge upon the Bench ."", 'Now for the top slice of bread , a/k/a verse 13 , to complete the sandwich ; to wit : `` This their way is their folly ; yet their posterity approve their sayings .', ""Benjamin Franklin was a womanizing old fool all his days , who rejected Christ and the Bible , and thought the nation was better off without what the Puritans of his day called , `` Sincere Christianity '' meaning that it was a dangerous thing to REALLY BELIEVE what the Bible says ."", '`` And the kingdom and dominion , and the greatness of the kingdom under the whole heaven , shall be given to the people of the saints of the most High , whose kingdom is an everlasting kingdom , and all dominions shall serve and obey him .']"
