,groupId,files,timeRun,keywords,perPos,perNeg,perPosDoc,perNegDoc,PSJudge,judgementCount,judgementFrac,nous,vous,je,ils,il,elle,le,avgSD,avgEVC,groupName,Unnamed: 0,rank,rfPred,rfClassPred,svmPred,svmClassPred
0,YV02_test,1,1.3095228672,"yoga, ceremoni, eat, sleep, satchidananda, sake, don't, swami, spiritu, sri",0.0265780730897,0.00332225913621,1.0,0.0,0.611111111111,13.0,0.722222222222,0.00996677740864,0.0199335548173,0.0332225913621,0.0265780730897,0.0,0.0,0.00332225913621,0.78027555358,0.579184715841,YV02,127,4,2.98,1,3.08763522811,3
4,piper81 041781_test,1,2.93513989449,"thief, jesus, save, penit, paradis, wrong, fear, god, say, thiev",0.0258342303552,0.037674919268,0.0,1.0,0.487179487179,85.0,0.726495726496,0.018837459634,0.0139935414424,0.0139935414424,0.00861141011841,0.034983853606,0.0,0.00914962325081,0.67291941053,0.713595475237,piper81 041781,45,3,3.49,3,2.51724808351,3
8,piper85 pn850005_test,1,5.1203148365,"sing, jehoshaphat, judah, vers, lord, god, satan, worship, thi, prais",0.0246626337832,0.0228013029316,1.0,0.0,0.472573839662,187.0,0.789029535865,0.0216379711494,0.0169846440205,0.00814332247557,0.0221033038623,0.0169846440205,0.00279199627734,0.00697999069335,0.682842620148,0.719528746324,piper85 pn850005,47,3,2.83333333333,2,2.02463333525,2
14,MalcolmX-LettersFromAbroad_test,1,2.8272190094,"nigeria, mecca, racism, malcolm, brotherhood, abroad, color, muslim, ghana, sincer",0.0205669816565,0.0166759310728,1.0,0.0,0.458333333333,51.0,0.708333333333,0.0105614230128,0.000555864369094,0.0322401334074,0.0111172873819,0.00667037242913,0.00111172873819,0.0100055586437,0.747160542698,0.611114085611,MalcolmX-LettersFromAbroad,81,3,3.22666666667,3,3.32831166303,3
20,a-different-gospel-steve-shepherd-sermon-on-false-teaching-161833.asp_test,1,3.3506398201,"gospel, hell, say, jesus, preach, christ, knife, don, pleas, tri",0.0268980477223,0.0325379609544,0.0,1.0,0.282296650718,124.0,0.593301435407,0.00824295010846,0.0125813449024,0.0208242950108,0.00997830802603,0.0225596529284,0.00260303687636,0.0156182212581,0.654730816986,0.586214587548,a-different-gospel-steve-shepherd-sermon-on-false-teaching-161833.asp,93,1,4.09666666667,3,2.99690123527,3
24,SS14_test,1,1.39108204842,"vessel, thunder, poacher, crew, chase, gear, endur, illeg, monday, rescu",0.0356234096692,0.030534351145,1.0,0.0,0.47619047619,17.0,0.809523809524,0.0814249363868,0.00508905852417,0.0,0.0101781170483,0.0,0.0152671755725,0.00254452926209,0.81871315433,0.647116918527,SS14,125,3,2.72,2,2.92611334161,2
25,YV01_test,1,1.33838510513,"sannyasin, yoga, sannya, renounc, sri, satchidananda, monk, dress, “the, ceremoni",0.00547945205479,0.00821917808219,0.0,1.0,0.409090909091,13.0,0.590909090909,0.0027397260274,0.0,0.0,0.0328767123288,0.0109589041096,0.00547945205479,0.0027397260274,0.742492237834,0.502723161424,YV01,126,3,2.68333333333,3,2.68993582482,3
26,piper94 07-10-94_test,1,3.99618887901,"love, homosexu, say, command, fulfil, scriptur, keep, god, greg, violat",0.0492113564669,0.0261829652997,1.0,0.0,0.494186046512,119.0,0.691860465116,0.0331230283912,0.00694006309148,0.00851735015773,0.011356466877,0.00883280757098,0.00410094637224,0.00946372239748,0.722014630755,0.636675363489,piper94 07-10-94,54,2,3.70333333333,4,3.25383521167,2
27,piper90 01-28-90_test,1,3.26287317276,"gospel, preach, fulfil, jesus, god, matthew, ministri, glori, isaiah, repent",0.0205106739221,0.0108832147342,1.0,0.0,0.483050847458,83.0,0.703389830508,0.0121389702805,0.00251151109251,0.00460443700293,0.00460443700293,0.0334868145668,0.0,0.00795311845961,0.786116279407,0.834559504194,piper90 01-28-90,52,4,3.61333333333,3,3.25300109873,3
34,"2001-11-11 Microbes and Peter Rabbit, Rev. Mark Belletini.htm_test",1,0.868293046951,"tree, potter, unitarian, beatrix, lichen, mind, hound, lifemarri, farreach, imit",0.025641025641,0.021978021978,1.0,0.0,0.538461538462,9.0,0.692307692308,0.00732600732601,0.003663003663,0.025641025641,0.018315018315,0.0,0.018315018315,0.0,0.00556409095836,0.537620456564,"2001-11-11 Microbes and Peter Rabbit, Rev. Mark Belletini.htm",102,2,2.48333333333,3,3.47021652995,3
39,ACLU11_test,1,1.60438418388,"voter, kobach, regist, vote, registr, judg, restrict, kansa, citizenship, add",0.00759013282732,0.0265654648956,0.0,1.0,0.588235294118,10.0,0.588235294118,0.0,0.0,0.0,0.0379506641366,0.011385199241,0.0,0.00189753320683,0.63053660692,0.553391120255,ACLU11,149,3,1.92666666667,1,2.47496921531,3
43,SS12_test,1,2.53982186317,"costa, rican, coco, illeg, shepherd, arrest, vessel, guatemalan, charg, rica",0.0115321252059,0.0219659527732,0.0,1.0,0.44578313253,56.0,0.674698795181,0.0175727622186,0.0,0.0236133992312,0.0126304228446,0.00054914881933,0.0,0.00604063701263,0.693964017822,0.628273480924,SS12,123,1,2.04,3,1.36908264239,1
48,SS09_test,1,1.23098111153,"shepherd, pamela, anderson, seal, slaughter, babi, orca, whale, newfoundland, salmon",0.0155763239875,0.0155763239875,0.0,1.0,0.818181818182,10.0,0.909090909091,0.018691588785,0.0,0.00934579439252,0.0,0.0,0.0249221183801,0.00311526479751,0.80628722103,0.609438581614,SS09,120,2,2.77666666667,2,3.14489370175,3
52,291.html_test,1,2.05258703232,"smell, relief, walk, swim, hang, babi, stanley, garden, harlem, hot",0.0307062436029,0.028659160696,1.0,0.0,0.325581395349,29.0,0.674418604651,0.0112589559877,0.00204708290686,0.00614124872057,0.014329580348,0.00409416581372,0.0102354145343,0.00921187308086,0.794939150267,0.710015848458,291.html,31,4,3.26,3,2.55795172561,3
54,how-to-bless-america-steve-shepherd-sermon-on-independence-day-69779.asp_test,1,4.54056382179,"don, ill, bless, government, said, ask, attitud, want, mph, whi",0.0417189460477,0.0185069008783,1.0,0.0,0.126237623762,187.0,0.462871287129,0.0207026348808,0.017252195734,0.0228983688833,0.00752823086575,0.0100376411543,0.00752823086575,0.0131744040151,0.679444321559,0.508677204049,how-to-bless-america-steve-shepherd-sermon-on-independence-day-69779.asp,96,3,4.98666666667,4,4.83000523104,4
56,MalcolmX-TheBallotortheBullet_test,1,11.1576161385,"get, let, negro, bullet, got, ballot, segreg, malcolm, whi, civilright",0.0184800664452,0.0144310631229,1.0,0.0,0.265342960289,435.0,0.785198555957,0.0192068106312,0.03176910299,0.0129775747508,0.0140157807309,0.015988372093,0.00103820598007,0.0179609634551,0.694507023477,0.681160395609,MalcolmX-TheBallotortheBullet,84,2,3.65,2,3.29757625173,2
59,piper97 10-19-97_test,1,3.17659306526,"coven, shepherd, god, vers, etern, grace, christ, pleas, want, glori",0.0310734463277,0.0193032015066,1.0,0.0,0.406504065041,81.0,0.658536585366,0.0235404896422,0.0287193973635,0.0112994350282,0.00141242937853,0.0338983050847,0.0,0.00706214689266,0.633390479859,0.623267788082,piper97 10-19-97,57,3,3.47333333333,3,3.30092651397,3
62,YV04_test,1,2.83721208572,"mind, yoga, calm, clean, whi, medit, want, don't, sutra, everyth",0.0382059800664,0.00830564784053,1.0,0.0,0.350993377483,102.0,0.675496688742,0.0227021040975,0.0581395348837,0.00221483942414,0.000553709856035,0.00166112956811,0.000553709856035,0.014950166113,0.719693877707,0.714655700116,YV04,129,3,5.20666666667,4,4.14800620129,4
63,"2014-12-07 Is Hope Simply Wishful Thinking, Rev. Mark Belletini_test",1,5.94560694695,"hope, danc, sermon, jump, bad, morn, get, ask, hear, joy",0.0292850990525,0.0191645133506,1.0,0.0,0.291512915129,201.0,0.741697416974,0.0191645133506,0.0144272179156,0.0325150732127,0.015503875969,0.00172265288544,0.00172265288544,0.0152885443583,0.645319433209,0.617199416127,"2014-12-07 Is Hope Simply Wishful Thinking, Rev. Mark Belletini",110,5,4.63,5,4.33643254349,5
67,mapping-out-the-new-year-steve-shepherd-sermon-on-new-years-day-142575.asp_test,1,4.03545594215,"gps, lord, trust, happi, pray, husband, step, get, seek, prayer",0.0301783264746,0.0181755829904,1.0,0.0,0.240875912409,181.0,0.660583941606,0.0356652949246,0.0130315500686,0.0168038408779,0.00548696844993,0.031207133059,0.0161179698217,0.00891632373114,0.669395131962,0.596822233112,mapping-out-the-new-year-steve-shepherd-sermon-on-new-years-day-142575.asp,97,5,4.52,5,3.81874976912,4
68,SS07_test,1,1.55543398857,"net, totoaba, illeg, gear, farley, weather, endang, mowat, find, fish",0.0282828282828,0.030303030303,0.0,1.0,0.541666666667,14.0,0.583333333333,0.0323232323232,0.0,0.0,0.00606060606061,0.0,0.0,0.00606060606061,0.791281404891,0.801489295722,SS07,118,2,2.57666666667,2,2.12283087734,3
70,MalcolmX-MessagetotheGrassRoots_test,1,7.04847192764,"negro, got, get, let, talk, tom, master, know, say, malcolm",0.0166527893422,0.0214820982515,0.0,1.0,0.304136253041,314.0,0.76399026764,0.0121565362198,0.034304746045,0.0108243130724,0.0274771024147,0.0158201498751,0.00116569525396,0.0184845961699,0.713638526757,0.54987988973,MalcolmX-MessagetotheGrassRoots,82,2,2.42333333333,2,2.52403513824,2
74,wgV2n3-2_test,1,1.76435184479,"brother, avatar, savior, dawn, fear, inhuman, lord, selfish, pain, save",0.04625,0.03375,1.0,0.0,0.826086956522,21.0,0.913043478261,0.09125,0.0,0.00125,0.0,0.03,0.0,0.005,0.761780959047,0.624718088698,wgV2n3-2,70,5,2.95,2,2.93882876439,4
76,296.html_test,1,1.33872914314,"liturg, pray, prayer, christ, liturgi, mystic, laiti, injustic, campion, complin",0.00686498855835,0.0183066361556,0.0,1.0,0.51724137931,20.0,0.689655172414,0.0800915331808,0.00228832951945,0.00228832951945,0.00228832951945,0.0045766590389,0.00228832951945,0.0137299771167,0.77287259817,0.587619690619,296.html,32,5,3.51666666667,2,3.07805193501,2
77,SS01_test,1,1.35385203362,"vaquita, shepherd, gift, illeg, marin, save, porpois, whale, countless, gill",0.020325203252,0.0182926829268,1.0,0.0,0.35,13.0,0.65,0.020325203252,0.0121951219512,0.0020325203252,0.0,0.0,0.0,0.0020325203252,0.742442406862,0.588484581691,SS01,112,1,2.82333333333,3,1.69059932855,2
78,MalcolmX-AfterTheBombing_test,1,10.2799181938,"negro, get, know, got, hate, thing, say, tri, want, ourselv",0.0149876042371,0.0205093531666,0.0,1.0,0.318637274549,383.0,0.76753507014,0.0161144917737,0.0259184133423,0.0218616182105,0.0268199233716,0.0132972729322,0.0,0.0153256704981,0.689482084124,0.544888486371,MalcolmX-AfterTheBombing,88,2,2.6,2,2.29361005985,2
80,200.html_test,1,0.723555803299,"convers, address, noth, communist, talk, strang, sure, profess, opium, whi",0.0181818181818,0.0181818181818,0.0,1.0,0.478260869565,18.0,0.782608695652,0.0025974025974,0.0103896103896,0.0,0.0025974025974,0.0,0.0467532467532,0.0285714285714,-0.28844617007,0.598822570499,200.html,28,3,4.04333333333,3,3.47023620907,3
82,MalcolmX-ProspectsForFreedomin1965_test,1,4.40400314331,"get, civilright, noth, explos, promis, ake, harlem, oppress, prospect, malcolm",0.0210692652094,0.0221227284698,0.0,1.0,0.191489361702,153.0,0.651063829787,0.0152752172768,0.00948116934422,0.0163286805373,0.0281801422175,0.00421385304188,0.00131682907559,0.0186989728733,0.724859519289,0.588176520005,MalcolmX-ProspectsForFreedomin1965,83,2,2.90333333333,2,2.40227560794,2
87,SS05_test,1,1.85020804405,"seaworld, hsus, orca, manbi, pacell, keiko, condemn, profit, will, dolphin",0.0275229357798,0.0336391437309,0.0,1.0,0.456140350877,34.0,0.59649122807,0.00407747196738,0.0,0.00407747196738,0.0346585117227,0.0112130479103,0.0,0.00917431192661,0.679501551603,0.531921212903,SS05,116,2,2.82333333333,3,2.0405084826,1
88,339.html_test,1,2.39190602303,"get, worker, strike, bridg, dinner, sock, christma, thing, meet, paper",0.0231809401159,0.0218931101095,1.0,0.0,0.540540540541,66.0,0.891891891892,0.0302640051513,0.0186735350934,0.00965872504829,0.0148100450741,0.0212491951062,0.00193174500966,0.00579523502898,0.774665864827,0.504995744916,339.html,33,3,2.69,3,2.97609761833,5
90,ACLU07_test,1,2.21718096733,"camp, polic, dakota, protector, morton, surveil, pipelin, sheriff, roadblock, vehicl",0.0102702702703,0.0151351351351,0.0,1.0,0.391304347826,27.0,0.391304347826,0.00216216216216,0.000540540540541,0.0,0.0113513513514,0.00108108108108,0.0,0.00594594594595,0.580356663517,0.723923388205,ACLU07,145,3,2.71666666667,3,2.99736527835,3
92,12.html_test,1,1.31433200836,"radic, print, sent, worker, sheet, wander, dollar, rememb, donat, encycl",0.022641509434,0.011320754717,1.0,0.0,0.344827586207,17.0,0.586206896552,0.0132075471698,0.0,0.0,0.0207547169811,0.00566037735849,0.0,0.0188679245283,0.755227094453,0.571646121949,12.html,26,3,4.16333333333,3,3.85828331387,3
93,564.html_test,1,1.53121995926,"loneli, worker, farm, quarrel, dispel, ward, appeal, erupt, prison, grace",0.0343878954608,0.0275103163686,1.0,0.0,0.333333333333,28.0,0.622222222222,0.0316368638239,0.00687757909216,0.0110041265475,0.00275103163686,0.0041265474553,0.0041265474553,0.0137551581843,0.770762547247,0.469079468926,564.html,38,3,4.13,4,3.85158597504,4
94,journal.01.07.05_test,1,1.75933098793,"baba, grace, inner, happen, creed, done, met, lad, away, touch",0.0308924485126,0.0091533180778,1.0,0.0,0.6875,30.0,0.9375,0.0114416475973,0.0,0.0160183066362,0.0297482837529,0.045766590389,0.0,0.00343249427918,0.674897463383,0.447411743688,journal.01.07.05,61,5,3.42,3,3.64772980626,3
100,YV12_test,1,1.14946818352,"yantra, medit, faith, yoga, cosmos, divin, petal, path, express, god",0.037037037037,0.00617283950617,1.0,0.0,0.411764705882,7.0,0.411764705882,0.00617283950617,0.00617283950617,0.0,0.00617283950617,0.00617283950617,0.0,0.0154320987654,0.83890291239,0.608677116584,YV12,137,6,4.84,3,4.26452270081,4
102,remembering-9-11-steve-shepherd-sermon-on-america-160100.asp_test,1,3.6110188961,"happen, evil, look, whi, want, perfect, devil, lord, sept, get",0.0233017377567,0.0410742496051,0.0,1.0,0.0931174089069,144.0,0.291497975709,0.022906793049,0.0177725118483,0.0181674565561,0.010663507109,0.0165876777251,0.00276461295419,0.00987361769352,0.63838647683,0.576861251879,remembering-9-11-steve-shepherd-sermon-on-america-160100.asp,99,3,3.4,3,3.29632520156,4
