,groupId,files,timeRun,keywords,perPos,perNeg,perPosDoc,perNegDoc,PSJudge,judgementCount,judgementFrac,nous,vous,je,ils,il,elle,le,avgSD,avgEVC,groupName,Unnamed: 0,rank,rfPred,rfClassPred,svmPred,svmClassPred
8,ACLU04_test,1,1.8082690239,"cbp, fbi, assess, search, vulner, document, target, agenc, ask, question",0.00865384615385,0.0201923076923,0.0,1.0,0.4,17.0,0.425,0.00384615384615,0.00192307692308,0.0,0.0230769230769,0.0,0.0,0.00576923076923,0.665448761082,0.442937413482,ACLU04,142,3,2.12,3,2.86577552194,3
11,651.html_test,1,1.46762108803,"sudden, ask, job, met, simm, knew, policeman, polic, household, obituari",0.0180921052632,0.0180921052632,0.0,1.0,0.411764705882,27.0,0.794117647059,0.00986842105263,0.0,0.00328947368421,0.00986842105263,0.0740131578947,0.0180921052632,0.00657894736842,0.812209525339,0.599278229852,651.html,39,4,3.23,3,3.78231449702,3
12,piper99 4-4-99_test,1,2.9393799305,"condemn, christ, sinner, guilti, righteous, jesus, answer, god, judg, vers",0.0368709516692,0.0333831589437,1.0,0.0,0.402777777778,83.0,0.576388888889,0.0264075734928,0.0114598903837,0.0224215246637,0.000996512207275,0.02192326856,0.0,0.0119581464873,0.607660163698,0.528360248967,piper99 4-4-99,60,3,3.31666666667,3,3.02320972092,3
16,you-adulterous-people-steve-shepherd-sermon-on-adultery-165397.asp_test,1,3.34604215622,"adulteri, don, devil, fear, get, anger, friendship, satan, spiritu, want",0.0299760191847,0.0363709032774,0.0,1.0,0.194552529183,154.0,0.599221789883,0.0203836930456,0.0219824140687,0.0231814548361,0.0159872102318,0.0227817745803,0.00519584332534,0.00759392486011,0.648898136611,0.489921290693,you-adulterous-people-steve-shepherd-sermon-on-adultery-165397.asp,101,2,3.78,3,2.67974817647,3
26,a-different-gospel-steve-shepherd-sermon-on-false-teaching-161833.asp_test,1,3.14959812164,"gospel, hell, say, jesus, preach, christ, knife, don, pleas, tri",0.0268980477223,0.0325379609544,0.0,1.0,0.282296650718,124.0,0.593301435407,0.00824295010846,0.0125813449024,0.0208242950108,0.00997830802603,0.0225596529284,0.00260303687636,0.0156182212581,0.657418124861,0.586214587548,a-different-gospel-steve-shepherd-sermon-on-false-teaching-161833.asp,93,1,3.69,3,2.92626712176,3
31,"2007-11-11 Spiritual Claustrophobia, Rev. Mark Belletini.PDF_test",1,5.3860669136,"experi, dont, let, theolog, els, hallway, tell, wrong, realli, too",0.0243632336656,0.0190476190476,1.0,0.0,0.203045685279,233.0,0.591370558376,0.0148394241417,0.0104097452935,0.0423034330011,0.00863787375415,0.00398671096346,0.00996677740864,0.0126245847176,0.680896088229,0.514337817248,"2007-11-11 Spiritual Claustrophobia, Rev. Mark Belletini.PDF",107,7,3.97,2,4.1689388543,5
39,piper99 12-12-99_test,1,3.23920106888,"reconcil, vers, save, wrath, god, shall, christ, enemi, rescu, justifi",0.0267489711934,0.022633744856,1.0,0.0,0.496551724138,117.0,0.806896551724,0.0411522633745,0.0238683127572,0.00329218106996,0.00246913580247,0.043621399177,0.0,0.00987654320988,0.645491047132,0.646481448274,piper99 12-12-99,59,4,3.05,3,3.75040018724,3
51,piper89 4-7-89_test,1,2.80349397659,"womb, job, unborn, abort, god, innoc, shall, psalm, yuml, blood",0.0223234624146,0.0464692482916,0.0,1.0,0.353846153846,68.0,0.523076923077,0.00911161731207,0.00455580865604,0.0132118451025,0.00956719817768,0.0173120728929,0.0,0.0123006833713,0.657403913608,0.535040143732,piper89 4-7-89,50,5,3.0,3,2.44815032651,3
53,SS13_test,1,2.5914709568,"whale, seal, “human, “sustain, harvest, slaughter, club, eat, “conserv, fish",0.0180754917597,0.0425305688464,0.0,1.0,0.311926605505,65.0,0.596330275229,0.0154173312068,0.00478468899522,0.00744284954811,0.0127591706539,0.000531632110579,0.000531632110579,0.016480595428,0.69090088748,0.507854515709,SS13,124,1,2.73333333333,3,2.08548616888,3
54,how-to-bless-america-steve-shepherd-sermon-on-independence-day-69779.asp_test,1,3.93575000763,"don, ill, bless, government, said, ask, attitud, want, mph, whi",0.0417189460477,0.0185069008783,1.0,0.0,0.126237623762,187.0,0.462871287129,0.0207026348808,0.017252195734,0.0228983688833,0.00752823086575,0.0100376411543,0.00752823086575,0.0131744040151,0.681953471309,0.508677204049,how-to-bless-america-steve-shepherd-sermon-on-independence-day-69779.asp,96,3,4.50666666667,4,4.16186109922,4
56,YV04_test,1,2.83973193169,"mind, yoga, calm, clean, whi, medit, want, don't, sutra, everyth",0.0382059800664,0.00830564784053,1.0,0.0,0.350993377483,102.0,0.675496688742,0.0227021040975,0.0581395348837,0.00221483942414,0.000553709856035,0.00166112956811,0.000553709856035,0.014950166113,0.717465401078,0.714655700116,YV04,129,3,5.58666666667,7,4.08930464611,4
57,"2014-03-16 Guns Directness Controlling Sensitivity, Rev. Mark Belletini.pdf_test",1,5.19029688835,"gun, rabbi, congreg, kaddish, ask, say, alphabet, dan, talk, too",0.0240109764464,0.0160073176309,1.0,0.0,0.254166666667,168.0,0.7,0.0187514292248,0.00617425108621,0.0338440429911,0.00983306654471,0.00891836268008,0.0036588154585,0.00686027898468,0.645435858805,0.584276725375,"2014-03-16 Guns Directness Controlling Sensitivity, Rev. Mark Belletini.pdf",109,5,3.73666666667,5,4.12018979478,5
58,piper89 6-4-89_test,1,3.01894688606,"jesus, woman, sabbath, abraham, women, synagogu, want, say, husband, look",0.0288544358312,0.0159345391904,1.0,0.0,0.417218543046,106.0,0.701986754967,0.0142118863049,0.0193798449612,0.0021533161068,0.010766580534,0.0292850990525,0.0111972437554,0.0116279069767,0.68072230103,0.566452437182,piper89 6-4-89,51,3,4.40333333333,5,4.37384988721,5
64,MalcolmX-LastAnswersAndInterviews_test,1,12.3274769783,"malcolm, get, answer, think, racism, say, feel, negro, racist, interview",0.0136371482824,0.022009321595,0.0,1.0,0.309033280507,486.0,0.770206022187,0.00871741757293,0.0184705679268,0.0243397203521,0.0182979457967,0.01648541343,0.00060417745555,0.0156223027792,0.668288481725,0.545841172708,MalcolmX-LastAnswersAndInterviews,92,2,2.54,2,2.21423147939,2
67,journal.02.04.09_test,1,2.03548812866,"meher, realiz, baba, saint, spiritu, sincer, know, man, question, inquir",0.0313043478261,0.0130434782609,1.0,0.0,0.490196078431,37.0,0.725490196078,0.0,0.00173913043478,0.00782608695652,0.0095652173913,0.0365217391304,0.0,0.00869565217391,0.688744826078,0.571087679161,journal.02.04.09,62,6,4.47333333333,3,4.59113861417,5
70,piper95 12-03-95_test,1,2.43914794922,"vers, worship, fresh, christ, pleas, encourag, congreg, pray, godcent, uniti",0.0356484326982,0.00860479409957,1.0,0.0,0.428571428571,48.0,0.685714285714,0.0295021511985,0.00245851259988,0.00307314074985,0.00614628149969,0.0122925629994,0.0,0.00491702519975,0.727678062446,0.696327448264,piper95 12-03-95,56,2,3.86666666667,3,2.89713972984,2
76,wgV2n3-2_test,1,1.70879006386,"brother, avatar, savior, dawn, fear, inhuman, lord, selfish, pain, save",0.04625,0.03375,1.0,0.0,0.826086956522,21.0,0.913043478261,0.09125,0.0,0.00125,0.0,0.03,0.0,0.005,0.758271703655,0.624718088698,wgV2n3-2,70,5,2.81,3,2.69579750422,2
77,MalcolmX-TheHarlemHateGang_test,1,3.79148983955,"polic, harlem, nonviol, realiz, get, hategang, blood, oppressor, negro, malcolm",0.0123818833496,0.0234604105572,0.0,1.0,0.242937853107,128.0,0.723163841808,0.00879765395894,0.0153144346693,0.0215053763441,0.0260671228413,0.0149885956338,0.0,0.0159661127403,0.716359777473,0.552851283806,MalcolmX-TheHarlemHateGang,86,2,2.73333333333,2,2.23548176104,2
79,good-news-bad-news-steve-shepherd-sermon-on-doing-gods-will-32921.asp_test,1,3.4868710041,"bad, fire, evil, brandon, want, put, need, good, preacher, lit",0.0278824415976,0.0388093443858,0.0,1.0,0.18152866242,147.0,0.468152866242,0.035418236624,0.00640542577242,0.0211002260739,0.00753579502638,0.0128108515448,0.00263752825923,0.00979653353429,0.653615053538,0.471404768228,good-news-bad-news-steve-shepherd-sermon-on-doing-gods-will-32921.asp,95,4,3.48,3,2.87908597518,3
82,MalcolmX-AfterTheBombing_test,1,9.35945081711,"negro, get, know, got, hate, thing, say, tri, want, ourselv",0.0149876042371,0.0205093531666,0.0,1.0,0.318637274549,383.0,0.76753507014,0.0161144917737,0.0259184133423,0.0218616182105,0.0268199233716,0.0132972729322,0.0,0.0153256704981,0.690517111797,0.544888486371,MalcolmX-AfterTheBombing,88,2,2.71,2,2.06280835655,2
84,200.html_test,1,0.745000123978,"convers, address, noth, communist, talk, strang, sure, profess, opium, whi",0.0181818181818,0.0181818181818,0.0,1.0,0.478260869565,18.0,0.782608695652,0.0025974025974,0.0103896103896,0.0,0.0025974025974,0.0,0.0467532467532,0.0285714285714,-0.288634475523,0.598822570499,200.html,28,3,4.07,3,3.45036734606,3
87,piper2k 1-23-00_test,1,3.52666211128,"abort, babi, whi, excel, dark, deed, vers, let, christ, god",0.0317959468903,0.0359888190077,0.0,1.0,0.375722543353,108.0,0.624277456647,0.0317959468903,0.0132774283718,0.00559049615653,0.00698812019567,0.00873515024458,0.0,0.0083857442348,0.674249206949,0.449454604013,piper2k 1-23-00,41,5,2.95,3,2.21560772962,3
90,SS05_test,1,1.84172701836,"seaworld, hsus, orca, manbi, pacell, keiko, condemn, profit, will, dolphin",0.0275229357798,0.0336391437309,0.0,1.0,0.456140350877,34.0,0.59649122807,0.00407747196738,0.0,0.00407747196738,0.0346585117227,0.0112130479103,0.0,0.00917431192661,0.679060891262,0.531921212903,SS05,116,2,3.1,3,2.23857556945,3
92,ACLU07_test,1,2.30207300186,"camp, polic, dakota, protector, morton, surveil, pipelin, sheriff, roadblock, vehicl",0.0102702702703,0.0151351351351,0.0,1.0,0.391304347826,27.0,0.391304347826,0.00216216216216,0.000540540540541,0.0,0.0113513513514,0.00108108108108,0.0,0.00594594594595,0.577792432133,0.723923388205,ACLU07,145,3,2.36333333333,3,2.56920526331,3
93,YV03_test,1,1.51557993889,"yantra, triangl, manifest, crystal, dot, express, bindhu, mantra, kalaa, shanthi",0.0114942528736,0.00287356321839,1.0,0.0,0.3,23.0,0.46,0.00431034482759,0.0100574712644,0.0014367816092,0.00862068965517,0.0014367816092,0.0014367816092,0.0244252873563,0.750764831265,0.706460240765,YV03,128,3,4.29333333333,3,4.73900897782,6
96,558.html_test,1,1.21456193924,"obedi, poverti, ave, maria, love, rosari, advent, tell, convers, scriptur",0.0509383378016,0.00536193029491,1.0,0.0,0.35,9.0,0.45,0.0214477211796,0.0,0.0,0.0,0.00268096514745,0.0160857908847,0.00268096514745,0.772075522535,0.576540447136,558.html,37,4,3.79666666667,3,3.40250185946,2
99,"2004-08-29 Set Theory for Moderns, Rev. Mark Belletini.PDF_test",1,4.32428193092,"circl, senat, gay, episcop, hope, overlap, funni, venn, say, allard",0.0272263187748,0.0187180941577,1.0,0.0,0.230414746544,134.0,0.617511520737,0.0110606920023,0.00283607487238,0.0300623936472,0.010777084515,0.0144639818491,0.00340328984685,0.0116279069767,0.672938982717,0.536925084448,"2004-08-29 Set Theory for Moderns, Rev. Mark Belletini.PDF",104,3,4.29,4,4.81850739321,5
101,12.html_test,1,1.34280490875,"radic, print, sent, worker, sheet, wander, dollar, rememb, donat, encycl",0.022641509434,0.011320754717,1.0,0.0,0.344827586207,17.0,0.586206896552,0.0132075471698,0.0,0.0,0.0207547169811,0.00566037735849,0.0,0.0188679245283,0.753530760277,0.571646121949,12.html,26,3,4.27333333333,3,5.16568599791,3
103,remembering-9-11-steve-shepherd-sermon-on-america-160100.asp_test,1,3.352602005,"happen, evil, look, whi, want, perfect, devil, lord, sept, get",0.0233017377567,0.0410742496051,0.0,1.0,0.0931174089069,144.0,0.291497975709,0.022906793049,0.0177725118483,0.0181674565561,0.010663507109,0.0165876777251,0.00276461295419,0.00987361769352,0.631594507334,0.576861251879,remembering-9-11-steve-shepherd-sermon-on-america-160100.asp,99,3,3.20333333333,3,3.00431707418,3
106,MalcolmX-ADeclarationofIndependence_test,1,2.52069711685,"malcolm, negro, mosqu, solut, muhammad, inc, muslim, statement, too, ourselv",0.00901984365604,0.0204449789537,0.0,1.0,0.341463414634,67.0,0.817073170732,0.0306674684305,0.0,0.0204449789537,0.0108238123873,0.0204449789537,0.0,0.00781719783524,0.706764493434,0.625664061524,MalcolmX-ADeclarationofIndependence,87,2,2.80666666667,3,2.83237487568,3
110,"2005-07-10 Promoting Acceptance and Spiritual Growth, James Bailey.PDF_test",1,3.45861911774,"mystic, spiritu, accept, sunday, gay, radic, selfaccept, quilt, grandmoth, affirm",0.0192307692308,0.0134615384615,1.0,0.0,0.296774193548,118.0,0.761290322581,0.0192307692308,0.005,0.0457692307692,0.00346153846154,0.00961538461538,0.00846153846154,0.00807692307692,0.673938431277,0.546525072543,"2005-07-10 Promoting Acceptance and Spiritual Growth, James Bailey.PDF",105,5,3.2,2,4.0078723258,5
