,groupId,files,timeRun,keywords,perPos,perNeg,perPosDoc,perNegDoc,PSJudge,judgementCount,judgementFrac,nous,vous,je,ils,il,elle,le,avgSD,avgEVC,groupName,Unnamed: 0,rank,rfPred,rfClassPred,svmPred,svmClassPred
7,ACLU04_test,1,1.83271002769,"cbp, fbi, assess, search, vulner, document, target, agenc, ask, question",0.00865384615385,0.0201923076923,0.0,1.0,0.4,17.0,0.425,0.00384615384615,0.00192307692308,0.0,0.0230769230769,0.0,0.0,0.00576923076923,0.664385820826,0.442937413482,ACLU04,142,3,2.03666666667,3,2.95447327948,3
12,296.html_test,1,1.32395100594,"liturg, pray, prayer, christ, liturgi, mystic, laiti, injustic, campion, complin",0.00686498855835,0.0183066361556,0.0,1.0,0.51724137931,20.0,0.689655172414,0.0800915331808,0.00228832951945,0.00228832951945,0.00228832951945,0.0045766590389,0.00228832951945,0.0137299771167,0.771798446021,0.587619690619,296.html,32,5,3.43,2,2.9746857631,2
14,ACLU03_test,1,1.89117288589,"flint, safe, poison, failur, elementari, ppb, done, drink, appoint, water",0.030303030303,0.0251082251082,1.0,0.0,0.285714285714,25.0,0.446428571429,0.0025974025974,0.004329004329,0.0,0.00952380952381,0.004329004329,0.0,0.0103896103896,0.748825893103,0.47666167497,ACLU03,141,3,4.27333333333,4,3.78696973845,4
16,piper94 09-11-94_test,1,2.97852396965,"bless, vers, evil, insult, inherit, feel, say, grace, hope, futur",0.0522388059701,0.0171202809482,1.0,0.0,0.469565217391,87.0,0.75652173913,0.0377524143986,0.031167690957,0.00438981562774,0.00438981562774,0.0118525021949,0.0,0.00965759438104,0.692466034202,0.607689427771,piper94 09-11-94,55,2,4.23666666667,4,4.00481473313,4
26,MalcolmX-AnAppealtoAfricanHeadsofState_test,1,6.3868560791,"malcolm, negro, uniti, cairo, get, african, confer, here, civilright, afroamerican",0.0244808374135,0.0238055039676,1.0,0.0,0.408510638298,156.0,0.663829787234,0.0194158365693,0.00928583488097,0.00928583488097,0.00877933479656,0.00236366706061,0.00135066689178,0.0111430018572,0.722134832632,0.664602832219,MalcolmX-AnAppealtoAfricanHeadsofState,89,2,3.47,3,2.93058165365,2
27,a-different-gospel-steve-shepherd-sermon-on-false-teaching-161833.asp_test,1,3.1371178627,"gospel, hell, say, jesus, preach, christ, knife, don, pleas, tri",0.0268980477223,0.0325379609544,0.0,1.0,0.282296650718,124.0,0.593301435407,0.00824295010846,0.0125813449024,0.0208242950108,0.00997830802603,0.0225596529284,0.00260303687636,0.0156182212581,0.657110000122,0.586214587548,a-different-gospel-steve-shepherd-sermon-on-false-teaching-161833.asp,93,1,3.95333333333,3,3.18834017593,3
32,YV06_test,1,2.6121969223,"sri, gurudev, swami, satchidananda, spirit, spiritu, messag, uniti, sadhu, doesn't",0.027289266222,0.00727713765919,1.0,0.0,0.352941176471,78.0,0.764705882353,0.0109157064888,0.0133414190418,0.0,0.00667070952092,0.0333535476046,0.00485142510612,0.0127349909036,0.662561906226,0.689833712226,YV06,131,5,4.06,3,4.24940192669,3
33,214.html_test,1,2.06987094879,"worker, margaret, priest, morn, cathol, stanthoni, prayer, spoke, miracl, contempl",0.0296540362438,0.0107084019769,1.0,0.0,0.338983050847,44.0,0.745762711864,0.0131795716639,0.00247116968699,0.00988467874794,0.00494233937397,0.0304777594728,0.00658978583196,0.0107084019769,0.740453072867,0.574778575084,214.html,29,5,4.64333333333,3,4.63112174128,3
42,"2001-11-11 Microbes and Peter Rabbit, Rev. Mark Belletini.htm_test",1,0.836185932159,"tree, potter, unitarian, beatrix, lichen, mind, hound, lifemarri, farreach, imit",0.025641025641,0.021978021978,1.0,0.0,0.538461538462,9.0,0.692307692308,0.00732600732601,0.003663003663,0.025641025641,0.018315018315,0.0,0.018315018315,0.0,0.0073666459842,0.537620456564,"2001-11-11 Microbes and Peter Rabbit, Rev. Mark Belletini.htm",102,2,2.73,3,3.38086324802,3
47,ACLU06_test,1,1.81881213188,"geofeedia, user, twitter, instagram, facebook, enforc, surveil, monitor, data, agreement",0.0212150433944,0.0183220829315,1.0,0.0,0.4,23.0,0.511111111111,0.0154291224687,0.0,0.0,0.00771456123433,0.000964320154291,0.0,0.00867888138862,0.643088212149,0.494121722952,ACLU06,144,3,3.50666666667,3,2.6519548251,3
55,SS12_test,1,2.56745791435,"costa, rican, coco, illeg, shepherd, arrest, vessel, guatemalan, charg, rica",0.0115321252059,0.0219659527732,0.0,1.0,0.44578313253,56.0,0.674698795181,0.0175727622186,0.0,0.0236133992312,0.0126304228446,0.00054914881933,0.0,0.00604063701263,0.692795630658,0.628273480924,SS12,123,1,1.81333333333,2,1.22211692758,1
56,YV13_test,1,1.3436999321,"happi, want, get, stamp, unhappi, joy, got, say, can't, moment",0.0164705882353,0.00705882352941,1.0,0.0,0.578947368421,28.0,0.736842105263,0.00941176470588,0.0705882352941,0.00235294117647,0.00705882352941,0.0,0.0,0.0329411764706,0.774802145064,0.553920281175,YV13,138,5,3.7,3,4.04403025779,3
61,forget-not-all-your-benefits-steve-shepherd-sermon-on-remember-blessings-178073.asp_test,1,3.59696888924,"pit, forget, heal, prais, forgiv, get, sin, bless, thing, didnt",0.0414507772021,0.0173945225759,1.0,0.0,0.337423312883,126.0,0.773006134969,0.0188749074759,0.0214655810511,0.039600296077,0.00111028867506,0.0307179866765,0.0166543301258,0.0099925980755,0.619717811762,0.463175748418,forget-not-all-your-benefits-steve-shepherd-sermon-on-remember-blessings-178073.asp,94,4,4.65,3,3.88445524338,3
63,SS13_test,1,2.59012985229,"whale, seal, “human, “sustain, harvest, slaughter, club, eat, “conserv, fish",0.0180754917597,0.0425305688464,0.0,1.0,0.311926605505,65.0,0.596330275229,0.0154173312068,0.00478468899522,0.00744284954811,0.0127591706539,0.000531632110579,0.000531632110579,0.016480595428,0.687966880834,0.507854515709,SS13,124,1,2.68666666667,3,3.4571587074,5
64,piper81 071981m_test,1,4.21782779694,"drink, jesus, thirst, let, feast, christ, bless, tast, fulfil, god",0.0269186712486,0.0194730813288,1.0,0.0,0.502673796791,152.0,0.812834224599,0.0398052691867,0.00630011454754,0.0128865979381,0.00601374570447,0.0292096219931,0.00028636884307,0.0151775486827,0.738481078095,0.611053533494,piper81 071981m,46,5,4.35666666667,5,4.42048288367,5
66,MalcolmX-AtTheAudubon_test,1,7.74079489708,"get, congo, malcolm, let, dick, talk, mercenari, know, look, say",0.0200935865676,0.0228461326727,0.0,1.0,0.32,306.0,0.765,0.0177539223782,0.027250206441,0.0199559592623,0.0202312138728,0.0196807046518,0.00110101844206,0.01334984861,0.636655126945,0.600845079001,MalcolmX-AtTheAudubon,90,2,2.59333333333,2,2.13701950002,2
68,piper97 10-19-97_test,1,2.92505311966,"coven, shepherd, god, vers, etern, grace, christ, pleas, want, glori",0.0310734463277,0.0193032015066,1.0,0.0,0.406504065041,81.0,0.658536585366,0.0235404896422,0.0287193973635,0.0112994350282,0.00141242937853,0.0338983050847,0.0,0.00706214689266,0.637043750982,0.623267788082,piper97 10-19-97,57,3,3.08333333333,3,3.11313766041,3
76,MalcolmX-MessagetotheGrassRoots_test,1,6.6843149662,"negro, got, get, let, talk, tom, master, know, say, malcolm",0.0166527893422,0.0214820982515,0.0,1.0,0.304136253041,314.0,0.76399026764,0.0121565362198,0.034304746045,0.0108243130724,0.0274771024147,0.0158201498751,0.00116569525396,0.0184845961699,0.710400754835,0.54987988973,MalcolmX-MessagetotheGrassRoots,82,2,2.26333333333,2,2.19793076033,2
78,wgV2n3-2_test,1,1.65715789795,"brother, avatar, savior, dawn, fear, inhuman, lord, selfish, pain, save",0.04625,0.03375,1.0,0.0,0.826086956522,21.0,0.913043478261,0.09125,0.0,0.00125,0.0,0.03,0.0,0.005,0.760289710737,0.624718088698,wgV2n3-2,70,5,2.69666666667,2,2.84041899183,3
79,MalcolmX-TheHarlemHateGang_test,1,3.85177087784,"polic, harlem, nonviol, realiz, get, hategang, blood, oppressor, negro, malcolm",0.0123818833496,0.0234604105572,0.0,1.0,0.242937853107,128.0,0.723163841808,0.00879765395894,0.0153144346693,0.0215053763441,0.0260671228413,0.0149885956338,0.0,0.0159661127403,0.715954587695,0.552851283806,MalcolmX-TheHarlemHateGang,86,2,2.37,2,2.09547247383,2
82,ACLU08_test,1,1.65641093254,"tortur, jessen, mitchel, cia, rizzo, rodriguez, detaine, attorney, prison, judg",0.0102774922919,0.0195272353546,0.0,1.0,0.324324324324,13.0,0.351351351351,0.00308324768756,0.0,0.00102774922919,0.0123329907503,0.00308324768756,0.0,0.00411099691675,0.693768520614,0.659466953895,ACLU08,146,3,2.12666666667,3,2.0674200292,1
83,551.html_test,1,1.61727380753,"bill, gauchat, peter, merci, maurin, talk, worker, vietnam, fruit, ladi",0.0338294993234,0.021650879567,1.0,0.0,0.514285714286,30.0,0.857142857143,0.0189445196211,0.0,0.00811907983762,0.0148849797023,0.021650879567,0.00270635994587,0.00811907983762,0.812730910233,0.824332313968,551.html,36,3,3.50666666667,4,3.59289041314,4
85,200.html_test,1,0.775131940842,"convers, address, noth, communist, talk, strang, sure, profess, opium, whi",0.0181818181818,0.0181818181818,0.0,1.0,0.478260869565,18.0,0.782608695652,0.0025974025974,0.0103896103896,0.0,0.0025974025974,0.0,0.0467532467532,0.0285714285714,-0.288956570077,0.598822570499,200.html,28,3,3.90333333333,3,3.38093939959,3
88,ACLU01_test,1,1.65323495865,"tortur, prison, salim, “the, victim, dark, trauma, bensoud, client, psychologist",0.00826446280992,0.047225501771,0.0,1.0,0.439024390244,26.0,0.634146341463,0.0106257378985,0.00118063754427,0.00944510035419,0.00708382526564,0.0330578512397,0.0,0.00708382526564,0.614764606784,0.433556171817,ACLU01,139,3,2.83,3,3.57584278698,5
92,ACLU07_test,1,2.3148419857,"camp, polic, dakota, protector, morton, surveil, pipelin, sheriff, roadblock, vehicl",0.0102702702703,0.0151351351351,0.0,1.0,0.391304347826,27.0,0.391304347826,0.00216216216216,0.000540540540541,0.0,0.0113513513514,0.00108108108108,0.0,0.00594594594595,0.582800695555,0.723923388205,ACLU07,145,3,2.23666666667,3,2.19428072578,1
93,YV03_test,1,1.50957417488,"yantra, triangl, manifest, crystal, dot, express, bindhu, mantra, kalaa, shanthi",0.0114942528736,0.00287356321839,1.0,0.0,0.3,23.0,0.46,0.00431034482759,0.0100574712644,0.0014367816092,0.00862068965517,0.0014367816092,0.0014367816092,0.0244252873563,0.749034181134,0.706460240765,YV03,128,3,3.34,3,3.72709263762,3
95,564.html_test,1,1.56213498116,"loneli, worker, farm, quarrel, dispel, ward, appeal, erupt, prison, grace",0.0343878954608,0.0275103163686,1.0,0.0,0.333333333333,28.0,0.622222222222,0.0316368638239,0.00687757909216,0.0110041265475,0.00275103163686,0.0041265474553,0.0041265474553,0.0137551581843,0.771996570138,0.469079468926,564.html,38,3,4.24333333333,4,4.07808524742,4
96,journal.01.07.05_test,1,1.79625988007,"baba, grace, inner, happen, creed, done, met, lad, away, touch",0.0308924485126,0.0091533180778,1.0,0.0,0.6875,30.0,0.9375,0.0114416475973,0.0,0.0160183066362,0.0297482837529,0.045766590389,0.0,0.00343249427918,0.6775552086,0.447411743688,journal.01.07.05,61,5,3.13333333333,3,3.72267112428,3
98,"2006-04-09 Jesus, Rev. Mark Belletini.PDF_test",1,4.97509598732,"jesus, say, opinion, johnson, justic, ohio, pastor, seem, gospel, stake",0.02332433096,0.0203780996808,1.0,0.0,0.253787878788,152.0,0.575757575758,0.0127670022097,0.00515590473852,0.00883869383747,0.00613798183157,0.0235698502332,0.000982077093052,0.00736557819789,0.674938670121,0.584605724449,"2006-04-09 Jesus, Rev. Mark Belletini.PDF",106,6,3.19666666667,5,3.59596085064,3
100,"2004-08-29 Set Theory for Moderns, Rev. Mark Belletini.PDF_test",1,4.43757510185,"circl, senat, gay, episcop, hope, overlap, funni, venn, say, allard",0.0272263187748,0.0187180941577,1.0,0.0,0.230414746544,134.0,0.617511520737,0.0110606920023,0.00283607487238,0.0300623936472,0.010777084515,0.0144639818491,0.00340328984685,0.0116279069767,0.671095818045,0.536925084448,"2004-08-29 Set Theory for Moderns, Rev. Mark Belletini.PDF",104,3,3.83,4,4.92530663259,5
108,ACLU12_test,1,1.51715707779,"snowden, pardon, disclosur, obama, surveil, editori, whistleblow, post, privaci, opinion",0.0427728613569,0.023598820059,1.0,0.0,0.48275862069,18.0,0.620689655172,0.0117994100295,0.0,0.00294985250737,0.00442477876106,0.0191740412979,0.0,0.00884955752212,0.714092793198,0.559694541007,ACLU12,150,3,3.73333333333,3,3.28594861182,4
