,groupId,files,timeRun,keywords,perPos,perNeg,perPosDoc,perNegDoc,PSJudge,judgementCount,judgementFrac,nous,vous,je,ils,il,elle,le,avgSD,avgEVC,groupName,Unnamed: 0,rank,rfPred,rfClassPred,svmPred,svmClassPred
0,MalcolmX-MessagetotheGrassRoots_test,1,6.75079202652,"negro, got, get, let, talk, tom, master, know, say, malcolm",0.0166527893422,0.0214820982515,0.0,1.0,0.304136253041,314.0,0.76399026764,0.0121565362198,0.034304746045,0.0108243130724,0.0274771024147,0.0158201498751,0.00116569525396,0.0184845961699,0.713081013709,0.54987988973,MalcolmX-MessagetotheGrassRoots,82,2,2.44666666667,2,2.08810173626,2
4,piper81 041781_test,1,2.66687989235,"thief, jesus, save, penit, paradis, wrong, fear, god, say, thiev",0.0258342303552,0.037674919268,0.0,1.0,0.487179487179,85.0,0.726495726496,0.018837459634,0.0139935414424,0.0139935414424,0.00861141011841,0.034983853606,0.0,0.00914962325081,0.670887149738,0.713595475237,piper81 041781,45,3,3.98333333333,3,2.60129186386,3
7,ACLU04_test,1,1.83333015442,"cbp, fbi, assess, search, vulner, document, target, agenc, ask, question",0.00865384615385,0.0201923076923,0.0,1.0,0.4,17.0,0.425,0.00384615384615,0.00192307692308,0.0,0.0230769230769,0.0,0.0,0.00576923076923,0.664717407019,0.442937413482,ACLU04,142,3,2.34333333333,3,3.21638171743,3
9,225.html_test,1,3.7573530674,"worker, fergi, get, feast, too, kichi, soul, priest, kitchen, prayer",0.0224835696991,0.0300933932895,0.0,1.0,0.490909090909,99.0,0.9,0.020062262193,0.00345901072293,0.00968523002421,0.00657212037357,0.0276720857835,0.0231753718437,0.00657212037357,0.692580325597,0.700691663263,225.html,30,3,3.69333333333,3,2.57972551122,2
12,piper85 pn850005_test,1,4.9944691658,"sing, jehoshaphat, judah, vers, lord, god, satan, worship, thi, prais",0.0246626337832,0.0228013029316,1.0,0.0,0.472573839662,187.0,0.789029535865,0.0216379711494,0.0169846440205,0.00814332247557,0.0221033038623,0.0169846440205,0.00279199627734,0.00697999069335,0.683949475869,0.719528746324,piper85 pn850005,47,3,2.76,2,3.09754167831,3
15,ACLU03_test,1,1.87868404388,"flint, safe, poison, failur, elementari, ppb, done, drink, appoint, water",0.030303030303,0.0251082251082,1.0,0.0,0.285714285714,25.0,0.446428571429,0.0025974025974,0.004329004329,0.0,0.00952380952381,0.004329004329,0.0,0.0103896103896,0.750715195535,0.47666167497,ACLU03,141,3,3.95,3,3.5028525086,3
17,YV11_test,1,1.58403301239,"whi, lotus, love, don't, yogavill, want, should, tri, roof, religion",0.0368794326241,0.0156028368794,1.0,0.0,0.485294117647,44.0,0.647058823529,0.0326241134752,0.0198581560284,0.0212765957447,0.00992907801418,0.00141843971631,0.0,0.0156028368794,0.714964538578,0.607443977816,YV11,136,8,3.80333333333,3,4.05287905849,3
27,MalcolmX-AnAppealtoAfricanHeadsofState_test,1,6.27707099915,"malcolm, negro, uniti, cairo, get, african, confer, here, civilright, afroamerican",0.0244808374135,0.0238055039676,1.0,0.0,0.408510638298,156.0,0.663829787234,0.0194158365693,0.00928583488097,0.00928583488097,0.00877933479656,0.00236366706061,0.00135066689178,0.0111430018572,0.719667155632,0.664602832219,MalcolmX-AnAppealtoAfricanHeadsofState,89,2,3.82,4,3.44125625994,3
31,296.html_test,1,1.32400894165,"liturg, pray, prayer, christ, liturgi, mystic, laiti, injustic, campion, complin",0.00686498855835,0.0183066361556,0.0,1.0,0.51724137931,20.0,0.689655172414,0.0800915331808,0.00228832951945,0.00228832951945,0.00228832951945,0.0045766590389,0.00228832951945,0.0137299771167,0.771782069463,0.587619690619,296.html,32,5,3.12333333333,3,3.41709504876,2
32,piper94 09-11-94_test,1,2.99824690819,"bless, vers, evil, insult, inherit, feel, say, grace, hope, futur",0.0522388059701,0.0171202809482,1.0,0.0,0.469565217391,87.0,0.75652173913,0.0377524143986,0.031167690957,0.00438981562774,0.00438981562774,0.0118525021949,0.0,0.00965759438104,0.693220107821,0.607689427771,piper94 09-11-94,55,2,4.28333333333,5,4.14101187879,3
33,SS14_test,1,1.2429690361,"vessel, thunder, poacher, crew, chase, gear, endur, illeg, monday, rescu",0.0356234096692,0.030534351145,1.0,0.0,0.47619047619,17.0,0.809523809524,0.0814249363868,0.00508905852417,0.0,0.0101781170483,0.0,0.0152671755725,0.00254452926209,0.819659233834,0.647116918527,SS14,125,3,2.73,2,3.62662170051,5
34,YV01_test,1,1.39534902573,"sannyasin, yoga, sannya, renounc, sri, satchidananda, monk, dress, “the, ceremoni",0.00547945205479,0.00821917808219,0.0,1.0,0.409090909091,13.0,0.590909090909,0.0027397260274,0.0,0.0,0.0328767123288,0.0109589041096,0.00547945205479,0.0027397260274,0.735210217767,0.502723161424,YV01,126,3,2.89,3,3.05730107035,3
35,piper94 07-10-94_test,1,3.7540230751,"love, homosexu, say, command, fulfil, scriptur, keep, god, greg, violat",0.0492113564669,0.0261829652997,1.0,0.0,0.494186046512,119.0,0.691860465116,0.0331230283912,0.00694006309148,0.00851735015773,0.011356466877,0.00883280757098,0.00410094637224,0.00946372239748,0.720380984958,0.636675363489,piper94 07-10-94,54,2,3.85666666667,4,3.71663782022,4
36,SS13_test,1,2.60898208618,"whale, seal, “human, “sustain, harvest, slaughter, club, eat, “conserv, fish",0.0180754917597,0.0425305688464,0.0,1.0,0.311926605505,65.0,0.596330275229,0.0154173312068,0.00478468899522,0.00744284954811,0.0127591706539,0.000531632110579,0.000531632110579,0.016480595428,0.689845375134,0.507854515709,SS13,124,1,2.67,3,3.23147892441,5
41,journal.1.10.10_test,1,1.51568317413,"master, inner, baba, discipl, miracl, wonder, incid, miracul, moment, mandali",0.0459418070444,0.0183767228178,1.0,0.0,0.5,12.0,0.545454545455,0.00153139356815,0.0,0.00153139356815,0.00612557427259,0.0199081163859,0.00153139356815,0.00918836140888,0.755438682074,0.529939189283,journal.1.10.10,64,4,3.81666666667,3,3.65190800925,3
45,ACLU06_test,1,1.77083015442,"geofeedia, user, twitter, instagram, facebook, enforc, surveil, monitor, data, agreement",0.0212150433944,0.0183220829315,1.0,0.0,0.4,23.0,0.511111111111,0.0154291224687,0.0,0.0,0.00771456123433,0.000964320154291,0.0,0.00867888138862,0.637196117702,0.494121722952,ACLU06,144,3,3.45333333333,3,2.8109637969,3
48,SS03_test,1,1.16874194145,"whale, contamin, pollut, microplast, ecosystem, toxicolog, shepherd, expedit, scientist, california",0.0245398773006,0.0122699386503,1.0,0.0,0.357142857143,8.0,0.571428571429,0.0306748466258,0.0,0.0,0.0,0.0,0.00306748466258,0.00613496932515,0.800128111449,0.582645206635,SS03,114,2,3.16333333333,4,2.55750760805,1
52,ACLU05_test,1,1.77667713165,"mohamedou, prison, guantánamo, tortur, unlaw, mauritania, memoir, privaci, thrill, slahi",0.0309523809524,0.0297619047619,1.0,0.0,0.547619047619,34.0,0.809523809524,0.0261904761905,0.0,0.00595238095238,0.00119047619048,0.047619047619,0.00119047619048,0.00595238095238,0.69231558211,0.554392760686,ACLU05,143,3,4.08333333333,3,3.48192789557,3
54,SS12_test,1,2.52331209183,"costa, rican, coco, illeg, shepherd, arrest, vessel, guatemalan, charg, rica",0.0115321252059,0.0219659527732,0.0,1.0,0.44578313253,56.0,0.674698795181,0.0175727622186,0.0,0.0236133992312,0.0126304228446,0.00054914881933,0.0,0.00604063701263,0.693352000595,0.628273480924,SS12,123,1,1.85333333333,2,1.15471902463,1
61,YV08_test,1,3.16886997223,"yogavill, dedic, should, don't, joy, everyth, tree, whatev, feel, love",0.0296137339056,0.0068669527897,1.0,0.0,0.353773584906,158.0,0.745283018868,0.0210300429185,0.0450643776824,0.01330472103,0.0175965665236,0.00128755364807,0.00128755364807,0.0210300429185,0.707719863592,0.565988363143,YV08,133,6,4.35333333333,5,4.58813940799,5
62,piper2k 3-5-00_test,1,2.9331870079,"timothi, scriptur, vers, exult, sacr, bibl, christ, persecut, say, stay",0.0343158820941,0.0118785745711,1.0,0.0,0.341463414634,92.0,0.560975609756,0.0189177298724,0.0250769907611,0.0101187857457,0.00923889133304,0.0118785745711,0.0,0.010558732952,0.638409182612,0.70970737575,piper2k 3-5-00,42,3,3.96333333333,4,3.62903879926,3
63,MalcolmX-TheBallotortheBullet_test,1,9.93218398094,"get, let, negro, bullet, got, ballot, segreg, malcolm, whi, civilright",0.0184800664452,0.0144310631229,1.0,0.0,0.265342960289,435.0,0.785198555957,0.0192068106312,0.03176910299,0.0129775747508,0.0140157807309,0.015988372093,0.00103820598007,0.0179609634551,0.692066130458,0.681160395609,MalcolmX-TheBallotortheBullet,84,2,3.44666666667,2,3.57265697316,2
66,"2014-03-16 Guns Directness Controlling Sensitivity, Rev. Mark Belletini.pdf_test",1,5.11078619957,"gun, rabbi, congreg, kaddish, ask, say, alphabet, dan, talk, too",0.0240109764464,0.0160073176309,1.0,0.0,0.254166666667,168.0,0.7,0.0187514292248,0.00617425108621,0.0338440429911,0.00983306654471,0.00891836268008,0.0036588154585,0.00686027898468,0.6502257072,0.584276725375,"2014-03-16 Guns Directness Controlling Sensitivity, Rev. Mark Belletini.pdf",109,5,3.76666666667,5,5.10449824143,5
69,MalcolmX-LastAnswersAndInterviews_test,1,12.3548839092,"malcolm, get, answer, think, racism, say, feel, negro, racist, interview",0.0136371482824,0.022009321595,0.0,1.0,0.309033280507,486.0,0.770206022187,0.00871741757293,0.0184705679268,0.0243397203521,0.0182979457967,0.01648541343,0.00060417745555,0.0156223027792,0.671709432554,0.545841172708,MalcolmX-LastAnswersAndInterviews,92,2,2.26666666667,2,2.54899473531,2
70,SS06_test,1,1.39823389053,"dolphin, captiv, tank, sorri, orca, shepherd, endur, taiji, sought, concret",0.00904977375566,0.0633484162896,0.0,1.0,0.68,24.0,0.96,0.00452488687783,0.0633484162896,0.0180995475113,0.00904977375566,0.0,0.0,0.0,0.713624085932,0.641319399862,SS06,117,2,2.21333333333,1,3.19773722313,4
75,ACLU02_test,1,1.53844714165,"fisc, opinion, surveil, usa, yahoo, secret, aclu, hidden, refus, address",0.0263591433278,0.00164744645799,1.0,0.0,0.8125,14.0,0.875,0.00494233937397,0.00164744645799,0.0,0.00823723228995,0.0,0.0,0.0197693574959,0.749593424793,0.526031851325,ACLU02,140,3,4.08,3,3.13021297444,3
78,768.html_test,1,1.47116303444,"money, profit, tri, worker, sing, deem, forbad, matthew, insofar, duti",0.0206677265501,0.0143084260731,1.0,0.0,0.636363636364,18.0,0.818181818182,0.0683624801272,0.00635930047695,0.0,0.00476947535771,0.00158982511924,0.0,0.00794912559618,0.819808677031,0.592524274517,768.html,40,2,3.68,5,2.87169691719,2
79,journal.1.11.07_test,1,1.52306199074,"love, infinit, unexpress, condens, finit, genuin, manifest, revel, express, stake",0.0709117221418,0.0144717800289,1.0,0.0,0.485714285714,20.0,0.571428571429,0.00289435600579,0.0,0.0,0.00289435600579,0.0159189580318,0.0,0.0303907380608,0.781314650756,0.647381045738,journal.1.11.07,65,7,3.90333333333,3,3.80135131709,4
86,ACLU01_test,1,1.69514489174,"tortur, prison, salim, “the, victim, dark, trauma, bensoud, client, psychologist",0.00826446280992,0.047225501771,0.0,1.0,0.439024390244,26.0,0.634146341463,0.0106257378985,0.00118063754427,0.00944510035419,0.00708382526564,0.0330578512397,0.0,0.00708382526564,0.616773707607,0.433556171817,ACLU01,139,3,3.52,3,3.58202847855,5
89,SS05_test,1,1.78078889847,"seaworld, hsus, orca, manbi, pacell, keiko, condemn, profit, will, dolphin",0.0275229357798,0.0336391437309,0.0,1.0,0.456140350877,34.0,0.59649122807,0.00407747196738,0.0,0.00407747196738,0.0346585117227,0.0112130479103,0.0,0.00917431192661,0.677418792139,0.531921212903,SS05,116,2,2.91666666667,3,2.29806309102,3
91,ACLU07_test,1,2.27843499184,"camp, polic, dakota, protector, morton, surveil, pipelin, sheriff, roadblock, vehicl",0.0102702702703,0.0151351351351,0.0,1.0,0.391304347826,27.0,0.391304347826,0.00216216216216,0.000540540540541,0.0,0.0113513513514,0.00108108108108,0.0,0.00594594594595,0.582137085968,0.723923388205,ACLU07,145,3,2.31,3,2.4143794903,3
92,YV03_test,1,1.49917888641,"yantra, triangl, manifest, crystal, dot, express, bindhu, mantra, kalaa, shanthi",0.0114942528736,0.00287356321839,1.0,0.0,0.3,23.0,0.46,0.00431034482759,0.0100574712644,0.0014367816092,0.00862068965517,0.0014367816092,0.0014367816092,0.0244252873563,0.75385253528,0.706460240765,YV03,128,3,3.92333333333,3,3.38193339204,3
93,291.html_test,1,1.83859610558,"smell, relief, walk, swim, hang, babi, stanley, garden, harlem, hot",0.0307062436029,0.028659160696,1.0,0.0,0.325581395349,29.0,0.674418604651,0.0112589559877,0.00204708290686,0.00614124872057,0.014329580348,0.00409416581372,0.0102354145343,0.00921187308086,0.792010294677,0.710015848458,291.html,31,4,3.47333333333,3,2.44412907802,3
95,MalcolmX-TheBlackRevolution_test,1,4.80722904205,"negro, solv, socal, malcolm, sam, black, want, uncl, civilright, get",0.0209185993633,0.0163710777626,1.0,0.0,0.260330578512,154.0,0.636363636364,0.0118235561619,0.0161437016826,0.00591177808095,0.012278308322,0.0181900864029,0.00204638472033,0.012278308322,0.717511939238,0.68208128063,MalcolmX-TheBlackRevolution,85,2,3.59333333333,2,4.47958237245,5
96,"2004-08-29 Set Theory for Moderns, Rev. Mark Belletini.PDF_test",1,4.40316104889,"circl, senat, gay, episcop, hope, overlap, funni, venn, say, allard",0.0272263187748,0.0187180941577,1.0,0.0,0.230414746544,134.0,0.617511520737,0.0110606920023,0.00283607487238,0.0300623936472,0.010777084515,0.0144639818491,0.00340328984685,0.0116279069767,0.67384748574,0.536925084448,"2004-08-29 Set Theory for Moderns, Rev. Mark Belletini.PDF",104,3,4.11333333333,5,5.2557274778,5
99,piper81 071981m_test,1,4.15836715698,"drink, jesus, thirst, let, feast, christ, bless, tast, fulfil, god",0.0269186712486,0.0194730813288,1.0,0.0,0.502673796791,152.0,0.812834224599,0.0398052691867,0.00630011454754,0.0128865979381,0.00601374570447,0.0292096219931,0.00028636884307,0.0151775486827,0.735824796387,0.611053533494,piper81 071981m,46,5,4.47666666667,5,4.83441624839,5
101,YV12_test,1,1.15663218498,"yantra, medit, faith, yoga, cosmos, divin, petal, path, express, god",0.037037037037,0.00617283950617,1.0,0.0,0.411764705882,7.0,0.411764705882,0.00617283950617,0.00617283950617,0.0,0.00617283950617,0.00617283950617,0.0,0.0154320987654,0.838440534391,0.608677116584,YV12,137,6,3.91,3,4.05373544599,4
103,remembering-9-11-steve-shepherd-sermon-on-america-160100.asp_test,1,3.30999994278,"happen, evil, look, whi, want, perfect, devil, lord, sept, get",0.0233017377567,0.0410742496051,0.0,1.0,0.0931174089069,144.0,0.291497975709,0.022906793049,0.0177725118483,0.0181674565561,0.010663507109,0.0165876777251,0.00276461295419,0.00987361769352,0.638170255268,0.576861251879,remembering-9-11-steve-shepherd-sermon-on-america-160100.asp,99,3,3.03333333333,4,3.32449497482,4
111,overcoming-lifes-problems-steve-shepherd-sermon-on-endurance-32141.asp_test,1,3.63988804817,"want, christ, don, overcom, get, pain, ill, car, said, say",0.0274071402813,0.023079697079,1.0,0.0,0.293388429752,146.0,0.603305785124,0.0274071402813,0.0180310133429,0.0223584565453,0.00576992426974,0.0144248106744,0.0079336458709,0.00901550667147,0.645298651121,0.506494561511,overcoming-lifes-problems-steve-shepherd-sermon-on-endurance-32141.asp,98,3,3.82333333333,4,4.17030736639,3
