,groupId,files,timeRun,keywords,perPos,perNeg,perPosDoc,perNegDoc,PSJudge,judgementCount,judgementFrac,nous,vous,je,ils,il,elle,le,avgSD,avgEVC,groupName,Unnamed: 0,rank,rfPred,rfClassPred,svmPred,svmClassPred
3,piper81 041781_test,1,2.70249795914,"thief, jesus, save, penit, paradis, wrong, fear, god, say, thiev",0.0258342303552,0.037674919268,0.0,1.0,0.487179487179,85.0,0.726495726496,0.018837459634,0.0139935414424,0.0139935414424,0.00861141011841,0.034983853606,0.0,0.00914962325081,0.672937787127,0.713595475237,piper81 041781,45,3,3.22666666667,3,2.86776179684,3
8,225.html_test,1,3.82918810844,"worker, fergi, get, feast, too, kichi, soul, priest, kitchen, prayer",0.0224835696991,0.0300933932895,0.0,1.0,0.490909090909,99.0,0.9,0.020062262193,0.00345901072293,0.00968523002421,0.00657212037357,0.0276720857835,0.0231753718437,0.00657212037357,0.69210940946,0.700691663263,225.html,30,3,3.11333333333,3,2.94632226778,2
14,YV11_test,1,1.57807517052,"whi, lotus, love, don't, yogavill, want, should, tri, roof, religion",0.0368794326241,0.0156028368794,1.0,0.0,0.485294117647,44.0,0.647058823529,0.0326241134752,0.0198581560284,0.0212765957447,0.00992907801418,0.00141843971631,0.0,0.0156028368794,0.71565020579,0.607443977816,YV11,136,8,3.82333333333,3,3.89941387392,3
20,MalcolmX-LettersFromAbroad_test,1,2.69620394707,"nigeria, mecca, racism, malcolm, brotherhood, abroad, color, muslim, ghana, sincer",0.0205669816565,0.0166759310728,1.0,0.0,0.458333333333,51.0,0.708333333333,0.0105614230128,0.000555864369094,0.0322401334074,0.0111172873819,0.00667037242913,0.00111172873819,0.0100055586437,0.746355196203,0.611114085611,MalcolmX-LettersFromAbroad,81,3,2.99,3,3.39573804602,4
26,YV07_test,1,2.00615215302,"heaven, let, everybodi, yogavill, yoga, happi, better, everyth, hurt, feel",0.0457746478873,0.0105633802817,1.0,0.0,0.381818181818,75.0,0.681818181818,0.0448943661972,0.0281690140845,0.00352112676056,0.00704225352113,0.00176056338028,0.000880281690141,0.0140845070423,0.674566095787,0.542770124457,YV07,132,7,3.47666666667,5,3.66861945104,5
27,a-different-gospel-steve-shepherd-sermon-on-false-teaching-161833.asp_test,1,3.19587802887,"gospel, hell, say, jesus, preach, christ, knife, don, pleas, tri",0.0268980477223,0.0325379609544,0.0,1.0,0.282296650718,124.0,0.593301435407,0.00824295010846,0.0125813449024,0.0208242950108,0.00997830802603,0.0225596529284,0.00260303687636,0.0156182212581,0.652672205642,0.586214587548,a-different-gospel-steve-shepherd-sermon-on-false-teaching-161833.asp,93,1,3.58666666667,3,3.07515714197,3
30,296.html_test,1,1.34108901024,"liturg, pray, prayer, christ, liturgi, mystic, laiti, injustic, campion, complin",0.00686498855835,0.0183066361556,0.0,1.0,0.51724137931,20.0,0.689655172414,0.0800915331808,0.00228832951945,0.00228832951945,0.00228832951945,0.0045766590389,0.00228832951945,0.0137299771167,0.771375746335,0.587619690619,296.html,32,5,2.52666666667,2,2.90875853346,2
31,SS14_test,1,1.26713299751,"vessel, thunder, poacher, crew, chase, gear, endur, illeg, monday, rescu",0.0356234096692,0.030534351145,1.0,0.0,0.47619047619,17.0,0.809523809524,0.0814249363868,0.00508905852417,0.0,0.0101781170483,0.0,0.0152671755725,0.00254452926209,0.82297644056,0.647116918527,SS14,125,3,3.25,2,3.10572346412,2
33,YV06_test,1,2.60292196274,"sri, gurudev, swami, satchidananda, spirit, spiritu, messag, uniti, sadhu, doesn't",0.027289266222,0.00727713765919,1.0,0.0,0.352941176471,78.0,0.764705882353,0.0109157064888,0.0133414190418,0.0,0.00667070952092,0.0333535476046,0.00485142510612,0.0127349909036,0.667383139397,0.689833712226,YV06,131,5,3.66,3,4.15963107289,3
34,214.html_test,1,2.08338093758,"worker, margaret, priest, morn, cathol, stanthoni, prayer, spoke, miracl, contempl",0.0296540362438,0.0107084019769,1.0,0.0,0.338983050847,44.0,0.745762711864,0.0131795716639,0.00247116968699,0.00988467874794,0.00494233937397,0.0304777594728,0.00658978583196,0.0107084019769,0.740924409054,0.574778575084,214.html,29,5,4.05333333333,3,4.46813963795,3
35,"2006-04-09 Jesus, Rev. Mark Belletini.PDF_test",1,5.00187110901,"jesus, say, opinion, johnson, justic, ohio, pastor, seem, gospel, stake",0.02332433096,0.0203780996808,1.0,0.0,0.253787878788,152.0,0.575757575758,0.0127670022097,0.00515590473852,0.00883869383747,0.00613798183157,0.0235698502332,0.000982077093052,0.00736557819789,0.67162806425,0.584605724449,"2006-04-09 Jesus, Rev. Mark Belletini.PDF",106,6,3.11333333333,5,3.5525238194,3
42,piper99 12-12-99_test,1,3.27578806877,"reconcil, vers, save, wrath, god, shall, christ, enemi, rescu, justifi",0.0267489711934,0.022633744856,1.0,0.0,0.496551724138,117.0,0.806896551724,0.0411522633745,0.0238683127572,0.00329218106996,0.00246913580247,0.043621399177,0.0,0.00987654320988,0.642400567437,0.646481448274,piper99 12-12-99,59,4,3.57,5,3.69779290598,3
45,ACLU06_test,1,1.81466007233,"geofeedia, user, twitter, instagram, facebook, enforc, surveil, monitor, data, agreement",0.0212150433944,0.0183220829315,1.0,0.0,0.4,23.0,0.511111111111,0.0154291224687,0.0,0.0,0.00771456123433,0.000964320154291,0.0,0.00867888138862,0.636943550581,0.494121722952,ACLU06,144,3,2.65,3,2.36399598329,3
49,ACLU11_test,1,1.4126598835,"voter, kobach, regist, vote, registr, judg, restrict, kansa, citizenship, add",0.00759013282732,0.0265654648956,0.0,1.0,0.588235294118,10.0,0.588235294118,0.0,0.0,0.0,0.0379506641366,0.011385199241,0.0,0.00189753320683,0.626669341764,0.553391120255,ACLU11,149,3,2.27333333333,3,2.07071213129,1
54,journal.1.12.11_test,1,2.21337199211,"infinit, realiz, reaction, real, shall, finit, react, resign, meher, baba",0.0352020860495,0.00586701434159,1.0,0.0,0.505050505051,66.0,0.666666666667,0.0365058670143,0.0026075619296,0.029335071708,0.0,0.0280312907432,0.0,0.0176010430248,0.784632289103,0.853541756081,journal.1.12.11,66,5,4.27333333333,4,4.68213676557,4
58,piper89 4-7-89_test,1,2.87517881393,"womb, job, unborn, abort, god, innoc, shall, psalm, yuml, blood",0.0223234624146,0.0464692482916,0.0,1.0,0.353846153846,68.0,0.523076923077,0.00911161731207,0.00455580865604,0.0132118451025,0.00956719817768,0.0173120728929,0.0,0.0123006833713,0.659363463946,0.535040143732,piper89 4-7-89,50,5,2.65333333333,3,2.38889651985,1
59,forget-not-all-your-benefits-steve-shepherd-sermon-on-remember-blessings-178073.asp_test,1,3.69355893135,"pit, forget, heal, prais, forgiv, get, sin, bless, thing, didnt",0.0414507772021,0.0173945225759,1.0,0.0,0.337423312883,126.0,0.773006134969,0.0188749074759,0.0214655810511,0.039600296077,0.00111028867506,0.0307179866765,0.0166543301258,0.0099925980755,0.624789183714,0.463175748418,forget-not-all-your-benefits-steve-shepherd-sermon-on-remember-blessings-178073.asp,94,4,4.52333333333,5,4.59247828405,5
64,MalcolmX-TheBallotortheBullet_test,1,10.2524199486,"get, let, negro, bullet, got, ballot, segreg, malcolm, whi, civilright",0.0184800664452,0.0144310631229,1.0,0.0,0.265342960289,435.0,0.785198555957,0.0192068106312,0.03176910299,0.0129775747508,0.0140157807309,0.015988372093,0.00103820598007,0.0179609634551,0.69546024321,0.681160395609,MalcolmX-TheBallotortheBullet,84,2,3.19,2,3.80920429689,2
65,"2014-03-16 Guns Directness Controlling Sensitivity, Rev. Mark Belletini.pdf_test",1,5.32824206352,"gun, rabbi, congreg, kaddish, ask, say, alphabet, dan, talk, too",0.0240109764464,0.0160073176309,1.0,0.0,0.254166666667,168.0,0.7,0.0187514292248,0.00617425108621,0.0338440429911,0.00983306654471,0.00891836268008,0.0036588154585,0.00686027898468,0.646625342019,0.584276725375,"2014-03-16 Guns Directness Controlling Sensitivity, Rev. Mark Belletini.pdf",109,5,3.35333333333,5,4.5855298758,5
66,piper92 09-27-92_test,1,3.3550620079,"christ, gentil, reconcil, jew, god, israel, coven, glori, promis, jesus",0.0179290157336,0.0135382363703,1.0,0.0,0.467625899281,82.0,0.589928057554,0.0160995243322,0.0175631174533,0.00658616904501,0.00731796560556,0.0204903036956,0.0,0.0032930845225,0.684613298958,0.843150970135,piper92 09-27-92,53,1,2.84,3,2.65816797611,4
69,651.html_test,1,1.48144316673,"sudden, ask, job, met, simm, knew, policeman, polic, household, obituari",0.0180921052632,0.0180921052632,0.0,1.0,0.411764705882,27.0,0.794117647059,0.00986842105263,0.0,0.00328947368421,0.00986842105263,0.0740131578947,0.0180921052632,0.00657894736842,0.810965358357,0.599278229852,651.html,39,4,2.94666666667,2,3.70247236256,3
70,SS06_test,1,1.40597081184,"dolphin, captiv, tank, sorri, orca, shepherd, endur, taiji, sought, concret",0.00904977375566,0.0633484162896,0.0,1.0,0.68,24.0,0.96,0.00452488687783,0.0633484162896,0.0180995475113,0.00904977375566,0.0,0.0,0.0,0.709940366941,0.641319399862,SS06,117,2,2.30333333333,1,3.26842765408,3
72,YV09_test,1,2.78322792053,"gurudev, sri, yoga, peac, negat, woodstock, want, path, swami, messag",0.0358767054068,0.0101061141991,1.0,0.0,0.277777777778,74.0,0.685185185185,0.00859019706923,0.0101061141991,0.00656897422941,0.00960080848914,0.0267812026276,0.00202122283982,0.00909550277918,0.713369132602,0.634385752343,YV09,134,7,3.64666666667,3,4.28773632769,3
74,piper95 12-03-95_test,1,2.50111603737,"vers, worship, fresh, christ, pleas, encourag, congreg, pray, godcent, uniti",0.0356484326982,0.00860479409957,1.0,0.0,0.428571428571,48.0,0.685714285714,0.0295021511985,0.00245851259988,0.00307314074985,0.00614628149969,0.0122925629994,0.0,0.00491702519975,0.727279708213,0.696327448264,piper95 12-03-95,56,2,3.25333333333,3,2.68906136855,2
79,MalcolmX-TheHarlemHateGang_test,1,3.88968801498,"polic, harlem, nonviol, realiz, get, hategang, blood, oppressor, negro, malcolm",0.0123818833496,0.0234604105572,0.0,1.0,0.242937853107,128.0,0.723163841808,0.00879765395894,0.0153144346693,0.0215053763441,0.0260671228413,0.0149885956338,0.0,0.0159661127403,0.714021738868,0.552851283806,MalcolmX-TheHarlemHateGang,86,2,2.23,2,1.97926837588,2
83,551.html_test,1,1.65167617798,"bill, gauchat, peter, merci, maurin, talk, worker, vietnam, fruit, ladi",0.0338294993234,0.021650879567,1.0,0.0,0.514285714286,30.0,0.857142857143,0.0189445196211,0.0,0.00811907983762,0.0148849797023,0.021650879567,0.00270635994587,0.00811907983762,0.814051382952,0.824332313968,551.html,36,3,3.56,4,3.48487561095,4
86,ACLU01_test,1,1.6968729496,"tortur, prison, salim, “the, victim, dark, trauma, bensoud, client, psychologist",0.00826446280992,0.047225501771,0.0,1.0,0.439024390244,26.0,0.634146341463,0.0106257378985,0.00118063754427,0.00944510035419,0.00708382526564,0.0330578512397,0.0,0.00708382526564,0.615065886837,0.433556171817,ACLU01,139,3,2.75,3,2.74210182,3
91,whats-love-got-to-do-with-it-steve-shepherd-sermon-on-christian-love-118439.asp_test,1,3.96432113647,"love, got, debt, rememb, pay, don, husband, prayer, get, ill",0.0494915254237,0.0206779661017,1.0,0.0,0.212698412698,192.0,0.609523809524,0.0176271186441,0.0250847457627,0.0216949152542,0.0122033898305,0.0277966101695,0.00779661016949,0.015593220339,0.646161648664,0.508893073168,whats-love-got-to-do-with-it-steve-shepherd-sermon-on-christian-love-118439.asp,100,4,4.05,3,4.57855381373,3
93,SS02_test,1,1.32817792892,"turtl, shepherd, save, gift, donat, pollut, jairo, campaign, amaz, threat",0.0376811594203,0.0231884057971,1.0,0.0,0.882352941176,15.0,0.882352941176,0.0463768115942,0.0231884057971,0.0,0.00579710144928,0.0,0.0,0.0,0.669543379445,0.437062563421,SS02,113,1,3.50333333333,5,2.60343923656,2
94,558.html_test,1,1.24811911583,"obedi, poverti, ave, maria, love, rosari, advent, tell, convers, scriptur",0.0509383378016,0.00536193029491,1.0,0.0,0.35,9.0,0.45,0.0214477211796,0.0,0.0,0.0,0.00268096514745,0.0160857908847,0.00268096514745,0.771526616217,0.576540447136,558.html,37,4,3.46,3,3.29904266218,2
98,"2004-08-29 Set Theory for Moderns, Rev. Mark Belletini.PDF_test",1,4.46802902222,"circl, senat, gay, episcop, hope, overlap, funni, venn, say, allard",0.0272263187748,0.0187180941577,1.0,0.0,0.230414746544,134.0,0.617511520737,0.0110606920023,0.00283607487238,0.0300623936472,0.010777084515,0.0144639818491,0.00340328984685,0.0116279069767,0.670324084305,0.536925084448,"2004-08-29 Set Theory for Moderns, Rev. Mark Belletini.PDF",104,3,3.82333333333,4,4.88787974507,5
102,YV12_test,1,1.2035048008,"yantra, medit, faith, yoga, cosmos, divin, petal, path, express, god",0.037037037037,0.00617283950617,1.0,0.0,0.411764705882,7.0,0.411764705882,0.00617283950617,0.00617283950617,0.0,0.00617283950617,0.00617283950617,0.0,0.0154320987654,0.837571411163,0.608677116584,YV12,137,6,3.88,3,4.08032332501,4
103,you-adulterous-people-steve-shepherd-sermon-on-adultery-165397.asp_test,1,3.418446064,"adulteri, don, devil, fear, get, anger, friendship, satan, spiritu, want",0.0299760191847,0.0363709032774,0.0,1.0,0.194552529183,154.0,0.599221789883,0.0203836930456,0.0219824140687,0.0231814548361,0.0159872102318,0.0227817745803,0.00519584332534,0.00759392486011,0.648259050111,0.489921290693,you-adulterous-people-steve-shepherd-sermon-on-adultery-165397.asp,101,2,3.5,3,3.48451011256,4
104,remembering-9-11-steve-shepherd-sermon-on-america-160100.asp_test,1,3.50178098679,"happen, evil, look, whi, want, perfect, devil, lord, sept, get",0.0233017377567,0.0410742496051,0.0,1.0,0.0931174089069,144.0,0.291497975709,0.022906793049,0.0177725118483,0.0181674565561,0.010663507109,0.0165876777251,0.00276461295419,0.00987361769352,0.635331844138,0.576861251879,remembering-9-11-steve-shepherd-sermon-on-america-160100.asp,99,3,2.65333333333,3,3.44605624508,4
107,ACLU12_test,1,1.56710290909,"snowden, pardon, disclosur, obama, surveil, editori, whistleblow, post, privaci, opinion",0.0427728613569,0.023598820059,1.0,0.0,0.48275862069,18.0,0.620689655172,0.0117994100295,0.0,0.00294985250737,0.00442477876106,0.0191740412979,0.0,0.00884955752212,0.713700046377,0.559694541007,ACLU12,150,3,3.34,3,3.25586441297,4
111,overcoming-lifes-problems-steve-shepherd-sermon-on-endurance-32141.asp_test,1,3.64232993126,"want, christ, don, overcom, get, pain, ill, car, said, say",0.0274071402813,0.023079697079,1.0,0.0,0.293388429752,146.0,0.603305785124,0.0274071402813,0.0180310133429,0.0223584565453,0.00576992426974,0.0144248106744,0.0079336458709,0.00901550667147,0.645555342709,0.506494561511,overcoming-lifes-problems-steve-shepherd-sermon-on-endurance-32141.asp,98,3,3.66333333333,5,3.99735604384,3
