,groupId,files,timeRun,keywords,perPos,perNeg,perPosDoc,perNegDoc,PSJudge,judgementCount,judgementFrac,nous,vous,je,ils,il,elle,le,avgSD,avgEVC,groupName,Unnamed: 0,rank,rfPred,rfClassPred,svmPred,svmClassPred
6,12.html_test,1,1.66242003441,"radic, print, sent, worker, sheet, wander, dollar, rememb, donat, encycl",0.022641509434,0.011320754717,1.0,0.0,0.344827586207,17.0,0.586206896552,0.0132075471698,0.0,0.0,0.0207547169811,0.00566037735849,0.0,0.0188679245283,0.752934160739,0.571646121949,12.html,26,3,3.48333333333,3,4.36765148031,3
8,225.html_test,1,4.01023197174,"worker, fergi, get, feast, too, kichi, soul, priest, kitchen, prayer",0.0224835696991,0.0300933932895,0.0,1.0,0.490909090909,99.0,0.9,0.020062262193,0.00345901072293,0.00968523002421,0.00657212037357,0.0276720857835,0.0231753718437,0.00657212037357,0.696580113728,0.700691663263,225.html,30,3,3.00333333333,3,2.88344645319,3
12,piper99 4-4-99_test,1,3.23272490501,"condemn, christ, sinner, guilti, righteous, jesus, answer, god, judg, vers",0.0368709516692,0.0333831589437,1.0,0.0,0.402777777778,83.0,0.576388888889,0.0264075734928,0.0114598903837,0.0224215246637,0.000996512207275,0.02192326856,0.0,0.0119581464873,0.610909425489,0.528360248967,piper99 4-4-99,60,3,3.86333333333,3,3.71127102071,3
17,SS04_test,1,2.31903886795,"shepherd, net, illeg, whale, crew, gill, cut, happi, anyth, worri",0.0396119644301,0.018593371059,1.0,0.0,0.433333333333,53.0,0.883333333333,0.00970088924818,0.00323362974939,0.0299110751819,0.0210185933711,0.0,0.0,0.0121261115602,0.707464104514,0.664894099941,SS04,115,3,4.38333333333,4,4.44840307441,4
23,MalcolmX-AnAppealtoAfricanHeadsofState_test,1,6.82111382484,"malcolm, negro, uniti, cairo, get, african, confer, here, civilright, afroamerican",0.0244808374135,0.0238055039676,1.0,0.0,0.408510638298,156.0,0.663829787234,0.0194158365693,0.00928583488097,0.00928583488097,0.00877933479656,0.00236366706061,0.00135066689178,0.0111430018572,0.721745137433,0.664602832219,MalcolmX-AnAppealtoAfricanHeadsofState,89,2,3.76333333333,3,2.87917104499,3
24,a-different-gospel-steve-shepherd-sermon-on-false-teaching-161833.asp_test,1,3.39311504364,"gospel, hell, say, jesus, preach, christ, knife, don, pleas, tri",0.0268980477223,0.0325379609544,0.0,1.0,0.282296650718,124.0,0.593301435407,0.00824295010846,0.0125813449024,0.0208242950108,0.00997830802603,0.0225596529284,0.00260303687636,0.0156182212581,0.651764223687,0.586214587548,a-different-gospel-steve-shepherd-sermon-on-false-teaching-161833.asp,93,1,3.97333333333,3,2.95861888308,3
25,SS02_test,1,1.50091195107,"turtl, shepherd, save, gift, donat, pollut, jairo, campaign, amaz, threat",0.0376811594203,0.0231884057971,1.0,0.0,0.882352941176,15.0,0.882352941176,0.0463768115942,0.0231884057971,0.0,0.00579710144928,0.0,0.0,0.0,0.674050969643,0.437062563421,SS02,113,1,3.69333333333,2,2.4615490072,3
26,journal.1.10.10_test,1,1.59119105339,"master, inner, baba, discipl, miracl, wonder, incid, miracul, moment, mandali",0.0459418070444,0.0183767228178,1.0,0.0,0.5,12.0,0.545454545455,0.00153139356815,0.0,0.00153139356815,0.00612557427259,0.0199081163859,0.00153139356815,0.00918836140888,0.75858690531,0.529939189283,journal.1.10.10,64,4,4.10333333333,3,4.47648108954,3
29,piper94 09-11-94_test,1,3.16365695,"bless, vers, evil, insult, inherit, feel, say, grace, hope, futur",0.0522388059701,0.0171202809482,1.0,0.0,0.469565217391,87.0,0.75652173913,0.0377524143986,0.031167690957,0.00438981562774,0.00438981562774,0.0118525021949,0.0,0.00965759438104,0.690047011029,0.607689427771,piper94 09-11-94,55,2,4.76333333333,5,4.85695320244,4
30,SS14_test,1,1.33925914764,"vessel, thunder, poacher, crew, chase, gear, endur, illeg, monday, rescu",0.0356234096692,0.030534351145,1.0,0.0,0.47619047619,17.0,0.809523809524,0.0814249363868,0.00508905852417,0.0,0.0101781170483,0.0,0.0152671755725,0.00254452926209,0.817379022008,0.647116918527,SS14,125,3,3.59,2,2.99312789915,2
31,MalcolmX-ConfrontationWithAnExpert_test,1,6.78395795822,"malcolm, bernard, hall, alcolm, let, negro, think, say, get, expert",0.0184566707681,0.0123044471788,1.0,0.0,0.495356037152,258.0,0.798761609907,0.00457022323783,0.0355071190016,0.0344524521005,0.0105466690104,0.00931622429249,0.00123044471788,0.013183336263,0.626539192405,0.656116850638,MalcolmX-ConfrontationWithAnExpert,91,2,3.12333333333,2,3.45932111121,3
32,piper94 07-10-94_test,1,3.99479103088,"love, homosexu, say, command, fulfil, scriptur, keep, god, greg, violat",0.0492113564669,0.0261829652997,1.0,0.0,0.494186046512,119.0,0.691860465116,0.0331230283912,0.00694006309148,0.00851735015773,0.011356466877,0.00883280757098,0.00410094637224,0.00946372239748,0.722641295231,0.636675363489,piper94 07-10-94,54,2,4.27333333333,4,4.42560930595,4
33,piper90 01-28-90_test,1,3.21146202087,"gospel, preach, fulfil, jesus, god, matthew, ministri, glori, isaiah, repent",0.0205106739221,0.0108832147342,1.0,0.0,0.483050847458,83.0,0.703389830508,0.0121389702805,0.00251151109251,0.00460443700293,0.00460443700293,0.0334868145668,0.0,0.00795311845961,0.786420030578,0.834559504194,piper90 01-28-90,52,4,3.01666666667,5,2.92337048753,1
54,forget-not-all-your-benefits-steve-shepherd-sermon-on-remember-blessings-178073.asp_test,1,3.98817205429,"pit, forget, heal, prais, forgiv, get, sin, bless, thing, didnt",0.0414507772021,0.0173945225759,1.0,0.0,0.337423312883,126.0,0.773006134969,0.0188749074759,0.0214655810511,0.039600296077,0.00111028867506,0.0307179866765,0.0166543301258,0.0099925980755,0.626809119281,0.463175748418,forget-not-all-your-benefits-steve-shepherd-sermon-on-remember-blessings-178073.asp,94,4,4.29666666667,3,3.6317249098,3
56,piper81 071981m_test,1,4.45537400246,"drink, jesus, thirst, let, feast, christ, bless, tast, fulfil, god",0.0269186712486,0.0194730813288,1.0,0.0,0.502673796791,152.0,0.812834224599,0.0398052691867,0.00630011454754,0.0128865979381,0.00601374570447,0.0292096219931,0.00028636884307,0.0151775486827,0.740491201466,0.611053533494,piper81 071981m,46,5,4.47333333333,5,4.52281261198,5
59,"2014-03-16 Guns Directness Controlling Sensitivity, Rev. Mark Belletini.pdf_test",1,5.74442386627,"gun, rabbi, congreg, kaddish, ask, say, alphabet, dan, talk, too",0.0240109764464,0.0160073176309,1.0,0.0,0.254166666667,168.0,0.7,0.0187514292248,0.00617425108621,0.0338440429911,0.00983306654471,0.00891836268008,0.0036588154585,0.00686027898468,0.64774860547,0.584276725375,"2014-03-16 Guns Directness Controlling Sensitivity, Rev. Mark Belletini.pdf",109,5,3.83333333333,3,3.67584139337,3
60,piper97 10-19-97_test,1,3.20029091835,"coven, shepherd, god, vers, etern, grace, christ, pleas, want, glori",0.0310734463277,0.0193032015066,1.0,0.0,0.406504065041,81.0,0.658536585366,0.0235404896422,0.0287193973635,0.0112994350282,0.00141242937853,0.0338983050847,0.0,0.00706214689266,0.638806744798,0.623267788082,piper97 10-19-97,57,3,3.94666666667,3,3.697035129,3
64,YV04_test,1,2.83919501305,"mind, yoga, calm, clean, whi, medit, want, don't, sutra, everyth",0.0382059800664,0.00830564784053,1.0,0.0,0.350993377483,102.0,0.675496688742,0.0227021040975,0.0581395348837,0.00221483942414,0.000553709856035,0.00166112956811,0.000553709856035,0.014950166113,0.717040107702,0.714655700116,YV04,129,3,5.70666666667,7,4.29536319016,4
65,"2014-12-07 Is Hope Simply Wishful Thinking, Rev. Mark Belletini_test",1,5.79480099678,"hope, danc, sermon, jump, bad, morn, get, ask, hear, joy",0.0292850990525,0.0191645133506,1.0,0.0,0.291512915129,201.0,0.741697416974,0.0191645133506,0.0144272179156,0.0325150732127,0.015503875969,0.00172265288544,0.00172265288544,0.0152885443583,0.644840163975,0.617199416127,"2014-12-07 Is Hope Simply Wishful Thinking, Rev. Mark Belletini",110,5,4.48666666667,2,4.47802875522,3
67,YV10_test,1,2.23078083992,"mantra, gurudeva, mind, felt, get, know, dream, lesson, stop, husband",0.0203426124197,0.0182012847966,1.0,0.0,0.35632183908,77.0,0.885057471264,0.00321199143469,0.0117773019272,0.117773019272,0.00107066381156,0.0235546038544,0.0,0.0182012847966,0.726986291656,0.64483544488,YV10,135,8,3.52,3,3.36898565162,3
71,piper95 12-03-95_test,1,2.66208004951,"vers, worship, fresh, christ, pleas, encourag, congreg, pray, godcent, uniti",0.0356484326982,0.00860479409957,1.0,0.0,0.428571428571,48.0,0.685714285714,0.0295021511985,0.00245851259988,0.00307314074985,0.00614628149969,0.0122925629994,0.0,0.00491702519975,0.72834006924,0.696327448264,piper95 12-03-95,56,2,4.44666666667,3,3.23675233441,2
78,wgV2n3-2_test,1,1.82516002655,"brother, avatar, savior, dawn, fear, inhuman, lord, selfish, pain, save",0.04625,0.03375,1.0,0.0,0.826086956522,21.0,0.913043478261,0.09125,0.0,0.00125,0.0,0.03,0.0,0.005,0.760129371366,0.624718088698,wgV2n3-2,70,5,3.56,3,2.88882805539,2
82,551.html_test,1,1.78924489021,"bill, gauchat, peter, merci, maurin, talk, worker, vietnam, fruit, ladi",0.0338294993234,0.021650879567,1.0,0.0,0.514285714286,30.0,0.857142857143,0.0189445196211,0.0,0.00811907983762,0.0148849797023,0.021650879567,0.00270635994587,0.00811907983762,0.812890045977,0.824332313968,551.html,36,3,3.62666666667,3,3.3877375483,3
84,MalcolmX-ProspectsForFreedomin1965_test,1,4.82592010498,"get, civilright, noth, explos, promis, ake, harlem, oppress, prospect, malcolm",0.0210692652094,0.0221227284698,0.0,1.0,0.191489361702,153.0,0.651063829787,0.0152752172768,0.00948116934422,0.0163286805373,0.0281801422175,0.00421385304188,0.00131682907559,0.0186989728733,0.72513756788,0.588176520005,MalcolmX-ProspectsForFreedomin1965,83,2,2.33666666667,2,2.2753305553,2
85,piper80 071380m_test,1,1.64436388016,"pastor, say, bibl, baptist, criswel, preacher, wisdom, know, anyth, hear",0.0272435897436,0.00801282051282,1.0,0.0,0.636363636364,30.0,0.909090909091,0.00801282051282,0.0192307692308,0.0512820512821,0.00320512820513,0.0192307692308,0.0,0.0128205128205,0.712539833475,0.734986918699,piper80 071380m,43,4,4.43666666667,3,3.75751228168,3
89,SS05_test,1,2.05210399628,"seaworld, hsus, orca, manbi, pacell, keiko, condemn, profit, will, dolphin",0.0275229357798,0.0336391437309,0.0,1.0,0.456140350877,34.0,0.59649122807,0.00407747196738,0.0,0.00407747196738,0.0346585117227,0.0112130479103,0.0,0.00917431192661,0.676569902675,0.531921212903,SS05,116,2,3.03666666667,3,2.6156460335,3
93,564.html_test,1,1.71401786804,"loneli, worker, farm, quarrel, dispel, ward, appeal, erupt, prison, grace",0.0343878954608,0.0275103163686,1.0,0.0,0.333333333333,28.0,0.622222222222,0.0316368638239,0.00687757909216,0.0110041265475,0.00275103163686,0.0041265474553,0.0041265474553,0.0137551581843,0.773529336654,0.469079468926,564.html,38,3,4.63,4,3.81837872174,3
94,558.html_test,1,1.41068601608,"obedi, poverti, ave, maria, love, rosari, advent, tell, convers, scriptur",0.0509383378016,0.00536193029491,1.0,0.0,0.35,9.0,0.45,0.0214477211796,0.0,0.0,0.0,0.00268096514745,0.0160857908847,0.00268096514745,0.774428826696,0.576540447136,558.html,37,4,4.06333333333,3,3.47849069523,3
95,journal.01.07.05_test,1,1.9418118,"baba, grace, inner, happen, creed, done, met, lad, away, touch",0.0308924485126,0.0091533180778,1.0,0.0,0.6875,30.0,0.9375,0.0114416475973,0.0,0.0160183066362,0.0297482837529,0.045766590389,0.0,0.00343249427918,0.677394292535,0.447411743688,journal.01.07.05,61,5,4.16666666667,3,3.95179768689,3
110,"2005-07-10 Promoting Acceptance and Spiritual Growth, James Bailey.PDF_test",1,3.70764303207,"mystic, spiritu, accept, sunday, gay, radic, selfaccept, quilt, grandmoth, affirm",0.0192307692308,0.0134615384615,1.0,0.0,0.296774193548,118.0,0.761290322581,0.0192307692308,0.005,0.0457692307692,0.00346153846154,0.00961538461538,0.00846153846154,0.00807692307692,0.676539247186,0.546525072543,"2005-07-10 Promoting Acceptance and Spiritual Growth, James Bailey.PDF",105,5,3.25333333333,3,3.56364406037,3
