,groupId,files,timeRun,keywords,perPos,perNeg,perPosDoc,perNegDoc,PSJudge,judgementCount,judgementFrac,nous,vous,je,ils,il,elle,le,avgSD,avgEVC,groupName,Unnamed: 0,rank,rfPred,rfClassPred,svmPred,svmClassPred
5,SS14_test,1,1.28766918182,"vessel, thunder, poacher, crew, chase, gear, endur, illeg, monday, rescu",0.0356234096692,0.030534351145,1.0,0.0,0.47619047619,17.0,0.809523809524,0.0814249363868,0.00508905852417,0.0,0.0101781170483,0.0,0.0152671755725,0.00254452926209,0.819285421908,0.647116918527,SS14,125,3,2.83,1,3.1768214275,2
9,651.html_test,1,1.47705817223,"sudden, ask, job, met, simm, knew, policeman, polic, household, obituari",0.0180921052632,0.0180921052632,0.0,1.0,0.411764705882,27.0,0.794117647059,0.00986842105263,0.0,0.00328947368421,0.00986842105263,0.0740131578947,0.0180921052632,0.00657894736842,0.809983424921,0.599278229852,651.html,39,4,3.04666666667,3,3.89332078607,3
10,piper85 pn850005_test,1,4.90767097473,"sing, jehoshaphat, judah, vers, lord, god, satan, worship, thi, prais",0.0246626337832,0.0228013029316,1.0,0.0,0.472573839662,187.0,0.789029535865,0.0216379711494,0.0169846440205,0.00814332247557,0.0221033038623,0.0169846440205,0.00279199627734,0.00697999069335,0.684065947925,0.719528746324,piper85 pn850005,47,3,2.98333333333,2,2.53197465943,2
12,YV11_test,1,1.57289910316,"whi, lotus, love, don't, yogavill, want, should, tri, roof, religion",0.0368794326241,0.0156028368794,1.0,0.0,0.485294117647,44.0,0.647058823529,0.0326241134752,0.0198581560284,0.0212765957447,0.00992907801418,0.00141843971631,0.0,0.0156028368794,0.718767085688,0.607443977816,YV11,136,8,3.84,3,4.45654261336,3
16,SS04_test,1,2.20104002953,"shepherd, net, illeg, whale, crew, gill, cut, happi, anyth, worri",0.0396119644301,0.018593371059,1.0,0.0,0.433333333333,53.0,0.883333333333,0.00970088924818,0.00323362974939,0.0299110751819,0.0210185933711,0.0,0.0,0.0121261115602,0.705113627695,0.664894099941,SS04,115,3,3.81,4,4.60417945155,5
25,"2007-11-11 Spiritual Claustrophobia, Rev. Mark Belletini.PDF_test",1,5.37454795837,"experi, dont, let, theolog, els, hallway, tell, wrong, realli, too",0.0243632336656,0.0190476190476,1.0,0.0,0.203045685279,233.0,0.591370558376,0.0148394241417,0.0104097452935,0.0423034330011,0.00863787375415,0.00398671096346,0.00996677740864,0.0126245847176,0.676425081254,0.514337817248,"2007-11-11 Spiritual Claustrophobia, Rev. Mark Belletini.PDF",107,7,3.87,3,4.0607367748,5
26,YV01_test,1,1.2665309906,"sannyasin, yoga, sannya, renounc, sri, satchidananda, monk, dress, “the, ceremoni",0.00547945205479,0.00821917808219,0.0,1.0,0.409090909091,13.0,0.590909090909,0.0027397260274,0.0,0.0,0.0328767123288,0.0109589041096,0.00547945205479,0.0027397260274,0.744222166948,0.502723161424,YV01,126,3,3.10666666667,3,3.01896736426,3
31,SS11_test,1,2.04862904549,"whale, shepherd, whaler, save, japanes, injunct, quota, japan, illeg, vessel",0.0123171670516,0.0246343341032,0.0,1.0,0.424242424242,32.0,0.484848484848,0.0230946882217,0.00153964588145,0.00230946882217,0.0238645111624,0.0,0.0,0.00769822940724,0.693940087427,0.747693114453,SS11,122,1,2.43,3,1.94809010237,3
36,"2001-11-11 Microbes and Peter Rabbit, Rev. Mark Belletini.htm_test",1,0.85041308403,"tree, potter, unitarian, beatrix, lichen, mind, hound, lifemarri, farreach, imit",0.025641025641,0.021978021978,1.0,0.0,0.538461538462,9.0,0.692307692308,0.00732600732601,0.003663003663,0.025641025641,0.018315018315,0.0,0.018315018315,0.0,0.00223763554375,0.537620456564,"2001-11-11 Microbes and Peter Rabbit, Rev. Mark Belletini.htm",102,2,2.72333333333,3,3.78941093887,3
42,SS03_test,1,1.18543291092,"whale, contamin, pollut, microplast, ecosystem, toxicolog, shepherd, expedit, scientist, california",0.0245398773006,0.0122699386503,1.0,0.0,0.357142857143,8.0,0.571428571429,0.0306748466258,0.0,0.0,0.0,0.0,0.00306748466258,0.00613496932515,0.800592288127,0.582645206635,SS03,114,2,3.63333333333,4,2.55763265224,3
49,SS12_test,1,2.50944304466,"costa, rican, coco, illeg, shepherd, arrest, vessel, guatemalan, charg, rica",0.0115321252059,0.0219659527732,0.0,1.0,0.44578313253,56.0,0.674698795181,0.0175727622186,0.0,0.0236133992312,0.0126304228446,0.00054914881933,0.0,0.00604063701263,0.690585597988,0.628273480924,SS12,123,1,2.01333333333,2,1.01172299628,1
51,YV13_test,1,1.31273412704,"happi, want, get, stamp, unhappi, joy, got, say, can't, moment",0.0164705882353,0.00705882352941,1.0,0.0,0.578947368421,28.0,0.736842105263,0.00941176470588,0.0705882352941,0.00235294117647,0.00705882352941,0.0,0.0,0.0329411764706,0.776529299039,0.553920281175,YV13,138,5,3.61333333333,3,4.45267551005,3
60,journal.02.06.10_test,1,1.57655596733,"princess, matchabelli, meher, master, usa, baba, princ, spiritu, norina, miracl",0.0433566433566,0.00699300699301,1.0,0.0,0.555555555556,20.0,0.740740740741,0.0013986013986,0.0013986013986,0.0,0.0111888111888,0.0223776223776,0.020979020979,0.0041958041958,0.75336862981,0.713404162438,journal.02.06.10,63,3,4.44,3,3.73235994425,4
71,SS07_test,1,1.37705516815,"net, totoaba, illeg, gear, farley, weather, endang, mowat, find, fish",0.0282828282828,0.030303030303,0.0,1.0,0.541666666667,14.0,0.583333333333,0.0323232323232,0.0,0.0,0.00606060606061,0.0,0.0,0.00606060606061,0.793195998328,0.801489295722,SS07,118,2,2.97,4,2.37103263224,3
75,ACLU09_test,1,1.68084597588,"secreci, subpoena, gag, amend, signal, default, demand, too, juri, aclu",0.0152173913043,0.020652173913,0.0,1.0,0.40625,17.0,0.53125,0.00652173913043,0.00108695652174,0.0,0.00326086956522,0.0,0.0,0.0195652173913,0.701472616426,0.607449832182,ACLU09,147,3,2.86666666667,3,2.96081553508,3
78,good-news-bad-news-steve-shepherd-sermon-on-doing-gods-will-32921.asp_test,1,3.46017599106,"bad, fire, evil, brandon, want, put, need, good, preacher, lit",0.0278824415976,0.0388093443858,0.0,1.0,0.18152866242,147.0,0.468152866242,0.035418236624,0.00640542577242,0.0211002260739,0.00753579502638,0.0128108515448,0.00263752825923,0.00979653353429,0.651568858015,0.471404768228,good-news-bad-news-steve-shepherd-sermon-on-doing-gods-will-32921.asp,95,4,3.37,3,2.95889868471,5
80,551.html_test,1,1.65321803093,"bill, gauchat, peter, merci, maurin, talk, worker, vietnam, fruit, ladi",0.0338294993234,0.021650879567,1.0,0.0,0.514285714286,30.0,0.857142857143,0.0189445196211,0.0,0.00811907983762,0.0148849797023,0.021650879567,0.00270635994587,0.00811907983762,0.812733004282,0.824332313968,551.html,36,3,3.73666666667,4,3.56760335656,4
81,MalcolmX-AfterTheBombing_test,1,9.30657100677,"negro, get, know, got, hate, thing, say, tri, want, ourselv",0.0149876042371,0.0205093531666,0.0,1.0,0.318637274549,383.0,0.76753507014,0.0161144917737,0.0259184133423,0.0218616182105,0.0268199233716,0.0132972729322,0.0,0.0153256704981,0.686139322319,0.544888486371,MalcolmX-AfterTheBombing,88,2,2.10666666667,2,2.09543044328,2
84,MalcolmX-ProspectsForFreedomin1965_test,1,4.43439602852,"get, civilright, noth, explos, promis, ake, harlem, oppress, prospect, malcolm",0.0210692652094,0.0221227284698,0.0,1.0,0.191489361702,153.0,0.651063829787,0.0152752172768,0.00948116934422,0.0163286805373,0.0281801422175,0.00421385304188,0.00131682907559,0.0186989728733,0.723458950355,0.588176520005,MalcolmX-ProspectsForFreedomin1965,83,2,2.40666666667,2,2.20633893576,2
85,piper80 071380m_test,1,1.53943300247,"pastor, say, bibl, baptist, criswel, preacher, wisdom, know, anyth, hear",0.0272435897436,0.00801282051282,1.0,0.0,0.636363636364,30.0,0.909090909091,0.00801282051282,0.0192307692308,0.0512820512821,0.00320512820513,0.0192307692308,0.0,0.0128205128205,0.714907858293,0.734986918699,piper80 071380m,43,4,4.35,5,4.33007690199,5
90,339.html_test,1,2.46030211449,"get, worker, strike, bridg, dinner, sock, christma, thing, meet, paper",0.0231809401159,0.0218931101095,1.0,0.0,0.540540540541,66.0,0.891891891892,0.0302640051513,0.0186735350934,0.00965872504829,0.0148100450741,0.0212491951062,0.00193174500966,0.00579523502898,0.776302687083,0.504995744916,339.html,33,3,2.97,2,2.68607678731,2
92,YV03_test,1,1.83139204979,"yantra, triangl, manifest, crystal, dot, express, bindhu, mantra, kalaa, shanthi",0.0114942528736,0.00287356321839,1.0,0.0,0.3,23.0,0.46,0.00431034482759,0.0100574712644,0.0014367816092,0.00862068965517,0.0014367816092,0.0014367816092,0.0244252873563,0.753487015451,0.706460240765,YV03,128,3,3.58333333333,3,4.12076744081,3
95,558.html_test,1,1.21806907654,"obedi, poverti, ave, maria, love, rosari, advent, tell, convers, scriptur",0.0509383378016,0.00536193029491,1.0,0.0,0.35,9.0,0.45,0.0214477211796,0.0,0.0,0.0,0.00268096514745,0.0160857908847,0.00268096514745,0.769890624059,0.576540447136,558.html,37,4,4.08666666667,3,3.61717649845,4
104,"2015-07-05 Privilege Unpacking the Knapsack, Morgan Patten_test",1,2.32777881622,"privileg, realli, joke, talk, felt, miss, thing, kid, crimin, ticket",0.0179597701149,0.0280172413793,0.0,1.0,0.472527472527,83.0,0.912087912088,0.00862068965517,0.0114942528736,0.0646551724138,0.0100574712644,0.010775862069,0.000718390804598,0.0172413793103,0.705267756889,0.597191696742,"2015-07-05 Privilege Unpacking the Knapsack, Morgan Patten",111,3,2.72333333333,2,3.46613522149,3
