,groupId,files,timeRun,keywords,perPos,perNeg,perPosDoc,perNegDoc,PSJudge,judgementCount,judgementFrac,nous,vous,je,ils,il,elle,le,avgSD,avgEVC,groupName,Unnamed: 0,rank,rfPred,rfClassPred,svmPred,svmClassPred
5,225.html_test,1,4.03105211258,"worker, fergi, get, feast, too, kichi, soul, priest, kitchen, prayer",0.0224835696991,0.0300933932895,0.0,1.0,0.490909090909,99.0,0.9,0.020062262193,0.00345901072293,0.00968523002421,0.00657212037357,0.0276720857835,0.0231753718437,0.00657212037357,0.690303442835,0.700691663263,225.html,30,3,3.28666666667,3,2.96145631176,2
8,296.html_test,1,1.45758795738,"liturg, pray, prayer, christ, liturgi, mystic, laiti, injustic, campion, complin",0.00686498855835,0.0183066361556,0.0,1.0,0.51724137931,20.0,0.689655172414,0.0800915331808,0.00228832951945,0.00228832951945,0.00228832951945,0.0045766590389,0.00228832951945,0.0137299771167,0.772089867428,0.587619690619,296.html,32,5,2.72,2,2.88802344835,2
9,ACLU03_test,1,2.05265808105,"flint, safe, poison, failur, elementari, ppb, done, drink, appoint, water",0.030303030303,0.0251082251082,1.0,0.0,0.285714285714,25.0,0.446428571429,0.0025974025974,0.004329004329,0.0,0.00952380952381,0.004329004329,0.0,0.0103896103896,0.749150294502,0.47666167497,ACLU03,141,3,3.74666666667,3,3.34847346979,3
11,YV11_test,1,1.70211696625,"whi, lotus, love, don't, yogavill, want, should, tri, roof, religion",0.0368794326241,0.0156028368794,1.0,0.0,0.485294117647,44.0,0.647058823529,0.0326241134752,0.0198581560284,0.0212765957447,0.00992907801418,0.00141843971631,0.0,0.0156028368794,0.715425818412,0.607443977816,YV11,136,8,3.77333333333,3,3.96942178344,3
12,"2011-12-11 Hope Not Hype, Rev. Mark Belletini.pdf_test",1,4.64463210106,"hope, hype, magic, pain, happen, too, dont, perfect, love, suffer",0.0356933879462,0.0333528379169,1.0,0.0,0.258928571429,142.0,0.633928571429,0.0263311878291,0.00643651258046,0.0295494441194,0.00848449385606,0.00263311878291,0.00672908133411,0.0119953188999,0.657585873862,0.631939537011,"2011-12-11 Hope Not Hype, Rev. Mark Belletini.pdf",108,4,3.60333333333,3,3.85981351685,3
16,SS04_test,1,2.3231010437,"shepherd, net, illeg, whale, crew, gill, cut, happi, anyth, worri",0.0396119644301,0.018593371059,1.0,0.0,0.433333333333,53.0,0.883333333333,0.00970088924818,0.00323362974939,0.0299110751819,0.0210185933711,0.0,0.0,0.0121261115602,0.710258766636,0.664894099941,SS04,115,3,3.6,3,4.50004258429,3
21,MalcolmX-AnAppealtoAfricanHeadsofState_test,1,6.85113692284,"malcolm, negro, uniti, cairo, get, african, confer, here, civilright, afroamerican",0.0244808374135,0.0238055039676,1.0,0.0,0.408510638298,156.0,0.663829787234,0.0194158365693,0.00928583488097,0.00928583488097,0.00877933479656,0.00236366706061,0.00135066689178,0.0111430018572,0.723240914134,0.664602832219,MalcolmX-AnAppealtoAfricanHeadsofState,89,2,3.58333333333,3,3.12495423573,3
24,"2007-11-11 Spiritual Claustrophobia, Rev. Mark Belletini.PDF_test",1,5.83502912521,"experi, dont, let, theolog, els, hallway, tell, wrong, realli, too",0.0243632336656,0.0190476190476,1.0,0.0,0.203045685279,233.0,0.591370558376,0.0148394241417,0.0104097452935,0.0423034330011,0.00863787375415,0.00398671096346,0.00996677740864,0.0126245847176,0.676236376264,0.514337817248,"2007-11-11 Spiritual Claustrophobia, Rev. Mark Belletini.PDF",107,7,3.87333333333,3,3.58598677533,5
26,piper94 07-10-94_test,1,4.09002304077,"love, homosexu, say, command, fulfil, scriptur, keep, god, greg, violat",0.0492113564669,0.0261829652997,1.0,0.0,0.494186046512,119.0,0.691860465116,0.0331230283912,0.00694006309148,0.00851735015773,0.011356466877,0.00883280757098,0.00410094637224,0.00946372239748,0.719639740739,0.636675363489,piper94 07-10-94,54,2,3.60333333333,3,3.6032145218,3
36,ACLU11_test,1,1.48945593834,"voter, kobach, regist, vote, registr, judg, restrict, kansa, citizenship, add",0.00759013282732,0.0265654648956,0.0,1.0,0.588235294118,10.0,0.588235294118,0.0,0.0,0.0,0.0379506641366,0.011385199241,0.0,0.00189753320683,0.626408145811,0.553391120255,ACLU11,149,3,2.23,3,2.31133286221,3
37,SS03_test,1,1.25377392769,"whale, contamin, pollut, microplast, ecosystem, toxicolog, shepherd, expedit, scientist, california",0.0245398773006,0.0122699386503,1.0,0.0,0.357142857143,8.0,0.571428571429,0.0306748466258,0.0,0.0,0.0,0.0,0.00306748466258,0.00613496932515,0.802418534228,0.582645206635,SS03,114,2,3.42666666667,4,2.54585576005,4
42,SS12_test,1,2.72388696671,"costa, rican, coco, illeg, shepherd, arrest, vessel, guatemalan, charg, rica",0.0115321252059,0.0219659527732,0.0,1.0,0.44578313253,56.0,0.674698795181,0.0175727622186,0.0,0.0236133992312,0.0126304228446,0.00054914881933,0.0,0.00604063701263,0.691054198822,0.628273480924,SS12,123,1,1.85666666667,3,1.09819261849,1
53,MalcolmX-TheBallotortheBullet_test,1,9.91008806229,"get, let, negro, bullet, got, ballot, segreg, malcolm, whi, civilright",0.0184800664452,0.0144310631229,1.0,0.0,0.265342960289,435.0,0.785198555957,0.0192068106312,0.03176910299,0.0129775747508,0.0140157807309,0.015988372093,0.00103820598007,0.0179609634551,0.6939761716,0.681160395609,MalcolmX-TheBallotortheBullet,84,2,2.7,2,3.79039411938,2
56,piper85 pn850026_test,1,1.63766384125,"grace, god, welltim, christ, priest, let, know, lord, templ, tomorrow",0.0267094017094,0.0160256410256,1.0,0.0,0.204081632653,12.0,0.244897959184,0.0213675213675,0.025641025641,0.0106837606838,0.00213675213675,0.0192307692308,0.0,0.00320512820513,0.750226902328,0.639940519154,piper85 pn850026,48,3,3.17333333333,4,2.68410011617,3
58,YV04_test,1,2.60878300667,"mind, yoga, calm, clean, whi, medit, want, don't, sutra, everyth",0.0382059800664,0.00830564784053,1.0,0.0,0.350993377483,102.0,0.675496688742,0.0227021040975,0.0581395348837,0.00221483942414,0.000553709856035,0.00166112956811,0.000553709856035,0.014950166113,0.717585582129,0.714655700116,YV04,129,3,4.54666666667,4,3.86397481769,4
63,YV10_test,1,1.87777900696,"mantra, gurudeva, mind, felt, get, know, dream, lesson, stop, husband",0.0203426124197,0.0182012847966,1.0,0.0,0.35632183908,77.0,0.885057471264,0.00321199143469,0.0117773019272,0.117773019272,0.00107066381156,0.0235546038544,0.0,0.0182012847966,0.726005857734,0.64483544488,YV10,135,8,3.63666666667,3,3.36697390607,4
64,piper99 1-31-99_test,1,3.53842902184,"doer, justifi, judgment, christ, vers, gospel, god, say, hypothet, sin",0.0322055953155,0.0198438516591,1.0,0.0,0.415584415584,96.0,0.623376623377,0.014313597918,0.00553025374105,0.0100845803513,0.0113858165257,0.0123617436565,0.000325309043591,0.0107351984385,0.754225297451,0.649720303758,piper99 1-31-99,58,4,3.71666666667,3,3.73079736203,3
67,535.html_test,1,1.61783909798,"love, prayer, reader, happi, worker, keep, think, appeal, confid, grace",0.0506155950752,0.0123119015048,1.0,0.0,0.477272727273,33.0,0.75,0.0424076607387,0.0232558139535,0.0246238030096,0.0123119015048,0.00683994528044,0.00136798905609,0.0123119015048,0.731809732366,0.593020139762,535.html,35,5,3.96666666667,2,4.30560785364,2
73,wgV2n3-2_test,1,1.65578699112,"brother, avatar, savior, dawn, fear, inhuman, lord, selfish, pain, save",0.04625,0.03375,1.0,0.0,0.826086956522,21.0,0.913043478261,0.09125,0.0,0.00125,0.0,0.03,0.0,0.005,0.761738245808,0.624718088698,wgV2n3-2,70,5,3.31333333333,2,2.72175862376,2
74,ACLU09_test,1,1.70006108284,"secreci, subpoena, gag, amend, signal, default, demand, too, juri, aclu",0.0152173913043,0.020652173913,0.0,1.0,0.40625,17.0,0.53125,0.00652173913043,0.00108695652174,0.0,0.00326086956522,0.0,0.0,0.0195652173913,0.703386224845,0.607449832182,ACLU09,147,3,2.67,3,2.82456764877,3
76,good-news-bad-news-steve-shepherd-sermon-on-doing-gods-will-32921.asp_test,1,3.47316598892,"bad, fire, evil, brandon, want, put, need, good, preacher, lit",0.0278824415976,0.0388093443858,0.0,1.0,0.18152866242,147.0,0.468152866242,0.035418236624,0.00640542577242,0.0211002260739,0.00753579502638,0.0128108515448,0.00263752825923,0.00979653353429,0.650439005161,0.471404768228,good-news-bad-news-steve-shepherd-sermon-on-doing-gods-will-32921.asp,95,4,3.28333333333,5,2.72343673791,5
78,551.html_test,1,1.64307999611,"bill, gauchat, peter, merci, maurin, talk, worker, vietnam, fruit, ladi",0.0338294993234,0.021650879567,1.0,0.0,0.514285714286,30.0,0.857142857143,0.0189445196211,0.0,0.00811907983762,0.0148849797023,0.021650879567,0.00270635994587,0.00811907983762,0.81351956147,0.824332313968,551.html,36,3,3.55,4,3.72000450809,4
79,MalcolmX-AfterTheBombing_test,1,9.26573586464,"negro, get, know, got, hate, thing, say, tri, want, ourselv",0.0149876042371,0.0205093531666,0.0,1.0,0.318637274549,383.0,0.76753507014,0.0161144917737,0.0259184133423,0.0218616182105,0.0268199233716,0.0132972729322,0.0,0.0153256704981,0.686525042736,0.544888486371,MalcolmX-AfterTheBombing,88,2,2.15,2,2.08548512626,2
80,200.html_test,1,1.1080019474,"convers, address, noth, communist, talk, strang, sure, profess, opium, whi",0.0181818181818,0.0181818181818,0.0,1.0,0.478260869565,18.0,0.782608695652,0.0025974025974,0.0103896103896,0.0,0.0025974025974,0.0,0.0467532467532,0.0285714285714,-0.289556462704,0.598822570499,200.html,28,3,2.91333333333,3,3.27082078138,2
82,MalcolmX-ProspectsForFreedomin1965_test,1,4.45147800446,"get, civilright, noth, explos, promis, ake, harlem, oppress, prospect, malcolm",0.0210692652094,0.0221227284698,0.0,1.0,0.191489361702,153.0,0.651063829787,0.0152752172768,0.00948116934422,0.0163286805373,0.0281801422175,0.00421385304188,0.00131682907559,0.0186989728733,0.722617202129,0.588176520005,MalcolmX-ProspectsForFreedomin1965,83,2,2.35,2,1.91105272339,2
87,SS05_test,1,1.82390594482,"seaworld, hsus, orca, manbi, pacell, keiko, condemn, profit, will, dolphin",0.0275229357798,0.0336391437309,0.0,1.0,0.456140350877,34.0,0.59649122807,0.00407747196738,0.0,0.00407747196738,0.0346585117227,0.0112130479103,0.0,0.00917431192661,0.677538235093,0.531921212903,SS05,116,2,3.02666666667,3,2.10831258917,1
90,ACLU07_test,1,2.27260398865,"camp, polic, dakota, protector, morton, surveil, pipelin, sheriff, roadblock, vehicl",0.0102702702703,0.0151351351351,0.0,1.0,0.391304347826,27.0,0.391304347826,0.00216216216216,0.000540540540541,0.0,0.0113513513514,0.00108108108108,0.0,0.00594594594595,0.580981870721,0.723923388205,ACLU07,145,3,2.68666666667,3,2.57759286394,3
95,188.html_test,1,1.79376196861,"christ, rememb, hope, unto, shall, worker, mighti, coffe, pull, fortif",0.0217391304348,0.0217391304348,0.0,1.0,0.415094339623,43.0,0.811320754717,0.0239130434783,0.0184782608696,0.00978260869565,0.00978260869565,0.0173913043478,0.0,0.0141304347826,0.788078639089,0.691311412199,188.html,27,3,2.98666666667,3,2.61760625955,2
99,YV12_test,1,1.18527197838,"yantra, medit, faith, yoga, cosmos, divin, petal, path, express, god",0.037037037037,0.00617283950617,1.0,0.0,0.411764705882,7.0,0.411764705882,0.00617283950617,0.00617283950617,0.0,0.00617283950617,0.00617283950617,0.0,0.0154320987654,0.838997285524,0.608677116584,YV12,137,6,4.35,4,4.12183361776,4
101,remembering-9-11-steve-shepherd-sermon-on-america-160100.asp_test,1,3.32484197617,"happen, evil, look, whi, want, perfect, devil, lord, sept, get",0.0233017377567,0.0410742496051,0.0,1.0,0.0931174089069,144.0,0.291497975709,0.022906793049,0.0177725118483,0.0181674565561,0.010663507109,0.0165876777251,0.00276461295419,0.00987361769352,0.636420781417,0.576861251879,remembering-9-11-steve-shepherd-sermon-on-america-160100.asp,99,3,2.75,3,2.4185281543,2
104,ACLU12_test,1,1.55086088181,"snowden, pardon, disclosur, obama, surveil, editori, whistleblow, post, privaci, opinion",0.0427728613569,0.023598820059,1.0,0.0,0.48275862069,18.0,0.620689655172,0.0117994100295,0.0,0.00294985250737,0.00442477876106,0.0191740412979,0.0,0.00884955752212,0.715834534397,0.559694541007,ACLU12,150,3,3.59666666667,3,3.60853888885,4
109,"2005-07-10 Promoting Acceptance and Spiritual Growth, James Bailey.PDF_test",1,3.43086886406,"mystic, spiritu, accept, sunday, gay, radic, selfaccept, quilt, grandmoth, affirm",0.0192307692308,0.0134615384615,1.0,0.0,0.296774193548,118.0,0.761290322581,0.0192307692308,0.005,0.0457692307692,0.00346153846154,0.00961538461538,0.00846153846154,0.00807692307692,0.676582165204,0.546525072543,"2005-07-10 Promoting Acceptance and Spiritual Growth, James Bailey.PDF",105,5,3.00333333333,5,4.00881446687,5
110,overcoming-lifes-problems-steve-shepherd-sermon-on-endurance-32141.asp_test,1,3.58441710472,"want, christ, don, overcom, get, pain, ill, car, said, say",0.0274071402813,0.023079697079,1.0,0.0,0.293388429752,146.0,0.603305785124,0.0274071402813,0.0180310133429,0.0223584565453,0.00576992426974,0.0144248106744,0.0079336458709,0.00901550667147,0.65150119138,0.506494561511,overcoming-lifes-problems-steve-shepherd-sermon-on-endurance-32141.asp,98,3,3.37,3,3.60150849916,3
