,groupId,files,timeRun,keywords,perPos,perNeg,perPosDoc,perNegDoc,PSJudge,judgementCount,judgementFrac,nous,vous,je,ils,il,elle,le,avgSD,avgEVC,groupName,Unnamed: 0,rank,rfPred,rfClassPred,svmPred,svmClassPred
1,YV02_test,1,1.20541906357,"yoga, ceremoni, eat, sleep, satchidananda, sake, don't, swami, spiritu, sri",0.0265780730897,0.00332225913621,1.0,0.0,0.611111111111,13.0,0.722222222222,0.00996677740864,0.0199335548173,0.0332225913621,0.0265780730897,0.0,0.0,0.00332225913621,0.780034833057,0.579184715841,YV02,127,4,3.68333333333,3,3.35679251197,3
3,MalcolmX-MessagetotheGrassRoots_test,1,6.64370989799,"negro, got, get, let, talk, tom, master, know, say, malcolm",0.0166527893422,0.0214820982515,0.0,1.0,0.304136253041,314.0,0.76399026764,0.0121565362198,0.034304746045,0.0108243130724,0.0274771024147,0.0158201498751,0.00116569525396,0.0184845961699,0.71065342732,0.54987988973,MalcolmX-MessagetotheGrassRoots,82,2,2.25,2,2.65466886153,2
8,225.html_test,1,3.73407101631,"worker, fergi, get, feast, too, kichi, soul, priest, kitchen, prayer",0.0224835696991,0.0300933932895,0.0,1.0,0.490909090909,99.0,0.9,0.020062262193,0.00345901072293,0.00968523002421,0.00657212037357,0.0276720857835,0.0231753718437,0.00657212037357,0.692226869832,0.700691663263,225.html,30,3,3.29666666667,3,3.49809090263,3
9,409.html_test,1,1.42084407806,"bread, retreat, farm, tabl, tree, easton, babi, read, everyon, herb",0.0339558573854,0.0169779286927,1.0,0.0,0.392857142857,14.0,0.5,0.0237691001698,0.0,0.00169779286927,0.00509337860781,0.0,0.0,0.0101867572156,0.756387448818,0.576023711084,409.html,34,4,3.43,3,3.14047758468,3
11,piper85 pn850005_test,1,4.94274687767,"sing, jehoshaphat, judah, vers, lord, god, satan, worship, thi, prais",0.0246626337832,0.0228013029316,1.0,0.0,0.472573839662,187.0,0.789029535865,0.0216379711494,0.0169846440205,0.00814332247557,0.0221033038623,0.0169846440205,0.00279199627734,0.00697999069335,0.68240192887,0.719528746324,piper85 pn850005,47,3,2.66333333333,2,2.19585314839,2
13,piper99 4-4-99_test,1,2.8577029705,"condemn, christ, sinner, guilti, righteous, jesus, answer, god, judg, vers",0.0368709516692,0.0333831589437,1.0,0.0,0.402777777778,83.0,0.576388888889,0.0264075734928,0.0114598903837,0.0224215246637,0.000996512207275,0.02192326856,0.0,0.0119581464873,0.60877027635,0.528360248967,piper99 4-4-99,60,3,3.67333333333,3,3.31043868802,3
17,YV11_test,1,1.61019182205,"whi, lotus, love, don't, yogavill, want, should, tri, roof, religion",0.0368794326241,0.0156028368794,1.0,0.0,0.485294117647,44.0,0.647058823529,0.0326241134752,0.0198581560284,0.0212765957447,0.00992907801418,0.00141843971631,0.0,0.0156028368794,0.716179677662,0.607443977816,YV11,136,8,4.27666666667,3,4.15080581325,3
23,MalcolmX-TheHarlemHateGang_test,1,3.84694194794,"polic, harlem, nonviol, realiz, get, hategang, blood, oppressor, negro, malcolm",0.0123818833496,0.0234604105572,0.0,1.0,0.242937853107,128.0,0.723163841808,0.00879765395894,0.0153144346693,0.0215053763441,0.0260671228413,0.0149885956338,0.0,0.0159661127403,0.714763127158,0.552851283806,MalcolmX-TheHarlemHateGang,86,2,2.36,2,2.08604673405,2
25,MalcolmX-LettersFromAbroad_test,1,2.9470281601,"nigeria, mecca, racism, malcolm, brotherhood, abroad, color, muslim, ghana, sincer",0.0205669816565,0.0166759310728,1.0,0.0,0.458333333333,51.0,0.708333333333,0.0105614230128,0.000555864369094,0.0322401334074,0.0111172873819,0.00667037242913,0.00111172873819,0.0100055586437,0.744391372908,0.611114085611,MalcolmX-LettersFromAbroad,81,3,2.93333333333,3,3.0743415011,3
27,journal.02.06.10_test,1,1.5999751091,"princess, matchabelli, meher, master, usa, baba, princ, spiritu, norina, miracl",0.0433566433566,0.00699300699301,1.0,0.0,0.555555555556,20.0,0.740740740741,0.0013986013986,0.0013986013986,0.0,0.0111888111888,0.0223776223776,0.020979020979,0.0041958041958,0.753189331623,0.713404162438,journal.02.06.10,63,3,4.19333333333,3,3.81955241393,4
33,a-different-gospel-steve-shepherd-sermon-on-false-teaching-161833.asp_test,1,3.1036438942,"gospel, hell, say, jesus, preach, christ, knife, don, pleas, tri",0.0268980477223,0.0325379609544,0.0,1.0,0.282296650718,124.0,0.593301435407,0.00824295010846,0.0125813449024,0.0208242950108,0.00997830802603,0.0225596529284,0.00260303687636,0.0156182212581,0.653304331128,0.586214587548,a-different-gospel-steve-shepherd-sermon-on-false-teaching-161833.asp,93,1,3.67,3,3.19423945785,3
36,piper94 09-11-94_test,1,2.95117998123,"bless, vers, evil, insult, inherit, feel, say, grace, hope, futur",0.0522388059701,0.0171202809482,1.0,0.0,0.469565217391,87.0,0.75652173913,0.0377524143986,0.031167690957,0.00438981562774,0.00438981562774,0.0118525021949,0.0,0.00965759438104,0.692558502393,0.607689427771,piper94 09-11-94,55,2,4.09666666667,5,3.84338091874,3
38,YV01_test,1,1.28059887886,"sannyasin, yoga, sannya, renounc, sri, satchidananda, monk, dress, “the, ceremoni",0.00547945205479,0.00821917808219,0.0,1.0,0.409090909091,13.0,0.590909090909,0.0027397260274,0.0,0.0,0.0328767123288,0.0109589041096,0.00547945205479,0.0027397260274,0.738876178822,0.502723161424,YV01,126,3,3.69,3,3.1156521278,3
39,piper90 01-28-90_test,1,3.03002905846,"gospel, preach, fulfil, jesus, god, matthew, ministri, glori, isaiah, repent",0.0205106739221,0.0108832147342,1.0,0.0,0.483050847458,83.0,0.703389830508,0.0121389702805,0.00251151109251,0.00460443700293,0.00460443700293,0.0334868145668,0.0,0.00795311845961,0.786338638848,0.834559504194,piper90 01-28-90,52,4,3.3,3,3.89116574107,3
49,SS03_test,1,1.17385697365,"whale, contamin, pollut, microplast, ecosystem, toxicolog, shepherd, expedit, scientist, california",0.0245398773006,0.0122699386503,1.0,0.0,0.357142857143,8.0,0.571428571429,0.0306748466258,0.0,0.0,0.0,0.0,0.00306748466258,0.00613496932515,0.802533806501,0.582645206635,SS03,114,2,3.61,3,2.85409486615,2
53,ACLU05_test,1,1.71834182739,"mohamedou, prison, guantánamo, tortur, unlaw, mauritania, memoir, privaci, thrill, slahi",0.0309523809524,0.0297619047619,1.0,0.0,0.547619047619,34.0,0.809523809524,0.0261904761905,0.0,0.00595238095238,0.00119047619048,0.047619047619,0.00119047619048,0.00595238095238,0.694340259573,0.554392760686,ACLU05,143,3,3.65666666667,5,4.27286846783,3
56,YV13_test,1,1.35123991966,"happi, want, get, stamp, unhappi, joy, got, say, can't, moment",0.0164705882353,0.00705882352941,1.0,0.0,0.578947368421,28.0,0.736842105263,0.00941176470588,0.0705882352941,0.00235294117647,0.00705882352941,0.0,0.0,0.0329411764706,0.774892692325,0.553920281175,YV13,138,5,3.51333333333,3,4.10324614244,3
57,journal.1.12.11_test,1,2.20707082748,"infinit, realiz, reaction, real, shall, finit, react, resign, meher, baba",0.0352020860495,0.00586701434159,1.0,0.0,0.505050505051,66.0,0.666666666667,0.0365058670143,0.0026075619296,0.029335071708,0.0,0.0280312907432,0.0,0.0176010430248,0.782589589821,0.853541756081,journal.1.12.11,66,5,4.23,3,4.53907845552,3
61,SS09_test,1,1.26239991188,"shepherd, pamela, anderson, seal, slaughter, babi, orca, whale, newfoundland, salmon",0.0155763239875,0.0155763239875,0.0,1.0,0.818181818182,10.0,0.909090909091,0.018691588785,0.0,0.00934579439252,0.0,0.0,0.0249221183801,0.00311526479751,0.804271568807,0.609438581614,SS09,120,2,2.95,2,3.54508956244,3
64,how-to-bless-america-steve-shepherd-sermon-on-independence-day-69779.asp_test,1,3.95763897896,"don, ill, bless, government, said, ask, attitud, want, mph, whi",0.0417189460477,0.0185069008783,1.0,0.0,0.126237623762,187.0,0.462871287129,0.0207026348808,0.017252195734,0.0228983688833,0.00752823086575,0.0100376411543,0.00752823086575,0.0131744040151,0.684129235382,0.508677204049,how-to-bless-america-steve-shepherd-sermon-on-independence-day-69779.asp,96,3,5.03666666667,4,4.55816266826,3
65,MalcolmX-AtTheAudubon_test,1,7.66701602936,"get, congo, malcolm, let, dick, talk, mercenari, know, look, say",0.0200935865676,0.0228461326727,0.0,1.0,0.32,306.0,0.765,0.0177539223782,0.027250206441,0.0199559592623,0.0202312138728,0.0196807046518,0.00110101844206,0.01334984861,0.638309150029,0.600845079001,MalcolmX-AtTheAudubon,90,2,2.32,2,2.29392016722,2
68,piper92 09-27-92_test,1,3.28351902962,"christ, gentil, reconcil, jew, god, israel, coven, glori, promis, jesus",0.0179290157336,0.0135382363703,1.0,0.0,0.467625899281,82.0,0.589928057554,0.0160995243322,0.0175631174533,0.00658616904501,0.00731796560556,0.0204903036956,0.0,0.0032930845225,0.68536970797,0.843150970135,piper92 09-27-92,53,1,3.0,3,2.12296831637,2
72,piper85 pn850026_test,1,1.61415100098,"grace, god, welltim, christ, priest, let, know, lord, templ, tomorrow",0.0267094017094,0.0160256410256,1.0,0.0,0.204081632653,12.0,0.244897959184,0.0213675213675,0.025641025641,0.0106837606838,0.00213675213675,0.0192307692308,0.0,0.00320512820513,0.749053516956,0.639940519154,piper85 pn850026,48,3,3.87333333333,3,3.17482392053,3
73,651.html_test,1,1.51194906235,"sudden, ask, job, met, simm, knew, policeman, polic, household, obituari",0.0180921052632,0.0180921052632,0.0,1.0,0.411764705882,27.0,0.794117647059,0.00986842105263,0.0,0.00328947368421,0.00986842105263,0.0740131578947,0.0180921052632,0.00657894736842,0.812038075452,0.599278229852,651.html,39,4,3.54,3,3.74036222759,3
74,"2014-12-07 Is Hope Simply Wishful Thinking, Rev. Mark Belletini_test",1,5.39824008942,"hope, danc, sermon, jump, bad, morn, get, ask, hear, joy",0.0292850990525,0.0191645133506,1.0,0.0,0.291512915129,201.0,0.741697416974,0.0191645133506,0.0144272179156,0.0325150732127,0.015503875969,0.00172265288544,0.00172265288544,0.0152885443583,0.644930049318,0.617199416127,"2014-12-07 Is Hope Simply Wishful Thinking, Rev. Mark Belletini",110,5,4.22666666667,5,4.04379508389,5
76,SS06_test,1,1.37702798843,"dolphin, captiv, tank, sorri, orca, shepherd, endur, taiji, sought, concret",0.00904977375566,0.0633484162896,0.0,1.0,0.68,24.0,0.96,0.00452488687783,0.0633484162896,0.0180995475113,0.00904977375566,0.0,0.0,0.0,0.713300870941,0.641319399862,SS06,117,2,2.42,1,3.3239425887,3
78,SS01_test,1,1.35475897789,"vaquita, shepherd, gift, illeg, marin, save, porpois, whale, countless, gill",0.020325203252,0.0182926829268,1.0,0.0,0.35,13.0,0.65,0.020325203252,0.0121951219512,0.0020325203252,0.0,0.0,0.0,0.0020325203252,0.744013764516,0.588484581691,SS01,112,1,2.77,3,2.18547583341,2
79,YV10_test,1,1.95061302185,"mantra, gurudeva, mind, felt, get, know, dream, lesson, stop, husband",0.0203426124197,0.0182012847966,1.0,0.0,0.35632183908,77.0,0.885057471264,0.00321199143469,0.0117773019272,0.117773019272,0.00107066381156,0.0235546038544,0.0,0.0182012847966,0.727092514801,0.64483544488,YV10,135,8,3.70666666667,3,3.7662065041,3
81,mapping-out-the-new-year-steve-shepherd-sermon-on-new-years-day-142575.asp_test,1,3.76131486893,"gps, lord, trust, happi, pray, husband, step, get, seek, prayer",0.0301783264746,0.0181755829904,1.0,0.0,0.240875912409,181.0,0.660583941606,0.0356652949246,0.0130315500686,0.0168038408779,0.00548696844993,0.031207133059,0.0161179698217,0.00891632373114,0.670530588597,0.596822233112,mapping-out-the-new-year-steve-shepherd-sermon-on-new-years-day-142575.asp,97,5,4.49333333333,5,3.47321831046,3
83,ACLU02_test,1,1.53632283211,"fisc, opinion, surveil, usa, yahoo, secret, aclu, hidden, refus, address",0.0263591433278,0.00164744645799,1.0,0.0,0.8125,14.0,0.875,0.00494233937397,0.00164744645799,0.0,0.00823723228995,0.0,0.0,0.0197693574959,0.746984889434,0.526031851325,ACLU02,140,3,4.22,3,3.68202175865,3
86,piper80 122480_test,1,2.40206694603,"fear, god, bethlehem, joy, christma, luke, sake, jesus, shall, rejoic",0.0260545905707,0.037841191067,0.0,1.0,0.428571428571,66.0,0.725274725275,0.0117866004963,0.0198511166253,0.0179900744417,0.00496277915633,0.0353598014888,0.000620347394541,0.0130272952854,0.640254079754,0.612990412874,piper80 122480,44,3,3.56,3,3.53990575965,3
88,MalcolmX-AfterTheBombing_test,1,9.34794998169,"negro, get, know, got, hate, thing, say, tri, want, ourselv",0.0149876042371,0.0205093531666,0.0,1.0,0.318637274549,383.0,0.76753507014,0.0161144917737,0.0259184133423,0.0218616182105,0.0268199233716,0.0132972729322,0.0,0.0153256704981,0.689472617524,0.544888486371,MalcolmX-AfterTheBombing,88,2,2.27666666667,2,2.33951592451,2
89,SS10_test,1,1.45823907852,"dog, galapago, shark, wildlif, cristob, shepherd, “sniffer, remark, agreement, knum",0.0112570356473,0.0187617260788,0.0,1.0,0.631578947368,12.0,0.631578947368,0.00187617260788,0.0,0.00375234521576,0.0225140712946,0.0,0.0,0.00562851782364,0.713906746421,0.674479366693,SS10,121,1,2.18,3,1.51768335022,1
91,200.html_test,1,0.772809028625,"convers, address, noth, communist, talk, strang, sure, profess, opium, whi",0.0181818181818,0.0181818181818,0.0,1.0,0.478260869565,18.0,0.782608695652,0.0025974025974,0.0103896103896,0.0,0.0025974025974,0.0,0.0467532467532,0.0285714285714,-0.289358733798,0.598822570499,200.html,28,3,3.42,3,3.65636344688,3
96,piper85 pn850027_test,1,3.75999617577,"corinthian, enslav, thing, drink, whi, say, conscienc, spirit, stomach, immor",0.0242326332795,0.0142164781906,1.0,0.0,0.292237442922,157.0,0.716894977169,0.0132471728595,0.0222940226171,0.0168012924071,0.00743134087237,0.0210016155089,0.00032310177706,0.0158319870759,0.689379191695,0.66117322778,piper85 pn850027,49,5,3.94666666667,2,3.65430914735,3
100,whats-love-got-to-do-with-it-steve-shepherd-sermon-on-christian-love-118439.asp_test,1,3.87677788734,"love, got, debt, rememb, pay, don, husband, prayer, get, ill",0.0494915254237,0.0206779661017,1.0,0.0,0.212698412698,192.0,0.609523809524,0.0176271186441,0.0250847457627,0.0216949152542,0.0122033898305,0.0277966101695,0.00779661016949,0.015593220339,0.641568443871,0.508893073168,whats-love-got-to-do-with-it-steve-shepherd-sermon-on-christian-love-118439.asp,100,4,4.21,4,4.52901408624,3
102,"2006-04-09 Jesus, Rev. Mark Belletini.PDF_test",1,4.85927510262,"jesus, say, opinion, johnson, justic, ohio, pastor, seem, gospel, stake",0.02332433096,0.0203780996808,1.0,0.0,0.253787878788,152.0,0.575757575758,0.0127670022097,0.00515590473852,0.00883869383747,0.00613798183157,0.0235698502332,0.000982077093052,0.00736557819789,0.674316103634,0.584605724449,"2006-04-09 Jesus, Rev. Mark Belletini.PDF",106,6,3.32666666667,3,3.43269286267,3
105,you-adulterous-people-steve-shepherd-sermon-on-adultery-165397.asp_test,1,3.37366890907,"adulteri, don, devil, fear, get, anger, friendship, satan, spiritu, want",0.0299760191847,0.0363709032774,0.0,1.0,0.194552529183,154.0,0.599221789883,0.0203836930456,0.0219824140687,0.0231814548361,0.0159872102318,0.0227817745803,0.00519584332534,0.00759392486011,0.651009786701,0.489921290693,you-adulterous-people-steve-shepherd-sermon-on-adultery-165397.asp,101,2,3.48666666667,5,3.58679077942,3
110,"2005-07-10 Promoting Acceptance and Spiritual Growth, James Bailey.PDF_test",1,3.50299406052,"mystic, spiritu, accept, sunday, gay, radic, selfaccept, quilt, grandmoth, affirm",0.0192307692308,0.0134615384615,1.0,0.0,0.296774193548,118.0,0.761290322581,0.0192307692308,0.005,0.0457692307692,0.00346153846154,0.00961538461538,0.00846153846154,0.00807692307692,0.677771446646,0.546525072543,"2005-07-10 Promoting Acceptance and Spiritual Growth, James Bailey.PDF",105,5,3.74666666667,5,4.6042486865,5
