,groupId,files,timeRun,keywords,perPos,perNeg,perPosDoc,perNegDoc,PSJudge,judgementCount,judgementFrac,nous,vous,je,ils,il,elle,le,avgSD,avgEVC,groupName,Unnamed: 0,rank,rfPred,rfClassPred,svmPred,svmClassPred
7,651.html_test,1,1.58946108818,"sudden, ask, job, met, simm, knew, policeman, polic, household, obituari",0.0180921052632,0.0180921052632,0.0,1.0,0.411764705882,27.0,0.794117647059,0.00986842105263,0.0,0.00328947368421,0.00986842105263,0.0740131578947,0.0180921052632,0.00657894736842,0.809246635896,0.599278229852,651.html,39,4,3.23,3,3.87133990792,3
10,piper99 4-4-99_test,1,3.13932609558,"condemn, christ, sinner, guilti, righteous, jesus, answer, god, judg, vers",0.0368709516692,0.0333831589437,1.0,0.0,0.402777777778,83.0,0.576388888889,0.0264075734928,0.0114598903837,0.0224215246637,0.000996512207275,0.02192326856,0.0,0.0119581464873,0.608176286697,0.528360248967,piper99 4-4-99,60,3,3.35666666667,3,2.92483767651,3
14,"2011-12-11 Hope Not Hype, Rev. Mark Belletini.pdf_test",1,4.60343289375,"hope, hype, magic, pain, happen, too, dont, perfect, love, suffer",0.0356933879462,0.0333528379169,1.0,0.0,0.258928571429,142.0,0.633928571429,0.0263311878291,0.00643651258046,0.0295494441194,0.00848449385606,0.00263311878291,0.00672908133411,0.0119953188999,0.655388574238,0.631939537011,"2011-12-11 Hope Not Hype, Rev. Mark Belletini.pdf",108,4,3.40333333333,3,3.3530604838,3
15,you-adulterous-people-steve-shepherd-sermon-on-adultery-165397.asp_test,1,3.53644800186,"adulteri, don, devil, fear, get, anger, friendship, satan, spiritu, want",0.0299760191847,0.0363709032774,0.0,1.0,0.194552529183,154.0,0.599221789883,0.0203836930456,0.0219824140687,0.0231814548361,0.0159872102318,0.0227817745803,0.00519584332534,0.00759392486011,0.64954702578,0.489921290693,you-adulterous-people-steve-shepherd-sermon-on-adultery-165397.asp,101,2,3.33,3,2.8774789729,3
19,MalcolmX-LettersFromAbroad_test,1,2.81872296333,"nigeria, mecca, racism, malcolm, brotherhood, abroad, color, muslim, ghana, sincer",0.0205669816565,0.0166759310728,1.0,0.0,0.458333333333,51.0,0.708333333333,0.0105614230128,0.000555864369094,0.0322401334074,0.0111172873819,0.00667037242913,0.00111172873819,0.0100055586437,0.745765133392,0.611114085611,MalcolmX-LettersFromAbroad,81,3,3.09666666667,2,3.31955024012,3
26,a-different-gospel-steve-shepherd-sermon-on-false-teaching-161833.asp_test,1,3.34982299805,"gospel, hell, say, jesus, preach, christ, knife, don, pleas, tri",0.0268980477223,0.0325379609544,0.0,1.0,0.282296650718,124.0,0.593301435407,0.00824295010846,0.0125813449024,0.0208242950108,0.00997830802603,0.0225596529284,0.00260303687636,0.0156182212581,0.654898123731,0.586214587548,a-different-gospel-steve-shepherd-sermon-on-false-teaching-161833.asp,93,1,3.90333333333,3,3.1567723964,3
30,piper90 01-28-90_test,1,3.23506712914,"gospel, preach, fulfil, jesus, god, matthew, ministri, glori, isaiah, repent",0.0205106739221,0.0108832147342,1.0,0.0,0.483050847458,83.0,0.703389830508,0.0121389702805,0.00251151109251,0.00460443700293,0.00460443700293,0.0334868145668,0.0,0.00795311845961,0.785785953268,0.834559504194,piper90 01-28-90,52,4,3.72333333333,5,3.70846692233,2
31,"2006-04-09 Jesus, Rev. Mark Belletini.PDF_test",1,5.23828005791,"jesus, say, opinion, johnson, justic, ohio, pastor, seem, gospel, stake",0.02332433096,0.0203780996808,1.0,0.0,0.253787878788,152.0,0.575757575758,0.0127670022097,0.00515590473852,0.00883869383747,0.00613798183157,0.0235698502332,0.000982077093052,0.00736557819789,0.67113246655,0.584605724449,"2006-04-09 Jesus, Rev. Mark Belletini.PDF",106,6,3.39666666667,3,3.04984691516,3
36,ACLU10_test,1,2.05860519409,"prison, detent, dhs, ice, privat, justic, committe, reduc, cca, detaine",0.0136518771331,0.0358361774744,0.0,1.0,0.45652173913,22.0,0.478260869565,0.00511945392491,0.0,0.0,0.00682593856655,0.00341296928328,0.00170648464164,0.018771331058,0.675418025895,0.732896514523,ACLU10,148,3,3.16333333333,3,3.13957956904,3
37,"2001-11-11 Microbes and Peter Rabbit, Rev. Mark Belletini.htm_test",1,0.866385936737,"tree, potter, unitarian, beatrix, lichen, mind, hound, lifemarri, farreach, imit",0.025641025641,0.021978021978,1.0,0.0,0.538461538462,9.0,0.692307692308,0.00732600732601,0.003663003663,0.025641025641,0.018315018315,0.0,0.018315018315,0.0,0.00170028516153,0.537620456564,"2001-11-11 Microbes and Peter Rabbit, Rev. Mark Belletini.htm",102,2,2.72,3,3.66673517071,3
39,piper99 12-12-99_test,1,3.45541501045,"reconcil, vers, save, wrath, god, shall, christ, enemi, rescu, justifi",0.0267489711934,0.022633744856,1.0,0.0,0.496551724138,117.0,0.806896551724,0.0411522633745,0.0238683127572,0.00329218106996,0.00246913580247,0.043621399177,0.0,0.00987654320988,0.643546676288,0.646481448274,piper99 12-12-99,59,4,3.43,5,3.86041678873,5
41,ACLU06_test,1,1.91950201988,"geofeedia, user, twitter, instagram, facebook, enforc, surveil, monitor, data, agreement",0.0212150433944,0.0183220829315,1.0,0.0,0.4,23.0,0.511111111111,0.0154291224687,0.0,0.0,0.00771456123433,0.000964320154291,0.0,0.00867888138862,0.643044028995,0.494121722952,ACLU06,144,3,2.91,3,2.62942831596,3
49,SS08_test,1,1.45064496994,"greenpeac, seal, fur, whale, endors, sealer, brutal, risk, betray, revel",0.0232108317215,0.0522243713733,0.0,1.0,0.592592592593,17.0,0.62962962963,0.0116054158607,0.00193423597679,0.0251450676983,0.0232108317215,0.0,0.0,0.00193423597679,0.714695469763,0.592919761689,SS08,119,1,2.54,1,2.57490119594,3
50,YV13_test,1,1.44189500809,"happi, want, get, stamp, unhappi, joy, got, say, can't, moment",0.0164705882353,0.00705882352941,1.0,0.0,0.578947368421,28.0,0.736842105263,0.00941176470588,0.0705882352941,0.00235294117647,0.00705882352941,0.0,0.0,0.0329411764706,0.772826877158,0.553920281175,YV13,138,5,4.28666666667,2,4.43289498889,3
54,SS13_test,1,2.82191705704,"whale, seal, “human, “sustain, harvest, slaughter, club, eat, “conserv, fish",0.0180754917597,0.0425305688464,0.0,1.0,0.311926605505,65.0,0.596330275229,0.0154173312068,0.00478468899522,0.00744284954811,0.0127591706539,0.000531632110579,0.000531632110579,0.016480595428,0.690209946405,0.507854515709,SS13,124,1,2.9,3,3.35192718235,3
56,MalcolmX-TheBallotortheBullet_test,1,10.6937730312,"get, let, negro, bullet, got, ballot, segreg, malcolm, whi, civilright",0.0184800664452,0.0144310631229,1.0,0.0,0.265342960289,435.0,0.785198555957,0.0192068106312,0.03176910299,0.0129775747508,0.0140157807309,0.015988372093,0.00103820598007,0.0179609634551,0.695825524107,0.681160395609,MalcolmX-TheBallotortheBullet,84,2,3.66333333333,2,3.7091554613,2
59,"2014-03-16 Guns Directness Controlling Sensitivity, Rev. Mark Belletini.pdf_test",1,5.50549483299,"gun, rabbi, congreg, kaddish, ask, say, alphabet, dan, talk, too",0.0240109764464,0.0160073176309,1.0,0.0,0.254166666667,168.0,0.7,0.0187514292248,0.00617425108621,0.0338440429911,0.00983306654471,0.00891836268008,0.0036588154585,0.00686027898468,0.647214996609,0.584276725375,"2014-03-16 Guns Directness Controlling Sensitivity, Rev. Mark Belletini.pdf",109,5,3.61333333333,3,3.87216558457,5
60,piper97 10-19-97_test,1,3.22138214111,"coven, shepherd, god, vers, etern, grace, christ, pleas, want, glori",0.0310734463277,0.0193032015066,1.0,0.0,0.406504065041,81.0,0.658536585366,0.0235404896422,0.0287193973635,0.0112994350282,0.00141242937853,0.0338983050847,0.0,0.00706214689266,0.636581393999,0.623267788082,piper97 10-19-97,57,3,3.61,3,2.99527720783,3
61,piper92 09-27-92_test,1,3.49982380867,"christ, gentil, reconcil, jew, god, israel, coven, glori, promis, jesus",0.0179290157336,0.0135382363703,1.0,0.0,0.467625899281,82.0,0.589928057554,0.0160995243322,0.0175631174533,0.00658616904501,0.00731796560556,0.0204903036956,0.0,0.0032930845225,0.686365708141,0.843150970135,piper92 09-27-92,53,1,2.75,3,2.25277878883,3
67,YV04_test,1,2.85156083107,"mind, yoga, calm, clean, whi, medit, want, don't, sutra, everyth",0.0382059800664,0.00830564784053,1.0,0.0,0.350993377483,102.0,0.675496688742,0.0227021040975,0.0581395348837,0.00221483942414,0.000553709856035,0.00166112956811,0.000553709856035,0.014950166113,0.716984561543,0.714655700116,YV04,129,3,5.31666666667,4,4.14144786562,4
69,SS06_test,1,1.49526810646,"dolphin, captiv, tank, sorri, orca, shepherd, endur, taiji, sought, concret",0.00904977375566,0.0633484162896,0.0,1.0,0.68,24.0,0.96,0.00452488687783,0.0633484162896,0.0180995475113,0.00904977375566,0.0,0.0,0.0,0.711361772634,0.641319399862,SS06,117,2,2.38,1,3.62764914604,3
73,piper99 1-31-99_test,1,3.87954902649,"doer, justifi, judgment, christ, vers, gospel, god, say, hypothet, sin",0.0322055953155,0.0198438516591,1.0,0.0,0.415584415584,96.0,0.623376623377,0.014313597918,0.00553025374105,0.0100845803513,0.0113858165257,0.0123617436565,0.000325309043591,0.0107351984385,0.750449609213,0.649720303758,piper99 1-31-99,58,4,2.98333333333,3,2.98352051369,2
77,ACLU02_test,1,1.59369587898,"fisc, opinion, surveil, usa, yahoo, secret, aclu, hidden, refus, address",0.0263591433278,0.00164744645799,1.0,0.0,0.8125,14.0,0.875,0.00494233937397,0.00164744645799,0.0,0.00823723228995,0.0,0.0,0.0197693574959,0.750156935642,0.526031851325,ACLU02,140,3,4.97,3,3.95144287894,3
79,journal.1.11.07_test,1,1.66507291794,"love, infinit, unexpress, condens, finit, genuin, manifest, revel, express, stake",0.0709117221418,0.0144717800289,1.0,0.0,0.485714285714,20.0,0.571428571429,0.00289435600579,0.0,0.0,0.00289435600579,0.0159189580318,0.0,0.0303907380608,0.781259721907,0.647381045738,journal.1.11.07,65,7,5.01666666667,3,4.70431964116,3
80,MalcolmX-TheHarlemHateGang_test,1,4.05920791626,"polic, harlem, nonviol, realiz, get, hategang, blood, oppressor, negro, malcolm",0.0123818833496,0.0234604105572,0.0,1.0,0.242937853107,128.0,0.723163841808,0.00879765395894,0.0153144346693,0.0215053763441,0.0260671228413,0.0149885956338,0.0,0.0159661127403,0.717126394014,0.552851283806,MalcolmX-TheHarlemHateGang,86,2,2.68333333333,2,2.08682920131,2
81,ACLU09_test,1,1.83905386925,"secreci, subpoena, gag, amend, signal, default, demand, too, juri, aclu",0.0152173913043,0.020652173913,0.0,1.0,0.40625,17.0,0.53125,0.00652173913043,0.00108695652174,0.0,0.00326086956522,0.0,0.0,0.0195652173913,0.702374516871,0.607449832182,ACLU09,147,3,2.99333333333,3,3.39687543935,3
86,MalcolmX-ProspectsForFreedomin1965_test,1,4.80367398262,"get, civilright, noth, explos, promis, ake, harlem, oppress, prospect, malcolm",0.0210692652094,0.0221227284698,0.0,1.0,0.191489361702,153.0,0.651063829787,0.0152752172768,0.00948116934422,0.0163286805373,0.0281801422175,0.00421385304188,0.00131682907559,0.0186989728733,0.724068627754,0.588176520005,MalcolmX-ProspectsForFreedomin1965,83,2,3.07333333333,2,2.34163896122,2
89,piper2k 1-23-00_test,1,3.78180408478,"abort, babi, whi, excel, dark, deed, vers, let, christ, god",0.0317959468903,0.0359888190077,0.0,1.0,0.375722543353,108.0,0.624277456647,0.0317959468903,0.0132774283718,0.00559049615653,0.00698812019567,0.00873515024458,0.0,0.0083857442348,0.673915357516,0.449454604013,piper2k 1-23-00,41,5,2.94333333333,3,2.96932730833,3
94,"2003-01-05 A Simple Faith, Rev. Mark Belletini.htm_test",1,5.60809397697,"captain, hope, want, yes, say, geek, answer, know, simpl, niemojewski",0.030612244898,0.0204081632653,1.0,0.0,0.242857142857,199.0,0.710714285714,0.018820861678,0.0120181405896,0.024716553288,0.0233560090703,0.0122448979592,0.00204081632653,0.00839002267574,0.711303454654,0.488417497442,"2003-01-05 A Simple Faith, Rev. Mark Belletini.htm",103,5,3.32666666667,3,3.72478160827,3
95,339.html_test,1,2.59033799171,"get, worker, strike, bridg, dinner, sock, christma, thing, meet, paper",0.0231809401159,0.0218931101095,1.0,0.0,0.540540540541,66.0,0.891891891892,0.0302640051513,0.0186735350934,0.00965872504829,0.0148100450741,0.0212491951062,0.00193174500966,0.00579523502898,0.777696479223,0.504995744916,339.html,33,3,2.88666666667,3,2.57643500802,3
98,12.html_test,1,1.4824848175,"radic, print, sent, worker, sheet, wander, dollar, rememb, donat, encycl",0.022641509434,0.011320754717,1.0,0.0,0.344827586207,17.0,0.586206896552,0.0132075471698,0.0,0.0,0.0207547169811,0.00566037735849,0.0,0.0188679245283,0.757573477857,0.571646121949,12.html,26,3,4.86333333333,3,4.15595515351,3
99,558.html_test,1,1.3257420063,"obedi, poverti, ave, maria, love, rosari, advent, tell, convers, scriptur",0.0509383378016,0.00536193029491,1.0,0.0,0.35,9.0,0.45,0.0214477211796,0.0,0.0,0.0,0.00268096514745,0.0160857908847,0.00268096514745,0.772167331823,0.576540447136,558.html,37,4,3.67666666667,3,3.18579330006,3
103,188.html_test,1,1.91569709778,"christ, rememb, hope, unto, shall, worker, mighti, coffe, pull, fortif",0.0217391304348,0.0217391304348,0.0,1.0,0.415094339623,43.0,0.811320754717,0.0239130434783,0.0184782608696,0.00978260869565,0.00978260869565,0.0173913043478,0.0,0.0141304347826,0.785800242801,0.691311412199,188.html,27,3,3.36666666667,3,2.53736561686,2
