,groupId,files,timeRun,keywords,perPos,perNeg,perPosDoc,perNegDoc,PSJudge,judgementCount,judgementFrac,nous,vous,je,ils,il,elle,le,avgSD,avgEVC,groupName,Unnamed: 0,rank,rfPred,rfClassPred,svmPred,svmClassPred
5,214.html_test,1,2.1554608345,"worker, margaret, priest, morn, cathol, stanthoni, prayer, spoke, miracl, contempl",0.0296540362438,0.0107084019769,1.0,0.0,0.338983050847,44.0,0.745762711864,0.0131795716639,0.00247116968699,0.00988467874794,0.00494233937397,0.0304777594728,0.00658978583196,0.0107084019769,0.742430484967,0.574778575084,214.html,29,5,4.93666666667,4,5.44369855459,3
7,ACLU04_test,1,1.88192510605,"cbp, fbi, assess, search, vulner, document, target, agenc, ask, question",0.00865384615385,0.0201923076923,0.0,1.0,0.4,17.0,0.425,0.00384615384615,0.00192307692308,0.0,0.0230769230769,0.0,0.0,0.00576923076923,0.662343180605,0.442937413482,ACLU04,142,3,2.35333333333,3,2.69058586237,3
10,SS01_test,1,1.41620206833,"vaquita, shepherd, gift, illeg, marin, save, porpois, whale, countless, gill",0.020325203252,0.0182926829268,1.0,0.0,0.35,13.0,0.65,0.020325203252,0.0121951219512,0.0020325203252,0.0,0.0,0.0,0.0020325203252,0.745077620386,0.588484581691,SS01,112,1,2.91,3,1.80028763036,2
16,"2011-12-11 Hope Not Hype, Rev. Mark Belletini.pdf_test",1,4.32546377182,"hope, hype, magic, pain, happen, too, dont, perfect, love, suffer",0.0356933879462,0.0333528379169,1.0,0.0,0.258928571429,142.0,0.633928571429,0.0263311878291,0.00643651258046,0.0295494441194,0.00848449385606,0.00263311878291,0.00672908133411,0.0119953188999,0.65961808945,0.631939537011,"2011-12-11 Hope Not Hype, Rev. Mark Belletini.pdf",108,4,3.15,3,3.41356564256,3
27,"2007-11-11 Spiritual Claustrophobia, Rev. Mark Belletini.PDF_test",1,5.21595191956,"experi, dont, let, theolog, els, hallway, tell, wrong, realli, too",0.0243632336656,0.0190476190476,1.0,0.0,0.203045685279,233.0,0.591370558376,0.0148394241417,0.0104097452935,0.0423034330011,0.00863787375415,0.00398671096346,0.00996677740864,0.0126245847176,0.676572148713,0.514337817248,"2007-11-11 Spiritual Claustrophobia, Rev. Mark Belletini.PDF",107,7,3.88666666667,5,4.26704238599,5
29,768.html_test,1,1.48322510719,"money, profit, tri, worker, sing, deem, forbad, matthew, insofar, duti",0.0206677265501,0.0143084260731,1.0,0.0,0.636363636364,18.0,0.818181818182,0.0683624801272,0.00635930047695,0.0,0.00476947535771,0.00158982511924,0.0,0.00794912559618,0.816854893491,0.592524274517,768.html,40,2,3.84,3,2.99896518273,2
37,journal.1.10.10_test,1,1.55247688293,"master, inner, baba, discipl, miracl, wonder, incid, miracul, moment, mandali",0.0459418070444,0.0183767228178,1.0,0.0,0.5,12.0,0.545454545455,0.00153139356815,0.0,0.00153139356815,0.00612557427259,0.0199081163859,0.00153139356815,0.00918836140888,0.750688440322,0.529939189283,journal.1.10.10,64,4,3.73333333333,3,4.12890754819,3
46,ACLU05_test,1,1.84147906303,"mohamedou, prison, guantánamo, tortur, unlaw, mauritania, memoir, privaci, thrill, slahi",0.0309523809524,0.0297619047619,1.0,0.0,0.547619047619,34.0,0.809523809524,0.0261904761905,0.0,0.00595238095238,0.00119047619048,0.047619047619,0.00119047619048,0.00595238095238,0.693815076884,0.554392760686,ACLU05,143,3,3.80333333333,3,4.17695947154,3
50,journal.1.12.11_test,1,2.26483392715,"infinit, realiz, reaction, real, shall, finit, react, resign, meher, baba",0.0352020860495,0.00586701434159,1.0,0.0,0.505050505051,66.0,0.666666666667,0.0365058670143,0.0026075619296,0.029335071708,0.0,0.0280312907432,0.0,0.0176010430248,0.784459242169,0.853541756081,journal.1.12.11,66,5,5.26666666667,4,4.42394630957,4
55,SS09_test,1,1.27520489693,"shepherd, pamela, anderson, seal, slaughter, babi, orca, whale, newfoundland, salmon",0.0155763239875,0.0155763239875,0.0,1.0,0.818181818182,10.0,0.909090909091,0.018691588785,0.0,0.00934579439252,0.0,0.0,0.0249221183801,0.00311526479751,0.804857887167,0.609438581614,SS09,120,2,3.15666666667,4,2.78568660384,3
58,MalcolmX-AtTheAudubon_test,1,8.20241999626,"get, congo, malcolm, let, dick, talk, mercenari, know, look, say",0.0200935865676,0.0228461326727,0.0,1.0,0.32,306.0,0.765,0.0177539223782,0.027250206441,0.0199559592623,0.0202312138728,0.0196807046518,0.00110101844206,0.01334984861,0.637540330243,0.600845079001,MalcolmX-AtTheAudubon,90,2,2.51666666667,2,1.9346827659,2
59,MalcolmX-TheBallotortheBullet_test,1,10.4881939888,"get, let, negro, bullet, got, ballot, segreg, malcolm, whi, civilright",0.0184800664452,0.0144310631229,1.0,0.0,0.265342960289,435.0,0.785198555957,0.0192068106312,0.03176910299,0.0129775747508,0.0140157807309,0.015988372093,0.00103820598007,0.0179609634551,0.692514429068,0.681160395609,MalcolmX-TheBallotortheBullet,84,2,3.35666666667,2,3.64178380188,2
62,piper89 6-4-89_test,1,3.1702170372,"jesus, woman, sabbath, abraham, women, synagogu, want, say, husband, look",0.0288544358312,0.0159345391904,1.0,0.0,0.417218543046,106.0,0.701986754967,0.0142118863049,0.0193798449612,0.0021533161068,0.010766580534,0.0292850990525,0.0111972437554,0.0116279069767,0.67648621304,0.566452437182,piper89 6-4-89,51,3,4.60666666667,4,4.42340417352,3
67,YV04_test,1,2.81120109558,"mind, yoga, calm, clean, whi, medit, want, don't, sutra, everyth",0.0382059800664,0.00830564784053,1.0,0.0,0.350993377483,102.0,0.675496688742,0.0227021040975,0.0581395348837,0.00221483942414,0.000553709856035,0.00166112956811,0.000553709856035,0.014950166113,0.718027524426,0.714655700116,YV04,129,3,5.07666666667,4,3.85857935682,4
68,SS06_test,1,1.45161104202,"dolphin, captiv, tank, sorri, orca, shepherd, endur, taiji, sought, concret",0.00904977375566,0.0633484162896,0.0,1.0,0.68,24.0,0.96,0.00452488687783,0.0633484162896,0.0180995475113,0.00904977375566,0.0,0.0,0.0,0.710032469336,0.641319399862,SS06,117,2,2.46666666667,1,3.25264351621,3
71,YV10_test,1,2.00536704063,"mantra, gurudeva, mind, felt, get, know, dream, lesson, stop, husband",0.0203426124197,0.0182012847966,1.0,0.0,0.35632183908,77.0,0.885057471264,0.00321199143469,0.0117773019272,0.117773019272,0.00107066381156,0.0235546038544,0.0,0.0182012847966,0.729155585858,0.64483544488,YV10,135,8,3.96333333333,3,3.72512961136,3
75,535.html_test,1,1.69223213196,"love, prayer, reader, happi, worker, keep, think, appeal, confid, grace",0.0506155950752,0.0123119015048,1.0,0.0,0.477272727273,33.0,0.75,0.0424076607387,0.0232558139535,0.0246238030096,0.0123119015048,0.00683994528044,0.00136798905609,0.0123119015048,0.733572119759,0.593020139762,535.html,35,5,4.56,2,4.14430670465,2
84,551.html_test,1,1.71780204773,"bill, gauchat, peter, merci, maurin, talk, worker, vietnam, fruit, ladi",0.0338294993234,0.021650879567,1.0,0.0,0.514285714286,30.0,0.857142857143,0.0189445196211,0.0,0.00811907983762,0.0148849797023,0.021650879567,0.00270635994587,0.00811907983762,0.81508893916,0.824332313968,551.html,36,3,3.3,4,3.00444482179,4
85,MalcolmX-AfterTheBombing_test,1,9.86961817741,"negro, get, know, got, hate, thing, say, tri, want, ourselv",0.0149876042371,0.0205093531666,0.0,1.0,0.318637274549,383.0,0.76753507014,0.0161144917737,0.0259184133423,0.0218616182105,0.0268199233716,0.0132972729322,0.0,0.0153256704981,0.685380254303,0.544888486371,MalcolmX-AfterTheBombing,88,2,2.50333333333,2,2.0706178805,2
88,MalcolmX-ProspectsForFreedomin1965_test,1,4.70112514496,"get, civilright, noth, explos, promis, ake, harlem, oppress, prospect, malcolm",0.0210692652094,0.0221227284698,0.0,1.0,0.191489361702,153.0,0.651063829787,0.0152752172768,0.00948116934422,0.0163286805373,0.0281801422175,0.00421385304188,0.00131682907559,0.0186989728733,0.721853192364,0.588176520005,MalcolmX-ProspectsForFreedomin1965,83,2,2.38,2,1.94135001746,2
91,ACLU01_test,1,1.78210520744,"tortur, prison, salim, “the, victim, dark, trauma, bensoud, client, psychologist",0.00826446280992,0.047225501771,0.0,1.0,0.439024390244,26.0,0.634146341463,0.0106257378985,0.00118063754427,0.00944510035419,0.00708382526564,0.0330578512397,0.0,0.00708382526564,0.614708811411,0.433556171817,ACLU01,139,3,3.36333333333,3,3.29670472217,5
92,piper2k 1-23-00_test,1,3.75383090973,"abort, babi, whi, excel, dark, deed, vers, let, christ, god",0.0317959468903,0.0359888190077,0.0,1.0,0.375722543353,108.0,0.624277456647,0.0317959468903,0.0132774283718,0.00559049615653,0.00698812019567,0.00873515024458,0.0,0.0083857442348,0.67361460136,0.449454604013,piper2k 1-23-00,41,5,2.99333333333,3,2.26202872788,2
94,SS05_test,1,1.94099092484,"seaworld, hsus, orca, manbi, pacell, keiko, condemn, profit, will, dolphin",0.0275229357798,0.0336391437309,0.0,1.0,0.456140350877,34.0,0.59649122807,0.00407747196738,0.0,0.00407747196738,0.0346585117227,0.0112130479103,0.0,0.00917431192661,0.679094367164,0.531921212903,SS05,116,2,2.74666666667,3,2.02274652375,1
99,"2004-08-29 Set Theory for Moderns, Rev. Mark Belletini.PDF_test",1,4.66041302681,"circl, senat, gay, episcop, hope, overlap, funni, venn, say, allard",0.0272263187748,0.0187180941577,1.0,0.0,0.230414746544,134.0,0.617511520737,0.0110606920023,0.00283607487238,0.0300623936472,0.010777084515,0.0144639818491,0.00340328984685,0.0116279069767,0.669884336662,0.536925084448,"2004-08-29 Set Theory for Moderns, Rev. Mark Belletini.PDF",104,3,3.8,5,4.8222227868,5
100,188.html_test,1,1.92396998405,"christ, rememb, hope, unto, shall, worker, mighti, coffe, pull, fortif",0.0217391304348,0.0217391304348,0.0,1.0,0.415094339623,43.0,0.811320754717,0.0239130434783,0.0184782608696,0.00978260869565,0.00978260869565,0.0173913043478,0.0,0.0141304347826,0.786265672963,0.691311412199,188.html,27,3,3.21666666667,3,2.26638992787,2
110,"2005-07-10 Promoting Acceptance and Spiritual Growth, James Bailey.PDF_test",1,3.65952587128,"mystic, spiritu, accept, sunday, gay, radic, selfaccept, quilt, grandmoth, affirm",0.0192307692308,0.0134615384615,1.0,0.0,0.296774193548,118.0,0.761290322581,0.0192307692308,0.005,0.0457692307692,0.00346153846154,0.00961538461538,0.00846153846154,0.00807692307692,0.675183878641,0.546525072543,"2005-07-10 Promoting Acceptance and Spiritual Growth, James Bailey.PDF",105,5,3.86,3,4.39469593615,5
