,groupId,files,timeRun,keywords,perPos,perNeg,perPosDoc,perNegDoc,PSJudge,judgementCount,judgementFrac,nous,vous,je,ils,il,elle,le,avgSD,avgEVC,groupName,Unnamed: 0,rank,rfPred,rfClassPred,svmPred,svmClassPred
2,MalcolmX-MessagetotheGrassRoots_test,1,7.13057398796,"negro, got, get, let, talk, tom, master, know, say, malcolm",0.0166527893422,0.0214820982515,0.0,1.0,0.304136253041,314.0,0.76399026764,0.0121565362198,0.034304746045,0.0108243130724,0.0274771024147,0.0158201498751,0.00116569525396,0.0184845961699,0.71371243549,0.54987988973,MalcolmX-MessagetotheGrassRoots,82,2,2.2,2,2.22926756798,2
8,YV08_test,1,3.30748987198,"yogavill, dedic, should, don't, joy, everyth, tree, whatev, feel, love",0.0296137339056,0.0068669527897,1.0,0.0,0.353773584906,158.0,0.745283018868,0.0210300429185,0.0450643776824,0.01330472103,0.0175965665236,0.00128755364807,0.00128755364807,0.0210300429185,0.708135902987,0.565988363143,YV08,133,6,4.03333333333,5,4.4087871873,5
10,ACLU04_test,1,1.90374803543,"cbp, fbi, assess, search, vulner, document, target, agenc, ask, question",0.00865384615385,0.0201923076923,0.0,1.0,0.4,17.0,0.425,0.00384615384615,0.00192307692308,0.0,0.0230769230769,0.0,0.0,0.00576923076923,0.664081133987,0.442937413482,ACLU04,142,3,2.49,3,2.87502626919,3
11,225.html_test,1,4.00302910805,"worker, fergi, get, feast, too, kichi, soul, priest, kitchen, prayer",0.0224835696991,0.0300933932895,0.0,1.0,0.490909090909,99.0,0.9,0.020062262193,0.00345901072293,0.00968523002421,0.00657212037357,0.0276720857835,0.0231753718437,0.00657212037357,0.691652545736,0.700691663263,225.html,30,3,3.49666666667,3,3.37452583953,4
13,SS01_test,1,1.41260910034,"vaquita, shepherd, gift, illeg, marin, save, porpois, whale, countless, gill",0.020325203252,0.0182926829268,1.0,0.0,0.35,13.0,0.65,0.020325203252,0.0121951219512,0.0020325203252,0.0,0.0,0.0,0.0020325203252,0.739337780489,0.588484581691,SS01,112,1,2.79333333333,2,1.84108748333,2
20,YV03_test,1,1.59454011917,"yantra, triangl, manifest, crystal, dot, express, bindhu, mantra, kalaa, shanthi",0.0114942528736,0.00287356321839,1.0,0.0,0.3,23.0,0.46,0.00431034482759,0.0100574712644,0.0014367816092,0.00862068965517,0.0014367816092,0.0014367816092,0.0244252873563,0.754703306024,0.706460240765,YV03,128,3,3.20333333333,3,3.16843423002,3
22,SS04_test,1,2.76198101044,"shepherd, net, illeg, whale, crew, gill, cut, happi, anyth, worri",0.0396119644301,0.018593371059,1.0,0.0,0.433333333333,53.0,0.883333333333,0.00970088924818,0.00323362974939,0.0299110751819,0.0210185933711,0.0,0.0,0.0121261115602,0.710416294523,0.664894099941,SS04,115,3,3.91666666667,4,4.55011089302,3
24,journal.02.06.10_test,1,1.73367810249,"princess, matchabelli, meher, master, usa, baba, princ, spiritu, norina, miracl",0.0433566433566,0.00699300699301,1.0,0.0,0.555555555556,20.0,0.740740740741,0.0013986013986,0.0013986013986,0.0,0.0111888111888,0.0223776223776,0.020979020979,0.0041958041958,0.752052465347,0.713404162438,journal.02.06.10,63,3,3.82333333333,4,3.44070250044,4
28,MalcolmX-AnAppealtoAfricanHeadsofState_test,1,6.84096002579,"malcolm, negro, uniti, cairo, get, african, confer, here, civilright, afroamerican",0.0244808374135,0.0238055039676,1.0,0.0,0.408510638298,156.0,0.663829787234,0.0194158365693,0.00928583488097,0.00928583488097,0.00877933479656,0.00236366706061,0.00135066689178,0.0111430018572,0.719520626946,0.664602832219,MalcolmX-AnAppealtoAfricanHeadsofState,89,2,3.12,3,2.66678981312,3
29,a-different-gospel-steve-shepherd-sermon-on-false-teaching-161833.asp_test,1,3.32837295532,"gospel, hell, say, jesus, preach, christ, knife, don, pleas, tri",0.0268980477223,0.0325379609544,0.0,1.0,0.282296650718,124.0,0.593301435407,0.00824295010846,0.0125813449024,0.0208242950108,0.00997830802603,0.0225596529284,0.00260303687636,0.0156182212581,0.656034399631,0.586214587548,a-different-gospel-steve-shepherd-sermon-on-false-teaching-161833.asp,93,1,3.38666666667,3,2.14081121088,3
31,piper94 09-11-94_test,1,3.17397403717,"bless, vers, evil, insult, inherit, feel, say, grace, hope, futur",0.0522388059701,0.0171202809482,1.0,0.0,0.469565217391,87.0,0.75652173913,0.0377524143986,0.031167690957,0.00438981562774,0.00438981562774,0.0118525021949,0.0,0.00965759438104,0.692533278371,0.607689427771,piper94 09-11-94,55,2,4.73,4,4.64408893411,7
32,SS14_test,1,1.369754076,"vessel, thunder, poacher, crew, chase, gear, endur, illeg, monday, rescu",0.0356234096692,0.030534351145,1.0,0.0,0.47619047619,17.0,0.809523809524,0.0814249363868,0.00508905852417,0.0,0.0101781170483,0.0,0.0152671755725,0.00254452926209,0.818295107577,0.647116918527,SS14,125,3,3.85666666667,2,3.28576312535,2
33,"2007-11-11 Spiritual Claustrophobia, Rev. Mark Belletini.PDF_test",1,5.70011997223,"experi, dont, let, theolog, els, hallway, tell, wrong, realli, too",0.0243632336656,0.0190476190476,1.0,0.0,0.203045685279,233.0,0.591370558376,0.0148394241417,0.0104097452935,0.0423034330011,0.00863787375415,0.00398671096346,0.00996677740864,0.0126245847176,0.679182794711,0.514337817248,"2007-11-11 Spiritual Claustrophobia, Rev. Mark Belletini.PDF",107,7,3.88333333333,2,4.11515593766,5
34,YV06_test,1,2.72124004364,"sri, gurudev, swami, satchidananda, spirit, spiritu, messag, uniti, sadhu, doesn't",0.027289266222,0.00727713765919,1.0,0.0,0.352941176471,78.0,0.764705882353,0.0109157064888,0.0133414190418,0.0,0.00667070952092,0.0333535476046,0.00485142510612,0.0127349909036,0.664720190726,0.689833712226,YV06,131,5,3.66333333333,3,3.46278443762,3
35,piper90 01-28-90_test,1,3.21152997017,"gospel, preach, fulfil, jesus, god, matthew, ministri, glori, isaiah, repent",0.0205106739221,0.0108832147342,1.0,0.0,0.483050847458,83.0,0.703389830508,0.0121389702805,0.00251151109251,0.00460443700293,0.00460443700293,0.0334868145668,0.0,0.00795311845961,0.788282372983,0.834559504194,piper90 01-28-90,52,4,3.45666666667,3,2.37990110337,3
36,214.html_test,1,2.21766090393,"worker, margaret, priest, morn, cathol, stanthoni, prayer, spoke, miracl, contempl",0.0296540362438,0.0107084019769,1.0,0.0,0.338983050847,44.0,0.745762711864,0.0131795716639,0.00247116968699,0.00988467874794,0.00494233937397,0.0304777594728,0.00658978583196,0.0107084019769,0.741106271847,0.574778575084,214.html,29,5,4.12333333333,3,3.84660462207,3
54,SS09_test,1,1.33658599854,"shepherd, pamela, anderson, seal, slaughter, babi, orca, whale, newfoundland, salmon",0.0155763239875,0.0155763239875,0.0,1.0,0.818181818182,10.0,0.909090909091,0.018691588785,0.0,0.00934579439252,0.0,0.0,0.0249221183801,0.00311526479751,0.805684565632,0.609438581614,SS09,120,2,3.12666666667,4,3.35064818789,2
56,piper89 4-7-89_test,1,3.07696604729,"womb, job, unborn, abort, god, innoc, shall, psalm, yuml, blood",0.0223234624146,0.0464692482916,0.0,1.0,0.353846153846,68.0,0.523076923077,0.00911161731207,0.00455580865604,0.0132118451025,0.00956719817768,0.0173120728929,0.0,0.0123006833713,0.654906408502,0.535040143732,piper89 4-7-89,50,5,2.75333333333,3,1.80711283288,3
60,how-to-bless-america-steve-shepherd-sermon-on-independence-day-69779.asp_test,1,4.19014692307,"don, ill, bless, government, said, ask, attitud, want, mph, whi",0.0417189460477,0.0185069008783,1.0,0.0,0.126237623762,187.0,0.462871287129,0.0207026348808,0.017252195734,0.0228983688833,0.00752823086575,0.0100376411543,0.00752823086575,0.0131744040151,0.678992670212,0.508677204049,how-to-bless-america-steve-shepherd-sermon-on-independence-day-69779.asp,96,3,4.53,4,4.07231656146,3
61,"2014-03-16 Guns Directness Controlling Sensitivity, Rev. Mark Belletini.pdf_test",1,5.61962008476,"gun, rabbi, congreg, kaddish, ask, say, alphabet, dan, talk, too",0.0240109764464,0.0160073176309,1.0,0.0,0.254166666667,168.0,0.7,0.0187514292248,0.00617425108621,0.0338440429911,0.00983306654471,0.00891836268008,0.0036588154585,0.00686027898468,0.645417497764,0.584276725375,"2014-03-16 Guns Directness Controlling Sensitivity, Rev. Mark Belletini.pdf",109,5,3.67,5,4.15333206611,5
62,piper97 10-19-97_test,1,3.16560506821,"coven, shepherd, god, vers, etern, grace, christ, pleas, want, glori",0.0310734463277,0.0193032015066,1.0,0.0,0.406504065041,81.0,0.658536585366,0.0235404896422,0.0287193973635,0.0112994350282,0.00141242937853,0.0338983050847,0.0,0.00706214689266,0.633961908364,0.623267788082,piper97 10-19-97,57,3,3.84333333333,3,3.10523225642,3
65,YV04_test,1,2.87713217735,"mind, yoga, calm, clean, whi, medit, want, don't, sutra, everyth",0.0382059800664,0.00830564784053,1.0,0.0,0.350993377483,102.0,0.675496688742,0.0227021040975,0.0581395348837,0.00221483942414,0.000553709856035,0.00166112956811,0.000553709856035,0.014950166113,0.717056095635,0.714655700116,YV04,129,3,4.87333333333,4,4.00638075632,4
67,SS06_test,1,1.48529195786,"dolphin, captiv, tank, sorri, orca, shepherd, endur, taiji, sought, concret",0.00904977375566,0.0633484162896,0.0,1.0,0.68,24.0,0.96,0.00452488687783,0.0633484162896,0.0180995475113,0.00904977375566,0.0,0.0,0.0,0.710771949743,0.641319399862,SS06,117,2,2.50666666667,1,3.56563176834,4
68,YV10_test,1,2.00408577919,"mantra, gurudeva, mind, felt, get, know, dream, lesson, stop, husband",0.0203426124197,0.0182012847966,1.0,0.0,0.35632183908,77.0,0.885057471264,0.00321199143469,0.0117773019272,0.117773019272,0.00107066381156,0.0235546038544,0.0,0.0182012847966,0.728848978713,0.64483544488,YV10,135,8,3.88333333333,3,3.95865297915,5
71,piper99 1-31-99_test,1,3.76510691643,"doer, justifi, judgment, christ, vers, gospel, god, say, hypothet, sin",0.0322055953155,0.0198438516591,1.0,0.0,0.415584415584,96.0,0.623376623377,0.014313597918,0.00553025374105,0.0100845803513,0.0113858165257,0.0123617436565,0.000325309043591,0.0107351984385,0.752545359987,0.649720303758,piper99 1-31-99,58,4,3.50666666667,3,3.1575405121,3
73,"2015-07-05 Privilege Unpacking the Knapsack, Morgan Patten_test",1,2.49269795418,"privileg, realli, joke, talk, felt, miss, thing, kid, crimin, ticket",0.0179597701149,0.0280172413793,0.0,1.0,0.472527472527,83.0,0.912087912088,0.00862068965517,0.0114942528736,0.0646551724138,0.0100574712644,0.010775862069,0.000718390804598,0.0172413793103,0.707204126473,0.597191696742,"2015-07-05 Privilege Unpacking the Knapsack, Morgan Patten",111,3,2.91333333333,2,3.36465332511,2
74,SS07_test,1,1.47458982468,"net, totoaba, illeg, gear, farley, weather, endang, mowat, find, fish",0.0282828282828,0.030303030303,0.0,1.0,0.541666666667,14.0,0.583333333333,0.0323232323232,0.0,0.0,0.00606060606061,0.0,0.0,0.00606060606061,0.790753001781,0.801489295722,SS07,118,2,3.35333333333,2,2.29235103508,1
76,ACLU02_test,1,1.63045597076,"fisc, opinion, surveil, usa, yahoo, secret, aclu, hidden, refus, address",0.0263591433278,0.00164744645799,1.0,0.0,0.8125,14.0,0.875,0.00494233937397,0.00164744645799,0.0,0.00823723228995,0.0,0.0,0.0197693574959,0.750742077574,0.526031851325,ACLU02,140,3,3.65666666667,5,3.96132735291,3
80,ACLU09_test,1,1.90215802193,"secreci, subpoena, gag, amend, signal, default, demand, too, juri, aclu",0.0152173913043,0.020652173913,0.0,1.0,0.40625,17.0,0.53125,0.00652173913043,0.00108695652174,0.0,0.00326086956522,0.0,0.0,0.0195652173913,0.701986289244,0.607449832182,ACLU09,147,3,2.86666666667,3,3.01815481061,3
83,good-news-bad-news-steve-shepherd-sermon-on-doing-gods-will-32921.asp_test,1,3.73134613037,"bad, fire, evil, brandon, want, put, need, good, preacher, lit",0.0278824415976,0.0388093443858,0.0,1.0,0.18152866242,147.0,0.468152866242,0.035418236624,0.00640542577242,0.0211002260739,0.00753579502638,0.0128108515448,0.00263752825923,0.00979653353429,0.65024694797,0.471404768228,good-news-bad-news-steve-shepherd-sermon-on-doing-gods-will-32921.asp,95,4,3.66666666667,5,2.56252722239,3
84,ACLU08_test,1,1.73307299614,"tortur, jessen, mitchel, cia, rizzo, rodriguez, detaine, attorney, prison, judg",0.0102774922919,0.0195272353546,0.0,1.0,0.324324324324,13.0,0.351351351351,0.00308324768756,0.0,0.00102774922919,0.0123329907503,0.00308324768756,0.0,0.00411099691675,0.69273436565,0.659466953895,ACLU08,146,3,2.66666666667,3,2.8212116698,3
85,SS10_test,1,1.48067212105,"dog, galapago, shark, wildlif, cristob, shepherd, “sniffer, remark, agreement, knum",0.0112570356473,0.0187617260788,0.0,1.0,0.631578947368,12.0,0.631578947368,0.00187617260788,0.0,0.00375234521576,0.0225140712946,0.0,0.0,0.00562851782364,0.715717801447,0.674479366693,SS10,121,1,2.2,1,1.93331639171,3
86,YV09_test,1,2.94125509262,"gurudev, sri, yoga, peac, negat, woodstock, want, path, swami, messag",0.0358767054068,0.0101061141991,1.0,0.0,0.277777777778,74.0,0.685185185185,0.00859019706923,0.0101061141991,0.00656897422941,0.00960080848914,0.0267812026276,0.00202122283982,0.00909550277918,0.714294966283,0.634385752343,YV09,134,7,3.82,4,3.85227491141,3
87,piper80 071380m_test,1,1.65515899658,"pastor, say, bibl, baptist, criswel, preacher, wisdom, know, anyth, hear",0.0272435897436,0.00801282051282,1.0,0.0,0.636363636364,30.0,0.909090909091,0.00801282051282,0.0192307692308,0.0512820512821,0.00320512820513,0.0192307692308,0.0,0.0128205128205,0.716307813183,0.734986918699,piper80 071380m,43,4,3.78666666667,5,3.94387628713,5
93,whats-love-got-to-do-with-it-steve-shepherd-sermon-on-christian-love-118439.asp_test,1,4.1899228096,"love, got, debt, rememb, pay, don, husband, prayer, get, ill",0.0494915254237,0.0206779661017,1.0,0.0,0.212698412698,192.0,0.609523809524,0.0176271186441,0.0250847457627,0.0216949152542,0.0122033898305,0.0277966101695,0.00779661016949,0.015593220339,0.648846036186,0.508893073168,whats-love-got-to-do-with-it-steve-shepherd-sermon-on-christian-love-118439.asp,100,4,4.58333333333,4,4.40699422787,3
96,SS02_test,1,1.35855579376,"turtl, shepherd, save, gift, donat, pollut, jairo, campaign, amaz, threat",0.0376811594203,0.0231884057971,1.0,0.0,0.882352941176,15.0,0.882352941176,0.0463768115942,0.0231884057971,0.0,0.00579710144928,0.0,0.0,0.0,0.672514842628,0.437062563421,SS02,113,1,4.36,4,3.30891235703,2
98,MalcolmX-TheBlackRevolution_test,1,5.39900112152,"negro, solv, socal, malcolm, sam, black, want, uncl, civilright, get",0.0209185993633,0.0163710777626,1.0,0.0,0.260330578512,154.0,0.636363636364,0.0118235561619,0.0161437016826,0.00591177808095,0.012278308322,0.0181900864029,0.00204638472033,0.012278308322,0.715787057501,0.68208128063,MalcolmX-TheBlackRevolution,85,2,2.84333333333,2,2.87731252354,3
99,188.html_test,1,1.97625207901,"christ, rememb, hope, unto, shall, worker, mighti, coffe, pull, fortif",0.0217391304348,0.0217391304348,0.0,1.0,0.415094339623,43.0,0.811320754717,0.0239130434783,0.0184782608696,0.00978260869565,0.00978260869565,0.0173913043478,0.0,0.0141304347826,0.784057574501,0.691311412199,188.html,27,3,2.96,3,2.75682990999,2
103,YV12_test,1,1.44540500641,"yantra, medit, faith, yoga, cosmos, divin, petal, path, express, god",0.037037037037,0.00617283950617,1.0,0.0,0.411764705882,7.0,0.411764705882,0.00617283950617,0.00617283950617,0.0,0.00617283950617,0.00617283950617,0.0,0.0154320987654,0.838429444884,0.608677116584,YV12,137,6,5.0,3,4.09351342655,4
107,ACLU12_test,1,1.82614994049,"snowden, pardon, disclosur, obama, surveil, editori, whistleblow, post, privaci, opinion",0.0427728613569,0.023598820059,1.0,0.0,0.48275862069,18.0,0.620689655172,0.0117994100295,0.0,0.00294985250737,0.00442477876106,0.0191740412979,0.0,0.00884955752212,0.713063382967,0.559694541007,ACLU12,150,3,4.08666666667,4,3.45575029503,4
109,piper85 pn850027_test,1,4.22287201881,"corinthian, enslav, thing, drink, whi, say, conscienc, spirit, stomach, immor",0.0242326332795,0.0142164781906,1.0,0.0,0.292237442922,157.0,0.716894977169,0.0132471728595,0.0222940226171,0.0168012924071,0.00743134087237,0.0210016155089,0.00032310177706,0.0158319870759,0.691826986275,0.66117322778,piper85 pn850027,49,5,3.42,2,3.51206158109,3
111,535.html_test,1,1.81762504578,"love, prayer, reader, happi, worker, keep, think, appeal, confid, grace",0.0506155950752,0.0123119015048,1.0,0.0,0.477272727273,33.0,0.75,0.0424076607387,0.0232558139535,0.0246238030096,0.0123119015048,0.00683994528044,0.00136798905609,0.0123119015048,0.734884029305,0.593020139762,535.html,35,5,4.59666666667,5,5.5060365863,8
