,groupId,files,timeRun,keywords,perPos,perNeg,perPosDoc,perNegDoc,PSJudge,judgementCount,judgementFrac,nous,vous,je,ils,il,elle,le,avgSD,avgEVC,groupName,Unnamed: 0,rank,rfPred,rfClassPred,svmPred,svmClassPred
7,214.html_test,1,2.19007897377,"worker, margaret, priest, morn, cathol, stanthoni, prayer, spoke, miracl, contempl",0.0296540362438,0.0107084019769,1.0,0.0,0.338983050847,44.0,0.745762711864,0.0131795716639,0.00247116968699,0.00988467874794,0.00494233937397,0.0304777594728,0.00658978583196,0.0107084019769,0.74063303858,0.574778575084,214.html,29,5,4.75,5,5.32651168316,3
10,409.html_test,1,1.47391200066,"bread, retreat, farm, tabl, tree, easton, babi, read, everyon, herb",0.0339558573854,0.0169779286927,1.0,0.0,0.392857142857,14.0,0.5,0.0237691001698,0.0,0.00169779286927,0.00509337860781,0.0,0.0,0.0101867572156,0.755290815217,0.576023711084,409.html,34,4,3.26333333333,3,3.13888586077,3
11,651.html_test,1,1.5578379631,"sudden, ask, job, met, simm, knew, policeman, polic, household, obituari",0.0180921052632,0.0180921052632,0.0,1.0,0.411764705882,27.0,0.794117647059,0.00986842105263,0.0,0.00328947368421,0.00986842105263,0.0740131578947,0.0180921052632,0.00657894736842,0.80886102295,0.599278229852,651.html,39,4,3.51,3,3.52701855492,3
12,SS01_test,1,1.40515494347,"vaquita, shepherd, gift, illeg, marin, save, porpois, whale, countless, gill",0.020325203252,0.0182926829268,1.0,0.0,0.35,13.0,0.65,0.020325203252,0.0121951219512,0.0020325203252,0.0,0.0,0.0,0.0020325203252,0.742003760217,0.588484581691,SS01,112,1,3.04666666667,3,2.10131712079,2
29,journal.1.10.10_test,1,1.61101293564,"master, inner, baba, discipl, miracl, wonder, incid, miracul, moment, mandali",0.0459418070444,0.0183767228178,1.0,0.0,0.5,12.0,0.545454545455,0.00153139356815,0.0,0.00153139356815,0.00612557427259,0.0199081163859,0.00153139356815,0.00918836140888,0.755953833138,0.529939189283,journal.1.10.10,64,4,3.55666666667,3,3.98693075435,3
31,"2007-11-11 Spiritual Claustrophobia, Rev. Mark Belletini.PDF_test",1,5.72160983086,"experi, dont, let, theolog, els, hallway, tell, wrong, realli, too",0.0243632336656,0.0190476190476,1.0,0.0,0.203045685279,233.0,0.591370558376,0.0148394241417,0.0104097452935,0.0423034330011,0.00863787375415,0.00398671096346,0.00996677740864,0.0126245847176,0.676550091362,0.514337817248,"2007-11-11 Spiritual Claustrophobia, Rev. Mark Belletini.PDF",107,7,4.18,5,4.63102012674,5
32,piper90 01-28-90_test,1,3.20457386971,"gospel, preach, fulfil, jesus, god, matthew, ministri, glori, isaiah, repent",0.0205106739221,0.0108832147342,1.0,0.0,0.483050847458,83.0,0.703389830508,0.0121389702805,0.00251151109251,0.00460443700293,0.00460443700293,0.0334868145668,0.0,0.00795311845961,0.785251106596,0.834559504194,piper90 01-28-90,52,4,3.82,3,3.93480034385,3
38,"2001-11-11 Microbes and Peter Rabbit, Rev. Mark Belletini.htm_test",1,0.893421173096,"tree, potter, unitarian, beatrix, lichen, mind, hound, lifemarri, farreach, imit",0.025641025641,0.021978021978,1.0,0.0,0.538461538462,9.0,0.692307692308,0.00732600732601,0.003663003663,0.025641025641,0.018315018315,0.0,0.018315018315,0.0,0.00440213171935,0.537620456564,"2001-11-11 Microbes and Peter Rabbit, Rev. Mark Belletini.htm",102,2,2.55333333333,3,3.45107593954,3
40,piper99 12-12-99_test,1,3.42438793182,"reconcil, vers, save, wrath, god, shall, christ, enemi, rescu, justifi",0.0267489711934,0.022633744856,1.0,0.0,0.496551724138,117.0,0.806896551724,0.0411522633745,0.0238683127572,0.00329218106996,0.00246913580247,0.043621399177,0.0,0.00987654320988,0.642688579859,0.646481448274,piper99 12-12-99,59,4,3.14666666667,3,3.4718269103,3
46,SS03_test,1,1.26057505608,"whale, contamin, pollut, microplast, ecosystem, toxicolog, shepherd, expedit, scientist, california",0.0245398773006,0.0122699386503,1.0,0.0,0.357142857143,8.0,0.571428571429,0.0306748466258,0.0,0.0,0.0,0.0,0.00306748466258,0.00613496932515,0.805747716981,0.582645206635,SS03,114,2,3.80666666667,2,3.06368648332,2
60,MalcolmX-TheBallotortheBullet_test,1,10.4463970661,"get, let, negro, bullet, got, ballot, segreg, malcolm, whi, civilright",0.0184800664452,0.0144310631229,1.0,0.0,0.265342960289,435.0,0.785198555957,0.0192068106312,0.03176910299,0.0129775747508,0.0140157807309,0.015988372093,0.00103820598007,0.0179609634551,0.693203159422,0.681160395609,MalcolmX-TheBallotortheBullet,84,2,3.55,2,3.48367872814,2
63,YV05_test,1,2.5767788887,"want, yogavill, guidelin, get, smoke, whi, don't, anyth, benefit, here",0.0372272143774,0.0224646983312,1.0,0.0,0.335664335664,101.0,0.706293706294,0.0166880616175,0.0590500641849,0.0141206675225,0.0109114249037,0.0,0.0,0.0115532734275,0.694655547667,0.628187391097,YV05,130,4,2.61666666667,3,3.29309593107,3
64,piper92 09-27-92_test,1,3.47144007683,"christ, gentil, reconcil, jew, god, israel, coven, glori, promis, jesus",0.0179290157336,0.0135382363703,1.0,0.0,0.467625899281,82.0,0.589928057554,0.0160995243322,0.0175631174533,0.00658616904501,0.00731796560556,0.0204903036956,0.0,0.0032930845225,0.686774271494,0.843150970135,piper92 09-27-92,53,1,3.24,3,2.3961979872,3
70,SS06_test,1,1.47183394432,"dolphin, captiv, tank, sorri, orca, shepherd, endur, taiji, sought, concret",0.00904977375566,0.0633484162896,0.0,1.0,0.68,24.0,0.96,0.00452488687783,0.0633484162896,0.0180995475113,0.00904977375566,0.0,0.0,0.0,0.714269486899,0.641319399862,SS06,117,2,2.26333333333,1,3.05143086307,3
71,YV10_test,1,2.02331495285,"mantra, gurudeva, mind, felt, get, know, dream, lesson, stop, husband",0.0203426124197,0.0182012847966,1.0,0.0,0.35632183908,77.0,0.885057471264,0.00321199143469,0.0117773019272,0.117773019272,0.00107066381156,0.0235546038544,0.0,0.0182012847966,0.72728664957,0.64483544488,YV10,135,8,4.18666666667,3,3.55189833023,3
77,ACLU02_test,1,1.63752698898,"fisc, opinion, surveil, usa, yahoo, secret, aclu, hidden, refus, address",0.0263591433278,0.00164744645799,1.0,0.0,0.8125,14.0,0.875,0.00494233937397,0.00164744645799,0.0,0.00823723228995,0.0,0.0,0.0197693574959,0.74618720164,0.526031851325,ACLU02,140,3,4.3,3,3.33121338423,3
81,journal.1.11.07_test,1,1.60357499123,"love, infinit, unexpress, condens, finit, genuin, manifest, revel, express, stake",0.0709117221418,0.0144717800289,1.0,0.0,0.485714285714,20.0,0.571428571429,0.00289435600579,0.0,0.0,0.00289435600579,0.0159189580318,0.0,0.0303907380608,0.778869672435,0.647381045738,journal.1.11.07,65,7,4.44333333333,3,4.22519850061,3
84,MalcolmX-AfterTheBombing_test,1,10.0361680984,"negro, get, know, got, hate, thing, say, tri, want, ourselv",0.0149876042371,0.0205093531666,0.0,1.0,0.318637274549,383.0,0.76753507014,0.0161144917737,0.0259184133423,0.0218616182105,0.0268199233716,0.0132972729322,0.0,0.0153256704981,0.68496737543,0.544888486371,MalcolmX-AfterTheBombing,88,2,2.55333333333,2,2.04151125331,2
86,SS10_test,1,1.57691693306,"dog, galapago, shark, wildlif, cristob, shepherd, “sniffer, remark, agreement, knum",0.0112570356473,0.0187617260788,0.0,1.0,0.631578947368,12.0,0.631578947368,0.00187617260788,0.0,0.00375234521576,0.0225140712946,0.0,0.0,0.00562851782364,0.712997938419,0.674479366693,SS10,121,1,2.37,3,1.42367337543,1
87,200.html_test,1,0.87787604332,"convers, address, noth, communist, talk, strang, sure, profess, opium, whi",0.0181818181818,0.0181818181818,0.0,1.0,0.478260869565,18.0,0.782608695652,0.0025974025974,0.0103896103896,0.0,0.0025974025974,0.0,0.0467532467532,0.0285714285714,-0.291031355923,0.598822570499,200.html,28,3,3.20666666667,3,3.45110118352,3
89,MalcolmX-ProspectsForFreedomin1965_test,1,4.62768101692,"get, civilright, noth, explos, promis, ake, harlem, oppress, prospect, malcolm",0.0210692652094,0.0221227284698,0.0,1.0,0.191489361702,153.0,0.651063829787,0.0152752172768,0.00948116934422,0.0163286805373,0.0281801422175,0.00421385304188,0.00131682907559,0.0186989728733,0.723270135869,0.588176520005,MalcolmX-ProspectsForFreedomin1965,83,2,2.17666666667,2,1.94206780939,2
92,piper2k 1-23-00_test,1,3.86841797829,"abort, babi, whi, excel, dark, deed, vers, let, christ, god",0.0317959468903,0.0359888190077,0.0,1.0,0.375722543353,108.0,0.624277456647,0.0317959468903,0.0132774283718,0.00559049615653,0.00698812019567,0.00873515024458,0.0,0.0083857442348,0.673704506417,0.449454604013,piper2k 1-23-00,41,5,2.86,2,2.36314423682,2
98,564.html_test,1,1.74113702774,"loneli, worker, farm, quarrel, dispel, ward, appeal, erupt, prison, grace",0.0343878954608,0.0275103163686,1.0,0.0,0.333333333333,28.0,0.622222222222,0.0316368638239,0.00687757909216,0.0110041265475,0.00275103163686,0.0041265474553,0.0041265474553,0.0137551581843,0.774247087113,0.469079468926,564.html,38,3,3.57,4,3.64304342333,3
101,"2004-08-29 Set Theory for Moderns, Rev. Mark Belletini.PDF_test",1,4.6244559288,"circl, senat, gay, episcop, hope, overlap, funni, venn, say, allard",0.0272263187748,0.0187180941577,1.0,0.0,0.230414746544,134.0,0.617511520737,0.0110606920023,0.00283607487238,0.0300623936472,0.010777084515,0.0144639818491,0.00340328984685,0.0116279069767,0.669663476845,0.536925084448,"2004-08-29 Set Theory for Moderns, Rev. Mark Belletini.PDF",104,3,4.02666666667,5,5.00303899496,5
111,overcoming-lifes-problems-steve-shepherd-sermon-on-endurance-32141.asp_test,1,3.89127993584,"want, christ, don, overcom, get, pain, ill, car, said, say",0.0274071402813,0.023079697079,1.0,0.0,0.293388429752,146.0,0.603305785124,0.0274071402813,0.0180310133429,0.0223584565453,0.00576992426974,0.0144248106744,0.0079336458709,0.00901550667147,0.646798421492,0.506494561511,overcoming-lifes-problems-steve-shepherd-sermon-on-endurance-32141.asp,98,3,3.29,4,4.09147881932,3
