,groupId,files,timeRun,keywords,perPos,perNeg,perPosDoc,perNegDoc,PSJudge,judgementCount,judgementFrac,nous,vous,je,ils,il,elle,le,avgSD,avgEVC,groupName,Unnamed: 0,rank,rfPred,rfClassPred,svmPred,svmClassPred
9,piper85 pn850005_test,1,4.94357800484,"sing, jehoshaphat, judah, vers, lord, god, satan, worship, thi, prais",0.0246626337832,0.0228013029316,1.0,0.0,0.472573839662,187.0,0.789029535865,0.0216379711494,0.0169846440205,0.00814332247557,0.0221033038623,0.0169846440205,0.00279199627734,0.00697999069335,0.68332547407,0.719528746324,piper85 pn850005,47,3,3.12,2,2.27623510033,2
14,"2011-12-11 Hope Not Hype, Rev. Mark Belletini.pdf_test",1,4.2913839817,"hope, hype, magic, pain, happen, too, dont, perfect, love, suffer",0.0356933879462,0.0333528379169,1.0,0.0,0.258928571429,142.0,0.633928571429,0.0263311878291,0.00643651258046,0.0295494441194,0.00848449385606,0.00263311878291,0.00672908133411,0.0119953188999,0.658196393376,0.631939537011,"2011-12-11 Hope Not Hype, Rev. Mark Belletini.pdf",108,4,3.12,3,3.99716544603,3
24,a-different-gospel-steve-shepherd-sermon-on-false-teaching-161833.asp_test,1,3.11580896378,"gospel, hell, say, jesus, preach, christ, knife, don, pleas, tri",0.0268980477223,0.0325379609544,0.0,1.0,0.282296650718,124.0,0.593301435407,0.00824295010846,0.0125813449024,0.0208242950108,0.00997830802603,0.0225596529284,0.00260303687636,0.0156182212581,0.654402045106,0.586214587548,a-different-gospel-steve-shepherd-sermon-on-false-teaching-161833.asp,93,1,3.79,3,2.90890691619,3
28,piper94 09-11-94_test,1,3.0433409214,"bless, vers, evil, insult, inherit, feel, say, grace, hope, futur",0.0522388059701,0.0171202809482,1.0,0.0,0.469565217391,87.0,0.75652173913,0.0377524143986,0.031167690957,0.00438981562774,0.00438981562774,0.0118525021949,0.0,0.00965759438104,0.692477626796,0.607689427771,piper94 09-11-94,55,2,4.15,5,3.79886161271,3
29,"2006-04-09 Jesus, Rev. Mark Belletini.PDF_test",1,4.93893098831,"jesus, say, opinion, johnson, justic, ohio, pastor, seem, gospel, stake",0.02332433096,0.0203780996808,1.0,0.0,0.253787878788,152.0,0.575757575758,0.0127670022097,0.00515590473852,0.00883869383747,0.00613798183157,0.0235698502332,0.000982077093052,0.00736557819789,0.6706135649,0.584605724449,"2006-04-09 Jesus, Rev. Mark Belletini.PDF",106,6,3.08666666667,5,3.22529138075,3
36,"2001-11-11 Microbes and Peter Rabbit, Rev. Mark Belletini.htm_test",1,0.833578824997,"tree, potter, unitarian, beatrix, lichen, mind, hound, lifemarri, farreach, imit",0.025641025641,0.021978021978,1.0,0.0,0.538461538462,9.0,0.692307692308,0.00732600732601,0.003663003663,0.025641025641,0.018315018315,0.0,0.018315018315,0.0,0.00526992636291,0.537620456564,"2001-11-11 Microbes and Peter Rabbit, Rev. Mark Belletini.htm",102,2,2.92333333333,3,3.84859391596,3
44,SS08_test,1,1.40791487694,"greenpeac, seal, fur, whale, endors, sealer, brutal, risk, betray, revel",0.0232108317215,0.0522243713733,0.0,1.0,0.592592592593,17.0,0.62962962963,0.0116054158607,0.00193423597679,0.0251450676983,0.0232108317215,0.0,0.0,0.00193423597679,0.709390174332,0.592919761689,SS08,119,1,2.85666666667,3,2.20192920085,2
47,SS01_test,1,1.35362696648,"vaquita, shepherd, gift, illeg, marin, save, porpois, whale, countless, gill",0.020325203252,0.0182926829268,1.0,0.0,0.35,13.0,0.65,0.020325203252,0.0121951219512,0.0020325203252,0.0,0.0,0.0,0.0020325203252,0.74056303893,0.588484581691,SS01,112,1,2.84,3,1.51199862235,2
51,forget-not-all-your-benefits-steve-shepherd-sermon-on-remember-blessings-178073.asp_test,1,3.65707206726,"pit, forget, heal, prais, forgiv, get, sin, bless, thing, didnt",0.0414507772021,0.0173945225759,1.0,0.0,0.337423312883,126.0,0.773006134969,0.0188749074759,0.0214655810511,0.039600296077,0.00111028867506,0.0307179866765,0.0166543301258,0.0099925980755,0.623896982399,0.463175748418,forget-not-all-your-benefits-steve-shepherd-sermon-on-remember-blessings-178073.asp,94,4,4.81333333333,5,4.55086116067,5
52,SS13_test,1,2.61147809029,"whale, seal, “human, “sustain, harvest, slaughter, club, eat, “conserv, fish",0.0180754917597,0.0425305688464,0.0,1.0,0.311926605505,65.0,0.596330275229,0.0154173312068,0.00478468899522,0.00744284954811,0.0127591706539,0.000531632110579,0.000531632110579,0.016480595428,0.688711422238,0.507854515709,SS13,124,1,3.09666666667,3,3.15926183379,3
53,how-to-bless-america-steve-shepherd-sermon-on-independence-day-69779.asp_test,1,3.88542890549,"don, ill, bless, government, said, ask, attitud, want, mph, whi",0.0417189460477,0.0185069008783,1.0,0.0,0.126237623762,187.0,0.462871287129,0.0207026348808,0.017252195734,0.0228983688833,0.00752823086575,0.0100376411543,0.00752823086575,0.0131744040151,0.678552433948,0.508677204049,how-to-bless-america-steve-shepherd-sermon-on-independence-day-69779.asp,96,3,4.69666666667,4,4.71878816443,4
55,MalcolmX-AtTheAudubon_test,1,7.91933512688,"get, congo, malcolm, let, dick, talk, mercenari, know, look, say",0.0200935865676,0.0228461326727,0.0,1.0,0.32,306.0,0.765,0.0177539223782,0.027250206441,0.0199559592623,0.0202312138728,0.0196807046518,0.00110101844206,0.01334984861,0.63657907038,0.600845079001,MalcolmX-AtTheAudubon,90,2,3.3,2,2.48228246661,2
58,piper89 6-4-89_test,1,2.99735188484,"jesus, woman, sabbath, abraham, women, synagogu, want, say, husband, look",0.0288544358312,0.0159345391904,1.0,0.0,0.417218543046,106.0,0.701986754967,0.0142118863049,0.0193798449612,0.0021533161068,0.010766580534,0.0292850990525,0.0111972437554,0.0116279069767,0.679809348028,0.566452437182,piper89 6-4-89,51,3,4.35,5,4.49748803747,5
60,MalcolmX-LastAnswersAndInterviews_test,1,12.1769690514,"malcolm, get, answer, think, racism, say, feel, negro, racist, interview",0.0136371482824,0.022009321595,0.0,1.0,0.309033280507,486.0,0.770206022187,0.00871741757293,0.0184705679268,0.0243397203521,0.0182979457967,0.01648541343,0.00060417745555,0.0156223027792,0.668156049846,0.545841172708,MalcolmX-LastAnswersAndInterviews,92,2,3.18,2,2.98544287574,2
66,piper99 1-31-99_test,1,3.5389008522,"doer, justifi, judgment, christ, vers, gospel, god, say, hypothet, sin",0.0322055953155,0.0198438516591,1.0,0.0,0.415584415584,96.0,0.623376623377,0.014313597918,0.00553025374105,0.0100845803513,0.0113858165257,0.0123617436565,0.000325309043591,0.0107351984385,0.751839588483,0.649720303758,piper99 1-31-99,58,4,3.17333333333,3,2.78273980123,2
69,"2015-07-05 Privilege Unpacking the Knapsack, Morgan Patten_test",1,2.32595801353,"privileg, realli, joke, talk, felt, miss, thing, kid, crimin, ticket",0.0179597701149,0.0280172413793,0.0,1.0,0.472527472527,83.0,0.912087912088,0.00862068965517,0.0114942528736,0.0646551724138,0.0100574712644,0.010775862069,0.000718390804598,0.0172413793103,0.706711502953,0.597191696742,"2015-07-05 Privilege Unpacking the Knapsack, Morgan Patten",111,3,3.96333333333,3,3.56061488265,3
71,MalcolmX-MessagetotheGrassRoots_test,1,6.64623498917,"negro, got, get, let, talk, tom, master, know, say, malcolm",0.0166527893422,0.0214820982515,0.0,1.0,0.304136253041,314.0,0.76399026764,0.0121565362198,0.034304746045,0.0108243130724,0.0274771024147,0.0158201498751,0.00116569525396,0.0184845961699,0.712184223141,0.54987988973,MalcolmX-MessagetotheGrassRoots,82,2,3.11,2,2.75800588778,2
76,YV09_test,1,3.12881612778,"gurudev, sri, yoga, peac, negat, woodstock, want, path, swami, messag",0.0358767054068,0.0101061141991,1.0,0.0,0.277777777778,74.0,0.685185185185,0.00859019706923,0.0101061141991,0.00656897422941,0.00960080848914,0.0267812026276,0.00202122283982,0.00909550277918,0.715482019361,0.634385752343,YV09,134,7,3.86,3,4.30056165611,5
79,ACLU08_test,1,1.69633603096,"tortur, jessen, mitchel, cia, rizzo, rodriguez, detaine, attorney, prison, judg",0.0102774922919,0.0195272353546,0.0,1.0,0.324324324324,13.0,0.351351351351,0.00308324768756,0.0,0.00102774922919,0.0123329907503,0.00308324768756,0.0,0.00411099691675,0.69339527162,0.659466953895,ACLU08,146,3,2.76333333333,3,2.2074160187,3
80,MalcolmX-ADeclarationofIndependence_test,1,2.49467802048,"malcolm, negro, mosqu, solut, muhammad, inc, muslim, statement, too, ourselv",0.00901984365604,0.0204449789537,0.0,1.0,0.341463414634,67.0,0.817073170732,0.0306674684305,0.0,0.0204449789537,0.0108238123873,0.0204449789537,0.0,0.00781719783524,0.708962980873,0.625664061524,MalcolmX-ADeclarationofIndependence,87,2,2.79,3,2.49941140955,1
81,551.html_test,1,1.60677289963,"bill, gauchat, peter, merci, maurin, talk, worker, vietnam, fruit, ladi",0.0338294993234,0.021650879567,1.0,0.0,0.514285714286,30.0,0.857142857143,0.0189445196211,0.0,0.00811907983762,0.0148849797023,0.021650879567,0.00270635994587,0.00811907983762,0.811371952702,0.824332313968,551.html,36,3,2.96333333333,4,3.36810286085,4
82,MalcolmX-AfterTheBombing_test,1,9.34272408485,"negro, get, know, got, hate, thing, say, tri, want, ourselv",0.0149876042371,0.0205093531666,0.0,1.0,0.318637274549,383.0,0.76753507014,0.0161144917737,0.0259184133423,0.0218616182105,0.0268199233716,0.0132972729322,0.0,0.0153256704981,0.686008129255,0.544888486371,MalcolmX-AfterTheBombing,88,2,3.4,2,2.85093383615,2
84,SS10_test,1,1.3943297863,"dog, galapago, shark, wildlif, cristob, shepherd, “sniffer, remark, agreement, knum",0.0112570356473,0.0187617260788,0.0,1.0,0.631578947368,12.0,0.631578947368,0.00187617260788,0.0,0.00375234521576,0.0225140712946,0.0,0.0,0.00562851782364,0.71711861243,0.674479366693,SS10,121,1,2.58333333333,3,1.2577638891,1
85,200.html_test,1,0.740206003189,"convers, address, noth, communist, talk, strang, sure, profess, opium, whi",0.0181818181818,0.0181818181818,0.0,1.0,0.478260869565,18.0,0.782608695652,0.0025974025974,0.0103896103896,0.0,0.0025974025974,0.0,0.0467532467532,0.0285714285714,-0.290383113793,0.598822570499,200.html,28,3,4.22333333333,3,3.84852319589,3
87,MalcolmX-ProspectsForFreedomin1965_test,1,4.52465105057,"get, civilright, noth, explos, promis, ake, harlem, oppress, prospect, malcolm",0.0210692652094,0.0221227284698,0.0,1.0,0.191489361702,153.0,0.651063829787,0.0152752172768,0.00948116934422,0.0163286805373,0.0281801422175,0.00421385304188,0.00131682907559,0.0186989728733,0.723003481433,0.588176520005,MalcolmX-ProspectsForFreedomin1965,83,2,3.24333333333,2,2.29254300743,2
89,ACLU01_test,1,1.67209506035,"tortur, prison, salim, “the, victim, dark, trauma, bensoud, client, psychologist",0.00826446280992,0.047225501771,0.0,1.0,0.439024390244,26.0,0.634146341463,0.0106257378985,0.00118063754427,0.00944510035419,0.00708382526564,0.0330578512397,0.0,0.00708382526564,0.616262957389,0.433556171817,ACLU01,139,3,3.34666666667,3,3.66517108344,3
90,piper2k 1-23-00_test,1,3.54068088531,"abort, babi, whi, excel, dark, deed, vers, let, christ, god",0.0317959468903,0.0359888190077,0.0,1.0,0.375722543353,108.0,0.624277456647,0.0317959468903,0.0132774283718,0.00559049615653,0.00698812019567,0.00873515024458,0.0,0.0083857442348,0.672031321773,0.449454604013,piper2k 1-23-00,41,5,2.84,3,3.23392659024,2
97,558.html_test,1,1.20506596565,"obedi, poverti, ave, maria, love, rosari, advent, tell, convers, scriptur",0.0509383378016,0.00536193029491,1.0,0.0,0.35,9.0,0.45,0.0214477211796,0.0,0.0,0.0,0.00268096514745,0.0160857908847,0.00268096514745,0.771163047165,0.576540447136,558.html,37,4,3.52666666667,3,3.4119663842,3
102,YV12_test,1,1.17600917816,"yantra, medit, faith, yoga, cosmos, divin, petal, path, express, god",0.037037037037,0.00617283950617,1.0,0.0,0.411764705882,7.0,0.411764705882,0.00617283950617,0.00617283950617,0.0,0.00617283950617,0.00617283950617,0.0,0.0154320987654,0.837916790483,0.608677116584,YV12,137,6,4.11333333333,3,4.06838954885,4
109,piper85 pn850027_test,1,3.74898695946,"corinthian, enslav, thing, drink, whi, say, conscienc, spirit, stomach, immor",0.0242326332795,0.0142164781906,1.0,0.0,0.292237442922,157.0,0.716894977169,0.0132471728595,0.0222940226171,0.0168012924071,0.00743134087237,0.0210016155089,0.00032310177706,0.0158319870759,0.691645586898,0.66117322778,piper85 pn850027,49,5,3.84,2,4.01797004828,5
110,"2005-07-10 Promoting Acceptance and Spiritual Growth, James Bailey.PDF_test",1,3.496997118,"mystic, spiritu, accept, sunday, gay, radic, selfaccept, quilt, grandmoth, affirm",0.0192307692308,0.0134615384615,1.0,0.0,0.296774193548,118.0,0.761290322581,0.0192307692308,0.005,0.0457692307692,0.00346153846154,0.00961538461538,0.00846153846154,0.00807692307692,0.677043485291,0.546525072543,"2005-07-10 Promoting Acceptance and Spiritual Growth, James Bailey.PDF",105,5,4.3,5,5.50882670042,5
111,overcoming-lifes-problems-steve-shepherd-sermon-on-endurance-32141.asp_test,1,3.60187792778,"want, christ, don, overcom, get, pain, ill, car, said, say",0.0274071402813,0.023079697079,1.0,0.0,0.293388429752,146.0,0.603305785124,0.0274071402813,0.0180310133429,0.0223584565453,0.00576992426974,0.0144248106744,0.0079336458709,0.00901550667147,0.649174987875,0.506494561511,overcoming-lifes-problems-steve-shepherd-sermon-on-endurance-32141.asp,98,3,3.07666666667,4,4.5151115906,5
