,fileName,sentence
0,./data_dsicap/DorothyDay/raw/2.html.txt,"['CONTENTS Introduction Explains she is writing the book to answer her Communist brother and friends question : How could you become a Catholic ?', 'Some markers along her way included praying the Psalms , reading Dostoyvskys and Mauriacs novels , and seeing the love of the poor found among those who dont consciously accept Christ .', 'Links her suffering with others to Christs withinHis Mystical Body .', 'Chapter 2 : Childhood Recounts her first childhood experiences of discovering God in the Bible , helping others , singing in church , meeting her first Catholic .', 'After being baptized in the Episcopalian Church and loving the services she disavows organized religion as her sense of social justice develops .', 'Chapter 4 : College Recounts her loneliness and poverty at college as well as her conscious turn away from religion .', 'Chaper 5 : Rayna Prohme An account of the deep friendship with Rayna Prohme whose joyousness and love for truth deeply impressed her .', 'She admires the Catholic faith of another student and attends Sunday Mass with her .', 'Chapter 13 : Your Three Objections Answers three objections of her brother to her faith : that religion is morbid , the Catholic belief in the presence of Christ in the Eucharist , and the problem of evil .', 'Relies on St.Theresa of Avila , St.John of the Cross , and the scriptures to elaborate her faith and love of God .']"
1,./data_dsicap/DorothyDay/raw/149.html.txt,"['Peter is proud of being a peasant and calls attention to it .', 'My word is tradition , he says .', 'A man has a mission , a calling , a vocation , he says .', 'We must get people away from being job-minded , wage-minded .', 'They are willing to accept voluntary poverty as the cost of their freedom to follow their call .', 'A priest , a sister , are taken care of in their work .', ""The layman says , They have security . ''"", 'St.Paul maintained himself by the labor of his hands ; he was a tentmaker .', 'Just the same , he said , The laborer is worthy of his hire .', 'They immediately began serving one another , serving the poor , serving those who gave up all to follow Christ .', 'Look at the missions , and the work priests do with nothing but their bare hands .', 'They had no security until they made it with their labor and suffering .', 'Joseph Day , the real estate speculator , got the swamps and sold them to factories , and now the place is a vision of hell , instead of a vision of heaven .', 'On the other hand , With our neighbor , St.Anthony says , is life and death .', 'And it was a rule , written not for priests , but for laymen .', 'Of course now it is used by priests and lay brothers , but why can not it be used by the family ?', 'The Green Revolution is the expression Peter used when he first started the Catholic Worker Movement .', 'Some Quaker Friends Once when some Quaker friends came to visit us at the farming commune at Easton , they told us we had two great assets in our work on the farm , one , our poverty , and two , our lack of leadership .', 'It is true that our poverty should force us to use the means at hand , whether it be stone or earth for houses , if there is lacking wood .', 'It is true our poverty should force us to work for food and clothing .', 'Perhaps they were thinking of various Quaker and socialistic experiments of the past where wealth made things easy so that the poor did not exert themselves , and good leadership made the rank and file lean too heavily and depend too much on one man .', 'We did not have enough voluntary poverty .', 'While professing poverty to the extent of going without salary , wearing cast-off clothes , sleeping in vermin-ridden and cold tenements , still we clung to such comforts as the food we liked , the cigarettes we craved , magazines , newspapers , moviesthe artificial tastes and desires built up in us by modern advertisers .', 'Peter remarked succinctly , Eat what you raise , and raise what you eat , on farming communes .', 'Such a principle would allow us bacon and ham , corn and wheat bread , honey , dairy products , fowl and eggs , and all the vegetables we could raise .', 'You could not eat the brood sow , nor could you eat the pig you were fattening for slaughter later .', 'You could not eat the chicks , nor did they begin to lay eggs at once .', 'You could not fatten the calf and eat it and still have the money for tools and seed .', 'We had to rule out the latter at once because there were too many amongst us with a weakness , and St.Paul says to do without what causes your brother to stumble .', 'So that brought us down to bread , fats and vegetables .', 'The mother of one of the families on the farm made bread for all who lived on the farm , but there were those who could not eat it because it was not like store bread !', 'Peter inveighed against packaged foods and canned goods , but those who came to us were not hermits and ascetics , they were the poor and the bourgeois of a rich country , the poor who were used to some form of relief , the poor who with their pennies bought liquor and store foods , canned and packaged goods , because they didnt know anything about cooking , nor about foods .', 'And most certainly they did not like either whole wheat bread or corn meal mush .', 'Poor Cooks Let me lay the blame where it belongs , and that is on the women , first of all , nor do I think I am being faithless to my sex in so saying .', 'It was not the women who did the cooking in our houses of hospitality and our farming communes .', 'Perhaps , having so nobly taken the blame on my own sex , we can put some of it on Peter too .', 'Be what you want the other fellow to be , he kept on saying .', 'It was not that he did not know how things ought to be , so that he could have said , do this , do that .', 'His own life showed how he thought things ought to be .', 'I Am Not a Question Box When Peter was asked questions , he answered them if he felt strongly enough about it .', 'If the question was too obvious , if he felt that it was not in his sphere of ethics and morality , he said , I am not a question box .', 'And the job is so hard , so gigantic in this our day of chaos , that there is only one motive that can make it possible for us to live in hope , that motive , love of God .', 'There is a natural love for our fellow human being but that does not endure unless it is animated by the love of God .', 'And if we do not live in love we are dead indeed , and there is no life in us .', 'I asked Peter .', 'I am a radical and know that we must get down to the roots of the evil .']"
2,./data_dsicap/DorothyDay/raw/145.html.txt,"['Calls her readers to have a Christ room in their homes , hospices in poor parishes and coffee lines for the transients , in order to exercise personal responsibility .', 'We spoke last year too , of the necessity of starting this work in other centers throughout the country , and now we note with joy that Pittsburgh , Detroit , Milwaukee , Boston , Houma , and other places are feeding the Ambassadors of the gods who come to them .', 'Always the Poor In our editorial this issue , we speak of plans to form unemployed groups with the end in view of getting them on the land , of starting a movement in that direction all over the country .', 'We do this with the full recognition that these bread lines , this work of feeding the hungry , must always go on .', 'But we must recognize the hard fact , that no matter how good a social order , there will always be the lame , the halt and the blind who must be helped , those poor of Christ , the least of His children , whom He loved , and through whom there is a swift and easy road to find Him .', 'The most profound expression of this I came across last month in Bernanos Diary of a Country Priest , a tremendously moving book which ahs become a best seller in France .', 'Poverty and suffering , and the joy of Christ found through them !', 'The book is overwhelming on first reading , and one feels the necessity of going over passages again and again to get their full meanings .', '11 of us who are engaged in trying to build a new social order , who consider ourselves revolutionaries , need this book to work with a fuller understanding of the place our work takes in the temporal scheme .', 'Peter is always making lists of books for people to read so I shall give my own list herewith : Diary of a Country Priest ; Manriacs Life of Christ ; Silones Bread and Wine ; Dostoievskys Legend of the Grand Inquisitor in The Brothers Karamazov ; Chautards Soul of the Apostolate ; Fr .', 'They were not strangers , we pointed out , since we regarded them as brothers in Christ .', 'When we succeed in persuading our readers to take the homeless into their homes , having a Christ room in the house as St.Jerome said , then we will be known as Christians because of the way we love one another .', 'They were knowing Marxist teaching through the breaking of bread , instead of Christian .', 'Too often we are afraid of the poor , of the worker .', 'We do not realize that we know him , and Christ through him , in the breaking of bread .', 'We are so broke that we dare not run up too big a printers bill .', 'He is too grateful to St.Joseph for the care He got on this earth to disregard his requests , and St.Joseph is our special protector in his work .', 'And the one thing we are sure in feeding the unemployed is that our Lord wants us to do this work so we must do it .']"
3,./data_dsicap/DorothyDay/raw/142.html.txt,"['The papers have been telling us recently of the new trend in Soviet Russia to glorify the woman who raises a family rather than the woman in the factory or driving a tractor .', 'Even there , it seems , the experimentation in social relations has confirmed what Catholic sociology has always taught , that .', 'There are so many things needed for the reconstruction of social order out of chaos today that we scarcely know where to begin .', 'All of these , of coursebut personal responsibility on the part of the individual alone does not perpetuate a new mode of life ; schools and colleges are directed by those brought up in the old ways ; communities of individuals die out or change their character ; Catholic co-operatives and trade unions can not begin to exist until we have Catholics living their faith and creating a truly Catholic culture and tradition .', 'So it is to the re-creation of the Catholic family , that microcosm of society and type of the Mystical Body , that we must look now if we expect later generations in this country to see Catholicism , instead of Marxism , a vital force in the nation , if we hope to maintain the freedom of the children of God against the diabolic forces of fascism .', 'if we wish our posterity to enjoy the peace which is their heritage from Christ instead of the strife of wars and hatreds between nations and classes .', 'Marxist Communism has been condemned by Catholics for its destruction of family life .', 'Capitalism bars them from living by the fruits of the labor they would willingly give , and marriage is out of the question .', 'Even if they have jobs , Catholic young people dare not assume the responsibilities of marriage because they cant afford a baby .', 'We assert that in these days of revolution , when we Catholics must arm ourselves with the Holy Spirit to renew the face of the earth , in this struggle , too , children are an asset and family life the most powerful and enduring form of propaganda .', 'We can not understand , then , the shortsightedness of Catholics who contribute generously for Catholic schools and neglect to aid the Catholic family life from which the schools must draw their students .', 'We have often commented , in THE CATHOLIC WORKER , on the high cost of maternity care here and the lack of facilities for such care under Catholic auspices .', 'Chicago has its large Catholic maternity hospital , where , in the short time it has existed , over ten thousand mothers have been cared for , many without charge .', 'But in New York , where last year Misericordia Hospitalthe only Catholic hospital in the city which accepts free maternity casescared for nearly 1,000 free maternity patients , there is no diocesan provision whatsoever for the poor who are trying to observe the teachings of the Church against birth control and raise families despite their economic circumstances !', 'We would suggest that as a first , even though inadequate , step toward realizing out ideals of family life our Catholic lay-people and clergy show the sincerity of their conviction by raising their voices in loud agitation for Catholic provision of such care .']"
