,fileName,sentence
0,./data_dsicap/IntegralYoga/raw/YV55.txt,"['So that they can be happy .', 'But why are they seeking happiness ?', 'How do they know that happiness is something worth having ?', 'Otherwise , how would they know they are not happy and should be looking for happiness ?', 'Still , if you ask anybody what they want in life , they will tell you , **CODEC_ERROR** just want to be **CODEC_ERROR** Who will be the happiest person ?', 'Happiness is already there , in you , as you .', 'You are that .', 'What you call the Self or the Atman or the image of God in you is happiness .', 'But , unfortunately , we are constantly looking outside .', 'Only when we get tired of searching outside , do we learn the lesson that nothing can give us happiness .', 'Then , we begin to look within .', 'Such Self-realization is what you call enlightenment .', 'Steady means still , **CODEC_ERROR** can shake you .', 'This is what we find in the second chapter of the Bhagavad Gita , where Sri Krishna gives the description of the Sthitapragnya Lakshana , the enlightened person , or sage of steady wisdom .', 'It is the Atma Surya , the Divine Light of the Self .', 'So far , Arjuna has been listening to Sri Krishna talking a lot about the restless mind and how to tame it .', 'But now he wants to know if there are people who have achieved this goal , whose minds are always tranquil and whose actions are always perfect .', '**CODEC_ERROR** Keep that question in mind as we read further .', 'They have no wants .', 'And because they **CODEC_ERROR** want anything , it seems all those things that everyone else wants , are now wanting them .', 'It is just there , and because it is just there , all the rivers say , **CODEC_ERROR** , I want to be with **CODEC_ERROR** They all run toward the sea , headlong , like a mad lover running to the beloved .', 'They have different names , colors , depths , everything .', 'Something else we learn from the ocean is this .', 'Imagine that you **CODEC_ERROR** want anything , you are just contented .', 'If everything starts coming to you , naturally you might start to feel , **CODEC_ERROR** is this ?', 'Look at me !', 'The sea knows it is all the same water , it is all one .', 'Whether you buy , borrow or steal a rose , it will still be fragrant .', 'It will not say , **CODEC_ERROR** , you **CODEC_ERROR** pay me so I **CODEC_ERROR** give you my **CODEC_ERROR** We see this equanimity everywhere in the nature .', 'Arjuna asks , **CODEC_ERROR** is very dear to you ?', '**CODEC_ERROR** dear to me is that devotee who hates no creature ; who is friendly and compassionate ; who does not feel separate from others , and therefore does not think anything is his own ; who stays calm in pleasure and pain , and is forgiving .', 'I cherish that devotee who is ever content ; who , through meditation , is steady of mind ; who controls himself ; whose convictions are consistent and strong ; and who offers his heart and mind to me .', 'Because if you get excited , naturally , the opposite should **CODEC_ERROR** will later become depressed .', 'So , if you want to know whether someone is a person of steady wisdom , a real bhakta , then see him or her through this lens .', 'Sri Krishna gives still another description of a sage : one who is **CODEC_ERROR** detached from personal desires , **CODEC_ERROR** one who **CODEC_ERROR** have any interests of his or her own .', '( 12.16 ) That is why the sage can keep his mind steady : he or she has nothing to gain , nothing to lose , and in that state , sees the one and the same Self in all .', 'Sri Krishna says , **CODEC_ERROR** dear to me is that devotee who worships the same Self in friend and foe **CODEC_ERROR** ( 12.18 ) .', 'My Master , Swami Sivanandaji , used to sing : **CODEC_ERROR** , Bliss , Knowledge , Bliss , Bliss Absolute .', 'In all conditions I am Knowledge , Bliss **CODEC_ERROR** Everyone can sing that , because in truth you are that Self .', 'Once you realize that , you will be possessed by all of these beautiful qualities and nothing will be able to shake you .']"
1,./data_dsicap/IntegralYoga/raw/YV48.txt,"['The work does not bind me , I am **CODEC_ERROR** All of creation is seen as the play of maya , or illusion .', 'It accepts everything ; it is not proud .', 'And this is the real nature of your true Self .', 'Only knowledge of this true nature will free you from the turmoil of this world .', 'It will free you from the petty-mindedness which divides humanity into thousands of names : **CODEC_ERROR** am this ; he is that .', 'They fail to see and know that they are above all these differences .', 'By knowing your true identity you can also know others .', 'We come together in that knowledge .', 'In this practice you simply sit and analyze everything that has happened and everything that is happening .', 'That way you detach yourself and rise above your limitations .', 'How do I know all these things ?', 'I know that I am disturbed .', 'Yet my knowing **CODEC_ERROR** seem to get disturbed .', 'If I am disturbed , who is it that knows something is disturbed in me ?', 'The true person , the true you is constantly the same because there is no change in that knowing .', 'You knew you were a child .', 'Now you know that you are an adult , and you know you are going to be an old man or an old woman .', 'You are not really isolated or separated You are only temporarily identifying yourself as the body .', 'If I ask you what you are doing , you can say , **CODEC_ERROR** am sitting down , **CODEC_ERROR** but you are not sitting .', 'Your body is seated .', 'When you say **CODEC_ERROR** fell down , **CODEC_ERROR** who is this **CODEC_ERROR** ?', 'The differences of the body make your mind feel different , and you identify yourself as the body .', 'This self-analysis can solve all your problems .', 'You are not your body .', 'You are not your mind because you are the one who is observing them .', 'Whatever it is that is bothering **CODEC_ERROR** at **CODEC_ERROR** back and ask yourself , **CODEC_ERROR** did I do ?', '**CODEC_ERROR** When you analyze in this way you will see that your happiness does not come from outside you .', 'Your mind and body continue to go through some changes , but knowing **CODEC_ERROR** change .', 'Only when you forget and identify yourself with the body or the mind do the clouds come and block your view of the **CODEC_ERROR** true Self .', 'The mind may pass through some of these cloudy periods , but as the Knower , you can enjoy the show .', 'Enjoy the mind and its play .', 'You know that .', 'So watch your mind .', 'Watch your breath .', 'Just see what is happening within you .', 'Be still and watch what is happening in your mind and in your body .', 'Maybe you have been repeating a mantra or focusing on one object for a time .', 'You may then relax and sit calmly and watch the mind ; observe the peaceful vibrations that come .', 'Observe your own brain .', 'See how peaceful you are .', 'You might think the mind is almost asleep , yet you are still conscious of the whole thing .', 'The mind is almost sleeping but you are aware of everything .', 'That is You .', 'You are totally different from your body , from your mind .', 'You are the **CODEC_ERROR** what you call the Self ; the Pure **CODEC_ERROR** witness of the body and mind .', 'If you could maintain this witnessing constantly , still knowing you are that witness all the time , you would have reached self-awareness or self-realization .', 'Keep up this awareness , even in your day-to-day activities .', 'When you are eating , you can still witness : **CODEC_ERROR** I am taking the food , chewing the food , tasting the **CODEC_ERROR** You will constantly enjoy supreme peace .', 'Through this you become the master or your own body and mind .', 'Find out who you are .', 'Once you know who you are , you will be the best instrument to bring peace and harmony to all .', 'Ultimately you will find you are not somebody who is going up and down , but that you are a permanent entity , an image of God .', '**CODEC_ERROR** see that you will be doing things perfectly because you have become a beautiful instrument and everything will want to come to you , to be used by you and to make use of you .', 'You never take sides .', 'You become the total , neutral person .', 'From there , according to the need , you can go this way or that way without losing your center .']"
2,./data_dsicap/IntegralYoga/raw/YV02.txt,"['Because the same force that created me created everything else , I have a duty to serve others .', 'That way you can have your house , your food , your clothes , your sleep , but , ultimately , you realize : Why do I eat ?', 'I sleep to get a good rest so that I can wake up and serve others .', 'I live in a house because I need shelter to sleep comfortably , to eat , and then to serve **CODEC_ERROR** **CODEC_ERROR** Sri Swami Satchidananda Integral Yoga MinistryIntegral Yoga ministers are dedicated to leading a lifestyle that is in harmony with the Integral Yoga teachings of their spiritual Guru , Sri Swami Satchidananda .']"
3,./data_dsicap/IntegralYoga/raw/YV05.txt,"['As individuals , we may find it hard to achieve that end ; so , collectively , we are helping each other .', 'That is the great benefit of satsang , the good **CODEC_ERROR** are placing yourself in a proper atmosphere .', 'And , that is the very reason why we wanted Yogaville .', 'If you want to be a Jivanmukta , where do you begin ?', 'Change your company .', 'If you have good company , you are not in the bad company ; that is the immediate benefit .', 'Then , because you are not in the bad company , your mind is more calm .', 'Because your mind is more calm , you experience your own inner Self .', 'The good company paves the way step by step , until at last you realize your own Self .', 'You learn to be a Jivanmukta .', 'If you want to have the attainment of a Jivanmukta , if you want to get liberated from the clutches of ego , start with **CODEC_ERROR** Not everyone can do the right things all by themselves .', 'On the other hand there are so many people to pull you into the old life .', 'If you say , **CODEC_ERROR** **CODEC_ERROR** drink **CODEC_ERROR** or **CODEC_ERROR** **CODEC_ERROR** take drugs anymore , **CODEC_ERROR** your old friends will wonder what kind of abnormality you have developed !', 'Suppose you are a smoker , and you want to stop smoking .', 'What would you do ?', 'Will you have friends who smoke a lot ?', 'Even though you want to do good things you might not be able to if you are in the wrong company .', 'If you have friends who smoke a lot , they will tempt you .', 'They will wait for a weak moment to convince you to do that .', 'Then , even though , sometimes , your past experience will want you to put your hand in the pocket and take up a cigarette , fortunately you are in the good company .', 'You feel ashamed to do that .', 'So , you are separating yourself from all those things .', 'Good company will naturally , even without your effort , take you toward your goal .', 'You are made by the company you keep .', 'Others are there not to drown you but to help you .', 'If you go out into the regular life , you are getting into deep water ; nobody will even bother to help you .', 'On the other hand , they may even push you down a little more .', 'If , even in the shallow water , you are about to drown , there are hundreds of people to pull you out .', 'Those who find it difficult to follow any spiritual practices **CODEC_ERROR** have to do anything ; just get onto the bandwagon .', 'The moment you come and live here , many of the vices just drop away .', 'Because **CODEC_ERROR** no similar vibrations here , you **CODEC_ERROR** even think of it .', 'There are people to help you .', 'That is one of the reasons we are developing Yogaville .', 'Many of our children are being born in Yogaville .', 'Certainly , they must have been good Yogis before ; they **CODEC_ERROR** finish their practices then , and they were looking for a Yoga home to continue .', 'In a way , that is what we are trying to create **CODEC_ERROR** good Yoga home , a Yoga **CODEC_ERROR** that we can attract all those little , little Yogis who **CODEC_ERROR** finish their job .', 'They can come over here and be born here in Yogaville .', 'Often , I thought , **CODEC_ERROR** we survive ?', 'Yes , with proper support and cooperation , we can achieve what we want .', 'And we see the fruit of it today .', 'My heart is filled with emotions when I think of these children , these young people .', 'Our main purpose here in Yogaville is to learn to live a clean life , a healthy life , a peaceful life .', 'Anything that would adversely affect our physical health and mental peace should not be allowed to come in .', 'That is why I have given lifestyle guidelines for the children and also for the adults .', 'Follow these guidelines ; they are for your benefit .', 'You know what disturbs your mental or physical health .', 'So , see the guidelines and then you decide yourself .', 'Should we say nobody should read books ?', 'You know what is good and what is not good .', 'Thousands of years before , they knew about the effect of sound vibration on the body and the mind .', 'That is why you have nice , beautiful soft music like Gregorian chants and other things when you go to the church .', 'In general , we say that anything **CODEC_ERROR** not violent , anything **CODEC_ERROR** soft and serene is recommended .', 'That is why I used one term **CODEC_ERROR** Food must be sattwic , music must be sattwic .', 'Keep this as the guideline : **CODEC_ERROR** that would adversely affect my body and mind is to be **CODEC_ERROR** **CODEC_ERROR** all .', 'Because we are not just having a sort of wild community here .', 'I have faith in some principles , and I want to live up to that .', 'I want all those people who have faith in those principles and want to live up to them .', 'If you have any doubt in my principles , question me .', 'Until then , yes , my principles should be followed here .', 'If you **CODEC_ERROR** want to follow the Ashram guidelines , do your own thing .', 'Did we say to you , **CODEC_ERROR** come to **CODEC_ERROR** No .', 'You came yourself .', 'To refine your life .', 'So , as long as you are here , follow the guidelines .', 'Otherwise , go out , get burned , and **CODEC_ERROR** drop all the bad habits by yourself .', 'In the old days , when you went on a plane , they asked you , **CODEC_ERROR** you want a smoking seat or a **CODEC_ERROR** seat ?', '**CODEC_ERROR** If you are a **CODEC_ERROR** , sit in the **CODEC_ERROR** section .', 'If you want to smoke , go to the smoking section .', 'If you know that people are not happy with your mentality or habits , change them .', 'You **CODEC_ERROR** come to ruin the harmony here .', 'If you **CODEC_ERROR** follow the guidelines , you are free to go .', 'As long as you are here , follow the guidelines .', '**CODEC_ERROR** not forcing you .', 'When you know something is not right , drop it immediately .', 'You can do it .', 'But , if you **CODEC_ERROR** want to do that , you can live in another place and come visit us now and then as a guest .', 'If you are calling yourself Yogaville community members , sangha , I insist that you should follow the guidelines .', 'Either we keep it clean and yogic or we close it .', '**CODEC_ERROR** very positive about that , and you should all understand the benefit .', 'You should feel convinced yourself .', 'If I want to be peaceful , how can I be negative ?', 'The **CODEC_ERROR** , me , **CODEC_ERROR** That is why we say in Yogaville there is no **CODEC_ERROR** , me , **CODEC_ERROR** It is ours .', 'We are all in a boat together .', 'Either we float across or we sink together .']"
4,./data_dsicap/IntegralYoga/raw/YV13.txt,"['If you observe carefully , throughout nature you will find one common goal in everybody and **CODEC_ERROR** in the atom .', 'In the case of human beings you see hundreds of efforts of various forms .', 'Some people want to be happy quickly , so they take short cuts and get temporary happiness , but borrowed joy comes and goes .', 'The happiness that we seem to be getting by our daily efforts is fleeting and mixed with a lot of troubles , worries , and unhappiness .', '**CODEC_ERROR** better to say , **CODEC_ERROR** am happy , **CODEC_ERROR** than , **CODEC_ERROR** want to be **CODEC_ERROR** The minute you say , **CODEC_ERROR** want to be happy , **CODEC_ERROR** that very want disturbs the mind .', 'They pay thousands of dollars to get that piece of paper .', 'If you are caught up in this , **CODEC_ERROR** say , **CODEC_ERROR** **CODEC_ERROR** be happy without the **CODEC_ERROR** So you pay the price .', 'Then you say , **CODEC_ERROR** , I got **CODEC_ERROR** **CODEC_ERROR** simple enough .', 'First you said , **CODEC_ERROR** want **CODEC_ERROR** After all the effort you say , **CODEC_ERROR** got **CODEC_ERROR** Where are you now ?', 'The same place you were before you wanted it .', 'You were happy before you wanted the stamp .', 'The moment you wanted it , you became unhappy .', 'And the moment you got it , you were happy again .', 'The thing by itself **CODEC_ERROR** give you any happiness .', 'You regained the happiness when you took the want back or when you fulfilled the cavity or depression created by the want .', 'When we finally tire of searching for happiness outside , we sit quietly and analyze and realize that true and lasting happiness can never come from outside .', 'You are Happiness personified .', 'You are that Supreme Bliss .', 'You are that Joy .', 'You are the image of happiness .', 'God is the one who is always happy , and you are the image of God .', 'When you forget your true nature and look for happiness in external ways , that is the basic ignorance .', 'The aim of all the Yoga practices is to stop anything from disturbing the mind so that it can reflect the Peace and Joy that is your true nature .']"
5,./data_dsicap/IntegralYoga/raw/YV53.txt,"['But if we explore it in a little more detail , **CODEC_ERROR** see how Arjuna got into his present situation and why the entire Bhagavad Gita had to be given .', 'He had been gifted to see what was happening on the battlefield miles away , and even to know the thoughts of everyone there .', 'Dhritarashtra said : Tell me , Sanjaya , what did my sons and Pandits sons do when they assembled on the holy field of Kurukshetra , eager to fight ?', 'Master , look at this great army of the sons of Pandu , marshaled by Drupada , your skilled disciple .', 'Our leaders , too , are distinguished ; let me name them for you who are highest of the twice-born .', 'There are you , Bhishma , Kama , Kripa , who is victorious in battle ; Asvatthama , Vikama and Jayadratha , son of Somadatta also .', 'And many more heroes and well-trained warriors fully armed and ready to give their lives for me .', 'Now , all of you take your positions throughout your divisions , and by all means protect Bhishma .', 'He accepted it as his svadharma or his predestined duty : **CODEC_ERROR** my duty to fight , even though I know **CODEC_ERROR** on the unrighteous **CODEC_ERROR** And it was Bhishma who actually began the fighting .', 'Then Lord Krishna , Arjuna and others blew their conches .', 'Then Krishna and Arjuna stood in their magnificent chariot , which was yoked to white horses , and blew their divine conches , 15 .', 'Together with Drupada , the sons of Draupadi and the mighty son of Subhadra blew their conches , my Lord , 19 .', 'On observing **CODEC_ERROR** host arrayed for battle and ready to begin , Arjuna , flying the ensign of Hanuman , lifted his bow and said to Krishna : **CODEC_ERROR** .', 'Draw my chariot between the two armies so I can see whom to fight and with whom I must wage war ; 23 .', 'I want to know who is gathered here intending to please the evil-minded Duryodhana in battle ; **CODEC_ERROR** .', 'Arjuna no longer saw them as enemies .', 'On seeing his friends and relatives positioned on both sides , Arjuna was overcome with pity and said despondently : **CODEC_ERROR** .', 'O , Krishna , my limbs fail me , my mouth is parched , my body is shaking and my hair stands on end seeing my relatives gathered here and anxious to fight .', '**CODEC_ERROR** good to know these symptoms which we too may face in similar situations , even when we try to fight our own undesirable habits .', 'It was not real compassion he felt , but a kind of **CODEC_ERROR** a judge who loses his neutrality when he sees a relative in the dock , Arjuna forgot they were vicious people the minute he saw them as relatives .', '**CODEC_ERROR** bow , Gandiva , fell from his hand : My skin is burning , I **CODEC_ERROR** keep standing , and my mind seems to be reeling , 31 .', 'I see bad omens , Krishna .', 'I can not see any good resulting from the slaughter of my own people in battle , See how the mind immediately finds excuses , and more excuses .', 'Arjuna is an intelligent man , so he says : 32 .', 'Krishna , I do not desire victory , kingdom or even pleasures .', 'Those for whom we might desire kingdom , enjoyment and pleasures are here ready for battle , having renounced life and wealth , Listen to the so-called beautiful advice **CODEC_ERROR** giving the Lord .', 'Before me are teachers , fathers , sons and even grandfathers , uncles , fathers-in-law , grandsons , brothers-in-law , and other relatives .', 'Though they might kill me , Krishna , I do not want to kill **CODEC_ERROR** even for the sake of dominion over the three worlds , much less , just for this earth .', '**CODEC_ERROR** why we **CODEC_ERROR** kill the sons of Dhritarashtra , our own relatives .', 'How could we ever be happy again , Krishna , after killing our own people ?', 'Though their understanding is clouded by greed , and they feel no guilt about exterminating an entire family , or showing hostility toward **CODEC_ERROR** Now Arjuna gives another excuse for not fighting .', '**CODEC_ERROR** Why does he call them wretched ?', 'If you go through the whole Mahabharata , you will see no criminal offense to which they were strangers .', 'Overwhelmed with sentiment , Arjuna wants to save them , even though his duty as a kshatriya ( member of the ruling , protecting caste ) is to destroy evil .', 'At the same time that he calls them murderers , still he wants to save them , and speaks of committing sin .', '**CODEC_ERROR** we recoil from such sin , Krishna , seeing clearly the troubles that follow a **CODEC_ERROR** destruction ?', 'In slokas 38 and 39 , Arjuna has been arguing : **CODEC_ERROR** this war we are going to destroy the family **CODEC_ERROR** This is a reasonable excuse not to fight if **CODEC_ERROR** an unjust war .', 'Sloka 39 clearly says , **CODEC_ERROR** **CODEC_ERROR** we just avoid such momentous action which will cause so much sin .', 'We know that this war will bring vast destruction and families will be dispersed .', 'And as you know , Arjuna continues , the men will be destroyed in this war .', 'In those days , it was believed that people should marry in the same group to avoid cultural and intellectual differences .', 'These are some of the reasons why he **CODEC_ERROR** want to fight .', 'Krishna , we have heard that people must suffer for some time in hell when the religious practices of their families are destroyed .', 'Alas , we are bent on perpetrating the great sin of killing our relatives all out of greed for the pleasures of a kingdom .', 'But greater than any of these reasons , the necessity to go to war is there in this case because the wicked people have been unnecessarily disturbing the innocent people , So Lord Krishna will somehow educate him about the necessity of this war .', 'Sometimes we lose sight of the truth when we get into emotional attachments to people .', 'It is here that Lord Krishna tries to remove the sentimental feelings and bring Arjuna back to truth and his duty .', 'But overwhelmed with sorrow , Arjuna sits despondently in the chariot and abandons his weapons .', 'It would be far better for me if the armed sons of Dhritarashtra would come upon me , unarmed and unresisting in battle , and slay me .', 'Sanjaya said : Having said this , Arjuna threw down his bow and arrows and sat down in his chariot overcome with sorrow , Thus ends the first discourse of the Bhagavad Gita , the science of Yoga , entitled : The Despondency of Arjuna .']"
