,fileName,judgements
3,./data_dsicap/WBC/raw/WestboroBaptist_Sermon_20080316.pdf.txt,"[""those terms are usually put for God 's Elect , because God 's Elect , in this world , are pictured as helpless , weak little sheep in the midst of ravenous , salivating wolves ; to wit : `` Fear not , little flock ; for it is your Father 's good pleasure to give you the kingdom . ''"", ""To wit : `` They are terrible and dreadful ... Their horses also are swifter than leopards , and are more FIERCE than the EVENING WOLVES . ''"", ""And then add `` RAVENOUS '' to the bloody description ; to wit : `` Her princes in the midst thereof are like wolves RAVENING ( i.e."", ""And our Savior picked up and thereby endorsed the phrase , when He said , `` Beware of false prophets , which come to you in sheep 's clothing , but inwardly they are RAVENING wolves . ''"", ""Once that wolf pack pounces on that lamb , slashing and tearing and swallowing flesh give them , oh , say , 2 seconds , and there 's not a sign of that lamb having ever existed every morsel of that lamb is devoured and in some salivating wolf 's belly ."", ""God 's little sheep are `` more than conquerors through him that loved us . ''"", 'Listen to the glorious passage , dictated by the Holy Ghost ; to wit : `` As it is written , For thy sake we are killed all the day long ; we are accounted as sheep for the slaughter .', ""And that glorious passage is quoted out of Psalm 44:22 ; to wit : `` Yea , for thy sake are we killed all the day long ; we are counted as sheep for the slaughter . ''"", ""And , just here is the glorious passage showing forth the blessed paradox ; to wit : `` But thanks be to God , which giveth us the victory through our Lord Jesus Christ . ''"", "", His Elect ) that Jesus is speaking in our text , when He says , `` Precious shall their blood be in His sight . ''"", 'Every last , single drop of blood , of every last , single sheep , is precious to Him .', '13:20 ) `` Take heed that ye despise not one of these little ones ( My Sheep ) ; for I say unto you , That in heaven their angels do always behold the face of my Father which is in heaven ...', '`` And the Lord said unto Cain , Where is Abel thy brother ?', ""( Gen. 4:9-11 ) The Lord Jesus expanded or at least articulated the concept of murder probably as it appertained to the murder or shedding the blood of God 's Elect ; to wit : `` Ye have heard that it was said by them of old time , Thou shalt not kill ; and whosoever shall kill shall be in danger of the judgment : But I say unto you , That whosoever is angry with his brother '' ( i.e."", "", dull or stupid clown , absurd , foolish buffoon ; which constitutes mocking and scoffing God 's Elect for their preaching ) , `` shall be in danger of Hell fire '' ( the ultimate punishment ) . ''"", ""`` And in her '' ( the Great Whore of false religious systems as they control governments and together persecute God 's Elect ) `` And in her was found the blood of prophets , and of saints , and of all ( God 's Elect ) that were slain upon the earth . ''"", ""Here 's the passage of proof ; to wit : `` For true and righteous are his judgments ; for he hath judged the great whore , which did corrupt the earth with her fornication , and hath AVENGED THE BLOOD OF HIS SERVANTS at her hand . ''"", ""`` Knowing this first , that there shall come in the last days scoffers , walking after their own lusts , And saying , Where is the promise of his coming ? ''"", 'The old Puritan Thomas Brooks wrote a lengthy Sermon about the matter , which he delivered to the House of Commons he being the appointed chaplain of that body .', 'The several themes of the Sermon were essentially the themes of Westboro Baptist Church ; to wit : that God burned London down , because of their sins and departing from the Lord , primarily because of the way London had persecuted the Puritans and other faithful preachers , and that the smart-ass , stiff-necked Londoners were too stupid to recognize that God had sent the fire because of their sins , which would only bring worse and more tragedies .', ""Brooks wrote , preached , and believed about this matter , all that the Puritans and other faithful ministers through the centuries have written , preached , and believed ; to wit : `` God is the author of all the plagues and judgments that befall a nation . ''"", "", chapters 24 and 25 as further dispositive and irrefragable proof of his proposition that , `` God is the author of all the plagues and judgments that befall a nation . ''"", ""And , in a general way , God sends all such tragedies in punishment for the persecution of His people on earth ; because , `` Precious shall their blood be in His sight . ''"", 'Our Father will redeem our soul from the deceit and violence of all our enemies ; and precious shall our blood be in his sight .']"
4,./data_dsicap/WBC/raw/WestboroBaptist_Sermon_20070923.pdf.txt,"[""He came on the scene near the end of Judah 's life as a nation , when God had already determined to destroy Judah for her sins and a good chunk of those sins were the blatant sins of Manasseh ."", 'It was a kind of STAY OF EXECUTION , FOR THE SINS OF MANASSEH : `` And like unto him ( Josiah ) was there no king before him , that turned to the Lord with all his heart , and with all his soul , and with all his might , according to all the law of Moses ; neither after him arose there any like him .', ""NOTWITHSTANDING the Lord turned not from the fierceness of his great wrath , wherewith his anger was kindled against Judah , because of all the provocations that MANASSEH had provoked him withal . ''"", ""The record of Manasseh 's life and 55-year reign is given twice almost identical accounts at 2 Kgs ."", ""Did Manasseh truly repent after all his bloody deeds and blasphemous mistreatment of God 's Elect people or was his foxhole conversion feigned ?"", 'Gill says he was bound with painful fetters both hands and feet , with chains of brass which were never removed or loosened all the way to Babylon .', ""HIS PRAYER also , and how God was intreated of him , and all his sins , and his trespass , and the places wherein he built HIGH PLACES , and set up groves and graven images , before he was humbled : behold , they are written among the sayings of the seers . ''"", ""Thou hast built thy HIGH PLACE at every head of the way , and hast made thy beauty to be abhorred , and hast opened thy feet ( spread thy legs ) to every one that passed by , and multiplied thy whoredoms . ''"", 'Manasseh knew all about the HIGH PLACES where they were , how many there were , and the sinful nature and filthy practices peculiarly associated with each place .', ""Even the pinheads in England , who wrote and/or edited The Illustrated Bible Dictionary , see through the pretended conversion of Manasseh ; saying : `` His ( Manasseh 's ) reformation appears to have been superficial . ''"", 'An eternal principle as old as God , and as binding as Thou shalt not kill or commit adultery is involved here .', 'By dealing fast and loose with the HIGH PLACES , Manasseh demonstrated beyond any doubt that his reformation ( or better said , his repentance ) was superficial .', 'DESTROY ALL HIGH PLACES The only way to get right with God was to destroy ALL HIGH PLACES .', 'But when ye go over Jordan , and dwell in the land which the Lord your God giveth you to inherit , and when he giveth you rest from all your enemies round about , so that ye dwell in safety ; Then there shall be A PLACE which the Lord your God shall choose to cause his name to dwell there ; thither shall ye bring all that I command you ; your burnt offerings , and your sacrifices , your tithes , and the heave offering of your hand , and all your choice vows which ye vow unto the Lord : And ye shall rejoice before the Lord your God , ye , and your sons , and your daughters , and your menservants , and your maidservants , and the Levite that is within your gates ; forasmuch as he hath no part nor inheritance with you .', 'ONE PLACE FOR LEGITIMATE PUBLIC WORSHIP The only legitimate place for public worship in the days of Manasseh was the Temple of God in Jerusalem .', ""The Lord chose that PLACE , and dwelt there , and spoke to His people there ; where every vessel and every piece of furniture spoke clearly and definitively of some grand Truth ; and where accurate notions of the nature and attribute of God were communicated to God 's Elect people .""]"
5,./data_dsicap/WBC/raw/WestboroBaptist_Sermon_20080518.pdf.txt,"['27:50-53 ) Truly amazing and astonishing things were coming to pass on the day they crucified our Lord Jesus Christ .', ""1:7 ) Remember , also , Beloved , that this commanding Centurion was responsible and accountable for the conduct of those soldiers who stripped our Lord Jesus Christ of his humble clothing , and even cast lots for that garment which had no seam so that they could not tear it in pieces ; to wit : `` Then the soldiers , when they had crucified Jesus , took his garments , and made four parts '' ( apparently only four of the 100 soldiers actually did the grisly work of driving the nails into His dear hands and feet crucifying ) `` and made four parts , to every soldier a part ; and also his coat : now the coat was without seam , woven from the top throughout ."", ""AND THE SOLDIERS also mocked him , coming to him , and offering him vinegar , And saying , If thou be the king of the Jews , save thyself . ''"", ""Psalm 22 is a Messianic Psalm , the first verse of which is a heart-cry of the Lord Jesus from the Cross ; to wit : `` My God , my God , why hast thou forsaken me ? ''"", ""`` Dogs , '' because of their impudence , filthiness , and libidinous nature are often put as symbols of homosexuals ( fags ) in Scripture ."", ""Sunday , May 18 , 2008 page 3 Sermon Outline That Centurion and his troops probably sodomites in whole , certainly sodomites in part face nothing but terror and the Great Day of God 's wrath , which they are now , suddenly , brought face to face with , by the earthquake and other displays of God 's power at the death of Christ ."", 'God is glorified when intractable sinners are brought to terror .', '23:47,48 ) Gill says that those evil people , `` smote their breasts as being conscious of guilt , and as fearing some dreadful judgment would fall upon them , and their nation , for this sin of crucifying Christ .', ""'' Beloved , I repeat , God is glorified when evil , intractable earth-dwellers impenitent & hardhearted sinners are reduced to TERROR , as when God strikes them with killer storms , whirlwinds , and earthquakes ."", "", His Essence , His essential attributes ) ; so that they are without excuse . ''"", ""And , according to the Revelation 's seven last angels of death and destruction , worse and more is on the way from an angry God ; to wit : `` And the seventh angel poured out his vial into the air ; and there came a great voice out of the temple of heaven , from the throne , saying , It is done ."", ""16:17,18 ) On the day of Pentecost fifty days after our Lord 's last Passover and His resurrection Peter preached his greatest sermon , ( as recorded in the second chapter of the book of Acts ) , which launched as it were the New Testament Church ."", ""Thousands of God 's Elect were supernaturally called to salvation that day , `` and the Lord added to the church daily such as should be saved . ''"", 'It was so arranged in the providence of God , that good , high-quality people from every nation on the globe should be in Jerusalem that day to hear Peter preach ; and , amazingly , and supernaturally , every single one of those people heard Peter preach IN HIS OWN LANGUAGE .', 'And how hear we every man in our own tongue , where we were born ?', 'Sunday , May 18 , 2008 page 5 Sermon Outline As a young preacher , I read the biography of Adoniram Judson ( 1788-1850 ) , a U.S. Baptist missionary to Burma , who translated the Bible into Burmese , and who was author of a Burmese dictionary .', ""After laboring for the Burmese people for many years , he was imprisoned and suffered `` extreme torture '' for two years ."", ""Judson authored the little poem we have informally adopted ; to wit : `` In spite of peril , toil , and pain ; our course be onward still ; We sow on Burma 's barren plain ; we 'll reap on Zion 's Hill . ''"", 'The Chinese persecution of Studd and Hudson Taylor and the missionaries of the China Inland Mission and the many others who for centuries have made Bibles available to the Chinese is cause enough for God to send earthquakes that killed 250,000 Chinese in 1976 , and for God to send the 7.9 earthquake last Monday that killed many more thousands .']"
6,./data_dsicap/WBC/raw/WestboroBaptist_Sermon_20071216.pdf.txt,"['You probably noticed that Baxter was a contemporary and a fellow Englishman of Joseph Caryl , who lived from 1602 to 1673 and was 72 years of age when he died , who also wrote a huge book , during the same period that Baxter was at work on his book .', ""Caryl 's massive work was simply entitled , An Exposition of Job ."", ""Some 55 years ago I came by greatly-abridged copies of both of those old puritan books , and tracked down an UNABRIDGED copy ( in fact , it was an ORIGINAL copy , now almost 400 years old ) of Caryl 's 2-volume work on Job ."", 'You may see from these books on the table , what a vast difference there is in the size of the 2 huge UNABRIDGED volumes , and the rather small ABRIDGED volume .', ""LET US FIND THE ORIGINAL BOOK : THE SAINTS ' EVERLASTING REST The Internet has provided us with some sheets of Baxter 's book , available to all for the downloading ; together with what is called , `` An Introductory Essay by Thomas Erskine , '' dated in 1824 ."", ""Baxter says , `` The Saints ' Rest is the most happy state of a Christian ; it is the perfect endless enjoyment of God by the perfected saints , according to the measure of their capacity , to which their souls arrive at death , and both soul and body most fully , after the resurrection and final judgment . ''"", ""It would be a wonderful thing , Beloved , if you would read and thoroughly digest Baxter 's Book ; if you would walk in Baxter 's footsteps , think Baxter 's thoughts with him , as it were , such thoughts as those that produced polished sentences and phrases as the following that define and explain The Saints ' Everlasting Rest ; to wit : `` It is a rest from all controversy with God from all opposition to his will ."", ""For example , Lawyer Erskine praises Baxter to the skies for about nine pages ; in glowing language such as this ; to wit : `` We assuredly do not know any author who can be compared with him , for the power with which he brings his reader directly face to face , with death , and judgment , and eternity ; and compels him to look upon them , and converse with them . ''"", "", Baxter 's preaching and writing ) on such a subject praise is superfluous , as it is easy ; AND WE SHALL RATHER BEG THE ATTENTION OF OUR READERS to some observations on his MANNER OF STATING DIVINE TRUTH , and on the interesting subject of the work before us ( to wit : the doctrine of HELL ) . ''"", ""Sunday , December 16 , 2007 pg.3 Sermon Outline Having announced that he would make some innocent-sounding `` observations on Baxter 's MANNER of stating divine truth , '' snake-boy Erskine proceeds as follows , and lets the cat out of the bag ; to wit : `` In the first place , then , there is perhaps , too little appearance of compassion , and too much detail in his descriptions of the punishments after death ( i.e."", ""I have thought for some time , that Jonathan Edwards ' great and famous sermon , `` Sinners in the Hands of an Angry God '' was mightily inspired and influenced by Baxter 's even greater and even more famous , book ."", ""`` SINNERS IN THE HANDS OF AN ANGRY GOD '' Listen to some of the colorful language of Edwards , compared to that of Baxter ; to wit : `` The God that holds you over the pit of hell much as one holds a spider or some loathsome insect over the fire , abhors you , and is dreadfully provoked ; his wrath toward you burns like fire ; he looks upon you as worthy of nothing else but to be cast into the fire ; he is of purer eyes than to bear to have you in his sight ; you are ten thousand times so abominable in his eyes as the most hateful and venomous serpent is in ours ."", ""`Tis ascribed to nothing else , that you did not go to hell last night ; that you were suffered to awake again in this world after you closed your eyes to sleep , and there is no other reason to be given why you have not dropped into hell since you arose in the morning , but that God 's hand has held you up . ''"", 'Now that , Beloved , is vintage Jonathan Edwards , and is in every high school literature book as an example of how they used to preach throughout America and England two or three centuries ago .', ""And only eternity will show how many preachers like Jonathan Edwards have been inspired and influenced to boldly preach God 's Word by Baxter 's Book , The Saints ' Everlasting Rest ."", ', the eternal loss of heaven itself ) will be greatly aggravated by suffering the torments of hell .', 'The exceeding greatness of such torments may appear by considering the principal Author of them , who is God himself !', ""And again , Baxter says ( let me interpose here , that I have hard evidence that The Saints ' Everlasting Rest has been important to me for at least 48 years , and probably closer to 55 years but at least 48 years , because 48 years ago we named our dear little newborn son after Richard Baxter ) ( and , let us never name a child , Erskine ) so , back to excerpts showing with what frightening detail Baxter handled the torments of hell ; to wit : `` The principal author of hell-torments is God himself ."", 'If thy strength were as iron , and thy bones as brass ; if thy foundation were as the earth , and thy power as the heavens , yet shouldst thou perish at the breath of his indignation .', ""HOW MUCH MORE , when thou art but a piece of breathing clay , kept a few days from being eaten with worms , by the mere support and favor of him whom thou art thus resisting . ''"", ""HARD TO TELL JONATHAN EDWARDS FROM RICHARD BAXTER It is hard to tell which of these preachments are Jonathan Edwards ' , in `Sinners in the Hands of an Angry God ' and which are Richard Baxter 's , in The Saints ' Everlasting Rest ."", ""Here 's what the weasel has to say ; to wit : `` In the first place , then , there is perhaps , too little appearance of compassion , and too much detail in his descriptions of the punishments after death . ''"", 'the general idea about hell is all that is given in Scripture , and even that is rarely insisted on , except by our Lord himself ; as if such a fearful denunciation could only have its right effect , when pronounced by the lips of him who is love itself .', 'It must be read and re-read to deal with its many errors in such a short space ; and before we sort all those errors out , here comes another batch ; to wit : `` Whatever men may think or feel on the subject , there can be no doubt , that the doctrine ( i.e.', ""2:4 ) And then , lest someone arise to actually preach what God says is the truth , weasel Erskine hastens to substitute an Old Wives Tale for his lack of Bible authority for his nonsensical proposition ; to wit : `` And it ought to be remembered , '' says Erskine , `` that men are not made Christians by terror , but by love . ''"", ""( Jude 22,23 ) And just look at the Devil 's syrup dripping from old Erskine 's lying lips , when he says : `` Our gracious Master , who suffered in our stead , and whose deep , and solemn , and tender interests in our welfare , could not be doubted , did , indeed , in his discourses , always set before men life and death , as the solemn alternatives of their choice . ''"", 'Lawyer Thomas Erskine , who would thus pervert the plain teachings of Jesus Christ , is likely to have been in Hell himself for nearly 200 years now ; and it is certain that he now knows better about Hell .', ""And he now knows clearly that the Lord Jesus was not joking when he said : `` And fear not them which kill the body , but are not able to kill the soul : but rather fear him which is able to destroy both soul and body in hell ; yea , I say unto you , fear him . ''""]"
7,./data_dsicap/WBC/raw/WestboroBaptist_Sermon_20080413.pdf.txt,"[""The Scriptures are full of God 's appointments , and none is more comforting to God 's dear ones in affliction than the one in 1 Thessalonians 5:9 ."", 'Yet he possessed in his bosom a divine message straight from God Almighty , for the whole world and that message was pure wrath .', 'Every valley shall be exalted , and every mountain and hill shall be made low ; and the crooked shall be made straight , and the rough places plain ; And the glory of the Lord shall be revealed , and all flesh shall see it together ; for the mouth of the Lord hath spoken it .', ""Called out of the kingdom of Satan by the loud and lusty voice of God 's ministers on earth , as it were ."", 'Listen to the words : `` And thou shalt number seven sabbaths of years unto thee , seven times seven years ; and the space of the seven sabbaths of years shall be unto thee forty and nine years .', ""58:1 ) , `` loudly and lustily , '' `` in the ears of a waste and wild people ; meaning the world , void of God 's grace , barren in all virtue , having no pleasing abode , nor sure direction of any good way in it , being full of horror and accursed . ''"", ""Picture the man John as the Holy Spirit most accurately presents him ; to wit : `` And the same John had his raiment of camel 's hair , and a leathern girdle about his loins ; and his meat ( food ) was locusts and wild honey . ''"", ""For John had said unto Herod , It is not lawful for thee to have thy brother 's wife ."", ""yea , I say unto you , and more than a prophet ... Verily I say unto you , Among them that are born of women there has not risen a greater than John the Baptist . ''"", '11:7,9-11 ) So , Beloved , when we are taught by such a man speaking of eternal things , Heaven and Hell , with wonderful authority we are , above all people on earth , greatly blessed .', ""Of the preeminence of Christ , John said : `` I indeed baptize you with water unto repentance ; but he that cometh after me is mightier than I , whose shoes I am not worthy to bear ; he shall baptize you with the Holy Ghost , and with fire . ''"", ""Now , as to the urgency of the need for quick and decisive action if you would avoid `` unquenchable fire , '' John the Baptist said : `` Whose fan is in his hand , and he will throughly Sunday , April 13 , 2008 page 4 Sermon Outline purge his floor , and gather HIS wheat ( i.e."", ""1:4,5,11 ) `` And when the Gentiles heard this , they were glad , and glorified the word of the Lord ; and as many as were ordained to eternal life believed . ''"", 'If you find no comfort in the age-old doctrine of the Absolute Predestination of all things , it is because you are lost and on your way to Hell .', ""`` I am Jesus whom thou persecutest ; it is hard for thee to kick against the pricks . ''"", ""Here is the exact language which the Holy Spirit has used in describing and identifying you Arminian scum ; to wit : `` And a stone of stumbling , and a rock of offense , even to them which stumble at the word , being disobedient ; whereunto they were APPOINTED . ''"", '( Acts 17:31 ) And , God has made an APPOINTMENT with every individual of mankind except for those of His Elect Remnant who are alive and remain at the coming of the Lord , who will be raptured without tasting death ( 1 Cor .', ""2:12a `` Kiss the Son , lest he be angry , and ye perish from the way , when his wrath is kindled but a little . ''""]"
