,fileName,judgements
4,./data_dsicap/WBC/raw/WestboroBaptist_Sermon_20071014.pdf.txt,"['Sunday , October 14 , 2007 pg.1 Sermon Outline The Abomination of Desolation standing in the holy place Beloved , the Lord has given us an amazing perspective from which to view time and eternity the life which now is , and that which is to come .', 'The signs are great and they are everywhere .', ""Just as though we had not sent them and every other media outlet a weekly news release every week for 17 years entitled , `` Week so-and-so of the Great Gage Park Decency Drive , '' the latest such news release being sent forth to all media last Friday , Oct. 12 with an opening line for all the world to see ; to wit : `` WBC observes WEEK 851 ( nearly 17 years ) of protests against public sodomy at Gage Park , Oct ."", 'Our experience at Gage Park just a few blocks from our church , where we have been located by the amazing providence of God , and where we have preached every week for 52 years I say that our experience at Gage Park in Topeka , Kansas , at the very heart and geographical center of the United States and of the world proves that THE END OF THE WORLD IS NEAR THE COMING OF THE LORD ( AND OUR REDEMPTION ) DRAWETH NIGH .', ""Here is the verse ; to wit : `` But when ye shall see the abomination of desolation , spoken of by Daniel the prophet , standing where it ought not , '' the end is near ."", ""And the companion verse ; to wit : `` When ye therefore shall see the abomination of desolation , spoken of by Daniel the prophet , stand in the holy place , '' the end is near ."", ""23:17,18 ) Further proof that the abomination of desolation refers to sodomites or fags or dogs or the power of the dog , or the socio-political/socio-religious power of fags , I say further proof is seen in the words of Daniel referred to by our Lord Jesus Christ where He says , `` the abomination of desolation , SPOKEN OF BY DANIEL THE PROPHET . ''"", 'Fag fornicating is always barren fornicating , desolate , totally unproductive , forever sterile there are many kinds of ceremonial and moral abominations ; but only one that is always , totally , and forever the abomination of desolation ; to wit : fags .', ""In the now-19 year old saga of `` THE GREAT GAGE PARK DECENCY DRIVE '' we are dealing with `` the power of the dog . ''"", ""We did not know it at the time , but that letter launched the epochal struggle that later became known as THE GREAT GAGE PARK DECENCY DRIVE and , in a way , signaled the end of the world to those with eyes to see , which is the meaning of the parenthetical words of the Lord Jesus , `` let him that readeth understand . ''"", 'Dear Friends : A malodorous sore with the scab off is open and running at the extreme southwest corner of Gage Park .', ""`At any hour of the day or night , ' a park official told me , `male couples may be seen entering and exiting the area . '"", ""In preparation for the presidential visit and lest the national media focus on the shameful running sore of Topeka 's Gage Park the area was purged of its unnatural visitors for about a month prior to and including the day of Reagan 's visit ."", ""Sunday , October 14 , 2007 pg.4 Sermon Outline Last week , on Fri. , Oct. 5 , a story in the paper , headlined , `` Two Arrested in Sex Sting , '' said : `` two Topeka men were arrested in connection with solicitation of sodomy in Gage Park during a prostitution sting operation by the Topeka Police Dept ."", ""So it was at Sodom ; to wit : `` Even as Sodom and Gomorrah , and the cities about them in like manner , giving themselves over to fornication , and going after strange flesh , are set forth for an example , suffering the vengeance of eternal fire . ''"", '( Jude 7 ) And our Lord Jesus said that when those conditions prevail as they did in Sodom and Gomorrah such would signal the approaching end of the world as when you see the abomination of desolation standing in the holy place and standing where it ought not ; to wit : `` Likewise also as it was in the days of Lot ; they did eat , they drank , they bought , they sold , they planted , they builded ( a vibrant , thriving society , like the USA ) ; But the same day that Lot went out of Sodom it rained fire and brimstone from heaven , and destroyed them all .', ', every level of society ) : And they called unto Lot , and said unto him , Where are the men which came in to thee this night ?']"
5,./data_dsicap/WBC/raw/WestboroBaptist_Sermon_20080525.pdf.txt,"[""These are fair samplings of such `` exceeding great and precious promises ; that by these we might be partakers of the divine nature , having escaped the corruption that is in the world through lust . ''"", "": `` And the Lord shall deliver me from every evil work , and will preserve me unto his heavenly kingdom ; to whom be glory for ever and ever . ''"", '4:18 ) `` Now to the King eternal , immortal , invisible , the only wise God , be honor and glory for ever and ever .', '1:17 ) `` Which in his times he shall show , who is the blessed and only Potentate ( Sovereign ) , the King of kings , and Lord of lords ; Who only hath immortality , dwelling in the light which no man can approach unto ; whom no man hath seen , nor can see ; to whom be honor and power everlasting .', '3:16 ) `` And the very God of peace sanctify you wholly ; and I pray God your whole spirit and soul and body be preserved blameless unto the coming of our Lord Jesus Christ .', 'Be perfect , be of good comfort , be of one mind , live in peace ; and the God of love and peace shall be with you .', '16:22-24 ) `` Now to him that is of power to stablish you according to my gospel , and the preaching of Jesus Christ , according to the revelation of the mystery , which was kept secret since the world began , But now is made manifest , and by the scriptures of the prophets , according to the commandment of the everlasting God , MADE KNOWN TO ALL NATIONS for the obedience of faith ; To God only wise , be glory through Jesus Christ for ever .', ""Remember the words of John Owen , that whatever else is going on , never forget that the ULTIMATE AIM of Satan and the world of these vile earth-dwellers all around us I say , their ultimate aim ALWAYS is the death of all God 's Elect and the `` utter destruction of the church ; '' and , `` For , CONSIDER HIM ( i.e."", ', immediately , directly , in-your-face ) `` lest ye be wearied and faint in your minds .', 'And , Beloved , remember that this great conflict , that we in this humble church are engaged in , is the very essence of the Gospel and is irrefutable , irrefragable evidence ( proof positive ) that our calling and election is sure .', "", the aging apostle was falsely imprisoned by the sodomite perverts running the mighty , but doomed , Roman Empire ) `` but be thou partaker of the AFFLICTIONS OF THE GOSPEL according to the power of God ; Who hath saved US , and called US with an HOLY CALLING , not according to OUR works , but according to his own purpose and grace , which was given US in Christ Jesus BEFORE THE WORLD BEGAN , But is now made manifest '' ( openly revealed for the whole world to see who the CALLED THE ELECT are , and the Gospel that was given to ONLY THEM before the world began ) `` by the appearing of our Savior Jesus Christ , who hath abolished death , and hath brought life and immortality to light through the gospel ; Whereunto I am appointed a preacher , and an apostle , and a teacher of the Gentiles . ''"", "", a severe understatement for dramatic effect if ever there was one ) meaning , not that He is barely `` able '' , but that all the Sovereign Power of an Almighty God is dedicated , devoted , and solemnly PLEDGED UNDER OATH `` to keep that which I have committed unto him against that day . ''"", ""When they are in any kind of danger , the Lord God of hosts will leave His throne in Heaven and come down to Earth to fight for His loved ones in His Church Militant and , as birds flying ( state-of-the-art supersonic fighter-planes and bomber- planes laden with stateof-the-art nuclear weapons and bombs ) I say , when His Loved Ones in His Church Militant are threatened with harm in any way , the Lord God has pledged as Heaven 's war-birds flying to defend them ."", 'Champion Football Coach Vince Lombardi used to say that the best defense is a good offence .', ""Their immediate context involves a total destruction of a mighty Assyrian army that had laid siege to and was threatening the imminent and utter destruction of Jerusalem ( the church , God 's Holy Remnant ) ."", ""Lord Byron was not a Bible man ; in fact he was a whoremongering drunk ; and he certainly had no interest in knowing that the Lord 's supersonic War-Birds were flying that night . )"", 'Like the leaves of the forest when Summer is green , That host with their banners at sunset were seen ; Like the leaves of the forest when Autumn hath blown , That host on the morrow lay withered and strown .', 'And there lay the rider distorted and pale , With the dew on his brow , and the rust on his mail ; And the tents were all silent , the banners alone , The lances uplifted , the trumpets unblown .', ""And the widows of Ashur are loud in their wail , And the idols are broke in the temple of Baal ; And the might of the Gentile , unsmote by the sword , Hath melted like snow in the glance of the Lord ! ''"", 'For I will defend this city ( WBC ) , to save it , for mine own sake ... And it came to pass that night , that the angel of the Lord went out , and smote in the camp of the Assyrians an hundred fourscore and five thousand ; and when they arose early in the morning , behold , they were all dead corpses .', ""And , Remember Coach Lombardi 's bit of football wisdom , that a good OFFENSE is the best DEFENSE ."", 'O thou that dwellest upon many waters , abundant in treasures , thine end is come , and the measure of thy covetousness ( think , America ) .', 'Every man is brutish by his knowledge ; every founder is confounded by the graven image ; for his molten image is falsehood , and there is no breath in them .', ""`` ) : `` The portion of Jacob is not like them ; for he is the former of all things ; and Israel ( God 's Elect ) is the rod of his inheritance ; the Lord of hosts is his name ."", ""51:12-24 ) Beloved , has not the cruel persecution of our little church by the United States been done `` IN YOUR SIGHT ? ''"", 'For 17 years we have been mercilessly persecuted by the lawless , filthy , criminal citizens of this godless country all of whom are wide- awake to this fact , and are wellaware of what they have done , and are doing .', 'On your Hellish , mean , lawless , godless , filthy streets as it was in the days of Sodom .', ""`` But without faith it is impossible to please him ; for he that cometh to God must believe that he is , and that he is a rewarder of them that diligently seek him . ''"", ""Beloved , we are told of a great gathering of our friends , who have gone on to Heaven from the bygone years , looking on as our witnesses and to encourage us in our struggles ; to wit : `` Wherefore seeing we also are compassed about with so great a cloud of witnesses ... let us run with patience the race that is set before us . ''"", 'John Owen says , `` So it is with us in our patient perseverance ; all the saints of the old testament do as it were stand looking on us in our striving , encouraging us unto our duty , and ready to testify unto our success with their applauses .', 'And it is not unuseful for us , in all our trials for the profession of our faith , to consider that the eyes as it were of all that have gone before us in the same , or the like , or greater trials , are upon us , to bear witness how we acquit ourselves .']"
6,./data_dsicap/WBC/raw/WestboroBaptist_Sermon_20070909.pdf.txt,"['( Jude 11 ) While Bush stubbornly sends people to die every day in Iraq , and incurs billions if not trillions in debt prosecuting a bloody war , he is busily planning his own post-presidency future and how to become a multimillionaire , bragging on his failed policies , and bragging on how he brought down the wrath of God on America .', ""And those `` words '' mark him as a `` condemned '' child of Hell , according to the Lord Jesus ; to wit : `` For by thy WORDS thou shalt be justified , and by thy WORDS thou shalt be CONDEMNED . ''"", '`` Holy Father ... those that thou gavest me I have kept , and none of them is lost , but the son of perdition [ i.e.', ""The Draper , `` Dead Certain , '' book says : `` Discussing his past battles with alcohol , Bush says he would never be able to make decisions on war if he was still drinking . ''"", 'Remember , Beloved , that this is the same Bush who choked and fainted while trying to eat a pretzel , that cries all the time , uncontrollably , who sees ghosts coming at him out of the walls and out of unoccupied rooms in the White House , and who admits he has been a sloppy drunk for years , unable to make decisions , with a cloudy brain , absolutely , he says .', 'Balaam , for lucre , spoke in the name of the true and living God and he knew and well understood and pretended to believe the 5-point doctrines of Calvinism , as in predestination and election and reprobation ; to wit : Sunday , September 9 , 2007 pg.3 Sermon Outline `` God is not a man , that he should lie ; neither the son of man , that he should repent ; hath he said , and shall he not do it ?', ""In fact it is the worst form , and is symbolized by the iron-and-clay feet and toes of King Nebuchadnezzar 's image ."", '; to wit : `` I blessed the most High , and I praised and honored him that liveth for ever , whose dominion is an everlasting dominion , and his kingdom is from generation to generation .', ""On the night of Belshazzar 's great feast which marked the end of Israel 's 70 years of Babylonian Captivity and shortly after Daniel had pronounced the King 's and the Kingdom 's doom , right to the King 's face we read these words : `` In that night was Belshazzar the king of the Chaldeans slain ."", 'Another ancient monarch who ruled the world the direct antithesis of democracy yet see what kind of man he was from his words ; to wit : `` Then king Darius wrote unto all people , nations and languages , that dwell in all the earth ; Peace be multiplied unto you .', 'I make a decree , That in every dominion of my kingdom men tremble and fear before the God of Daniel ; for he is the living God , and stedfast for ever , and his kingdom that which shall not be destroyed , and his dominion shall be even unto the end .', 'If they should lift a hand or a voice to protect us in any way , and do their Constitutional and moral duty toward WBC their political careers would be over .', ""By and by , the time would come , when good America would no longer be good ( which he said was the reason for America 's greatness , after he went into faithful churches in those days , and concluded that America was great because America was good . )"", ""And that is why America persecutes us , because ELECTED officials are afraid they wo n't be RE-ELECTED if they protect our Constitutional rights .""]"
7,./data_dsicap/WBC/raw/WestboroBaptist_Sermon_20071202.pdf.txt,"[""Doyle Cannon then-pastor of Central Church of Christ , located at Huntoon & College Streets , here in Topeka SAID : ( in a 4-night , 12-hour debate he had with me exactly 50 years ago ) Doyle Cannon said : `` FRED PHELPS MAKES THAT DEAD MAN TOO DEAD ; '' to wit : `` You hath he quickened who were DEAD . ''"", 'A little further down in Ephesians , Chapter Two , are these words : `` But God , who is rich in mercy , for his great love wherewith he loved us , Even when we were DEAD in sins , hath quickened us together with Christ , ( by grace ye are saved ; ) And hath raised us up together , and made us sit together in heavenly places in Christ Jesus : That in the ages to come he might show the exceeding riches of his grace in his KINDNESS toward us through Christ Jesus .', 'For by GRACE are ye saved through FAITH ; and THAT not of yourselves : it is the gift of God .', ""2:4-10 ) Doyle Cannon 's church at Huntoon & College Streets is what the old-timers called a Campbellite church named after its founder , Alexander Campbell , who himself was raised as a Calvinistic , Old School , Primitive ( some say a Hardshell , or TULIP ) BAPTIST who went to seed over one verse ( Acts 2:38 ) and became an Arminian , Free-Will , Baptismal-Regeneration heretic , whose followers of the sect he founded are called CAMPBELLITES ."", ""As I said , old Alexander went to seed over Acts 2:38 , joined the Baptists in 1813 , and DISSOCIATED from the Baptists in 1830 to start up his own church whose outward distinguishing characteristics are rejection of all musical instruments at worship services , and insistence that one must be baptized in water by immersion in order to be saved , ala Acts 2:38 ; to wit : `` Then Peter said unto them , Repent , and be baptized every one of you in the name of Jesus Christ for the remission of sins , and ye shall receive the gift of the Holy Ghost . ''"", 'Mankind virulently HATES the doctrine of TOTAL DEPRAVITY that natural man is dead in his sins , and can do nothing whatsoever to either save himself or help save himself .', 'Then the Arminian heretic tells one of his favorite little stories , by way of encouraging the dead man to help raise himself from the dead about the lying Roman Catholic legend of St. Dennis ; to wit : `` St. Dennis was slain as a martyr , by having his head cut off .', ""In writing of the Arminian preacher Charles G. Finney ( 1792-1875 ) , the Britannica says , `` His theology was typical of all the revivalists , emphasizing MAN 'S INITIATIVE in conversion and ability to make himself a new heart by his own choice ."", ""He said something like this , as a prelude to his so-called `` Altar Call '' , as the choir sang , `` Just As I Am ; '' to wit : `` Faith is such a simple thing ."", ""You did n't turn the chair upside down and examine the screws , nuts and bolts that held the chair together , to be sure you would be safe sitting in it ."", ""When you drove your car to the meeting tonight , and came to a hill , so that you could not see the other side of the hill to be sure the highway kept going on the other side of the hill you did n't pull your car over to the side of the road , and walk up to the top of the hill , to be sure the highway kept going on the other side of the hill ."", 'You exercised your simple , everyday faith , and probably never gave it a thought but that the highway kept going and was safe to drive on , Sunday , December 2 , 2007 pg.3 Sermon Outline on the other side of the hill .', ""There 's all the difference in the world between the supernatural faith of God 's Elect that leads to salvation ; and the common faith of all mankind that is a natural part of human existence ."", ""The context of the declaration that `` All men have not faith , '' is rather startling ; to wit : `` Finally , brethren , pray for us , that the word of the Lord may run and have free course and be glorified , even as it is with you : And that we may be DELIVERED FROM UNREASONABLE AND WICKED MEN : FOR ALL MEN HAVE NOT FAITH . ''"", 'It is a Satanic perversion of the truth to say that the same kind of simple faith that all men are possessed with when turned to believing in Christ simply take Jesus as your savior , and trust in Him is all that is needed for salvation .', '3:2 ) The warning is serious , and to be taken seriously , as in Phil .', ""For we are the circumcision , ( the true children of Abraham , who is `the father of all them that believe . '"", ""`` `` Know ye therefore that they which are of faith , the same are the children of Abraham . ''"", ""And so you see , without the supernatural FAITH OF GOD 'S ELECT , there is no apostleship , there is no ultimate , absolute TRUTH , there is no godliness , and there is no hope of eternal life ."", ""THE FAITH OF GOD 'S ELECT is also the personal FAITH OF JESUS CHRIST ; to wit : `` Knowing that a man is not justified by the works of the law , but by THE FAITH OF JESUS CHRIST , even we have believed in Jesus Christ , that we might be justified by THE FAITH OF CHRIST ..."", ""2:16,20 ) Sunday , December 2 , 2007 pg.4 Beloved , this is a great mystery : Sermon Outline `` Even the mystery which hath been hid from ages and from generations , but now is made manifest to his saints : TO WHOM God would make known what is the riches of the glory of this mystery among the Gentiles ; which is CHRIST IN YOU , the hope of glory . ''"", 'Beloved , not only do preachers fail and refuse to preach Calvinism , ( which is nothing other than the Gospel , rather than the God-loves-everybody Arminian lies that they all preach , instead of the Gospel ) but all American preachers are engaged in a massive conspiracy to silence all Calvinistic preaching .', ""It 's saved millions of unsuspecting Christians from being infected with Reformed ( CALVINISTIC ) theology . ''"", 'On the other side at the lower right is a row of little tulips , ticking off some kind of time or number , with a slow-moving turtle superimposed over the row of tulips .', ""With TULIP control , '' on the filter package , is that Finney was a famous Arminian preacher of days gone by , who debated Calvinists of his day , and founded and was president of Oberlin College near Cleveland , Ohio , which is now a hotbed of fags , and which we picketed a while back for blatantly hiring an openly-gay athletic director , and bragging about it to the whole world ."", ""Sunday , December 2 , 2007 pg.5 Sermon Outline THE PREACHERS ARE TO BLAME , & ARE CURSED OF GOD Thus , you see how easily this generation of proud perverts was spawned by yesterday 's Arminian , God-loves-everybody , anti-Calvinist heretics ."", ""You tell people the truth : That all mankind are totally depraved `` T '' ; that only those whom God has unconditionally elected will be saved `` U '' ; that the atonement of Jesus Christ was limited to the Elect `` L '' ; that the call of God to salvation is irresistible , but is only for the Elect `` I '' ; that God 's Elect will inevitably persevere unto final salvation in Heaven `` P '' ."", ""INSTITUTIONALIZED MOCKING & SCOFFING `` Knowing this first , that there shall come in the last days SCOFFERS , walking after their own lusts , And saying , Where is the promise of his coming ? ''"", ""See how these Arminian idiots package their new `` version '' of God 's Holy ( mangled ) word ; to wit : `` The TNAIRSECCLKJMV ( t-nair-seckel-KJM-vee ) : Now the most complicated translation is more affordable ."", ""Clear as a bell ; to wit : `` Holding fast the faithful word as he hath been taught . ''""]"
