,fileName,judgements
0,./data_dsicap/WBC/raw/WestboroBaptist_Sermon_20080127.pdf.txt,"['Some Jew named Ruthie called in to a radio program I was on last Thursday and said that I hated Jews and that I therefore was anti-Semitic .', ""Then said Jesus TO THOSE JEWS which believed on him , If ye continue in my word , then are ye my disciples indeed ; And ye shall know the truth , and the truth shall make you free . ''"", ""She wanted to read to me from Gen. 1:27 ; and when she had done so , she made the argument that it was proof from the Bible that sodomy was OK , that it 's OK to be gay ."", ""Ruthie the Jew said that that verse proves it 's OK to be gay , in full demonstration of the fact that God Almighty has stricken the Christ- rejecting Jews with His judicial blindness , as it is written in Romans 11 : 7-10 ; to wit : Sunday , January 27 , 2008 page 2 Sermon Outline `` What then ?"", ""11:7-10 ) These are strong , so-called imprecatory prayers ( `` imprecatory '' means to pray for God to bring evil things upon a person ; a curse ) these verses in Romans are prayers of David imprecatory prayers but very acceptable to God , ( who answered those prayers by striking unbelieving Jews with judicial blindness to this day ) and that kind of praying was also acceptable to Paul the Jew , who chooses to quote from ( and adopt as his own ) David 's imprecatory prayers ."", ""Speaking directly to the Jews of His day , our Lord Jesus Christ was very uncompromising ( Jesus was a straight , plain , hard , no-nonsense preacher not a kissy-pooh preacher ) ; and very straight-forward ; to wit : `` Then said Jesus again unto them , I go my way , and ye shall seek me , and shall die in your sins : whither I go , ye can not come . ''"", '`` And he said unto them , Ye are from beneath ( doomed earthdwellers ) ; I am from above : ye are of this world ( this doomed , soon-to- be-destroyed-with-fire world , make no mistake ) ; I am not of this world .', ""And so , following the example of my Savior , Captain , and Divine Pattern , I say unto Ruthie the Jew , that if you believe not that Jesus is the Christ , the Messiah , the Son of the Living God you will die in your sins ; and you will thereupon join Heath Ledger in Hell , where , throughout eternity , you two can swap fairy tales like saying that Gen. 1:27 proves it 's OK to be gay , and like making the movie `` Brokeback Mountain '' was just fine with God ."", ""Sunday , January 27 , 2008 page 3 Sermon Outline Moreover , we learn from the words of Christ Himself that the experience WBC is having with exposing the evils of the movie `` Brokeback Mountain '' , as well as exposing the eternal destiny of Heath Ledger as being torment in the Lake of Fire and Brimstone , the fires of Hell excites murderous rage throughout the world ."", 'And so it is , that when the Elect hear the Word of God preached , a responsive chord is struck , such that the heart of the sheep resonates with that of the Shepherd .', 'And a part of that Gospel is to tell them that most of them are deaf , dumb , and blind , and otherwise are too hard-hearted to accept our message ; and that what little of Gospel preaching ( seed ) might Sunday , January 27 , 2008 page 4 Sermon Outline otherwise take hold and grow within them , is IMMEDIATELY snatched away by Satan , their father .', 'For the non-Elect , Jesus had the following plain , clear words ; to wit : `` Ye are of your father the devil , and the lusts of your father ye will do .', ""When he speaketh a lie , he speaketh of his own : for he is a liar , and the father of it . ''"", ""It is my belief that God is similar to my parents while he may see the sin itself as an abomination , HOW COULD HE HATE ANYONE HE HAS CALLED HIS CHILD ... who are we to put the word `hate ' in God 's mouth ? ''"", ""For by thy words thou shalt be justified , and by thy words thou shalt be condemned . ''"", 'To the editor referred to above ; Listen up , smart-mouth : God is not your father ; and you are not His child .', 'Your editorial maligning WBC is sufficient evidence in and of itself to prove that God is not your father ; and you are not His child .', '8:45,47 ) The response of the Jews upon hearing such devastating pronouncements of their lost condition , was to attack Jesus with baseless , slanderous and irrelevant , ad hominem lies ( like they do us today ) to wit : `` Then answered the Jews , and said unto him , Say we not well that thou art a Samaritan , and hast a devil ?', 'Art thou greater than our father Abraham , which is dead ?']"
1,./data_dsicap/WBC/raw/WestboroBaptist_Sermon_20080615.pdf.txt,"['From all eternity He has purposed to work in us that which is well pleasing to Him , and to make us perfect in every good work to do His will and it is a matter of supreme irrelevancy how we belatedly feel about it !', 'I tell you , it is irrelevant , and it is too late by a few billion years ; to wit : `` Now the God of peace , that brought again from the dead our Lord Jesus , that great shepherd of the sheep , through the blood of the everlasting covenant , MAKE YOU PERFECT IN EVERY GOOD WORK to do his will , WORKING IN YOU THAT WHICH IS WELL-PLEASING IN HIS SIGHT , through Jesus Christ ; to whom be glory for ever and ever .', ""2:14 ) Now the next verse in the context ; to wit : `` For we are unto God a SWEET SAVOR of Christ , in them that are saved , AND IN THEM THAT PERISH . ''"", ""God 's Elect preach the truth about the Elect AND the Reprobate ( the non-elect ) ; and such knowledge about the Sunday , June 15 , 2008 Sermon Outline ... page 2 Truth of God as it is made manifest by these servants of God always and everywhere is a sweet savor unto God ."", ""2:12 ) all succumb to the deadly fuminations of Hell ( fumes rising from the pit ) ; which Goodwin calls `` exhalations of Hell and wrath , '' and `` the scent of Hell itself , '' and , `` the very evaporations of that Lake of Fire and Brimstone , which is the second death '' ( Rev ."", 'And , remember , Beloved , that it is the SAME WORD OF GOD as preached on the street and on the Web by the Westboro Baptist Church , in the power of the Holy Spirit , that is a sweet savor of Christ , both in them that are saved , and in them that perish .', ""And , also remember , that by the WORD OF GOD , which we preach , we mean that we expound the true knowledge of the nature and attributes of the living and true God ; to wit : `` Now thanks be unto God , which always causeth us to triumph '' ( i.e."", '2:14 ) Lest there be any doubt about this matter of what activity we are engaged in that results in our being unto God simultaneously a sweet savor of Christ SIMULTANEOUSLY in them that are saved , and in them that perish , ( 2 Cor .', '2:12 ) Paul was busy going from place to place preaching on the street among other places when it was clear to him that the Lord God had OPENED THE DOOR OF UTTERANCE TO HIM MUCH AS WE DO !', ""Howbeit certain men clave unto him , and believed : among the which was Dionysius the Areopagite , and a woman named Damaris , and others with them . ''"", ""( Acts 17:34 ) The first of the pitiful few citizens of the great city of Athens to whom the preaching of Paul was a `` sweet savor of Christ , '' even `` a savor of life unto life '' ( i.e."", "", a new creature in Christ NOW , in this present life , and bound for the promised land of Heaven and everlasting life SOON to be put into actual , glorious possession of `` life unto life ) '' indeed !"", 'Athens was the thriving and vibrant capitol of Greece , and was given virtually complete autonomy by the Romans , in acknowledgment of her universities and legal culture famous worldwide for its scholarship and fairness .', 'Gill says : `` The business of this court was not only to try causes of murder , which seems to have been the original business of it ; but by these judges the rights of the city were preserved and defended , war was proclaimed , and all lawsuits were adjusted and decided ; they always heard and judged causes in the night , in the dark , because they would only know FACTS , and not PERSONS , lest they should be influenced by their affections , and be led wrong ; they were very famous in other nations for their wisdom and skill , and for their gravity and strict justice .', ""Dolabella , proconsul of Asia , having a woman brought before him for poisoning her husband and son , which she confessed , and gave reasons for doing it , referred the matter to a council , who refused to pass sentence ; upon which he sent the case to Athens , to the Areopagites , as to judges more grave and more experienced ; and hence these words of Julian the emperor , `Let an Areopagite be judge , and we will not be afraid of the judgment . '"", ""8:1-3 ) ; ( incidentally , we might want to build a new website to publicize judicial corruption as it is forever cropping up , and call it the SOS Awards , wherein are famously inaugurated corrupted judges like federal chief judge Earl O'Connor who killed his wife and then himself ; we could give him a Sons of Samuel ( SOS ) Award , and make him an honorary member of the SOS Club ; because , with rare exceptions , judges are unjust , with no fear of God and no regard for their fellow human beings ( Lk 18:1-8 `` There was in a city '' make that , every city `` there was in a city a judge '' make that every judge , which feared not God , neither regarded man which pretty well describes every judge I ever saw , with rare exceptions ."", '58:1,2 ) ; human judges are a special breed of evildoers , estranged from God from the womb , speaking lies by nature and inordinately even as depraved sons of Adam , and whose malice and obstinacy is likened unto venomous serpents , infecting all mankind with the fatal poison of their perverse judgments ( Psa .', ""58:3-5 ) ; `` who turn judgment to wormwood ( poison hemlock ) '' ( Amos 5:7 ) ; think , Lawrence vs. Texas ; human judges are the subject of the fervent prayers of God 's humble servants , that God would deliver them from their devouring teeth and the malignant arrows of the judicial bow ( Psa ."", ""58:6-8 ) ; such that , each time a judge is taken away in God 's wrath and vengeance , it is a refreshing time of great joy , that God has answered the prayers of His people , who then proclaim , `` Verily there is a reward for the righteous : verily he is a God that judgeth in the earth . ''"", ""Beloved , human judges are included among those to whom `` we are the savor of death unto death , '' and to whom God `` maketh manifest the savor of his knowledge by us in every place . ''"", ""Also he declares those PRECURSORY savors or odors of death in their kind to be , which do arise from the threatenings of the same word in horrors upon them that perish , which he pronounceth to be the very EVAPORATIONS OF THAT `LAKE OF FIRE AND BRIMSTONE , WHICH IS THE SECOND DEATH , ' in styling them the odor or `savor of death unto death ; ' so speaks he ."", "") I say , as those ashes of the furnace miraculously did upon men 's bodies , these gospel words of truth that to sinners are `` the savor of death unto death , '' cause sores and blains upon men 's consciences . ''"", ""And the answer is reflected in the next verse ; to wit : `` For we are not as many , which corrupt the word of God : but as of sincerity , but as of God , in the sight of God speak we in Christ . ''""]"
2,./data_dsicap/WBC/raw/WestboroBaptist_Sermon_20080302.pdf.txt,"["", this lonely `` country '' of Israel , the 10 northern tribes , sequestered and isolated from all other countries ) Israel shall say in that day , Behold , such is our expectation , whither we flee for help to be delivered from the king of Assyria : and how shall we escape ? ''"", '20:2-6 ) Gill ; to wit : `` Signifying that it was vain and foolish , and they had acted a very weak , as well as a wicked part , in having recourse to the Egyptians and Ethiopians to help them against the Assyrians , as it plainly appeared by both nations now being conquered by the Assyrians ; and how shall WE escape ?', ""Isaiah was obedient to the divine command , Gill says , `` not regarding the disgrace which might attend it , nor the danger of catching cold , to which he was exposed , and hence he has the character of a servant of the Lord , and a faithful obedient one he was . ''"", ""Earlier in his long career as an obedient servant of the Lord , Isaiah 's complete dedication to the publication of his message from God led to the naming of his first son ; to wit : `` Shearjashub '' ( Isaiah 7:3 ) which Strong says was the `` Symbolic name of a son of Isaiah '' meaning , `` A remnant shall return . ''"", ""`` Except the Lord of hosts had left unto us a very small remnant , we should have been as Sodom , and we should have been like unto Gomorrah . ''"", ""What a glorious sign and wonder that a little boy should be running around the house all day every day bearing such a name ; to wit : `` The Remnant shall return . ''"", 'Sunday , March 2 , 2008 page 2 Sermon Outline `` Thus saith the Lord of hosts ; If it be marvellous in the eyes of the remnant of this people in these days , should it also be marvellous in mine eyes ?', ""The meaning of the new baby 's name is one of the great themes of Isaiah 's message ; to wit : `` Flee ye , flee ye , to the spoil . ''"", ""Now hear Isaiah 's own words the heart of the same glorious message as dictated by the Holy Spirit working in Isaiah ; to wit : `` Howl ye ; for the day of the Lord is at hand ( Maher-shalal-hash-baz , flee ye , flee ye , to the spoil ) it shall come as a destruction from the Almighty ."", ""Therefore shall all hands be faint , and every man 's heart shall melt : And they shall be afraid : pangs and sorrows shall take hold of them ; they shall be in pain as a woman that travaileth : they shall be amazed one at another ; their faces shall be as flames ."", '`` God is jealous , and the Lord revengeth ; the Lord revengeth , and is furious ; the Lord will take vengeance on his adversaries , and he reserveth wrath for his enemies .', 'The Lord is slow to anger , and great in power , and will not at all acquit the wicked : the Lord hath his way in the whirlwind and in the storm , and the clouds are the dust of his feet .', ""Neither their silver nor their gold shall be able to deliver them in the day of the Lord 's wrath ; but the whole land shall be devoured by the fire of his jealousy : for he shall make even a speedy riddance of all them that dwell in the land . ''"", ""This rage and fury of God involves that attribute of God called his jealousy ; to wit : The preamble to the Ten Commandments , `` for I the Lord thy God am a jealous God , visiting the iniquity of the fathers upon the children unto the third and fourth generation of them that hate me . ''"", ""34:13 ) `` For thou shalt worship no other god : for the Lord , WHOSE NAME IS JEALOUS , is a jealous God . ''"", '`` Men do not despise a thief , if he steal to satisfy his soul when he is hungry ; but if he be found , he shall restore sevenfold ; he shall give all the substance of his house .', 'The wonderful husband is the Lord ; and the unfaithful , slut of a wife is Israel , and , by logical extension , the whole of mankind , except the Elect .', ""Under this law , if the husband ( `` the spirit of jealousy come upon him , and he be jealous '' - Num ."", 'Thereupon the priest performed an elaborate but awful little ceremony , with dreadful and fearsome consequences if the woman was guilty .', ""5:29,30 ) Beloved , this chapter in Scripture called the Law of Jealousies is yet another way the Lord has provided to show unto us and to all mankind what a heinous thing adultery is , and why , in full flower , both physical and spiritual adultery is continually FRETTING the Lord our God , leading to the outpouring of God 's wrath ( Ezek ."", '5 , we have one little woman who MAY have been guilty of adultery ONE TIME being on frightful trial to determine guilt .', ""16 ( `` But thou didst trust in thine own beauty , and playest the harlot because of thy renown , and pourest out thy fornications on every one that passed by ; his it was . ''"", 'The words of Ezekiel dictated by the Holy Ghost and preserved for us so that we might declare them to our generation , and to the world at large , and in particular to doomed America , are these ; to wit : `` And in all thine abominations ( sodomy ) and thy whoredoms thou hast not remembered the days of thy youth , when thou wast naked and bare , and wast polluted in thy blood .']"
3,./data_dsicap/WBC/raw/WestboroBaptist_Sermon_20070624.pdf.txt,"['( Epochal > e-p-o-c-h-a-l < means an event in history that is highly significant , important , momentous ) .', ""Thus Satan 's Raid not only received prior planning and approval of officials at the highest levels , but it also was ratified by every level of gov't and religion and by all the people of Topeka , Kansas , and the U.S.A. Not one preacher of the 1 million preachers , priests and rabbis that infest this nation called in support of WBC after the Raid ."", '22 in his sermon last Sunday , translates it like this : `` For without are HOMOSEXUALS ( i.e.', ""Every American soldier blown to bits by a lowly IED in Iraq returned to this Godforsaken country in little pieces in a body bag is screaming out in Hell : `` Why in God 's Name did you Raid WBC ?"", 'The ancient and honorable , he is the head ; and the prophet that teacheth lies , he is the tail .', ""Christ said , `` And fear not them which kill the body , but are not able to kill the soul ; but rather fear him which is able to destroy both soul and body in Hell . ''"", ""`` For it is profitable for thee that one of thy members should perish , and not that thy whole body should be cast into Hell . ''"", ""Make no mistake , all you impenitent Church Raiders : There 's plenty of room in Hell for every last , single person living in Topeka , and in Kansas , and in the U.S.A. and this fact is made clear in the same passage of Scripture that identifies `` Topeka '' as a name meaning `` Hell '' itself : Isa ."", ""To-wit : `` For Tophet ( Topeka ) is ordained of old ; yea , for ( or , `` by '' ) the king it is prepared ; he hath made it deep ( bottomless ) and wide ( borderless ) ; the pile thereof is fire and much wood ( the bodies of the damned Church Raiders ) ; the breath of the Lord , like a stream of brimstone , doth kindle it ( doth guarantee its eternal burning ) . ''"", ""4 Sermon Outline Topeka , KS = Satan 's Seat The objective evidence is overwhelming ."", 'That startling fact settles this issue for all those with wisdom and understanding and nobody else matters ; to wit : `` Here is wisdom .', "", compute , or figure a secretly-coded thing out ) the number of the beast ; for it is 666 . ''"", ""The mission of the Beast ( Satan ) is to destroy the people and messengers of God on earth ; to-wit : `` And it was given unto him ( the Beast ) to make war with the saints . ''"", ""When they see Satan 's Raid on WBC , those who have Bible knowledge and wisdom understand immediately that Satan 's Raid on a church is the work of the Beast ; that Topeka , Kansas , U.S.A. , is the place where Satan 's Raid took place ; that Topeka is identified prominently throughout the world as the only spot on earth proudly wearing the Mark of the Beast , 666 ; and that such an amazing confluence of circumstances can only mean one thing ; to-wit : Topeka , Kansas , U.S.A. , is where Satan 's throne is located at this time in these momentous last days of the last days ."", ""14:4 , just as Topeka is the arch enemy of WBC ) ; and that Topeka 's God-defying mascot is the Ichabod ( meaning the glory of God has departed from this place ) ; none can deny with a straight face that Topeka is where Satan 's seat is ."", ""Early French trappers on maps called the place `` topage '' which means `` a noisy din '' ( a din is a mixture of loud and discordant notes ) which was a meaning of the Hebrew word `` Tophet '' in the Valley of Hinnom ( from which we get two words for `` Hell '' `` Tophet '' Isa ."", ""30:33 , ( `` For Tophet is ordained of old '' ) John Gill says : `` This was a valley near Jerusalem , the valley of the son of Hinnom ; so-called , from the drums and tabrets beat upon here , to prevent parents hearing the cries of their infants offered to Molech ; into it was brought the filth and dung of the city ; here malefactors were buried , it is said ; and such as were condemned to burning were burned here ; and such as had no burial were cast here ; so that it was an image and picture of hell itself ..."", 'He hath made it deep and large ; and so Hell is large and deep enough to hold Satan and his angels , antichrist and all his followers ; yea , all the wicked that have been from the beginning of the world , and will be to the end of it .', 'Isaiah 30:33 For Tophet is ordained of old ; yea , for the king it is prepared ; he hath made it deep and large : the pile thereof is fire and much wood ; the breath of the LORD , like a stream of brimstone , doth kindle it .']"
4,./data_dsicap/WBC/raw/WestboroBaptist_Sermon_20070722.pdf.txt,"[""These Mighty Men went to join David in the wilderness because they were in deep , ruinous debt , they were distressed ( in anguish under Saul 's oppression ) , and they were discontented ( bitter of soul ) ."", 'having been deceived into borrowing money at usurious rates of interest , and being dunned by bill collectors ; see , S # 5378 + S # 5377 ) , and every one that was discontented ( i.e.', ""This is an elegant metaphor of the Elect of God , who confess that they are strangers and pilgrims on the earth , that they are miserable living in the City of Destruction and fearing the wrath of God to come , and that they therefore declare plainly that they seek a country , better than this , that is , an heavenly country ; `` wherefore God is not ashamed to be called their God : for he hath prepared for them a city ; '' ( Heb ."", ""( 1 Samuel 22:1-2 ) Sunday , July 22 , 2007 pg.2 Sermon Outline David 's Mighty Men : TACHMONITES As with David 's Mighty Men leaving all to follow David into a danger-fraught wilderness knowing exactly what they were doing and what they were getting into , and yet rejoiced for the opportunity to suffer with David for a short while , and then to rule and reign with him , SO DO WE !"", '12:40 ) ; to wit : `` All these men of war , that could keep rank , came with a perfect heart to Hebron , to make David king over all Israel ; and all the rest also of Israel were of one heart to make David king .', '1:4 ) All to the effect that our afflictions are submicroscopic and infinitesimal ( so tiny in quantity and volume as to be incapable of measurement ) in size , and diminutive in duration , compared to the certainty of our glorious rewards , all of which are infinite in size and duration ; to wit , e.g .', "": `` For our light ( tiny ) affliction , which is but for a ( tiny ) moment , worketh for us a far more exceeding and eternal weight of glory ; While we look not at the things which are seen , but at the things which are not seen ; for the things which are seen are temporal ; but the things which are not seen are eternal . ''"", ""Indeed , our Lord Jesus Christ is our precise and precisely-worded pattern in and for this doctrine , urging us on to infinite reward and infinite glory ; to wit : `` Let us run with patience the race that is set before us , Looking unto Jesus the author and finisher of our faith ; who for the joy that was set before him endured the cross , despising the shame , and is set down at the right hand of the throne of God . ''"", 'And from that glorious throne on high , our Captain is beckoning us to join Him , with these happy words ; to wit : `` To him that overcometh will I grant to sit with me in my throne , even as I also overcame , and am set down with my Father in his throne .', ""Sunday , July 22 , 2007 pg.3 Sermon Outline 8 Characteristics of David 's Mighty Men Now let us examine the attributes and descriptive characteristics of David 's Mighty Men which are the same attributes and characteristics , in principle , as those possessed by God 's Elect in New Testament Churches ."", ""In each case , they are supernatural gifts from God ; `` For at that time day by day there came to David to help him , until it was a great host , like the host of God . ''"", ""( This attribute an understanding of the times , which is substantially the same as the signs of the times of Matthew 16:3 when connected to their thorough knowledge of the Word of the Lord of 1 Chronicles 12:23 is solid evidence that David 's Mighty Men were likely to have been God 's Elect , making them mighty in spirit even the Holy Spirit as well as in body . )""]"
