,fileName,judgements
0,./data_dsicap/WBC/raw/WestboroBaptist_Sermon_20070930.pdf.txt,"[""9:12 ; to wit : `` And he hath confirmed his words , which he spake against us , and against our judges that judged us , by bringing upon us a great evil : for under the whole heaven hath not been done as hath been done upon Jerusalem . ''"", ""Behold , and see if there be any sorrow like unto my sorrow , which is done unto me , wherewith the Lord hath afflicted me in the day of his fierce anger . ''"", '`` The hands of the pitiful women have sodden their own children : they were their meat in the destruction of the daughter of my people .', ""4:10,11 ) Additional evidence in support of my proposition that the destruction of Jerusalem was the worst tragedy in history , is the following from Ezekiel 5:9 ; to wit : `` And I will do in thee that which I have not done , and whereunto I will not do any more the like , because of all thine abominations . ''"", ""For though these instances only show that mothers ate their children , yet no doubt the fathers took part with them ; for if mothers , who are naturally more tender , could do this , it is much more reasonable to suppose that fathers did the same ... though monstrously shocking . ''"", 'Now let us continue the narrative : `` And on the ninth day of the fourth month the famine prevailed in the city , and there was no bread for the people of the land .', 'IT IS A DREADFUL & FEARFUL THING TO DEPART FROM THE LIVING GOD In any event , Beloved , you see from these nuances how that a thousand things coalesced to bring it to pass that the destruction of Jerusalem was a thing of unequaled horror and monstrous barbarism .', 'And thou shalt eat the fruit of thine own body , the flesh of thy sons and of thy daughters , which the Lord thy God hath given thee , in the siege , and in the straitness , wherewith thine enemies shall distress thee ; So that the man that is tender among you , and very delicate , his eye shall be evil toward his brother , and toward the wife of his bosom , and toward the remnant of his children which he shall leave ; So that he will not give to any of them of the flesh of his children whom he shall eat ; because he hath nothing left him in the siege , and in the straitness , wherewith thine enemies shall distress thee in all thy gates .', 'The tender and delicate woman among you , which would not adventure to set the sole of her foot upon the ground for delicateness and tenderness , her eye shall be evil toward the husband of her bosom , and toward her son , and toward her daughter .', ""THE WARNING PROPHECY OF JEREMIAH Moreover , the great prophet Jeremiah who was on the scene in the days of good king Josiah as well as evil kings Jehoiakim and Zedekiah , even unto the carrying away of Jerusalem captive warned that they would eat their children in Jerusalem ; to wit : `` Hear ye the word of the Lord , O kings of Judah , and inhabitants of Jerusalem ; Thus saith the Lord of hosts , the God of Israel ; Behold , I will bring evil upon this place , the which whosoever heareth , his ears shall tingle ... And I will cause them to eat the flesh of their sons and the flesh of their daughters , and they shall eat every one the flesh of his friend in the siege and straitness , wherewith their enemies , and they that seek their lives , shall straiten them . ''"", '19:3,9 ) And that same wonderful prophet , after the fact , lamented with tears as follows : `` The hands of the pitiful women have sodden their own children : they were their meat in the destruction of the daughter of my people .']"
1,./data_dsicap/WBC/raw/WestboroBaptist_Sermon_20080309.pdf.txt,"[""The short sentence announces a wonderful change in the dispensation of God 's dealings with the sons of men , in making His Word to be preserved by His prophets in writing for all future generations ."", ', a dispensation is the manner in which God deals with mankind during a certain period of time ) `` This was a great dispensation of Providence , and a great advance made in the affair of redemption .', 'The main end why the spirit of prophecy was given them was , that they might give testimony to Jesus Christ , the great Redeemer , that was to come ; and therefore the testimony of Jesus , and the spirit of prophecy , are spoken of as the same thing ; to wit : Rev .', ""`And I fell at his feet to worship him : and he said unto me , See thou do it not : I am thy fellow servant , and of thy brethren that have the testimony of Jesus : worship God : for the testimony of Jesus is the spirit of prophecy . '"", ""Now , Beloved , having summarily announced to the world , for all mankind and for all time and eternal ages to come , that God was herewith and henceforth altering His dispensations by raising up a set of great men to be known as the WRITING PROPHETS , to herald the coming of the Great Redeemer I say , having made such a spectacular announcement , the first words out of the prophet Hosea 's mouth were these ; to wit : Sunday , March 9 , 2008 page 2 Sermon Outline `` And the Lord said to Hosea , Go , take unto thee a wife of whoredoms and children of whoredoms : for the land hath committed great whoredom , departing from the Lord . ''"", 'They were brilliant and dedicated men , in the first place ; and , the overruling Hand of the faithful and all-wise God was in control , thereby to keep his Word pure for His people in the second place .', ""119:139-141 ) `` Every word of God is pure : he is a shield unto them that put their trust in him . ''"", '30:5 ) `` Now unto the King eternal , immortal , invisible , the ONLY WISE GOD , be honor and glory for ever and ever .', 'The first sentence announces the inauguration of a glorious new dispensation , to be known as the era of the WRITING PROPHETS .', 'The immediately- following sentence , placed jam up against the first , gives the central theme of just what it is that the Writing Prophets will be writing Sunday , March 9 , 2008 page 3 Sermon Outline from Isaiah 1:1 to Malachi 4:6 generally a huge section of the Bible ; to wit : `` For the land hath committed great whoredom , departing from the Lord .', 'Those who did not decry the soul-damning whoredoms in the land did NOT preach Jesus Christ , but rather some sissified idol , because idolatry is always accompanied by adultery .', 'Trapp calls this , `` An uncouth precept , and a rough beginning for a young preacher , whose youth might be despised , and whose sharpness might be disgusted .', ""58:1 ) Jerome of Prague ( 1375-1416 ) was called `` The Church Thunderbolt ; '' whose bold and uncompromising preaching led to his martyrdom by fire and his ashes thrown into the Rhine River ."", ""The great 16th Century Calvinist , William Perkins ( 1558-1602 ) , was said to have `` applied the word so closely to the consciences of his hearers , that he was able to make their hearts fall down and their hairs to stand on end . ''"", 'To which , Trapp says , `` An arrant whore , a stinking strumpet from the stews ( brothels ) , a known and trite harlot , such as were Thais , Lais , Phryne , etc .', ""( here the actual names of famous whores in John Trapp 's day were identified pursuant to the Bible injunction , `Them that sin rebuke before all , that others also may fear . '"", ""Others infer as much from the phrase in this verse , `The beginning of the word of the Lord in Hosea , ' that is ( says Polanus ) , appearing and speaking to him by an inward vision , as it were by an ecstasy ."", 'Besides , in the third chapter and three first verses , the young prophet is told to marry another harlot , to buy her for his own use , and to keep her at his house for a time .', '57:3,4 ) The Hebrews call such children brambles , such as Abimelech was , who grew in a hedgerow of a harlot ; they call them also Mamzer , as ye would say , a strange blot ; and Shatuki , or silent , because when others are praising their parents , such must hold their peace , and hold down their heads with shame .', ""Gill says , `` It seems best to understand the whole as a parable , and that the prophet , in a parabolical way , is bid to represent the treachery , unfaithfulness , and spiritual adultery of the people of Israel , under the feigned name of an unchaste woman , and of children begotten in fornication ; and to show unto them that their case was as if he had taken a woman out of the stews , '' ( note that old Anglo-Saxon word , `` stews '' , which means common brothels or cheaprate whorehouses ) , as though Hosea had said in his preaching , `you folks have treated God as badly as if I had taken me a woman out of some cheap whorehouse , with her bastard kids , to become my wife and family ; or , as if a wife married by him had defiled his bed , and brought Sunday , March 9 , 2008 page 5 Sermon Outline him a spurious brood of children that he thought were his , when in fact they were not his , nor was she a faithful wife ."", ""`` That is , '' says Gill , `` the inhabitants of the land of Israel the 10 northern tribes have committed idolatry , which is often in Scripture signified by adultery and whoredom ; as an adulterous woman deals treacherously with her husband , so these people had dealt with God , who stood in such a relation to them ; see , Jer ."", ""( Beloved , America is now similarly `` greatly polluted , '' by the same multiplicity of marital and sexual irregularities as Israel , Judah , and the antediluvian world as it was in the days of Noah . )"", ""`` Which thou hast commanded by thy servants the prophets , saying , The land , unto which ye go to possess it , is an unclean land with the filthiness of the people of the lands , with their abominations , which have filled it from one end to another with their uncleanness . ''""]"
2,./data_dsicap/WBC/raw/WestboroBaptist_Sermon_20070909.pdf.txt,"['( Jude 11 ) While Bush stubbornly sends people to die every day in Iraq , and incurs billions if not trillions in debt prosecuting a bloody war , he is busily planning his own post-presidency future and how to become a multimillionaire , bragging on his failed policies , and bragging on how he brought down the wrath of God on America .', ""And those `` words '' mark him as a `` condemned '' child of Hell , according to the Lord Jesus ; to wit : `` For by thy WORDS thou shalt be justified , and by thy WORDS thou shalt be CONDEMNED . ''"", '`` Holy Father ... those that thou gavest me I have kept , and none of them is lost , but the son of perdition [ i.e.', ""The Draper , `` Dead Certain , '' book says : `` Discussing his past battles with alcohol , Bush says he would never be able to make decisions on war if he was still drinking . ''"", 'Remember , Beloved , that this is the same Bush who choked and fainted while trying to eat a pretzel , that cries all the time , uncontrollably , who sees ghosts coming at him out of the walls and out of unoccupied rooms in the White House , and who admits he has been a sloppy drunk for years , unable to make decisions , with a cloudy brain , absolutely , he says .', 'Balaam , for lucre , spoke in the name of the true and living God and he knew and well understood and pretended to believe the 5-point doctrines of Calvinism , as in predestination and election and reprobation ; to wit : Sunday , September 9 , 2007 pg.3 Sermon Outline `` God is not a man , that he should lie ; neither the son of man , that he should repent ; hath he said , and shall he not do it ?', ""In fact it is the worst form , and is symbolized by the iron-and-clay feet and toes of King Nebuchadnezzar 's image ."", '; to wit : `` I blessed the most High , and I praised and honored him that liveth for ever , whose dominion is an everlasting dominion , and his kingdom is from generation to generation .', ""On the night of Belshazzar 's great feast which marked the end of Israel 's 70 years of Babylonian Captivity and shortly after Daniel had pronounced the King 's and the Kingdom 's doom , right to the King 's face we read these words : `` In that night was Belshazzar the king of the Chaldeans slain ."", 'Another ancient monarch who ruled the world the direct antithesis of democracy yet see what kind of man he was from his words ; to wit : `` Then king Darius wrote unto all people , nations and languages , that dwell in all the earth ; Peace be multiplied unto you .', 'I make a decree , That in every dominion of my kingdom men tremble and fear before the God of Daniel ; for he is the living God , and stedfast for ever , and his kingdom that which shall not be destroyed , and his dominion shall be even unto the end .', 'If they should lift a hand or a voice to protect us in any way , and do their Constitutional and moral duty toward WBC their political careers would be over .', ""By and by , the time would come , when good America would no longer be good ( which he said was the reason for America 's greatness , after he went into faithful churches in those days , and concluded that America was great because America was good . )"", ""And that is why America persecutes us , because ELECTED officials are afraid they wo n't be RE-ELECTED if they protect our Constitutional rights .""]"
3,./data_dsicap/WBC/raw/WestboroBaptist_Sermon_20080504.pdf.txt,"['Does the passage suggest a certain activity which while we are busily engaged therein will , rather automatically , and rather simultaneously , cause us to keep ourselves in the love of God , and also cause us to be looking for the mercy of our Lord Jesus Christ unto eternal life ?', ""Briefly put , if we find somebody who is genuinely sincere , humble , sorrowful and in mourning for his sins and above all , genuinely penitent we must SHOW THAT SINNER COMPASSION GALORE and spare no pains `` to comfort them which are in any trouble , by the comfort wherewith we ourselves are comforted of God . ''"", 'But these devils that we find ourselves dealing with every day , in every place from one end of this country to the other are not the least bit interested in repenting of their sins .', ""These oily , kissy-pooh preachers who are today filling their churches with vile , abominable , impenitent perverts ; I say , they are disobediently ignoring that divine order that Holy Command : to wit : `` Making a difference ! ''"", ""These are a people like those `` that jeoparded their lives unto the death in the high places of the field , '' where God 's faithful soldiers are to be found ; to wit : Sunday , May 4 , 2008 page 2 Sermon Outline `` They handle the pen of the writer ... they ( have ) great thoughts of heart , and great searchings of heart ... and they were a people that jeoparded ( i.e."", 'Beloved , we have no duty to be compassionate toward the arrogant , impenitent sinner especially when that filthy sodomite sinner impudently insists that he is NOT A SINNER !', ', give all due diligence ) to show thyself approved unto God , a workman that needeth not to be ashamed , rightly dividing ( i.e.', ""The `` Golden Rule Pledge '' is a national event where students on their campuses are urged to sign pledge cards that they will not engage in the name-calling , bullying , and harassment of others simply because of their sexuality ; because , 1 ) Christ said , `` And as ye would that men should do to you , do ye also to them likewise ; '' Lk ."", 'Leprosy could be very , very serious , as when the leprosy was in the head ; to the least serious , as when leprosy was only in the garment ; to wit : `` He is a leprous man !', ""All the days wherein the plague shall be in him he shall be defiled ; he is unclean ; he shall dwell alone ; without the camp shall his habitation be . ''"", ""13:44-46 ) `` Hating even the garment spotted by the flesh , '' seems to be a most elegant way of saying that just as the lowest kind of leprosy is still leprosy and is therefore deadly , and a thing not only not to be desired , but a thing to be feared and avoided at all costs even so , sodomy is the most deadly of all sins , in that , its practitioners are too judicially blind to recognize it as sin , but are deluded into believing it to be a thing of pride gay-pride week , gay-pride parade , etc ."", 'rendering these beasts unable to repent ( it is axiomatic that one can not repent of something that is a matter of pride ) .', 'SODOMY IS THE DEADLIEST OF ALL SINS By its nature by definition the sin of buggery ( as the British say ) can never be absolved , because it can never be repented of a precondition to absolution .', ""( Gen. 5:3-5 ) The fag 's so-called Day of Silence , when they wear a strip of duct tape over their mouths to call everybody 's attention to their complaint that the LGBT Community `` has been daily silenced by the name-calling , bullying and harassment simply because of their sexuality . ''"", ""Examine this claim closely , and you will find that what these smelly fornicators refer to as `` name-calling , bullying and harassment '' is nothing more than WBC 's Gospel preaching ."", 'Dr. Warren Throckmorton of Grove City College , a leading so-called fundamentalist college in the category of Bob Jones University , is taking a leading role in helping the fags and opposing us .', 'Likewise are the nationwide ministries of Campus Crusade for Christ and Intervarsity Christian Fellowship which I have known since the early days of my ministry , and which I have known to be leading evangelical power houses .', 'I believe that in this matter , all of these well-known and socalled evangelical ministries , and anybody and everybody associated with them , are going to Hell .', ', that all fags , though impenitent and cursed of God deserve love and respect , because they have infinite worth and dignity , because they are created in the image of God ) .', ""Manton said , `` But who are these `others ' in Jude 23 ( `And others save with fear ' ) who must be dealt with roughly ?"", 'I answer : 1 ) Those that are hardened , and grown perverse and stubborn ; softer strains would but harden these more ; and , 2 ) Those that are secure libertines , wallowing in sin and pleasure .', ""God 's wrath and vindicative justice is the proper object of fear , and so it must be looked upon ."", ""'' Jonathan Edwards said : `` The God that holds you over the pit of Hell , much as one holds a spider , or some loathsome insect , over the fire , ABHORS you , and is dreadfully provoked ; his wrath towards you burns like fire ; he looks upon you as worthy of nothing else , but to be cast into the fire ; he is of purer eyes than to bear to have you in his sight ; you are ten thousand times more abominable in his eyes , than the most hateful venomous serpent is in ours ."", 'It is to be ascribed to nothing else , that you did not go to Hell the last night ; that you were suffered to awake again in this world , after you closed your eyes to sleep ... O sinner !', 'consider the fearful danger you are in ; it is a great furnace of wrath , a wide and bottomless pit , full of the fire of wrath , that you are held over in the hand of that God , whose wrath is provoked and incensed as much against you , as against many of the damned already in Hell .']"
4,./data_dsicap/WBC/raw/WestboroBaptist_Sermon_20071014.pdf.txt,"['Sunday , October 14 , 2007 pg.1 Sermon Outline The Abomination of Desolation standing in the holy place Beloved , the Lord has given us an amazing perspective from which to view time and eternity the life which now is , and that which is to come .', 'The signs are great and they are everywhere .', ""Just as though we had not sent them and every other media outlet a weekly news release every week for 17 years entitled , `` Week so-and-so of the Great Gage Park Decency Drive , '' the latest such news release being sent forth to all media last Friday , Oct. 12 with an opening line for all the world to see ; to wit : `` WBC observes WEEK 851 ( nearly 17 years ) of protests against public sodomy at Gage Park , Oct ."", 'Our experience at Gage Park just a few blocks from our church , where we have been located by the amazing providence of God , and where we have preached every week for 52 years I say that our experience at Gage Park in Topeka , Kansas , at the very heart and geographical center of the United States and of the world proves that THE END OF THE WORLD IS NEAR THE COMING OF THE LORD ( AND OUR REDEMPTION ) DRAWETH NIGH .', ""Here is the verse ; to wit : `` But when ye shall see the abomination of desolation , spoken of by Daniel the prophet , standing where it ought not , '' the end is near ."", ""And the companion verse ; to wit : `` When ye therefore shall see the abomination of desolation , spoken of by Daniel the prophet , stand in the holy place , '' the end is near ."", ""23:17,18 ) Further proof that the abomination of desolation refers to sodomites or fags or dogs or the power of the dog , or the socio-political/socio-religious power of fags , I say further proof is seen in the words of Daniel referred to by our Lord Jesus Christ where He says , `` the abomination of desolation , SPOKEN OF BY DANIEL THE PROPHET . ''"", 'Fag fornicating is always barren fornicating , desolate , totally unproductive , forever sterile there are many kinds of ceremonial and moral abominations ; but only one that is always , totally , and forever the abomination of desolation ; to wit : fags .', ""In the now-19 year old saga of `` THE GREAT GAGE PARK DECENCY DRIVE '' we are dealing with `` the power of the dog . ''"", ""We did not know it at the time , but that letter launched the epochal struggle that later became known as THE GREAT GAGE PARK DECENCY DRIVE and , in a way , signaled the end of the world to those with eyes to see , which is the meaning of the parenthetical words of the Lord Jesus , `` let him that readeth understand . ''"", 'Dear Friends : A malodorous sore with the scab off is open and running at the extreme southwest corner of Gage Park .', ""`At any hour of the day or night , ' a park official told me , `male couples may be seen entering and exiting the area . '"", ""In preparation for the presidential visit and lest the national media focus on the shameful running sore of Topeka 's Gage Park the area was purged of its unnatural visitors for about a month prior to and including the day of Reagan 's visit ."", ""Sunday , October 14 , 2007 pg.4 Sermon Outline Last week , on Fri. , Oct. 5 , a story in the paper , headlined , `` Two Arrested in Sex Sting , '' said : `` two Topeka men were arrested in connection with solicitation of sodomy in Gage Park during a prostitution sting operation by the Topeka Police Dept ."", ""So it was at Sodom ; to wit : `` Even as Sodom and Gomorrah , and the cities about them in like manner , giving themselves over to fornication , and going after strange flesh , are set forth for an example , suffering the vengeance of eternal fire . ''"", '( Jude 7 ) And our Lord Jesus said that when those conditions prevail as they did in Sodom and Gomorrah such would signal the approaching end of the world as when you see the abomination of desolation standing in the holy place and standing where it ought not ; to wit : `` Likewise also as it was in the days of Lot ; they did eat , they drank , they bought , they sold , they planted , they builded ( a vibrant , thriving society , like the USA ) ; But the same day that Lot went out of Sodom it rained fire and brimstone from heaven , and destroyed them all .', ', every level of society ) : And they called unto Lot , and said unto him , Where are the men which came in to thee this night ?']"
