,fileName,judgements
5,./data_dsicap/WBC/raw/WestboroBaptist_Sermon_20070826.pdf.txt,"['Sunday , August 26 , 2007 pg.1 Sermon Outline God Spared Not the Old World , Bringing in the Flood John Bunyan ( 1628-1688 ) died when he was yet 59 years old , still 3 months short of his 60th birthday .', ""He was a dirt-poor , uneducated young Tinker ( a mender of pots and pans ) who said that he and his wife `` came together as poor as poor might be , not having so much household-stuff as a dish or spoon betwixt us both '' according to the Encyclopaedia Britannica , which took 4 full pages telling of the poor Tinker 's life and accomplishments ."", ""His most famous work was The Pilgrim 's Progress , such that Britannica said , as late as 1,900 A.D. , `` Bunyan , like the Bible , was to be found in every English home and was known to every ordinary reader ; '' adding : `` But it was The Pilgrim 's Progress which speedily found its way into every home and carried Bunyan 's reputation to every part of the British Isles , to Europe and to America . ''"", 'I believe that we have everything Bunyan ever wrote for publication in our humble library and I tell you it is massive .', ""For example since my sermon today involves The Flood of Noah , I will use Bunyan 's exposition of Gen. 7:20 to make this point ; to wit : Bunyan wrote : `` ( At the time of The Flood ) : `Fifteen cubits upward did the waters prevail ( some 24 feet ) and the mountains were covered . '"", 'And here is how Bunyan treats Gen. 7:21-23 ; to wit : `` And all flesh died that moved upon the earth , both of fowl , and of cattle , and of beast , and of every creeping thing that creepeth upon the earth , and every man : All in whose nostrils was the breath of life , of all that was in the dry land , died .', ""And every living substance was destroyed , which was upon the face of the ground , both man , and cattle , and the creeping things , and the fowls of the heaven ; and they were destroyed from the earth , and Noah only remained alive , and they that were with him in the ark . ''"", "", translated him ) before Noah was born , Noah 's father Lamech doubtless heard Enoch , his grandfather , preach many times , and we may be sure that Lamech , Noah 's father , and Methuselah , Noah 's grandfather saw to it that Noah knew all about the holy Enoch and his thunderous message Sunday , August 26 , 2007 pg.3 Sermon Outline of approaching doom for mankind ."", ""We may reasonably surmise that the moral and spiritual condition of mankind in the days of Enoch ( called the 7th from Adam ) was about as bad as it could get and getting worse , making things so dangerous for Enoch that God miraculously `` took '' him and further , that three generations later in the days of Noah ( the 10th from Adam ) the moral and spiritual condition of mankind was infinitely worse , thus bringing on The Flood ."", ""To wit : `` And God said unto Noah , The end of all flesh is come before me ; for the earth is filled with violence through them ; and , behold , I will destroy them with the earth . ''"", 'To the God-blessed prophet Enoch , the end of all things was at hand , and it is likely that he clearly foresaw The Flood ; and it is likely that he clearly foresaw the final Great Day of Judgment ; and it is likely that he understood that the message God gave him to preach covered both The Flood and the final Great Day of Judgment : `` Behold , the Lord cometh , with myriads of his saints , to execute judgment ( i.e.', ""`All flesh , ' `All in whose nostrils was the breath of life ' ; `All that was on the dry land , ' `every living substance , ' `every man ' ; and they were destroyed from off the earth : By which manner of language doubtless there is insinuated a threatening to them who should afterward live ungodly ."", "", `` suffering the vengeance of eternal fire , '' FOR THAT VERY PURPOSE ; to wit : to be an example for us to see consider well and tremble ."", ""( Thus ) Secretly intimating , that those Sunday , August 26 , 2007 pg.4 Sermon Outline that then lived , being the first of God 's workmanship , and far surpassing in magnificence those that lived after the Flood , if God would have spared , He would have spared them ; but seeing he so dreadfully swept them away , let no man be so bold to presume that wickedness shall now deliver him that is given to it . ''"", 'If God spared not a world of people who were far superior to us in every conceivable way , it would be no big deal , as they say , for Almighty God to obliterate this sad , sick , diseased , world of vile and abominable mankind as easily as one might smash a loathsome insect under foot , and with as much concern .', 'They were possessed of sharp minds , powerful intellects , and strong , agile bodies in robust good health ; blessed with a remarkably healthful climate and a salubrious ( conducive to good health and well-being ) atmosphere ; and fertile , productive soil covering the entire globe , yielding plentiful crops of herbs , fruits and vegetables which , while growing , were well-watered by a worldwide natural sprinkling system emitting a regular mist in exactly the ideal quantity .', 'Such that , before The Flood , people lived hundreds of years not uncommonly approaching a thousand years in vibrant good health ; contrasted with the sickly lives of threescore years and ten which is now the sad lot of mankind since The Flood .', 'Listen to this sentence of Rehwinkel : `` Even after sin and death had come into this world , it was still a world vastly superior to the world which now is .', ""Bunyan describe Noah and the members of Westboro Baptist Church ; to wit : `` `And Noah only remained alive , and they that were with him in the ark . '"", ""`` Antipas was my faithful martyr , who was slain among you , where Satan 's seat is . ''""]"
6,./data_dsicap/WBC/raw/WestboroBaptist_Sermon_20070923.pdf.txt,"[""He came on the scene near the end of Judah 's life as a nation , when God had already determined to destroy Judah for her sins and a good chunk of those sins were the blatant sins of Manasseh ."", 'It was a kind of STAY OF EXECUTION , FOR THE SINS OF MANASSEH : `` And like unto him ( Josiah ) was there no king before him , that turned to the Lord with all his heart , and with all his soul , and with all his might , according to all the law of Moses ; neither after him arose there any like him .', ""NOTWITHSTANDING the Lord turned not from the fierceness of his great wrath , wherewith his anger was kindled against Judah , because of all the provocations that MANASSEH had provoked him withal . ''"", ""The record of Manasseh 's life and 55-year reign is given twice almost identical accounts at 2 Kgs ."", ""Did Manasseh truly repent after all his bloody deeds and blasphemous mistreatment of God 's Elect people or was his foxhole conversion feigned ?"", 'Gill says he was bound with painful fetters both hands and feet , with chains of brass which were never removed or loosened all the way to Babylon .', ""HIS PRAYER also , and how God was intreated of him , and all his sins , and his trespass , and the places wherein he built HIGH PLACES , and set up groves and graven images , before he was humbled : behold , they are written among the sayings of the seers . ''"", ""Thou hast built thy HIGH PLACE at every head of the way , and hast made thy beauty to be abhorred , and hast opened thy feet ( spread thy legs ) to every one that passed by , and multiplied thy whoredoms . ''"", 'Manasseh knew all about the HIGH PLACES where they were , how many there were , and the sinful nature and filthy practices peculiarly associated with each place .', ""Even the pinheads in England , who wrote and/or edited The Illustrated Bible Dictionary , see through the pretended conversion of Manasseh ; saying : `` His ( Manasseh 's ) reformation appears to have been superficial . ''"", 'An eternal principle as old as God , and as binding as Thou shalt not kill or commit adultery is involved here .', 'By dealing fast and loose with the HIGH PLACES , Manasseh demonstrated beyond any doubt that his reformation ( or better said , his repentance ) was superficial .', 'DESTROY ALL HIGH PLACES The only way to get right with God was to destroy ALL HIGH PLACES .', 'But when ye go over Jordan , and dwell in the land which the Lord your God giveth you to inherit , and when he giveth you rest from all your enemies round about , so that ye dwell in safety ; Then there shall be A PLACE which the Lord your God shall choose to cause his name to dwell there ; thither shall ye bring all that I command you ; your burnt offerings , and your sacrifices , your tithes , and the heave offering of your hand , and all your choice vows which ye vow unto the Lord : And ye shall rejoice before the Lord your God , ye , and your sons , and your daughters , and your menservants , and your maidservants , and the Levite that is within your gates ; forasmuch as he hath no part nor inheritance with you .', 'ONE PLACE FOR LEGITIMATE PUBLIC WORSHIP The only legitimate place for public worship in the days of Manasseh was the Temple of God in Jerusalem .', ""The Lord chose that PLACE , and dwelt there , and spoke to His people there ; where every vessel and every piece of furniture spoke clearly and definitively of some grand Truth ; and where accurate notions of the nature and attribute of God were communicated to God 's Elect people .""]"
7,./data_dsicap/WBC/raw/WestboroBaptist_Sermon_20080629.pdf.txt,"[""Sunday , June 29 , 2008 Sermon Outline ... page 1 `` And fear not them which kill the body , but are not able to kill the soul : but rather fear him which is able to destroy both soul and body in hell . ''"", ""This verse falls logically into two parts ; to wit : 1 ) `` And fear not them which kill the body , but are not able to kill the soul : '' and 2 ) `` but rather fear him which is able to DESTROY both soul and body in hell . ''"", ""I was saying to Mom just the other day , at our morning Bible study and prayer time , that , as we have now reached the eventide of our Pilgrim 's Progress , I am just so thankful that the Bible is as dear , and wonderful , and precious to us now , ( indeed , even more so ) , as when we set out upon our journey together almost 56 years ago ."", ""Such unfeigned love for the Scriptures is also powerful internal and external evidence that one 's calling and election is sure ; to wit : `` Wherefore the rather , brethren , give diligence to make your calling and election sure . ''"", ""`` That is , '' says John Brown , `` get a hold of some undoubted evidence , that you are God 's elect . ''"", ""14:21 ) Note here , Beloved , that the great , teeming masses of mankind live and die in total , blind ignorance , of just exactly what the `` commandments '' of Jesus Christ are ; let alone do they have either the ability or the inclination to `` keep '' them ; nor do they give a rat 's tutu about finding out just exactly what those said `` commandments '' are , and less than a rat 's tutu about `` keeping '' them ."", ""Yet , `` having '' those commandments and `` keeping '' them constitutes that certain objective evidence that MANIFESTING of Himself to us those `` good works '' that constitute proof that `` our calling and election is sure . ''"", '14:22 ) Beloved , this is that JUDE ( who wrote the splendid little book of Jude , next to the last book in the Bible , Revelation ) who is putting this perceptive question to the Lord Jesus .', ""Sunday , June 29 , 2008 Sermon Outline ... page 2 I say , it appears that Jude sensed that holy mysteries must be involved here , but that he wanted the Lord Jesus to verify what he was already suspecting ; to-wit : `` How is it , '' asked Jude , `` that thou wilt manifest thyself unto us , and not unto the world ? ''"", "", the word which none but my elect can hear , by supernatural enabling , the effectual call ) I say , saith Christ , `` the word which ye hear is not mine , but the Father 's which sent me . ''"", 'By the grace of God this little flock will be publishing the holy message that God has given us and we will be as wise as serpents and harmless as doves and all the while we will accumulate an immense thorough , and well-documented TESTIMONY .', 'Everything Guinness has ever done and included in his world-famous Book is tidbits and chicken feed compared to what WBC has done for the cause of God and Truth in the earth .', '2:1-3 ) Those idiots in Congress the House of Representatives AND the United States Senate and President George Bush , who had to sign the unconstitutional laws they passed against us to make them effective and the various State Legislatures , and the Governors who signed the State laws to make them effective I say , all those thousands of idiots who think they can change the Word of God and who think they can stop the preaching of WBC are the objects of ridicule and scorn and mockery and derision each one by name and otherwise identified in the courts of Heaven ; to wit : `` He ( the Lord God ) that sitteth in the heavens shall LAUGH : the Lord shall have them in DERISION .', ""Senators and Representatives , all the governors , and all the state legislators who took official action to stop WBC 's preaching in flagrant violation of the Constitution and in oppressive denial of WBC 's First Amendment rights of freedoms of religion and speech I say , we know your names and identities we have documented your many crimes against our church we are competent witnesses to give first-hand testimony against each of you and we fully expect to give evidence against you , lasting for many days , at the Judgment of the Great Day of God 's Wrath ."", ""We are not afraid of you , because you are not able to kill the soul ; and this absence of fear on our part is solid irrefutable evidence and proof positive that we are saved and on our way to Heaven , and is furthermore proof positive that you are NOT saved , and are on your way to Hell ; to wit : `` And in nothing terrified by your adversaries : which is to them an evident token of perdition , but to you of salvation , and that of God . ''"", ""Gill says , `` By the CHAFF , are meant wicked and ungodly persons , such as are destitute of the grace of God , whether professors or profane ; being empty , barren , and unfruitful ; and so good for nothing but the fire , which therefore he will burn with the unquenchable fire , of divine wrath and vengeance . ''"", ""Beloved , these people who reject Christ and His Word that is to say , the preaching and the holy message of God through Westboro Baptist Church I say , those people are absolute , good-for-nothing trash , fit only to be dealt with by the fiery wrath of God Almighty 's indignation ."", ""Therefore as the FIRE devoureth the stubble , and the FLAME consumeth the CHAFF , so their root shall be as rottenness , '' ( i.e."", ""Therefore is the anger of the Lord kindled against his people , '' ( Chaff-People ) `` and he hath stretched forth his hand against them , and hath smitten them : and the hills did tremble , and their carcases were torn in the midst of the streets ."", ""Even as we speak , amazing ( the Associated Press says , `` unprecedented '' ) I say , AMAZING demonstrations of God 's fiery wrath are taking place in the godless state of California ."", ""The experts are calling it `` an unprecedented LIGHTNING STORM ... 5,000 to 6,000 LIGHTNING STRIKES ... `We are finding fires all the time . '"", ""'' 840-PLUS , and counting ; to wit ; ( from an AP story last Tuesday , June 24 ) `` More than 840 wildfires sparked by an `unprecedented ' LIGHTNING STORM are burning across Northern California , alarming the governor and requiring the help of firefighters from Nevada and Oregon . ''"", ""And here is the Bible commentary on these current events ; to wit : Sunday , June 29 , 2008 Sermon Outline ... page 5 `` For the wrath of God is revealed from heaven against all ungodliness and unrighteousness of men , who hold '' ( i.e."", '1:18 ) In other words , God by His amazing demonstrations , and even supernatural displays , of His fiery wrath is revealing to the Chaff-People the true nature of their coming Judgment and their long home in Hell .', ""Consider that solemn question in light of what the AP this week called the `` unprecedented LIGHTNING STORMS in Northern California , producing 5,000 to 6,000 LIGHTNING STRIKES , which in turn produced 840-PLUS WILDFIRES , '' most of which are still burning as we speak ."", 'WILDFIRES in such numbers that the governor of California is in a state of shock , the AP says , and is pleading for help from nearby states of Nevada and Oregon !', 'But WE know what to make of these things , and sooner or later the stupid governors and other officials will be forced in desperation to listen to us .', 'This was fire from heaven , and therefore said to be a fire from the Lord that devoured them ; it was such a FIRE , AS BLASTS OF LIGHTNING are , which strike , and blast , and shrivel the spirits of a living body in an instant , which is evident by the manner of their deaths .', 'Sunday , June 29 , 2008 Sermon Outline ... page 6 These two boys , Nadab and Abihu , were the eldest sons of Aaron the High Priest ; and they were the beloved nephews of Moses .', 'Their sins that so enraged the Lord as to strike them dead by a lightning bolt , is not clear .', ""Their cousins carried their bodies quickly out of God 's tabernacle to an ignominious burial , and their souls went straight to Hell , there to continue to be tormented by this lightning bolt fire of the Lord ."", 'FLASHES OF LIGHTNING from the cloud in which He was ; and consumed the 250 men that offered incense ; not that it reduced them to ashes , but took away their lives , struck them dead at once , in like manner as Nadab and Abihu were , who though said to be devoured by the fire , YET THEIR BODIES REMAINED .', 'To which Goodwin adds , `` What created fire can be conceived more subtle or powerful , than the angels themselves are conceived to be ?', ""In one night , just one angel struck 185,000 times , leaving only dead , unmarked bodies of Sennacharib 's Assyrian host all 185,000 of them and their SOULS all being tormented in Hell by the same fiery , flying angels ."", '26:53 ) A Roman legion was 6,000+ ; thus making 12 legions = 72,000+ angels a mere pittance compared to the total number , all of whom are engaged in lightning strikes around the world 24/7 , and in tormenting the multiplied billions of the damned already in Hell 24/7 .']"
8,./data_dsicap/WBC/raw/WestboroBaptist_Sermon_20070715.pdf.txt,"[""`` Scattered '' refers to what the Jews call The Diaspora which began with the blood bath of the Babylonian Captivity , and continues to this day with the dispersal and bloody persecution of the Jews throughout the world [ hence the term `` scattered '' ] throughout the past 2,600 years of history , and which is generally considered to be infinitely worse than the dreaded Nazi Holocaust which is said to have resulted in the bloody murders of 6 million Jews ."", ""And note that what these four hateful , horned beasts did to God 's Elect referred to euphemistically as `` Scattered '' , but which was in fact vicious , bloody persecution is mentioned 3 times in these 4 verses ."", ""Meaning that no man could `` go with an erect stature ; but , through oppression , sorrow , and misery , was obliged to stoop , and bow , and hang down his head . ''"", ""The beautiful message of our power to fray ( terrorize to their doom ) our oppressors , is couched in a wonderful context : Before the 4-verse message are these words : `` The Lord shall yet comfort Zion , and shall yet choose Jerusalem . ''"", ""Sunday , July 15 , 2007 pg.3 Sermon Outline In the Last Days of All the Last of the Last Days our duty is to `` Study '' i.e."", ""First , none but the Church of the Lord Jesus is equipped and empowered to make such determinations ; because to no other man or association of men did the Lord Jesus Christ bestow such remarkable power : `` Verily I say unto you , Whatsoever ye ( the Church ) shall bind on earth shall be bound in heaven ; and whatsoever ye shall loose on earth shall be loosed in heaven . ''"", ""The context shows beyond any doubt that the Lord Jesus Christ is talking to His Church and He appears to indicate here and elsewhere that His True Church will usually be very small : `` For where two or three are gathered together in my name , there am I in the midst of them . ''"", ""Yet it is to this tiny group ( 2 or 3 people ) that the Lord Jesus confers such power : `` Whatsoever ye shall bind on earth ... and whatsoever ye shall loose on earth '' ... are already so bound and loosed in Heaven ( i.e."", ', what doctrines are true and applicable to what situation , and what doctrines are false and/or not applicable ) are already so bound and loosed in Heaven .', ""This informs us that the Church on earth is militant , and therefore is represented as formidable and terrible as an army with banners ; she has many enemies to engage with , as sin , Satan , and the world , and yet has the greatest encouragement to fight , for she is bannered under the Lord of hosts . ''"", ""They met up with Paul at Corinth , `` a certain Jew named Aquila , lately come from Italy with his wife Priscilla ... And because Paul was of the same craft , he abode with them , and wrought ( worked together , about 3 years ) ; for by their occupation they were tentmakers . ''"", ""Sunday , July 15 , 2007 pg.4 Sermon Outline The one , essential ingredient in a True Church is the presence of Christ He is the sine qua non ( without which , nothing ) to wit : `` For where ( even ) two or three are gathered together in my name , THERE AM I , in the midst of them . ''"", '`` Know ye not that ye ( ye , plural , collectively , a body corporate ) are the temple of God , and that the Sprit of God dwelleth in you ?', ""`` Ye also , as lively stones , are built up a spiritual house , an holy priesthood , to offer up spiritual sacrifices , acceptable to God by Jesus Christ . ''"", 'And being turned , I saw seven golden candlesticks ( and the seven candlesticks which thou sawest are the seven churches ) .', ""The following prophesy of Daniel holds that breathtaking fact : `` This matter ( as to who rules the world and all inferior powers ) is by the decree of the watchers ( God 's Elect ) , and the demand by the word of the holy ones ( God 's Elect ) ; to the intent that the living may know that the most High ruleth in the kingdom of men , and giveth it to whomsoever he will , and setteth up over it the basest of men . ''""]"
