,fileName,judgements
0,./data_dsicap/WBC/raw/WestboroBaptist_Sermon_20080302.pdf.txt,"["", this lonely `` country '' of Israel , the 10 northern tribes , sequestered and isolated from all other countries ) Israel shall say in that day , Behold , such is our expectation , whither we flee for help to be delivered from the king of Assyria : and how shall we escape ? ''"", '20:2-6 ) Gill ; to wit : `` Signifying that it was vain and foolish , and they had acted a very weak , as well as a wicked part , in having recourse to the Egyptians and Ethiopians to help them against the Assyrians , as it plainly appeared by both nations now being conquered by the Assyrians ; and how shall WE escape ?', ""Isaiah was obedient to the divine command , Gill says , `` not regarding the disgrace which might attend it , nor the danger of catching cold , to which he was exposed , and hence he has the character of a servant of the Lord , and a faithful obedient one he was . ''"", ""Earlier in his long career as an obedient servant of the Lord , Isaiah 's complete dedication to the publication of his message from God led to the naming of his first son ; to wit : `` Shearjashub '' ( Isaiah 7:3 ) which Strong says was the `` Symbolic name of a son of Isaiah '' meaning , `` A remnant shall return . ''"", ""`` Except the Lord of hosts had left unto us a very small remnant , we should have been as Sodom , and we should have been like unto Gomorrah . ''"", ""What a glorious sign and wonder that a little boy should be running around the house all day every day bearing such a name ; to wit : `` The Remnant shall return . ''"", 'Sunday , March 2 , 2008 page 2 Sermon Outline `` Thus saith the Lord of hosts ; If it be marvellous in the eyes of the remnant of this people in these days , should it also be marvellous in mine eyes ?', ""The meaning of the new baby 's name is one of the great themes of Isaiah 's message ; to wit : `` Flee ye , flee ye , to the spoil . ''"", ""Now hear Isaiah 's own words the heart of the same glorious message as dictated by the Holy Spirit working in Isaiah ; to wit : `` Howl ye ; for the day of the Lord is at hand ( Maher-shalal-hash-baz , flee ye , flee ye , to the spoil ) it shall come as a destruction from the Almighty ."", ""Therefore shall all hands be faint , and every man 's heart shall melt : And they shall be afraid : pangs and sorrows shall take hold of them ; they shall be in pain as a woman that travaileth : they shall be amazed one at another ; their faces shall be as flames ."", '`` God is jealous , and the Lord revengeth ; the Lord revengeth , and is furious ; the Lord will take vengeance on his adversaries , and he reserveth wrath for his enemies .', 'The Lord is slow to anger , and great in power , and will not at all acquit the wicked : the Lord hath his way in the whirlwind and in the storm , and the clouds are the dust of his feet .', ""Neither their silver nor their gold shall be able to deliver them in the day of the Lord 's wrath ; but the whole land shall be devoured by the fire of his jealousy : for he shall make even a speedy riddance of all them that dwell in the land . ''"", ""This rage and fury of God involves that attribute of God called his jealousy ; to wit : The preamble to the Ten Commandments , `` for I the Lord thy God am a jealous God , visiting the iniquity of the fathers upon the children unto the third and fourth generation of them that hate me . ''"", ""34:13 ) `` For thou shalt worship no other god : for the Lord , WHOSE NAME IS JEALOUS , is a jealous God . ''"", '`` Men do not despise a thief , if he steal to satisfy his soul when he is hungry ; but if he be found , he shall restore sevenfold ; he shall give all the substance of his house .', 'The wonderful husband is the Lord ; and the unfaithful , slut of a wife is Israel , and , by logical extension , the whole of mankind , except the Elect .', ""Under this law , if the husband ( `` the spirit of jealousy come upon him , and he be jealous '' - Num ."", 'Thereupon the priest performed an elaborate but awful little ceremony , with dreadful and fearsome consequences if the woman was guilty .', ""5:29,30 ) Beloved , this chapter in Scripture called the Law of Jealousies is yet another way the Lord has provided to show unto us and to all mankind what a heinous thing adultery is , and why , in full flower , both physical and spiritual adultery is continually FRETTING the Lord our God , leading to the outpouring of God 's wrath ( Ezek ."", '5 , we have one little woman who MAY have been guilty of adultery ONE TIME being on frightful trial to determine guilt .', ""16 ( `` But thou didst trust in thine own beauty , and playest the harlot because of thy renown , and pourest out thy fornications on every one that passed by ; his it was . ''"", 'The words of Ezekiel dictated by the Holy Ghost and preserved for us so that we might declare them to our generation , and to the world at large , and in particular to doomed America , are these ; to wit : `` And in all thine abominations ( sodomy ) and thy whoredoms thou hast not remembered the days of thy youth , when thou wast naked and bare , and wast polluted in thy blood .']"
1,./data_dsicap/WBC/raw/WestboroBaptist_Sermon_20080622.pdf.txt,"[""Two questions that are approximately if not exactly the same because , `` they that obey not the gospel of God '' are the same persons who are identified as `` the ungodly and the sinner . ''"", ""THAT 'S where they that obey not the Gospel will be ; screaming for the mountains and rocks to fall on them and hide them from the blessed face of the Lord Jesus as it hath been known and clearly `` spoken by the mouth of all his holy prophets since the world began . ''"", '6:12-17 ; to wit : `` And I beheld when he had opened the sixth seal , and , lo , there was a great earthquake ; and the sun became black as sackcloth of hair , and the moon became as blood ; And the stars of heaven fell unto the earth , even as a fig tree casteth her untimely figs , when she is shaken of a mighty wind .', ""And the kings of the earth , and the great men , and the rich men , and the chief captains , and the mighty men , and every bondman , and every free man , hid themselves in the dens and in the rocks of the mountains ; And said to the mountains and rocks , Fall on us , and hide us from the face of him that sitteth on the throne , and from the wrath of the Lamb : For the great day of his wrath is come ; and who shall be able to stand ? ''"", ""Next come the billions upon billions of Chinese , with their idolatrous ancestor-worship and their rejection of the deity of Christ who now sits on the throne of Judgment , to dispose of their miserable souls in Hell for ever and ever , even as He hath warned from ancient times ; to wit : Sunday , June 22 , 2008 Sermon Outline ... page 2 `` Know therefore that the Lord thy God , he is God , the faithful God , which keepeth covenant and mercy with them that love him and keep his commandments to a thousand generations ; '' ( BANG ! )"", '7:9,10 ) And then there are the Jews by the billions , from the days of Abraham to now , whose very own scriptures the Torah and their own prophets from Isaiah to Malachi all warning them for centuries ; to wit : `` Howl ye ; for the Day of the Lord is at hand ; it shall come as a destruction from the Almighty .', ""Therefore shall all hands be faint , and every man 's heart shall melt : And they shall be afraid : pangs and sorrows shall take hold of them ; they shall be in pain as a woman that travaileth ; they shall be amazed one at another ; their faces shall be as flames ."", '13:6-11 ) Now to sample the so-called Minor Prophets of the scriptures of the Jews ; even the prophet Zephaniah ; to wit : `` The great day of the Lord is near , it is near , and hasteth greatly , even the voice of the day of the Lord : THE MIGHTY MAN SHALL CRY THERE BITTERLY .', 'That day is a day of wrath , a day of trouble and distress , a day of wasteness and desolation , a day of darkness and gloominess , a day of clouds and thick darkness ... And I will bring distress upon men , that they shall walk like blind men , because they have sinned against the Lord : and their blood shall be poured out as dust , and their flesh as the dung .', ""Neither their silver nor their gold shall be able to deliver them in the day of the Lord 's wrath ; but the whole land shall be devoured by the fire of his jealousy : for he shall make even a speedy riddance of all them that dwell in the land . ''"", ""Now get another Scriptural picture of the Lord Jesus , upon His throne , from another angle , upon the dawning at last of the Great Day of Judgment ; to wit : `` And I saw a GREAT WHITE THRONE , and HIM THAT SAT ON IT , from whose face the earth and the heaven fled away ; and there was found no place for them '' ( i.e."", ""`` And I saw a great white throne '' the same throne as that throne the Lamb was seated on that we read about earlier in Rev ."", ""they cried , `` from the face of him that sitteth on the throne , and from the wrath of the Lamb ; for the great day of his wrath is come ; and who shall be able to stand ? ''"", ""And these are the same billions upon billions of lost souls , desiring to flee and hide from the Lamb , `` for the great day of his wrath has come , and who shall be able to stand ? ''"", '17:4 ; to wit : `` And the woman was arrayed in purple and scarlet color , and decked with gold and precious stones and pearls , having a golden cup in her hand full of abominations and filthiness of her fornication : And upon her forehead was a name written , MYSTERY , BABYLON THE GREAT , THE MOTHER OF HARLOTS AND ABOMINATIONS OF THE EARTH .', 'To wit : `` And I saw the dead , small and great , stand before God ; and the books were opened : and another book was opened , which is the book of life : and the dead were judged out of those things which were written in the books , according to their works .', 'And the sea gave up the dead which were in it ; and death and hell delivered up the dead which were in them : and they were judged every man according to their works .', '14 , following these words ; to wit : Many things in the Bible are somewhat dark and recondite mysterious but THIS DOCTRINE IS NOT ONE OF THEM !', "", without dilution , meaning with full strength ) `` into the cup of his indignation ; and he shall be tormented with fire and brimstone in the presence of the holy angels , and in the presence of the Lamb : '' ( i.e."", "", the Lord Jesus Christ , including all His elect people who are His mystic body , all of whom are actively engaged in directly administering the torments of and to the damned ) ; `` And the smoke of their torment ascendeth up for ever and ever : and they have no rest day nor night . ''"", ""It was 2,000 years ago that our brother Jude , `` the servant of Jesus Christ , and brother of James , '' wrote to the Elect of God in his day , as follows : `` Beloved , when I gave all diligence to write unto you of the common salvation , it was needful for me to write unto you , and exhort you that ye should EARNESTLY CONTEND for the faith which was once '' ( i.e."", ""Jude said that you are a cancerous spot when you eat at the Lord 's table , doomed for eternal Hell , but feeding your gluttonous self without any fear of God before your eyes ; `` clouds they are without water , carried about of winds ; trees whose fruit withereth , without fruit , twice dead , plucked up by the roots ; '' ( Jude 12 ) and that you are raging waves of the sea , like the troubled sea , when it can not rest in your evil works , whose waters cast up mire and dirt , foaming out your own shame ; wandering stars without stability in the sky for accurate guidance in life ; and to whom is reserved the blackness of darkness for ever ."", 'And Jude described all this dismal condition of things as being precursory to the mighty coming of our Lord Jesus Christ in power and glory all preparatory to the final condemnation of the masses of mankind and the casting of these masses into eternal Hell all as prognosticated by the mouths of all His holy prophets since the world began .', 'Our brother Jude then called up testimony from dear old Enoch only the 7th generation from Adam as his witness , so to speak , in living proof that the doctrines we preach are the one and only message of God to the sons of men from the beginning of the world to now !', ""To wit : `` And Enoch also , the seventh from Adam , prophesied of these , saying , Behold , the Lord cometh with ten thousands of his saints , To execute judgment upon all , and to convince all that are ungodly among them of all their ungodly deeds which they have ungodly committed , and of all their hard speeches which ungodly sinners have spoken against him . ''"", 'The Great Day of the Last Judgment is longer BEFORE it comes , but shall be more terrible WHEN it comes .', ""( Beloved , does it thrill your heart just thinking about old Noah sitting in that great ark , reading the same things about the Coming of the Lord , from the book of Enoch 's prophesies 4,000+ years ago that we are preaching about today ? )"", ""Where Enoch saith , `` Behold , the Lord cometh with ten thousands of his saints , '' it were better translated , With His holy myriads ; saints and angels ; he shall not leave a single one of them behind him in heaven when He comes ."", ""ANSWER : They shall be with the goats at the fearful left hand of the avenging Savior when He comes with all the holy saints and angels to execute wrath and to pour out His retaliatory vengeance upon His and His people 's enemies ; to wit : Sunday , June 22 , 2008 Sermon Outline ... page 6 `` When the Son of man shall come in his glory , and all the holy angels with him , then shall he sit upon the throne of his glory : And before him shall be gathered all nations : and he shall separate them one from another , as a shepherd divideth his sheep from the goats : And he shall set the sheep on his right hand , but THE GOATS ON THE LEFT HAND ... Then shall he say also unto them on the LEFT HAND , Depart from me , ye cursed , into everlasting fire , prepared for the devil and his angels ... And these shall go away into everlasting punishment : but the righteous into life eternal . ''"", '25:31-33,41,46 ) With this little background , we are even more powerfully convinced , that this holy doctrine of Everlasting Punishment for the wicked , inflicted personally by Christ and His people and His angels , throughout eternity is as clear as crystal in the Scriptures , from one end to the other .', ""To Paul , no other church was more praiseworthy than the church of the Thessalonians insomuch that Paul gloried in them in all the other existing churches of God for their patience and faith `` IN ALL YOUR PERSECUTIONS AND TRIBULATIONS THAT YE ENDURE : Which is a MANIFEST TOKEN of the righteous judgment of God , that ye may be counted worthy of the kingdom of God , for which ye also suffer . ''"", 'Suffering persecutions was proof positive that they were born again and bound for the promised land .', ""To wit : `` Seeing it is a righteous thing with God to recompense tribulation to them that trouble you ; And to you who are troubled rest '' ( take comfort ) `` with us , '' ( just intelligently contemplating the glorious Day of the Lord to Come ) `` when the Lord Jesus shall be revealed from heaven with his mighty angels , IN FLAMING FIRE TAKING VENGEANCE on them that know not God , and that OBEY NOT THE GOSPEL OF OUR LORD JESUS CHRIST : Who shall be punished with everlasting destruction '' ( i.e.""]"
2,./data_dsicap/WBC/raw/WestboroBaptist_Sermon_20080525.pdf.txt,"[""These are fair samplings of such `` exceeding great and precious promises ; that by these we might be partakers of the divine nature , having escaped the corruption that is in the world through lust . ''"", "": `` And the Lord shall deliver me from every evil work , and will preserve me unto his heavenly kingdom ; to whom be glory for ever and ever . ''"", '4:18 ) `` Now to the King eternal , immortal , invisible , the only wise God , be honor and glory for ever and ever .', '1:17 ) `` Which in his times he shall show , who is the blessed and only Potentate ( Sovereign ) , the King of kings , and Lord of lords ; Who only hath immortality , dwelling in the light which no man can approach unto ; whom no man hath seen , nor can see ; to whom be honor and power everlasting .', '3:16 ) `` And the very God of peace sanctify you wholly ; and I pray God your whole spirit and soul and body be preserved blameless unto the coming of our Lord Jesus Christ .', 'Be perfect , be of good comfort , be of one mind , live in peace ; and the God of love and peace shall be with you .', '16:22-24 ) `` Now to him that is of power to stablish you according to my gospel , and the preaching of Jesus Christ , according to the revelation of the mystery , which was kept secret since the world began , But now is made manifest , and by the scriptures of the prophets , according to the commandment of the everlasting God , MADE KNOWN TO ALL NATIONS for the obedience of faith ; To God only wise , be glory through Jesus Christ for ever .', ""Remember the words of John Owen , that whatever else is going on , never forget that the ULTIMATE AIM of Satan and the world of these vile earth-dwellers all around us I say , their ultimate aim ALWAYS is the death of all God 's Elect and the `` utter destruction of the church ; '' and , `` For , CONSIDER HIM ( i.e."", ', immediately , directly , in-your-face ) `` lest ye be wearied and faint in your minds .', 'And , Beloved , remember that this great conflict , that we in this humble church are engaged in , is the very essence of the Gospel and is irrefutable , irrefragable evidence ( proof positive ) that our calling and election is sure .', "", the aging apostle was falsely imprisoned by the sodomite perverts running the mighty , but doomed , Roman Empire ) `` but be thou partaker of the AFFLICTIONS OF THE GOSPEL according to the power of God ; Who hath saved US , and called US with an HOLY CALLING , not according to OUR works , but according to his own purpose and grace , which was given US in Christ Jesus BEFORE THE WORLD BEGAN , But is now made manifest '' ( openly revealed for the whole world to see who the CALLED THE ELECT are , and the Gospel that was given to ONLY THEM before the world began ) `` by the appearing of our Savior Jesus Christ , who hath abolished death , and hath brought life and immortality to light through the gospel ; Whereunto I am appointed a preacher , and an apostle , and a teacher of the Gentiles . ''"", "", a severe understatement for dramatic effect if ever there was one ) meaning , not that He is barely `` able '' , but that all the Sovereign Power of an Almighty God is dedicated , devoted , and solemnly PLEDGED UNDER OATH `` to keep that which I have committed unto him against that day . ''"", ""When they are in any kind of danger , the Lord God of hosts will leave His throne in Heaven and come down to Earth to fight for His loved ones in His Church Militant and , as birds flying ( state-of-the-art supersonic fighter-planes and bomber- planes laden with stateof-the-art nuclear weapons and bombs ) I say , when His Loved Ones in His Church Militant are threatened with harm in any way , the Lord God has pledged as Heaven 's war-birds flying to defend them ."", 'Champion Football Coach Vince Lombardi used to say that the best defense is a good offence .', ""Their immediate context involves a total destruction of a mighty Assyrian army that had laid siege to and was threatening the imminent and utter destruction of Jerusalem ( the church , God 's Holy Remnant ) ."", ""Lord Byron was not a Bible man ; in fact he was a whoremongering drunk ; and he certainly had no interest in knowing that the Lord 's supersonic War-Birds were flying that night . )"", 'Like the leaves of the forest when Summer is green , That host with their banners at sunset were seen ; Like the leaves of the forest when Autumn hath blown , That host on the morrow lay withered and strown .', 'And there lay the rider distorted and pale , With the dew on his brow , and the rust on his mail ; And the tents were all silent , the banners alone , The lances uplifted , the trumpets unblown .', ""And the widows of Ashur are loud in their wail , And the idols are broke in the temple of Baal ; And the might of the Gentile , unsmote by the sword , Hath melted like snow in the glance of the Lord ! ''"", 'For I will defend this city ( WBC ) , to save it , for mine own sake ... And it came to pass that night , that the angel of the Lord went out , and smote in the camp of the Assyrians an hundred fourscore and five thousand ; and when they arose early in the morning , behold , they were all dead corpses .', ""And , Remember Coach Lombardi 's bit of football wisdom , that a good OFFENSE is the best DEFENSE ."", 'O thou that dwellest upon many waters , abundant in treasures , thine end is come , and the measure of thy covetousness ( think , America ) .', 'Every man is brutish by his knowledge ; every founder is confounded by the graven image ; for his molten image is falsehood , and there is no breath in them .', ""`` ) : `` The portion of Jacob is not like them ; for he is the former of all things ; and Israel ( God 's Elect ) is the rod of his inheritance ; the Lord of hosts is his name ."", ""51:12-24 ) Beloved , has not the cruel persecution of our little church by the United States been done `` IN YOUR SIGHT ? ''"", 'For 17 years we have been mercilessly persecuted by the lawless , filthy , criminal citizens of this godless country all of whom are wide- awake to this fact , and are wellaware of what they have done , and are doing .', 'On your Hellish , mean , lawless , godless , filthy streets as it was in the days of Sodom .', ""`` But without faith it is impossible to please him ; for he that cometh to God must believe that he is , and that he is a rewarder of them that diligently seek him . ''"", ""Beloved , we are told of a great gathering of our friends , who have gone on to Heaven from the bygone years , looking on as our witnesses and to encourage us in our struggles ; to wit : `` Wherefore seeing we also are compassed about with so great a cloud of witnesses ... let us run with patience the race that is set before us . ''"", 'John Owen says , `` So it is with us in our patient perseverance ; all the saints of the old testament do as it were stand looking on us in our striving , encouraging us unto our duty , and ready to testify unto our success with their applauses .', 'And it is not unuseful for us , in all our trials for the profession of our faith , to consider that the eyes as it were of all that have gone before us in the same , or the like , or greater trials , are upon us , to bear witness how we acquit ourselves .']"
